id,book,par_num,level,class,title,text
NULL,p121,308,100,bodytext,,"Ettha ca yena adhippāyena ‘‘kenassu nivuto loko’’ti gāthāya (su. ni. 1038; cūḷani. ajitamāṇavapucchā 57, ajitamāṇavapucchāniddesa 1; netti. 45) satipi nivāraṇādīnaṃ catunnaṃ pucchitabbabhāve eko pañhoti vuttaṃ. Tena tāva sotānaṃyeva saṃvaro pidhānañca pucchitanti sote ekatthavasena gahetvā pucchāya ekādhiṭṭhānabhāvato eko pañhoti vattabbaṃ siyā. Sotānaṃ vā bahubhāvato bahūti yattakā sotā, tattakā pañhāti. Yena pana adhippāyena ‘‘savanti sabbadhi sotā’’ti gāthāyaṃ (su. ni. 1040; cūḷani. ajitamāṇavapucchā 59, ajitamāṇavapucchāniddesa 3; netti. 45) sote anāmasitvā saṃvarapidhānānaṃ vasena ‘‘dve pañhā’’ti vuttaṃ. Tena paṭhamagāthāyaṃ satipi nivāraṇādīnaṃ lokādhārabhāve lokaṃ anāmasitvā nivāraṇādīnaṃ vibhāgena cattāro pañhātipi vattabbanti ayaṃ nayo dassitoti daṭṭhabbaṃ."
NULL,p121,309,100,bodytext,,"Idāni yasmā pucchanto na kevalaṃ pubbe attanā racitaniyāmeneva pucchati, atha kho desanākāle vuttadhammassa anusandhiṃ gahetvāpi pucchati, tasmā tassa anusandhiṃ pucchāya vicetabbākāraṃ dassento ‘‘yāni sotānī’’ti gāthāya anantaraṃ ‘‘paññā ceva sati cā’’ti gāthamāha. Tassāyaṃ saṅkhepattho – yāyaṃ bhagavatā vuttā paññā, yā ca  sati yañca tadavasesaṃ nāmarūpaṃ, etaṃ sabbampi kattha nirujjhati, etaṃ me puṭṭho pabrūhīti."
NULL,p121,310,100,bodytext,,"Vissajjanagāthāyaṃ panassa yasmā paññāsatiyo nāmeneva saṅgahaṃ gacchanti, tasmā tā visuṃ na vuttā. Ayañcettha saṅkhepattho – yaṃ maṃ tvaṃ, ajita, etaṃ pañhaṃ apucchi – ‘‘katthetaṃ uparujjhatī’’ti  anantaragāthāyaṃ (su. ni. 1042; cūḷani. ajitamāṇavapucchā 61, ajitamāṇavapucchāniddesa 5; netti. 11, 45), yattha taṃ asesaṃ uparujjhati, taṃ te vadāmi. Tassa tassa hi viññāṇassa nirodhena saheva apubbaṃ acarimaṃ etthetaṃ uparujjhati, ettheva viññāṇassa nirodhena nirujjhati, etaṃ viññāṇanirodhaṃ tassa nirodho nātivattatīti vuttaṃ hotīti. Ayaṃ pañhe anusandhiṃ pucchatīti anantaragāthāyaṃ sotānaṃ pariyuṭṭhānānusayappahānakiccena saddhiṃ sati paññā ca vuttā, taṃ sutvā tappahāne paññāsatīsu tiṭṭhantīsu tāsaṃ sannissayena nāmarūpena bhavitabbaṃ, tathā ca sati vaṭṭati eva. Kattha nu kho imāsaṃ sanissayānaṃ paññāsatīnaṃ asesanirodhoti iminā adhippāyena ayaṃ pucchā katāti āha – ‘‘ayaṃ pañhe…pe… dhātu’’nti. Tattha anusandhīyati desanā etāyāti anusandhi."
NULL,p121,311,100,bodytext,,"Yāya paṭipadāya anupādisesaṃ nibbānadhātuṃ adhigacchanti, taṃ catusaccakammaṭṭhānabhāvanāsaṅkhātaṃ paṭipadaṃ saha visayena dassetuṃ ‘‘tīṇi ca saccānī’’tiādi vuttaṃ. Tattha saṅkhatānīti samecca sambhūya paccayehi katānīti saṅkhatāni. Nirodhadhammānīti nirujjhanasabhāvāni. Dukkhaṃ samudayo maggoti tesaṃ sarūpadassanaṃ. Nirodho pana kathanti āha ‘‘nirodho asaṅkhato’’ti. So hi kenaci paccayena na saṅkhatoti asaṅkhato. Saha visayena pahātabbapahāyakasabhāvesu ariyasaccesu pahāyakavibhāgamukhena pahātabbavibhāgaṃ dassetuṃ ‘‘tattha samudayo’’tiādi vuttaṃ."
NULL,p121,312,100,bodytext,,"Tattha avijjāvasesāti dassanamaggena pahīnāvasesā avijjāti attho. Ayañca sesa-saddo kāmacchando byāpādo māno uddhaccanti etthāpi yojetabbo. Yathā hi avijjā, evaṃ etepi dhammā apāyagamanīyasabhāvā paṭhamamaggena pahīyanti evāti. ‘‘Avijjāniravasesā’’tipi pāṭho, etthāpi yathāvuttesu kāmacchandādipadesupi niravasesa-saddo yojetabbo. Sāvasesañhi purimamaggadvayena kāmacchandādayo pahīyanti, itarehi pana niravasesanti. Tedhātuke imāni dasa saṃyojanānīti ettha tedhātuketi saṃyojanānaṃ visayadassanaṃ. Tattha hi tāni saṃyojanavasena pavattanti."
NULL,p121,313,100,bodytext,,"12. Anaññātaññassāmītindriyaṃ adhiṭṭhāyāti taṃ pahāyakaṃ patvā. Yaṃ panāti ettha yanti hetuatthe nipāto. Idaṃ khaye ñāṇanti yena ñāṇena hetubhūtena ‘‘khīṇā me jātī’’ti attano jātiyā khīṇabhāvaṃ jānāti, idaṃ evaṃ paccavekkhaṇassa nimittabhūtaṃ arahattaphalañāṇaṃ khaye  ñāṇaṃ nāma. Nāparaṃ itthattāyāti pajānātīti etthāpi yanti ānetabbaṃ ‘‘yaṃ nāparaṃ itthattāyāti pajānātī’’ti. Idaṃ anuppāde ñāṇanti idhāpi pubbe vuttanayeneva arahattaphalañāṇavasena attho yojetabbo. Aṭṭhasāliniyaṃ (dha. sa. aṭṭha. cittuppādakkaṇḍa 135-142) pana ‘‘khaye ñāṇaṃ kilesakkhayakare ariyamagge ñāṇanti vuttaṃ. Anuppāde ñāṇaṃ paṭisandhivasena anuppādabhūte taṃtaṃmaggavajjhakilesānaṃ anuppādapariyosāne uppanne ariyaphale ñāṇa’’nti vuttaṃ. Idha pana ubhayampi arahattaphalañāṇavaseneva vibhattaṃ. Tenevāha – ‘‘imāni dve ñāṇāni aññātāvindriya’’nti, ‘‘ārammaṇasaṅketena dve nāmāni labbhantī’’ti ca."
NULL,p121,314,100,bodytext,,"Aññindriyaṃ heṭṭhimesu tīsu phalesu, uparimesu ca tīsu maggesu uppattiyā punappunaṃ uppajjamānampi anaññātaññassāmītindriyaṃ viya paṭhamaphaluppattiyā aggaphaluppattiyā anuppādanirodhena nirujjhatīti āha – ‘‘yañca anaññātaññassāmītindriya’’ntiādi. Etena pahātabbadhammā viya dassanabhāvanāhi aggaphaluppattiyā tadavasesaphaladhammāpi anuppādanirodhena nirujjhanti. Ko pana vādo tebhūmakadhammānanti dasseti, ekā paññā aññātāvindriyattā. Yadi ekā, kathaṃ dvidhā vuttāti āha ‘‘api cā’’tiādi. Ārammaṇasaṅketenāti khaye anuppādeti imāya ārammaṇasamaññāya. Sā pajānanaṭṭhena paññāti yā pubbe sotānaṃ pidhānakiccā vuttā paññā, sā pajānanasabhāvena paññā. Itarā pana yathādiṭṭhaṃ yathāgahitaṃ ārammaṇaṃ apilāpanaṭṭhena ogāhanaṭṭhena satīti."
NULL,p121,315,100,bodytext,,"13. Evaṃ  ‘‘paññā ceva sati cā’’ti padassa atthaṃ vivaritvā idāni ‘‘nāmarūpa’’nti padassa atthaṃ vivaranto ‘‘tattha ye pañcupādānakkhandhā, idaṃ nāmarūpa’’nti āha. Nāmarūpañca vibhāgena dassento sukhaggahaṇatthaṃ pākaṭanāmarūpameva vibhāvetuṃ ‘‘tattha ye’’tiādimāha. Taggahaṇeneva hi sahacaraṇādinā tadaññe cittacetasikā rūpadhammā ca gahitā hontīti. Nāmaggahaṇena cettha khandhattayameva gahitanti ‘‘nāmarūpaṃ viññāṇasampayutta’’nti vuttaṃ. Taṃ pana rūpaṃ sampayuttanti? Nayidaṃ sampayuttapaccayavasena vuttaṃ. Pacurajanassa pana avibhāgena gahaṇīyasabhāvaṃ sandhāya vuttanti daṭṭhabbaṃ."
NULL,p121,316,100,bodytext,,"Gāthāya anupādisesā nibbānadhātu pucchitāti taṃ caturiddhipādamukhena ariyamaggādhigamena pattabbanti dassento iddhipādabhāvanāmūlabhūtāni indriyāni satipaññāhi niddhāretuṃ ‘‘tattha sati ca paññā ca cattāri indriyānī’’ti āha. Kusalākusalānaṃ dhammānaṃ gatiyo  samanvesamānā sati sijjhantī ekantena samādhiṃ nipphādeti. Satiggahaṇena cettha pariyuṭṭhānappahānaṃ idhādhippetanti āha – ‘‘sati dve indriyāni, satindriyañca samādhindriyañcā’’ti. Tathā anusayasamugghātavidhāyinī paññā sijjhamānā na vinā catubbidhasammappadhānavīriyaṃ sijjhatīti vuttaṃ – ‘‘paññā dve indriyāni paññindriyañca vīriyindriyañcā’’ti."
NULL,p121,317,100,bodytext,,"Yā imesu catūsu indriyesūti imesu satiādīsu catūsu indriyesu nissayapaccayatāya adhiṭṭhānabhūtesu taṃsahajātā eva yā saddahanā. ‘‘Imehi catūhi indriyehī’’tipi pāḷi, tassā imehi catūhi indriyehi sampayuttāti vacanaseso, ārammaṇe abhippasādalakkhaṇā saddhā kattukāmatāsabhāvassa chandassa visesapaccayo hotīti āha – ‘‘yā saddhādhipateyyā cittekaggatā, ayaṃ chandasamādhī’’ti. Samāhite citteti vipassanāsamādhinā samāhite citte. Idaṃ pahānanti vikkhambhanappahānasādhako samādhi pahānanti vutto pajahati etenāti katvā. ‘‘Padhāna’’ntipi pāṭho, aggoti attho. Tathā hi ‘‘samādhi ekodī’’ti vuccati."
NULL,p121,318,100,bodytext,,"‘‘Assāsapassāsā’’tiādinā kāyavacīcittasaṅkhārasīsena taṃsamuṭṭhāpakā vīriyasaṅkhārāva gahitā. Te hi yāva bhāvanānipphatti tāva ekarasena saraṇato saṅkappetabbato ca sarasaṅkappā’’ti vuttā ‘‘evaṃ  me bhāvanā hotū’’ti yathā icchitā, tathā pavattiyā hetubhāvato. Tadubhayanti chandasamādhisaṅkhātañca padhānasaṅkhārasaṅkhātañca vīriyanti taṃ ubhayaṃ. Ubhayameva hi upacāravasena aññaṃ viya katvā ‘‘chandasamādhippadhānasaṅkhārasamannāgataṃ iddhipāda’’nti vuttaṃ. Abhinnampi hi upacāravasena bhinnaṃ viya katvā voharanti, yathā ‘‘silāputtakassa sarīra’’nti."
NULL,p121,319,100,bodytext,,"Tattha ijjhatīti iddhi, samijjhati nipphajjatīti attho. Ijjhanti vā tāya sattā iddhā vuddhā ukkaṃsagatā hontīti iddhi, pajjati etenāti pādo, paṭhamena atthena iddhi eva pādo iddhipādo, iddhikoṭṭhāsoti attho. Dutiyena atthena iddhiyā pādo patiṭṭhā adhigamūpāyoti iddhipādo. Tena hi uparūparivisesasaṅkhātaṃ iddhiṃ pajjanti pāpuṇanti. Vivekanissitanti tadaṅgavivekanissitaṃ samucchedavivekanissitaṃ nissaraṇavivekanissitañca iddhipādaṃ bhāvetīti attho. Tathā hi ayaṃ iddhipādabhāvanānuyutto yogī vipassanākkhaṇe kiccato tadaṅgavivekanissitaṃ ajjhāsayato nissaraṇavivekanissitaṃ. Maggakkhaṇe pana kiccato  samucchedavivekanissitaṃ ārammaṇato nissaraṇavivekanissitaṃ iddhipādaṃ bhāvetīti. Esa nayo virāganissitantiādīsu."
NULL,p121,320,100,bodytext,,"Vivekattā eva hi virāgādayo, kevalañcettha vossaggo duvidho pariccāgavossaggo ca pakkhandanavossaggo cāti. Tattha pariccāgavossaggo vipassanākkhaṇe tadaṅgavasena, maggakkhaṇe samucchedavasena kilesappahānaṃ. Pakkhandanavossaggo vipassanākkhaṇe tanninnabhāvena, maggakkhaṇe ārammaṇakaraṇavasena nibbānapakkhandanaṃ. Tadubhayampi imasmiṃ lokiyalokuttaramissake atthasaṃvaṇṇanānaye yujjati. Tathā hi ayaṃ paṭhamiddhipādo yathāvuttena pakārena kilese pariccajati nibbānañca pakkhandati. Vossaggapariṇāminti iminā pana vacanena vossaggatthaṃ pariṇamantaṃ pariṇatañca paripaccantaṃ paripakkañcāti attho. Ayañhi iddhipādabhāvanānuyutto yogī yathā paṭhamo iddhipādo kilesapariccāgavossaggatthaṃ nibbānapakkhandanavossaggatthañca paripaccati, yathā ca paripakko hoti, tathā naṃ bhāvetīti. Sesiddhipādesupi eseva nayo. Ayaṃ pana viseso – yathā chandaṃ jeṭṭhakaṃ katvā pavattito samādhi chandasamādhi. Evaṃ vīriyaṃ cittaṃ vīmaṃsaṃ jeṭṭhakaṃ katvā pavattito samādhi vīmaṃsāsamādhīti."
NULL,p121,321,100,bodytext,,"14. Na  kevalaṃ catutthaiddhipādo eva samādhiñāṇamūlako, atha kho sabbopīti dassetuṃ ‘‘sabbo samādhi ñāṇamūlako ñāṇapubbaṅgamo ñāṇānuparivattī’’ti vuttaṃ. Yadi evaṃ kasmā so eva vīmaṃsāsamādhīti vuttoti? Vīmaṃsaṃ jeṭṭhakaṃ katvā pavattitattāti vuttovāyamattho. Tattha pubbabhāgapaññāya ñāṇamūlako. Adhigamapaññāya ñāṇapubbaṅgamo. Paccavekkhaṇapaññāya ñāṇānuparivatti. Atha vā pubbabhāgapaññāya ñāṇamūlako. Upacārapaññāya ñāṇapubbaṅgamo. Appanāpaññāya ñāṇānuparivatti. Upacārapaññāya vā ñāṇamūlako. Appanāpaññāya ñāṇapubbaṅgamo. Abhiññāpaññāya ñāṇānuparivattīti veditabbaṃ."
NULL,p121,322,100,bodytext,,"Yathāpureti yathā samādhissa pubbenivāsānussatiñāṇānuparivattibhāvena pure pubbe atītāsu jātīsu asaṅkhyeyyesupi saṃvaṭṭavivaṭṭesu attano paresañca khandhaṃ khandhūpanibaddhañca duppaṭivijjhaṃ nāma natthi, tathā pacchā samādhissa anāgataṃsañāṇānuparivattibhāvena anāgatāsu jātīsu asaṅkhyeyyesupi saṃvaṭṭavivaṭṭesu attano paresañca khandhaṃ khandhūpanibaddhañca duppaṭivijjhaṃ nāma natthīti attho."
NULL,p121,323,100,bodytext,,"Yathā pacchāti yathā samādhissa cetopariyañāṇānuparivattibhāvena anāgatesu sattasu divasesu parasattānaṃ cittaṃ duppaṭivijjhaṃ nāma natthi, tathā pure atītesu sattasu divasesu parasattānaṃ cittaṃ duppaṭivijjhaṃ nāma natthīti attho. Yathā divāti yathā divasabhāge sūriyālokena andhakārassa vidhamitattā cakkhumantānaṃ sattānaṃ āpāthagataṃ cakkhuviññeyyaṃ rūpaṃ suviññeyyaṃ. Tathā rattinti tathā rattibhāge caturaṅgasamannāgatepi andhakāre vattamāne samādhissa dibbacakkhuñāṇānuparivattitāya duppaṭivijjhaṃ rūpāyatanaṃ natthi."
NULL,p121,324,100,bodytext,,"Yathā rattiṃ tathā divāti yathā ca rattiyaṃ tathā divāpi atisukhumaṃ kenaci tirohitaṃ yañca atidūre, taṃ sabbarūpaṃ duppaṭivijjhaṃ nāma natthi. Yathā ca rūpāyatane vuttaṃ, tathā samādhissa dibbasotañāṇānuparivattitāya saddāyatane ca netabbaṃ. Tenevāha ‘‘iti vivaṭena cetasā’’tiādi. Tattha apariyonaddhenāti abhiññāñāṇassa pāribandhakakilesehi anajjhotthaṭena, apariyonaddhattā eva sappabhāsaṃ cittaṃ. Eteneva samādhissa iddhividhañāṇānuparivattitāpi vuttā evāti daṭṭhabbaṃ. Pañcindriyānīti iddhipādasampayuttāni sekkhassa pañcindriyāni adhippetānīti āha ‘‘kusalānī’’ti. Cittasahabhūnītiādi tesaṃ viññāṇanirodhena nirodhadassanatthaṃ āraddhaṃ. Tathā ‘‘nāmarūpañcā’’tiādi. Tenetaṃ dasseti ‘‘na kevalaṃ pañcindriyāni eva, atha kho nāmarūpañca viññāṇahetukaṃ viññāṇassa nirodhā nirujjhatī’’ti."
NULL,p121,325,100,bodytext,,"Tassāti viññāṇassa. Hetūti taṇhāavijjādiko. Anāhāranti padassa atthavivaraṇaṃ. Anabhinanditanti abhinandanabhūtāya taṇhāya pahīnattā eva apatthitaṃ. Tato eva appaṭisandhikaṃ viññāṇaṃ taṃ nirujjhati. Yathā ca viññāṇaṃ, evaṃ nāmarūpampi viññāṇasaṅkhātassa hetuno paccayassa ca abhāvā tappaccayānaṃ saṅkhārādīnaṃ abhāvā ahetu appaccayaṃ. Sesaṃ pākaṭameva. Pucchāvissajjanavicayopi vuttanayānusārena veditabbo."
NULL,p121,326,100,bodytext,,"Evaṃ anusandhipucchampi dassetvā heṭṭhā sattādhiṭṭhānā dhammādhiṭṭhānā ca pucchā visuṃ visuṃ dassitāti idāni tā saha dassetuṃ ‘‘ye ca saṅkhātadhammāse’’tiādi āraddhaṃ. Tatthāyaṃ padattho – saṅkhātadhammāti aniccādivasena parivīmaṃsitadhammā, arahataṃ etaṃ adhivacanaṃ. Sekkhāti sīlādīni sikkhamānā avasesā ariyapuggalā. Puthūti bahū sattajanā. Tesaṃ me nipako iriyaṃ, puṭṭho pabrūhīti tesaṃ sekhāsekhānaṃ nipako paṇḍito tvaṃ bhagavā paṭipattiṃ puṭṭho me brūhīti. Sesaṃ pāḷivaseneva viññāyati."
NULL,p121,327,100,bodytext,,"15. Kissāti  kissa hetu, kena kāraṇenāti attho. Sekhāsekhavipassanā pubbaṅgamappahānayogenāti sekhe asekhe vipassanāpubbaṅgamappahāne ca pucchanayogena, pucchāvidhināti attho."
NULL,p121,328,100,bodytext,,"Vissajjanagāthāyaṃ kāmesu nābhigijjheyyāti vatthukāmesu kilesakāmena na abhigijjheyya. Manasānāvilo siyāti byāpādavitakkādayo kāyaduccaritādayo ca manaso āvilabhāvakare dhamme pajahanto cittena anāvilo bhaveyya. Yasmā pana asekkho aniccatādivasena sabbadhammānaṃ paritulitattā kusalo sabbadhammesu kāyānupassanāsatiādīhi ca sato sabbakilesānaṃ bhinnattā uttamabhikkhubhāvaṃ patto ca hutvā sabbairiyāpathesu pavattati, tasmā ‘‘kusalo…pe… paribbaje’’ti āhāti ayaṃ saṅkhepattho."
NULL,p121,329,100,bodytext,,"Tattha  yaṃ pucchāgāthāyaṃ ‘‘nipako’’ti padaṃ vuttaṃ, taṃ bhagavantaṃ sandhāya vuttaṃ, bhagavato ca nepakkaṃ ukkaṃsapāramippattaṃ anāvaraṇañāṇadassanena dīpetabbanti anāvaraṇañāṇaṃ tāva kammadvārabhedehi vibhajitvā sekhāsekhapaṭipadaṃ dassetuṃ ‘‘bhagavato sabbaṃ kāyakamma’’ntiādi vuttaṃ. Tena sabbattha appaṭihatañāṇadassanena tathāgatassa sekhāsekhapaṭipattidesanākosallameva vibhāveti. Tattha ko cāti kva ca, kasmiṃ visayeti attho. Taṃ visayaṃ dasseti ‘‘yaṃ anicce dukkhe anattani cā’’ti. Idaṃ vuttaṃ hoti – ñāṇadassanaṃ nāma uppajjamānaṃ ‘‘sabbaṃ saṅkhataṃ aniccaṃ dukkhaṃ sabbe dhammā anattā’’ti uppajjati, tassa pana tasmiṃ visaye yena appavatti, so paṭighātoti, etena lakkhaṇattayappaṭivedhassa durabhisambhavataṃ anaññasādhāraṇatañca dasseti. Lakkhaṇattayavibhāvanena hi bhagavato catusaccappaṭivedhaṃ sammāsambodhiñca paṇḍitā paṭijānanti."
NULL,p121,330,100,bodytext,,"Aññāṇaṃ adassananti taṃ paṭighātaṃ sarūpato dasseti. Chaḷārammaṇasabhāvappaṭicchādako hi sammoho ñāṇadassanassa paṭighātoti. Yasmiṃ visaye ñāṇadassanaṃ uppattirahaṃ, tattheva tassa paṭighātena bhavitabbanti āha – ‘‘yaṃ anicce dukkhe anattani cā’’ti. Yathā idha purisotiādi upamādassanaṃ. Tatridaṃ opammasaṃsandanaṃ – puriso viya sabbo loko, tārakarūpāni viya cha ārammaṇāni, tassa purisassa tārakarūpānaṃ dassanaṃ viya lokassa cakkhuviññāṇādīhi yathārahaṃ chaḷārammaṇajānanaṃ, tassa purisassa tārakarūpāni passantassāpi ‘‘ettakāni  satāni, ettakāni sahassānī’’tiādinā gaṇanasaṅketena ajānanaṃ viya lokassa rūpādiārammaṇaṃ kathañci jānantassāpi aniccādilakkhaṇattayānavabodhoti. Sesaṃ pākaṭameva."
NULL,p121,331,100,bodytext,,"Idāni yehi padehi bhagavatā āyasmato ajitassa sekhāsekhapaṭipadā vuttā, tesaṃ padānaṃ atthaṃ vibhajituṃ ‘‘tattha sekhenā’’tiādimāha. Tattha tatthāti nipātamattaṃ, tasmiṃ vā vissajjane. Sekhenāti sikkhā etassa sīlanti sekho, tena sekhena. Dvīsu dhammesūti duvidhesu dhammesūti adhippāyo. Pariyuṭṭhānīyesūti dosena pariyuṭṭhitena yattha parivattitabbaṃ, tesu āghātavatthūsūti attho. ‘‘Paṭighaṭṭhānīyesū’’tipi pāṭho, soyevattho."
NULL,p121,332,100,bodytext,,"Ettha  ca gedhapaṭisedhacodanāyaṃ gedhanimitto doso gedhe sati hotīti tatopi cittassa rakkhitabbatā niddhāretvā vuttā. Yasmā pana bhagavatā ‘‘kāmesu nābhigijjheyyā’’ti (su. ni. 1045; cūḷani. ajitamāṇavapucchā 64, ajitamāṇavapucchāniddesa 8; netti. 15-17) vuttaṃ, tasmā ‘‘tattha yā icchā’’tiādinā gedhavasena niddeso kato. Atha vā dosato cittassa rakkhitabbatā gāthāya dutiyapādena vuttāyevāti daṭṭhabbā. Dutiyapādena hi sesakilesavodānadhammā dassitā. Tathā hi uppannānuppannabhedato sammāvāyāmassa visayabhāvena sabbe saṃkilesavodānadhamme catudhā vibhajitvā sammappadhānamukhena sekhapaṭipadaṃ matthakaṃ pāpetvā dassetuṃ ‘‘sekho abhigijjhanto’’tiādi vuttaṃ. Tattha anāvilasaṅkappoti āvilānaṃ kāmasaṅkappādīnaṃ abhāvena anāvilasaṅkappo. Tato eva ca anabhigijjhanto vāyamati, vīriyaṃ pavatteti. Kathaṃ vāyamatīti āha – ‘‘so anuppannāna’’ntiādi."
NULL,p121,333,100,bodytext,,"Tattha soti uttarivisesatthāya paṭipajjamāno sekkho. Anuppannānanti anibbattānaṃ. Pāpakānanti lāmakānaṃ. Akusalānaṃ dhammānanti akosallasambhūtānaṃ dhammānaṃ. Anuppādāyāti na uppādanatthāya. Chandaṃ janetīti kattukamyatāsaṅkhātaṃ kusalacchandaṃ uppādeti. Vāyamatīti payogaparakkamaṃ karoti. Vīriyaṃ ārabhatīti kāyikacetasikavīriyaṃ karoti. Cittaṃ paggaṇhātīti teneva sahajātavīriyena cittaṃ ukkhipati. Padahatīti padhānavīriyaṃ karoti. Vāyamatītiādīni pana cattāri padāni āsevanābhāvanābahulīkammasātaccakiriyāhi yojetabbāni. Uppannānaṃ pāpakānanti anuppannāti avattabbataṃ āpannānaṃ pāpadhammānaṃ. Pahānāyāti pajahanatthāya. Anuppannānaṃ kusalānanti anibbattānaṃ kosallasambhūtānaṃ dhammānaṃ. Uppādāyāti uppādanatthāya. Uppannānanti nibbattānaṃ. Ṭhitiyāti ṭhitatthaṃ. Asammosāyāti anassanatthaṃ. Bhiyyobhāvāyāti punappunaṃ bhāvāya. Vepullāyāti vipulabhāvāya. Bhāvanāyāti vaḍḍhiyā. Pāripūriyāti paripūraṇatthāyāti ayaṃ tāva padattho."
NULL,p121,334,100,bodytext,,"16. ‘‘Katame anuppannā’’tiādi akusaladhammā kusaladhammā ca yādisā anuppannā yādisā ca uppannā, te dassetuṃ āraddhaṃ. Tattha ime anuppannāti ime kāmavitakkādayo asamudācāravasena vā ananubhūtārammaṇavasena  vā anuppannā nāma. Aññathā hi anamatagge saṃsāre anuppannā nāma akusalā dhammā natthi. Vitakkattayaggahaṇañcettha nidassanamattaṃ daṭṭhabbaṃ. Akusalamūlānīti anusayā eva sabbesaṃ akusalānaṃ mūlabhāvato evaṃ vuttā, na lobhādayo eva. Ime uppannā anusayā bhūmiladdhuppannā asamugghāṭituppannātiādiuppannapariyāyasabbhāvato nāmavasena uppannā nāma, na vattamānabhāvenāti attho. Ime anuppannā kusalā dhammāti ime sotāpannassa saddhādayo sotāpattiphalasacchikiriyāya paṭipannassa anuppannā kusalā dhammā nāma, ko pana vādo puthujjanānanti dasseti. Kusalasaddo cettha bāhitikasutte (ma. ni. 2.358 ādayo) viya anavajjapariyāyo daṭṭhabbo. Ime uppannā kusalā dhammāti ime paṭhamamagge saddhādayo sotāpattiphalasacchikiriyāya paṭipannassa uppannā kusalā dhammā nāma."
NULL,p121,335,100,bodytext,,"Satipaṭṭhānabhāvanāya suniggahito kāmavitakkoti āha – ‘‘yena kāmavitakkaṃ vāreti, idaṃ satindriya’’nti. Anavajjasukhapadaṭṭhānena avikkhepena cetodukkhasannissayo vikkhepapaccayo byāpādavitakko suniggahitoti vuttaṃ – ‘‘yena byāpādavitakkaṃ vāreti, idaṃ samādhindriya’’nti. Kusalesu dhammesu āraddhavīriyo parāparādhaṃ sukhena sahatīti vīriyena vihiṃsāvitakko suniggahitoti āha – ‘‘yena vihiṃsāvitakkaṃ vāreti, idaṃ vīriyindriya’’nti. Samādhiādīnampi yathāsakaṃpaṭipakkhappahānaṃ paññavantasseva ijjhatīti imamatthaṃ dassento āha – ‘‘yena uppannuppanne’’tiādi."
NULL,p121,336,100,bodytext,,"Etesaṃ yathāniddhāritānaṃ pañcannaṃ indriyānaṃ savisaye jeṭṭhakabhāvaṃ dassetuṃ ‘‘saddhindriyaṃ kattha daṭṭhabba’’ntiādi vuttaṃ. Taṃ suviññeyyameva. Imesañca saddhādīnaṃ sekhānaṃ indriyānaṃ nibbattiyā sabbepi sekhā dhammā matthakappattā hontīti dassento ‘‘evaṃ sekho’’tiādinā sekhapaṭipadaṃ nigameti."
NULL,p121,337,100,bodytext,,"17. Evaṃ sekhapaṭipadaṃ vibhajitvā idāni asekhapaṭipadaṃ vibhajituṃ ‘‘kusalo sabbadhammāna’’ntiādimāha. Tattha sabbadhammānanti iminā padena vuttadhamme tāva vibhajitvā tattha asekkhassa kosallaṃ dassetuṃ ‘‘loko nāmā’’tiādi  vuttaṃ. Taṃ vuttatthameva. Kilesalokena bhavaloko samudāgacchatīti kāmāvacaradhammaṃ nissāya rūpārūpāvacaradhamme samudāgametīti attho. Soti so mahaggatadhammesu, parittamahaggatadhammesu vā ṭhito. Indriyāni nibbattetīti sīlasamādhayo nibbedhabhāgiye katvā vimuttiparipācanīyāni saddhādīni indriyāni uppādeti. Indriyesu bhāviyamānesūti yathāvuttaindriyesu vaḍḍhiyamānesu rūpārūpapariggahādivasena neyyassa pariññā bhavati."
NULL,p121,338,100,bodytext,,"Dassanapariññāti ñātapariññā. Bhāvanāpariññāti tīraṇapariññā pahānapariññā ca. ‘‘Sā duvidhenā’’tiādinā saṅkhepato vuttamatthaṃ ‘‘yadā hi sekho’’tiādinā vivarati. Tattha ‘‘nibbidāsahagatehi saññāmanasikārehī’’ti iminā balavavipassanaṃ dasseti. Yadā hi sekhoti cettha sikkhanasīlatāya kalyāṇaputhujjanopi sekhapadena saṅgahitoti katvā ‘‘dve dhammā kosallaṃ gacchanti dassanakosallañcā’’tiādi vuttaṃ. Ayamettha adhippāyo – yadā kalyāṇaputhujjano pubbabhāgasikkhaṃ sikkhanto nibbidāsahagatehi saññāmanasikārehi ñeyyaṃ parijānāti, tadā tassa te vipassanādhammā dassanakosallaṃ paṭhamamaggañāṇaṃ gacchanti sampāpuṇanti tena saddhiṃ ghaṭenti. Yadā pana sotāpannādisekho vuttanayena neyyaṃ parijānāti, tadā tassa te vipassanādhammā bhāvanākosallaṃ gacchantīti."
NULL,p121,339,100,bodytext,,"Taṃ ñāṇanti yā pubbe neyyassa pariññā vuttā, taṃ neyyaparijānanañāṇaṃ. Pañcavidhena veditabbanti visayabhedena tassa bhedaṃ dasseti. Dhammānaṃ salakkhaṇe ñāṇanti rūpārūpadhammānaṃ kakkhaḷaphusanādisalakkhaṇe ñāṇaṃ. Taṃ pana yasmā sabbaṃ neyyaṃ hetuhetuphalabhedato duvidhameva hoti, tasmā ‘‘dhammapaṭisambhidā ca atthapaṭisambhidā cā’’ti niddiṭṭhaṃ."
NULL,p121,340,100,bodytext,,"Pariññāti tīraṇapariññā adhippetā. Yasmā panassa rūpārūpadhamme salakkhaṇato paccayato ca abhijānitvā kusalādivibhāgehi te pariggahetvā aniccādivasena jānanā hoti, tasmā ‘‘evaṃ abhijānitvā yā parijānanā, idaṃ kusala’’ntiādi vuttaṃ. Tattha evaṃgahitāti evaṃ aniccādito kalāpasammasanādivasena gahitā sammasitā. Idaṃ phalaṃ nibbattentīti idaṃ udayabbayañāṇādikaṃ phalaṃ paṭipāṭiyā uppādenti, nimittassa kattubhāvena upacaraṇato yathā ariyabhāvakarāni saccāni ariyasaccānīti. Tesanti udayabbayañāṇādīnaṃ. Evaṃgahitānanti evaṃpavattitānaṃ. Ayaṃ atthoti ayaṃ saccānaṃ anubodhapaṭivedho attho. Yathā hi pariññāpaññā sammasitabbadhamme sammasanadhamme tattha sammasanākāraṃ parijānāti, evaṃ sammasanaphalampi parijānātīti katvā ayaṃ nayo dassito."
