id,book,par_num,level,class,title,text
NULL,p121,775,100,bodytext,,"‘‘Ye hi kecī’’tiādinā tāsaṃ paṭipadānaṃ niyyāne tīsupi kālesu ekantikabhāvaṃ dasseti. Tattha imāhi eva catūhi paṭipadāhīti imāhi eva catūhi paṭipadāhi, tabbinimuttāya aññāya paṭipadāya abhāvato. Catukkamagganti paṭipadācatukkaṃ, paṭipadā hi maggoti. Atha vā catukkamagganti nandiyāvaṭṭassa catuddisāsaṅkhātaṃ maggaṃ. Tā pana catasso disā disālocananaye āgamissanti. Kimatthaṃ pana catukkamaggaṃ paññapentīti āha ‘‘abudhajanasevitāyā’’tiādi. Tattha abudhajanasevitāyāti apaṇḍitajanasevitāya. Bālakantāyāti bālajanakāmitāya. Rattavāsiniyāti rattesu rāgābhibhūtesu vasatīti rattavāsinī, tassā. Nandiyāti tatra tatrābhinandanaṭṭhena nandīsaṅkhātāya. Avaṭṭanatthanti samucchindanatthaṃ. Ayaṃ vuccati nandiyāvaṭṭassa nayassa bhūmīti ayaṃ taṇhāvijjānaṃ vasena saṃkilesapakkhe dve disā samathavipassanānaṃ vasena  vodānapakkhepi dve disā catusaccayojanā nandiyāvaṭṭassa nayassa samuṭṭhānatāya bhūmīti."
NULL,p121,776,100,bodytext,,"82. Evaṃ nandiyāvaṭṭassa nayassa bhūmiṃ niddisitvā idāni tassa disābhūtadhamme niddisantena yasmā cassa disābhūtadhammesu vuttesu disālocananayo vuttoyeva hoti, tasmā ‘‘veyyākaraṇesu hi ye kusalākusalā’’ti disālocanalakkhaṇaṃ ekadesena paccāmasitvā ‘‘te duvidhā upaparikkhitabbā’’tiādi āraddhaṃ. Tattha teti disābhūtadhammā. Duvidhāti ‘‘ime saṃkilesadhammā, ime vodānadhammā’’ti evaṃ duvidhena. Upaparikkhitabbāti upapattito parito ikkhitabbā, dhammayuttito taṃtaṃdisābhāvena pekkhitabbā ālocitabbāti attho."
NULL,p121,777,100,bodytext,,"Yaṃ pakāraṃ sandhāya ‘‘duvidhā upaparikkhitabbā’’ti vuttaṃ, taṃ dasseti ‘‘lokavaṭṭānusārī ca lokavivaṭṭānusārī cā’’ti. Tassattho – loko eva vaṭṭaṃ lokavaṭṭaṃ. Lokavaṭṭabhāvena anusarati pavattatīti lokavaṭṭānusārī, saṃkilesadhammoti attho. Lokassa, lokato vā vivaṭṭaṃ lokavivaṭṭaṃ, nibbānaṃ. Taṃ anusarati anulomanavasena gacchatīti lokavivaṭṭānusārī, vodānadhammoti attho. Tenevāha – ‘‘vaṭṭaṃ nāma saṃsāro, vivaṭṭaṃ nibbāna’’nti."
NULL,p121,778,100,bodytext,,"Taṃkathaṃ daṭṭhabbanti taṃ kathaṃ kena pakārena daṭṭhabbanti ce? Upacayena. Yathā kataṃ kammaṃ phaladānasamatthaṃ hoti, tathā kataṃ upacitanti vuccati. Evaṃ upacitabhāve kammaṃ nāma hoti, vipākavaṭṭassa kāraṇaṃ hotīti attho. Sabbepi kilesā catūhi vipallāsehi niddisitabbā, dasannampi kilesānaṃ vipallāsahetubhāvato. Te kattha daṭṭhabbāti te pana vipallāsā kattha passitabbāti āha – ‘‘dasa vatthuke kilesapuñje’’ti. Dasavidhakāraṇe kilesasamūheti attho. Tattha kilesāpi kilesavatthu, kilesānaṃ paccayadhammāpi kilesavatthu. Tesu kāraṇabhāvena purimasiddhā kilesā parato paresaṃ kilesānaṃ paccayabhāvato kilesāpi kilesavatthu. Ayonisomanasikāro, ayonisomanasikāraparikkhatā ca dhammā kilesuppattihetubhāvato kilesappaccayāpi kilesavatthūti daṭṭhabbaṃ."
NULL,p121,779,100,bodytext,,"Cattāroāhārāti ettha āhārasīsena tabbisayā kilesāpi adhippetā. Catasso viññāṇaṭṭhitiyoti etthāpi eseva nayo. ‘‘Paṭhame āhāre’’tiādinā dasavatthuke kilesapuñje purimaṃ purimaṃ pacchimassa pacchimassa kāraṇanti dasseti. Tattha paṭhame āhāreti visayabhūte paṭhame āhāre paṭhamo vipallāso pavattatīti attho. Sesāhāresupi eseva nayo. Paṭhame vipallāseti paṭhame vipallāse appahīne sati paṭhamaṃ upādānaṃ pavattatīti attho. Sesapadesupi eseva nayo. Yaṃ panettha vattabbaṃ, taṃ niddeseyeva kathayissāma."
NULL,p121,780,100,bodytext,,"83. Idāni dasavatthukaṃ kilesapuñjaṃ taṇhāvijjāvasena dve koṭṭhāse karonto ‘‘yo ca kabaḷīkāro āhāro’’tiādimāha. Tattha kabaḷīkārāhāraṃ phassāhārañca aparijānantassa taṇhācaritassa yathākkamaṃ kāyavedanāsu tibbo chandarāgo hoti, iti upakkilesassa chandarāgassa hetubhāvato yo ca kabaḷīkāro āhāro, yo ca phasso āhāro, ime taṇhācaritassa puggalassa upakkilesāti vuttā. Tathā manosañcetanāhāraṃ viññāṇāhārañca aparijānanto diṭṭhicarito tesu attasaññī niccasaññī ca hotīti vuttanayeneva te diṭṭhicaritassa puggalassa upakkilesāti vuttā. Tathā purimakā dve vipallāsā purimakāni eva ca dve dveupādānayogaganthāsavaoghasallaviññāṇaṭṭhitiagatigamanāni taṇhāpadhānattā taṇhāsabhāvattā taṇhāvisayattā ca taṇhācaritassa upakkilesāti vuttā. Pacchimakāni pana tāni diṭṭhipadhānattā diṭṭhisabhāvattā diṭṭhivisayattā ca diṭṭhicaritassa upakkilesāti vuttāti daṭṭhabbā."
NULL,p121,781,100,bodytext,,"84. Kabaḷīkāre āhāre ‘‘asubhe subha’’nti vipallāsoti catūsu āhāresu kabaḷīkāre  āhāre catūsu ca vipallāsesu ‘‘asubhe subha’’nti vipallāso daṭṭhabbo kabaḷīkārāhārassa asubhasabhāvattā asubhasamuṭṭhānattā ca. Tathā phassāhārassa dukkhasabhāvattā dukkhapaccayattā ca visesato tattha ‘‘dukkhe sukha’’nti vipallāso. Tathā yebhuyyena sattā viññāṇe niccasaññino, saṅkhāresu ca attasaññino, cetanāpadhānā ca saṅkhārāti vuttaṃ – ‘‘viññāṇe āhāre…pe… attāti vipallāso’’ti. Paṭhame vipallāse ṭhito kāme upādiyatīti ‘‘asubhe subha’’nti vipariyesaggāhī kilesakāmena vatthukāme daḷhaṃ gaṇhāti. Idaṃ vuccati kāmupādānanti yaṃ tathā kāmānaṃ gahaṇaṃ, idaṃ vuccati kāmupādānaṃ. ‘‘Dukkhe sukha’’nti vipariyesaggāhī ‘‘sīlabbatehi anāgate bhavavisuddhīti taṃ nibbutisukha’’nti daḷhaṃ gaṇhāti. ‘‘Anicce nicca’’nti vipariyesaggāhī ‘‘sabbe bhavā niccā dhuvā sassatā avipariṇāmadhammā’’ti saṃsārābhinandiniṃ bhavadiṭṭhiṃ daḷhaṃ gaṇhāti. ‘‘Anattani attā’’ti vipariyesaggāhī ‘‘asati attani kassidaṃ kammaphalaṃ, tasmā so karoti, so paṭisaṃvedetī’’ti attadiṭṭhiṃ daḷhaṃ gaṇhātīti imamatthaṃ dasseti ‘‘dutiye vipallāse ṭhito’’tiādinā."
NULL,p121,782,100,bodytext,,"Ayaṃ vuccati kāmayogoti yena kāmarāgasaṅkhātena kāmupādānena vatthukāmehi saha satto saṃyojīyati, ayaṃ kāmarāgo ‘‘kāmayogo’’ti vuccati. Ayaṃ vuccati bhavayogoti yato sīlabbatupādānasaṅkhātena bhavupādānena bhavena saha satto saṃyojīyati, ayaṃ bhavarāgo ‘‘bhavayogo’’ti vuccati. Ayaṃ vuccati diṭṭhiyogoti yāya ahetukadiṭṭhiādisaṅkhātāya pāpikāya diṭṭhiyā, sakkāyadiṭṭhiādiavasiṭṭhadiṭṭhiyā ca satto dukkhena saha saṃyojīyati, ayaṃ pāpikā diṭṭhi ‘‘diṭṭhiyogo’’ti vuccati. Ayaṃ vuccati avijjāyogoti yāya attavādupādānena sakalavaṭṭadukkhena ca saha satto saṃyojīyati, ayaṃ avijjā ‘‘avijjāyogo’’ti vuccati."
NULL,p121,783,100,bodytext,,"Yasmā pana kāmayogādayo abhijjhākāyaganthādīnaṃ paccayā honti, tasmā ‘‘paṭhame yoge ṭhito abhijjhāya kāyaṃ ganthatī’’tiādi vuttaṃ. Tattha abhijjhāya kāyaṃ ganthatīti parābhijjhāyanalakkhaṇāya abhijjhāya nāmakāyaṃ ganthati ghaṭṭetīti attho. Tathā bhavapatthanāya appahīnattā bhavadiṭṭhibhavarāgavasena āghātavatthūsu sattā cittāni padūsentīti āha – ‘‘dutiye yoge ṭhito byāpādena kāyaṃ ganthatī’’ti. Tathā diṭṭhivasena avijjāvasena ca sīlabbatehi sujjhati, idameva saccaṃ moghamaññanti ca abhinivisatīti āha – ‘‘tatiye…pe… idaṃsaccābhinivesena kāyaṃ ganthatī’’ti."
NULL,p121,784,100,bodytext,,"Tassāti  tassa abhijjhādīhi samannāgatassa puggalassa. Evaṃ ganthitāti evaṃ abhijjhāyanādivasena nāmakāyaṃ ganthitvā ṭhitā. Āsavantīti  āsavabhāvena pavattanti. Kuto ca vuccati āsavantīti kuto pana hetuto te kilesā āsavantīti āsavahetuṃ pucchati. Yasmā pana kilesā kusalappavattiṃ nivāretvā cittaṃ pariyādāya tiṭṭhantā, maggena asamucchinnā eva vā āsavānaṃ uppattihetu honti, tasmā ‘‘anusayato vā pariyuṭṭhānato vā’’ti vuttaṃ. Abhijjhākāyaganthena kāmāsavoti abhijjhākāyaganthena siddhena kāmarāgasabhāvattā kāmāsavo siddho hoti. Katthacideva visaye domanassito tappaṭipakkhe visaye tabbisayabahule ca bhave patthetīti āha – ‘‘byāpādakāyaganthena bhavāsavo’’ti. Parāmāsakāyaganthena diṭṭhāsavoti sīlabbataparāmāsakāyaganthena siddhena taṃsabhāvattā aparāparaṃ vā diṭṭhiyo ganthentassa diṭṭhāsavo siddho hoti. Idaṃsaccābhinivesakāyaganthena avijjāsavoti ‘‘idameva saccaṃ moghamañña’’nti abhinivisantassa ayonisomanasikārato anekehi akusalehi dhammehi saddhiṃ avijjāsavo uppajjati, sabbesaṃ vā akusaladhammānaṃ avijjāpubbaṅgamattā idaṃsaccābhinivesakāyaganthena siddhena tassa hetubhūto avijjāsavo siddho hoti."
NULL,p121,785,100,bodytext,,"Yasmā pana āsavā eva paribuddhā vaṭṭasmiṃ ohananti osādentīti ‘‘oghā’’ti vuccanti, tasmā vuttaṃ – ‘‘tassa ime cattāro āsavā’’tiādi."
NULL,p121,786,100,bodytext,,"Anusayasahagatāti anusayabhāvaṃ appaṭikkhipitvā gatā pavattā, anusayabhūtā vā. Ajjhāsayanti cittaṃ. Anupaviṭṭhāti ogāḷhā. Hadayaṃ āhacca tiṭṭhantīti cittassa abbhantarasaṅkhātaṃ hadayaṃ āhantvā tiṭṭhanti. Tathā hi vuttaṃ aṭṭhasāliniyaṃ (dha. sa. aṭṭha. 5) ‘‘abbhantaraṭṭhena hadaya’’nti. Tena vuccanti sallāti yasmā ajjhāsayaṃ anupaviṭṭhā hadayaṃ āhacca tiṭṭhanti, tena vuccanti ‘‘sallā’’ti. Pīḷājananaṃ duruddharaṇatā ca sallaṭṭho. ‘‘Eso me attā’’ti gahaṇamukhena ‘‘esohamasmī’’ti gahaṇaṃ hotīti diṭṭhiṃ nissāyapi mānaṃ jappentīti āha ‘‘diṭṭhoghena mānasallo’’ti."
NULL,p121,787,100,bodytext,,"Pariyādinnanti aññassa okāsaṃ adatvā samantato gahitaṃ. Catūsu dhammesu saṇṭhahatīti ārammaṇapaccayatāya ārammaṇabhūtesu catūsu  dhammesu patiṭṭhahati. Tāni sarūpato dasseti ‘‘rūpe vedanāya saññāya saṅkhāresū’’ti. Nandūpasecanenāti lobhasahagatassa sampayuttā nandī sahajātakoṭiyā, itarassa upanissayakoṭiyā upasecananti nandūpasecanaṃ, tena nandūpasecanena. Kena pana taṃ nandūpasecananti āha – ‘‘rāgasallena nandūpasecanena viññāṇenā’’ti."
NULL,p121,788,100,bodytext,,"Tattha rāgasallenāti rāgasallena hetubhūtena nandūpasecanena viññāṇenāti itthambhūtalakkhaṇe karaṇavacanaṃ. Rūpūpagā viññāṇaṭṭhitīti rūpameva ārammaṇakaraṇavasena upagantabbato, viññāṇassa patiṭṭhābhāvato ca rūpūpagā viññāṇaṭṭhiti. Tiṭṭhati etthāti ṭhiti. Pañcavokārabhavasmiñhi abhisaṅkhāraviññāṇaṃ rūpakkhandhaṃ nissāya tiṭṭhati. Dosasallenāti sahajātena dosasallena. Yadā vedanūpagā viññāṇaṭṭhiti vuccati, tadā upanissayakoṭiyāva nandiyā upasittaṃ viññāṇaṃ daṭṭhabbaṃ. Vedanāpi domanassavedanāva. Yadā ca upanissayapaccayabhūtena dosasallena vedanūpagā viññāṇaṭṭhiti vuccati, tadā sahajātakoṭiyā, upanissayakoṭiyā vā nandiyā upasittaṃ viññāṇaṃ daṭṭhabbaṃ. Vedanā pana tissopi tissannaṃ vedanānaṃ ārammaṇūpanissayabhāvato. Tattha paṭhamanayo domanassārammaṇassa abhisaṅkhāraviññāṇassa vasena vutto. Dutiyo sabbavedanārammaṇassa vasenāpi daṭṭhabbaṃ."
NULL,p121,789,100,bodytext,,"Mānasallenāti mānasallena sahajātena, upanissayabhūtena vā. Mohasallenāti etthāpi eseva nayo. Ettha ca anādimatisaṃsāre itthipurisā rūpābhirāmāti rāgasallavasena paṭhamā viññāṇaṭṭhiti yojitā. Sabbāyapi vedanāya dukkhapariyāyasabbhāvato dukkhāya ca doso anusetīti dosasallavasena dutiyā, saññāvasena ‘‘seyyohamasmī’’ti maññanā hotīti mānasallavasena tatiyā, saṅkhāresu samūhaghanaṃ dubbinibbhoganti mohasallavasena catutthī viññāṇaṭṭhiti yojitāti daṭṭhabbā."
NULL,p121,790,100,bodytext,,"Upatthaddhanti olubbhārammaṇabhūtāhi viññāṇaṭṭhitīhi upatthambhitaṃ. Tañca kammanti yaṃ ‘‘cetanā cetasika’’nti pubbe (netti. 82) vuttaṃ. Ime ca kilesāti ime ca dasavatthukā kilesā. Sesaṃ suviññeyyameva."
NULL,p121,791,100,bodytext,,"85. Idāni  āhārādayo nayānaṃ saṃkilesapakkhe disābhāvena vavatthapetuṃ ‘‘imā catasso disā’’tiādi āraddhaṃ, taṃ uttānameva. Puna kabaḷīkāro āhārotiādi āhārādīsuyeva yassa puggalassa upakkilesā, taṃ vibhajitvā dassetuṃ āraddhaṃ. Tattha dasannaṃ suttānanti ekadesesu samudāyavohārena vuttaṃ. Samudāyesu hi pavattā samaññā avayavesupi dissati, ‘‘yathā paṭo daḍḍho, samuddo diṭṭho’’ti ca. Eko atthoti ekassa atthassa nipphādanato vuttaṃ. Byañjanameva nānanti ettha byañjanaggahaṇena byañjanatthopi gahitoti daṭṭhabbaṃ. Dasahipi suttapadehi savatthukā taṇhā vuttā. Taṇhā ca rāgacaritaṃ puggalaṃ khippaṃ dūsetīti āha – ‘‘ime rāgacaritassa puggalassa upakkilesā’’ti. Yathā ca paṭhamadisābhāvena vuttadhammā rāgacaritassa upakkilesā, evaṃ dutiyadisābhāvena vuttadhammā dosacaritassa. Tatiyacatutthadisābhāvena vuttadhammā yathākkamaṃ diṭṭhicaritassa mandassa tikkhassa ca upakkilesā vuttā. Tesaṃ upakkilesabhāvo vuttanayānusārena veditabbo."
NULL,p121,792,100,bodytext,,"Āhāravipallāsādayo yadipi sabbehi tīhi vimokkhamukhehi pubbabhāge yathārahaṃ pariññeyyā pahātabbā ca. Yassa pana dukkhānupassanā purime āhāradvaye dukkhākārena bahulaṃ pavattati, tassa vasena yo ca kabaḷīkāro āhāro, yo ca phasso āhāro, ime appaṇihitena vimokkhamukhena pariññaṃ gacchantīti vuttaṃ. Esa nayo sesesu. Evañcetaṃ, na aññathā. Na hi ariyamaggānaṃ viya pahātabbesu vimokkhamukhānaṃ pariññeyyapahātabbesu koci niyamo sambhavati. Iti sabbe lokavaṭṭānusārino dhammā niyyanti, te lokā tīhi vimokkhamukhehīti nigamanaṃ. Tassattho – iti evaṃ vuttappakārā sabbe āhārādayo lokasaṅkhātavaṭṭānusārino dhammā te lokabhūtā vaṭṭato niyyanti aniccānupassanādīhi tīhi vimokkhamukhehīti."
NULL,p121,793,100,bodytext,,"86. Evaṃ saṃkilesapakkhe disābhūtadhamme niddisitvā idāni vodānapakkhe disābhūtadhamme dassetuṃ ‘‘catasso paṭipadā’’tiādi vuttaṃ. Tattha dibbabrahmaariyaāneñjavihāroti cattāro vihārā. Mānappahānaālayasamugghātaavijjāpahānabhavūpasamā cattāro acchariyā abbhutā dhammā. Saccādhiṭṭhānādīni cattāri adhiṭṭhānāni. Chandasamādhibhāvanādayo catasso samādhibhāvanā. Indriyasaṃvaro tapasaṅkhāto puññadhammo  bojjhaṅgabhāvanā sabbūpadhipaṭinissaggasaṅkhātaṃ nibbānañcāti cattāro sukhabhāgiyā dhammā veditabbāti."
NULL,p121,794,100,bodytext,,"Paṭhamā paṭipadātiādi paṭipadāsatipaṭṭhānādīnaṃ abhedasandassanaṃ. Yadi evaṃ kasmā visuṃ gahaṇaṃ katanti? Dasavatthukassa kilesapuñjassa paṭipakkhabhāvadassanatthaṃ paṭipadādidasakaniddeso. Tathā hi vakkhati – ‘‘cattāro āhārā tesaṃ paṭipakkho catasso paṭipadā’’tiādi  (netti. 87). Kiñcāpi catūsu satipaṭṭhānesu ‘‘idaṃ nāma satipaṭṭhānaṃ imāya eva paṭipadāya ijjhatī’’ti niyamo natthi, tathāpi paṭhamāya paṭipadāya paṭhamaṃ satipaṭṭhānaṃ sambhavatīti sambhavavasena evaṃ vuttaṃ – ‘‘paṭhamā paṭipadā, paṭhamaṃ satipaṭṭhāna’’nti. Yasmā pana āhāravipallāsādīnaṃ viya paṭipadāsatipaṭṭhānādīnaṃ atthato nānattaṃ natthi. Satipaṭṭhānāniyeva hi tathā tathā paṭipajjamānāni dukkhāpaṭipadādandhābhiññādināmakāni honti, tasmā yathā saṃkilesapakkhe ‘‘paṭhame āhāre paṭhamo vipallāso’’tiādinā adhikaraṇabhedena vuttaṃ, evaṃ adhikaraṇabhedaṃ akatvā ‘‘paṭhamā paṭipadā, paṭhamaṃ satipaṭṭhāna’’ntiādi vuttaṃ. Sesesupi eseva nayo."
NULL,p121,795,100,bodytext,,"Andhassa pabbatārohanaṃ viya kadācideva uppajjanakaṃ acchariyaṃ, accharāyoggaṃ acchariyanti porāṇā. Abhūtapubbaṃ bhūtanti abbhutaṃ. Ubhayampetaṃ vimhayāvahassa adhivacanaṃ. Na hi mānappahānādito aññaṃ durabhisambhavataraṃ vimhanīyañca upalabbhatīti adhitiṭṭhati etena, ettha vā adhiṭṭhānamattameva vā tanti adhiṭṭhānaṃ. Saccañca taṃ adhiṭṭhānañca, saccassa vā adhiṭṭhānaṃ, saccaṃ adhiṭṭhānaṃ etassāti vā saccādhiṭṭhānaṃ. Sesesupi eseva nayo. Samādhi eva bhāvetabbatāya samādhibhāvanā. Sukhaṃ bhajatīti sukhabhāgiyo, sukhabhāgassa vā sukhakoṭṭhāsassa hitoti sukhabhāgiyo. Ekassapi sattassa asubhabhāvanādayo viya ekadese avattitvā anavasesapariyādānato natthi etissā pamāṇanti appamaññā."
NULL,p121,796,100,bodytext,,"Paṭhamā paṭipadā bhāvitā bahulīkatā paṭhamaṃ satipaṭṭhānaṃ paripūretīti paṭhamāya paṭipadāya bhāvanābahulīkāro paṭhamassa satipaṭṭhānassa bhāvanāpāripūrīti attho. Sesapadesupi eseva nayo. Yathā hi ariyamagge bhāvite satipaṭṭhānādayo bodhipakkhiyadhammā sabbepi bhāvitā eva honti, evaṃsampadamidaṃ daṭṭhabbaṃ."
NULL,p121,797,100,bodytext,,"Kāyānupassanāya  kāmarāgassa ujuvipaccanīkabhāvato ‘‘paṭhamo satipaṭṭhāno bhāvito bahulīkato kāmapaṭipakkhaṃ paṭhamaṃ jhānaṃ paripūretī’’ti vuttaṃ. Tathā pītipaṭisaṃvedanādivasena pavattamānaṃ dutiyaṃ satipaṭṭhānaṃ, sappītikassa dutiyajjhānassa cittassa abhippamodanavasena pavattamānaṃ tatiyaṃ satipaṭṭhānaṃ ukkaṃsagatasukhassa tatiyajjhānassa aniccavirāgādivasena pavattiyā saṅkhāresu upekkhakaṃ catutthaṃ satipaṭṭhānaṃ upekkhāsatipārisuddhibhāvato catutthajjhānassa pāripūriyā saṃvattati."
NULL,p121,798,100,bodytext,,"Yasmā  pana rūpāvacarapaṭhamajjhānaṃ rūpāvacarasamāpattīnaṃ, dutiyajjhānaṃ byāpādavitakkādidūrībhāvena brahmavihārānaṃ, tatiyajjhānaṃ pītivirāgena sukhena vipassanāya adhiṭṭhānabhūtaṃ ariyavihārānaṃ, catutthajjhānaṃ upekkhāsatipārisuddhiāneñjappattaṃ āneñjavihārānaṃ visesato paccayo hoti, tasmā ‘‘paṭhamaṃ jhānaṃ bhāvitaṃ bahulīkataṃ paṭhamaṃ vihāraṃ paripūretī’’tiādi vuttaṃ. Iti yo yassa visesapaccayo, so taṃ paripūretīti vuttoti daṭṭhabbaṃ."
NULL,p121,799,100,bodytext,,"87. Idāni paṭipadādayo vodānapakkhe disābhāvena vavatthapetuṃ ‘‘tattha imā catasso disā’’tiādi vuttaṃ. Taṃ suviññeyyameva. Puna ‘‘paṭhamā paṭipadā’’tiādi paṭipadācatukkādīsu yena yassa puggalassa vodānaṃ, taṃ vibhajitvā dassetuṃ āraddhaṃ. Taṃ heṭṭhā vuttanayameva. Yadipi tīsu vimokkhamukhesu ‘‘idaṃ nāma vimokkhamukhaṃ imāya eva paṭipadāya ijjhatī’’ti niyamo natthi. Yesaṃ pana puggalānaṃ purimāhi dvīhi paṭipadāhi appaṇihitena vimokkhamukhena ariyamaggādhigamo. Tathā yassa tatiyāya paṭipadāya suññatavimokkhamukhena, yassa ca catutthāya paṭipadāya animittavimokkhamukhena ariyamaggādhigamo, tesaṃ puggalānaṃ vasena ayaṃ paṭipadāvimokkhamukhasaṃsandanā. Satipaṭṭhānādīhi vimokkhamukhasaṃsandanāyapi eseva nayo."
NULL,p121,800,100,bodytext,,"Tesaṃ vikkīḷitanti tesaṃ asantāsanajavaparakkamādivisesayogena sīhānaṃ buddhānaṃ paccekabuddhānaṃ buddhasāvakānañca vikkīḷitaṃ viharaṇaṃ. Yadidaṃ āhārādikilesavatthusamatikkamanamukhena saparasantāne paṭipadādisampādanā. Idāni āhārādīnaṃ paṭipadādīhi yena samatikkamanaṃ, taṃ nesaṃ paṭipakkhabhāvaṃ dassento ‘‘cattāro āhārā tesaṃ paṭipakkho catassopaṭipadā’’tiādimāha. Tattha tesaṃ paṭipakkhabhāvo pahātabbabhāvo pahāyakabhāvo ca āhāraviññāṇaṭṭhitīnañcettha pahātabbabhāvo tappaṭibandhachandarāgavasena daṭṭhabbo. Tattha ‘‘vikkīḷitaṃ bhāvanā sacchikiriyā cā’’tiādi tassāyaṃ saṅkhepattho – tesaṃ vikkīḷitanti ettha yadetaṃ vikkīḷitaṃ nāma bhāvetabbānaṃ bodhipakkhiyadhammānaṃ bhāvanā, sacchikātabbānaṃ phalanibbānānaṃ sacchikiriyā ca. Tathā pahātabbassa dasavatthukassa kilesapuñjassa tadaṅgādivasena pahānaṃ byantīkiriyā anavasesananti. Idāni taṃ saṅkhepena dassento ‘‘indriyādhiṭṭhānaṃ vikkīḷitaṃ vipariyāsānadhiṭṭhāna’’nti āha."
NULL,p121,801,100,bodytext,,"Indriyādhiṭṭhānanti indriyānaṃ pavattanaṃ bhāvanā sacchikiriyā ca. Vipariyāsānadhiṭṭhānanti vipallāsānaṃ apavattanaṃ pahānaṃ anuppādanaṃ. Indriyāni saddhammagocaroti indriyāni cettha saddhammassa  gocarabhūtāni pavattihetūti adhippetāni saddhindriyādīnīti attho. Vipariyāsā kilesagocaroti vipallāsā saṃkilesapakkhassa pavattiṭṭhānaṃ pavattihetūti. Ayaṃ vuccati sīhavikkīḷitassa nayassa bhūmīti yāyaṃ ‘‘cattāro āhārā’’tiādinā saṃkilesapakkhe dasannaṃ catukkānaṃ, ‘‘catasso paṭipadā’’tiādinā vodānapakkhepi dasannaṃ catukkānaṃ taṇhācaritādīnaṃ upakkilesavodānavibhāvanāmukhena niddhāraṇā, ayaṃ sīhavikkīḷitassa nayassa bhūmi nāma."
NULL,p121,802,100,bodytext,,"88. Idāni ugghaṭitaññuādipuggalattayavasena tipukkhalanayassa bhūmiṃ vibhāvetukāmo yasmā pana nayānaṃ aññamaññānuppavesassa icchitattā sīhavikkīḷitanayato tipukkhalanayo niggacchati, tasmā paṭipadāvibhāgato cattāro puggale sīhavikkīḷitanayassa bhūmiṃ niddisitvā tato eva ugghaṭitaññuādipuggalattaye niddhāretuṃ ‘‘tattha ye dukkhāya paṭipadāyā’’tiādi āraddhaṃ. Tattha ime dve puggalāti ime purimānaṃ dvinnaṃ paṭipadānaṃ vasena dve puggalā. Esa nayo itaratthāpi. Puna ‘‘tattha ye dukkhāya paṭipadāyā’’tiādi yathāvuttapuggalacatukkato ugghaṭitaññuādipuggalattayaṃ niddhāretuṃ vuttaṃ. Tattha yo sādhāraṇāyāti dukkhāpaṭipadāya khippābhiññāya, sukhāpaṭipadāya dandhābhiññāya ca niyyātīti sambandho. Kathaṃ pana paṭipadādvayaṃ ekassa sambhavatīti? Nayidamevaṃ daṭṭhabbaṃ. Ekassa puggalassa ekasmiṃ dve paṭipadā sambhavantīti. Yathāvuttāsu pana dvīsu  paṭipadāsu yo yāya kāyaci niyyāti, ayaṃ vipañcitaññūti ayamettha adhippāyo. Yasmā pana aṭṭhasāliniyaṃ (dha. sa. aṭṭha. 350) paṭipadā calati na calatīti vicāraṇāyaṃ ‘‘calatī’’ti vuttaṃ, tasmā ekassapi puggalassa jhānantaramaggantaresu paṭipadābhedo icchitovāti."
NULL,p121,803,100,bodytext,,"‘‘Tattha bhagavā’’tiādinā desanāvibhāgehipi tameva puggalavibhāgaṃ vibhāveti. Taṃ heṭṭhā vuttanayameva. Tattha adhicittanti adhicittasikkhañcāti ca-saddo luttaniddiṭṭho. Tena adhicittasikkhañca adhipaññāsikkhañca vipañcitaññussa paññapetīti attho. Adhisīlanti etthāpi eseva nayo. Adhisīlasikkhaṃ adhicittasikkhaṃ adhipaññāsikkhañcāti yojetabbaṃ."
NULL,p121,804,100,bodytext,,"Cattāri hutvā tīṇi bhavantīti liṅgavipallāsena vuttaṃ, cattāro puggalā hutvā tayo puggalā hontīti attho."
NULL,p121,805,100,bodytext,,"Ayaṃsaṃkilesoti ayaṃ akusalamūlādidvādasattikasaṅgaho saṃkilissati etenāti saṃkilesoti katvā. Idaṃ vodānanti etthāpi eseva nayo."
NULL,p121,806,100,bodytext,,"Tīṇi hutvā dve bhavantīti nandiyāvaṭṭanayassa disābhūtadhammadassanatthaṃ vuttaṃ. Tenevāha – ‘‘taṇhā ca avijjā cā’’tiādi, taṃ sabbaṃ suviññeyyameva."
NULL,p121,807,100,bodytext,,"Kasmā panettha nayānaṃ uddesānukkamena niddeso na katoti? Nayānaṃ nayehi sambhavadassanatthaṃ. Paṭhamanayato hi puggalādhiṭṭhānavasena tatiyanayassa, tatiyanayato ca dutiyanayassa sambhavoti imassa visesassa dassanatthaṃ paṭhamanayānantaraṃ tatiyanayo, tatiyanayānantarañca dutiyanayo niddiṭṭho. Dhammādhiṭṭhānavasena pana tatiyanayato dutiyanayo, dutiyanayato paṭhamanayopi sambhavatīti imassa visesassa dassanatthaṃ ante ‘‘taṇhā ca avijjā cā’’tiādinā paṭhamanayassa bhūmi dassitā. Teneva hi ‘‘cattāri hutvā tīṇi bhavanti, tīṇi hutvā dve bhavantī’’ti vuttaṃ. Yadi evaṃ ‘‘dve hutvā cattāri bhavanti, dve hutvā tīṇi bhavanti, tīṇi hutvā cattāri bhavantī’’ti ayampi nayo vattabbo siyāti? Saccametaṃ, ayaṃ pana nayo atthato dassito evāti  katvā na vutto. Yasmā tiṇṇaṃ atthanayānaṃ aññamaññaṃ anuppaveso icchito, sati ca anuppavese tato viniggamopi sambhavati evāti. Ayañca attho peṭakopadesena vibhāvetabbo."
NULL,p121,808,100,bodytext,,"Tatthāyaṃ ādito paṭṭhāya vibhāvanā – cattāro puggalā taṇhācarito duvidho mudindriyo tikkhindriyo ca. Tathā diṭṭhicaritoti. Tattha taṇhācarito mudindriyo dukkhāya paṭipadāya dandhābhiññāya niyyāti, tikkhindriyo dukkhāya paṭipadāya khippābhiññāya niyyāti, diṭṭhicarito pana mudindriyo sukhāya paṭipadāya dandhābhiññāya niyyāti, tikkhindriyo sukhāya paṭipadāya khippābhiññāya niyyāti. Iti imāsu paṭipadāsu yathārahaṃ ṭhitehi taṇhācaritadiṭṭhicaritehi cattāro āhārā tappaṭibandhachandarāgappahānena pahātabbā. Cattāro satipaṭṭhāne bhāvetvā cattāro vipallāsā daṭṭhabbāti sabbo yathāvuttanayo anugantabbo."
