id,book,par_num,level,class,title,text
NULL,p121,523,100,bodytext,,"Vijjāti vindiyaṃ vindatīti vijjā, vijjhanaṭṭhena vijjā, viditakaraṇaṭṭhena vijjā. ‘‘Dukkhe ñāṇa’’ntiādīsu dukkhasaccassa yāthāvasarasalakkhaṇaṃ jānāti passati paṭivijjhatīti dukkhe ariyasacce visayabhūte ñāṇaṃ ‘‘dukkhe ñāṇa’’nti vuttaṃ. Esa nayo sesesupi. Paññāti tassa tassa atthassa pākaṭakaraṇasaṅkhātena paññāpanaṭṭhena paññā, tena tena vā aniccādinā pakārena dhamme jānātīti paññā. Pajānanākāro pajānanā. Aniccādīni vicinatīti vicayo. Pakārehi vicinatīti pavicayo. Catusaccadhamme vicinatīti dhammavicayo. Aniccādīnaṃ sallakkhaṇavasena sallakkhaṇā. Tesaṃyeva pati pati upalakkhaṇavasena paccupalakkhaṇā. Paṇḍitabhāvo paṇḍiccaṃ. Kusalabhāvo kosallaṃ. Nipuṇabhāvo nepuññaṃ. Aniccādīnaṃ vibhāvanavasena vebhabyā. Tesaṃyeva cintanavasena cintā. Aniccādīni upaparikkhatīti upaparikkhā. Bhūrīti pathaviyā nāmaṃ, ayampi saṇhaṭṭhena vitthataṭṭhena ca bhūrī viyāti bhūrī. Tena vuttaṃ – ‘‘bhūrī vuccati pathavī, tāya pathavisamāya vitthatāya paññāya samannāgatoti  bhūripañño’’ti  (mahāni. 27). Api ca bhūrīti paññāyevetaṃ adhivacanaṃ. Bhūte atthe ramatīti bhūrī."
NULL,p121,524,100,bodytext,,"Kilese medhati hiṃsatīti medhā, khippaṃ gahaṇadhāraṇaṭṭhena vā medhā. Yassuppajjati, taṃ sattaṃ hitapaṭipattiyaṃ sampayuttaṃ vā yāthāvalakkhaṇapaṭivedhe pariṇetīti pariṇāyikā. Aniccādivasena dhamme vipassatīti vipassanā. Sammā pakārehi aniccādīni jānātīti sampajaññaṃ. Uppathapaṭipanne sindhave vīthiāropanatthaṃ patodo viya uppathe dhāvanakūṭacittaṃ vīthiāropanatthaṃ vijjhatīti patodo viyāti patodo. Dassanalakkhaṇe indaṭṭhaṃ kāretīti indriyaṃ, paññāsaṅkhātaṃ indriyaṃ paññindriyaṃ. Avijjāya na kampatīti paññābalaṃ. Kilesacchedanaṭṭhena paññāva satthaṃ paññāsatthaṃ. Accuggataṭṭhena paññāva pāsādo paññāpāsādo. Ālokanaṭṭhena paññāva āloko paññāāloko."
NULL,p121,525,100,bodytext,,"Obhāsanaṭṭhena paññāva obhāso paññāobhāso. Pajjotanaṭṭhena paññāva pajjoto paññāpajjoto. Ratikaraṇaṭṭhena ratidāyakaṭṭhena ratijanakaṭṭhena cittīkataṭṭhena dullabhapātubhāvaṭṭhena atulaṭṭhena anomasattaparibhogaṭṭhena ca paññāva ratanaṃ paññāratanaṃ. Na tena sattā muyhanti, sayaṃ vā ārammaṇe na muyhatīti amoho. Dhammavicayapadaṃ vuttatthameva. Kasmā panetaṃ puna vuttanti? Amohassa mohapaṭipakkhabhāvadīpanatthaṃ. Tenetaṃ dīpeti – yvāyaṃ amoho, so na kevalaṃ mohato añño dhammo, mohassa paṭipakkho dhammavicayasaṅkhāto amohova idhādhippetoti. Sammādiṭṭhīti yāthāvaniyyānikakusaladiṭṭhi. Dhammavicayasaṅkhāto pasattho sundaro vā bojjhaṅgoti dhammavicayasambojjhaṅgo. Maggaṅganti ariyamaggassa aṅgaṃ kāraṇanti maggaṅgaṃ. Ariyamaggassa antogadhattā maggapariyāpannanti."
NULL,p121,526,100,bodytext,,"Asaññāsamāpattīti saññāvirāgabhāvanāvasena pavattitā asaññabhavūpapattinibbattanasamāpatti. Anuppanne hi buddhe ekacce titthāyatane pabbajitvā vāyokasiṇe parikammaṃ katvā catutthajjhānaṃ nibbattetvā jhānā vuṭṭhāya saññāya dosaṃ passanti, saññāya sati hatthacchedādidukkhañceva sabbabhayāni  ca honti, ‘‘alaṃ imāya saññāya, saññābhāvo santo’’ti evaṃ saññāya dosaṃ passitvā saññāvirāgavasena catutthajjhānaṃ nibbattetvā aparihīnajjhānā kālaṃ katvā asaññīsu nibbattanti. Cittaṃ nesaṃ cuticittanirodheneva idha nivattati, rūpakkhandhamattameva tattha nibbattati."
NULL,p121,527,100,bodytext,,"Te  yathā nāma jiyāvegukkhitto saro yattako jiyāvego, tattakameva ākāse gacchati, evamevaṃ jhānavegukkhittā upapajjitvā yattako jhānavego, tattakameva kālaṃ tiṭṭhanti. Jhānavege pana parikkhīṇe tattha rūpakkhandho antaradhāyati, idha paṭisandhisaññā uppajjati, taṃ sandhāya vuttaṃ – ‘‘asaññabhavūpapattinibbattanasamāpattī’’ti. Vibhūtasaññāsamāpattīti viññāṇañcāyatanasamāpatti. Sā hi paṭhamāruppaviññāṇassa paṭhamāruppasaññāyapi vibhāvanato ‘‘vibhūtasaññā’’ti vuccati. Keci ‘‘vibhūtarūpasaññā’’ti paṭhanti, tesaṃ matena vibhūtarūpasamāpatti nāma sesāruppasamāpattiyo. Sesā samāpattiyo suviññeyyāva."
NULL,p121,528,100,bodytext,,"Nevasekkhanāsekkho jhāyīti jhānalābhī puthujjano. Ājāniyo jhāyīti arahā, sabbepi vā ariyapuggalā. Assakhaluṅko jhāyīti khaluṅkassasadiso jhāyī. Tathā hi khaluṅko asso damathaṃ na upeti ito cito ca yathāruci dhāvati, evamevaṃ yo puthujjano abhiññālābhī, so abhiññā assādetvā ‘‘alamettāvatā, katamettāvatā’’ti uttaridamathāya aparisakkanto abhiññācittavasena ito cito ca dhāvati pavattati, so ‘‘assakhaluṅko jhāyī’’ti vutto. Diṭṭhuttaro jhāyīti jhānalābhī diṭṭhigatiko. Paññuttaro jhāyīti lakkhaṇūpanijjhānena jhāyī, sabbo eva vā paññādhiko jhāyī."
NULL,p121,529,100,bodytext,,"Saraṇo samādhīti akusalacittekaggatā, sabbopi vā sāsavo samādhi. Araṇo samādhīti sabbo kusalābyākato samādhi, lokuttaro eva vā. Savero samādhīti paṭighacittesu ekaggatā. Avero samādhīti mettācetovimutti. Anantaradukepi eseva nayo. Sāmiso samādhīti lokiyasamādhi. So hi anatikkantavaṭṭāmisalokāmisatāya sāmiso. Nirāmiso samādhīti lokuttaro samādhi. Sasaṅkhāro samādhīti dukkhāpaṭipado dandhābhiñño sukhāpaṭipado ca dandhābhiñño. So hi sasaṅkhārena sappayogena cittena paccanīkadhamme kicchena  kasirena niggahetvā adhigantabbo. Itaro asaṅkhāro samādhi. Ekaṃsabhāvito samādhīti sukkhavipassakassa samādhi. Ubhayaṃsabhāvito samādhīti samathayānikassa samādhi. Ubhayato bhāvitabhāvano samādhīti kāyasakkhino ubhatobhāgavimuttassa ca samādhi. So hi ubhayato bhāgehi ubhayato bhāvitabhāvano."
NULL,p121,530,100,bodytext,,"Āgāḷhapaṭipadāti kāmānaṃ orohanapaṭipatti, kāmasukhānuyogoti attho. Nijjhāmapaṭipadāti kāmassa nijjhāpanavasena khedanavasena pavattā paṭipatti, attakilamathānuyogoti  attho. Akkhamā paṭipadātiādīsu padhānakaraṇakāle sītādīni asahantassa paṭipadā, tāni nakkhamatīti akkhamā. Sahantassa pana tāni khamatīti khamā. ‘‘Uppannaṃ kāmavitakkaṃ nādhivāsetī’’tiādinā (ma. ni. 1.26; a. ni. 4.14; 6.58) nayena micchāvitakke sametīti samā. Manacchaṭṭhāni indriyāni dametīti damā paṭipadā."
NULL,p121,531,100,bodytext,,"Evanti iminā vuttanayena. Yo dhammoti yo koci jātiādidhammo. Yassa dhammassāti tato aññassa jarādidhammassa. Samānabhāvoti dukkhādibhāvena samānabhāvo. Ekattatāyāti samānatāya dukkhādibhāvānaṃ ekībhāvena. Ekī bhavatīti anekopi ‘‘dukkha’’ntiādinā ekasaddābhidheyyatāya ekī bhavati. Etena ekattatāya lakkhaṇamāha. Yena yena vā pana vilakkhaṇoti yo dhammo yassa dhammassa yena yena bhāvena visadiso. Tena tena vemattaṃ gacchatīti tena tena bhāvena so dhammo tassa dhammassa vemattataṃ visadisattaṃ gacchati, dukkhabhāvena samānopi jātiādiko abhinibbattiādibhāvena jarādikassa visiṭṭhataṃ gacchatīti attho. Iminā vemattatāya lakkhaṇamāha."
NULL,p121,532,100,bodytext,,"Idāni tāva ekattavemattatāvisaye niyojetvā dassetuṃ ‘‘sutte vā veyyākaraṇe vā’’tiādi vuttaṃ. Tattha pucchitanti pucchāvasena desitasuttavasena vuttaṃ, na pana adhiṭṭhānahārassa pucchāvisayatāya. Sesaṃ uttānameva."
NULL,p121,533,100,centered,,"Adhiṭṭhānahāravibhaṅgavaṇṇanā niṭṭhitā."
NULL,p121,534,4,subhead,"15. Parikkhārahāravibhaṅgavaṇṇanā","15. Parikkhārahāravibhaṅgavaṇṇanā"
NULL,p121,535,100,bodytext,,"49. Tatthakatamo parikkhāro hāroti parikkhārahāravibhaṅgo. Tattha yo dhammo yaṃ dhammaṃ janayati, tassa so parikkhāroti saṅkhepato parikkhāralakkhaṇaṃ vatvā taṃ vibhāgena dassetuṃ ‘‘kiṃlakkhaṇo’’tiādi vuttaṃ. Tattha hinoti attano phalaṃ paṭikāraṇabhāvaṃ gacchatīti hetu. Paṭicca etasmā phalaṃ etīti paccayo. Kiñcāpi hetupaccayasaddehi kāraṇameva vuccati, tathāpi tattha visesaṃ vibhāgena dassetuṃ ‘‘asādhāraṇalakkhaṇo’’tiādi vuttaṃ. Sabhāvo hetūti samānabhāvo  bījaṃ hetu. Nanu ca bījaṃ aṅkurādisadisaṃ na hotīti? No na hoti, aññato hi tādisassa anuppajjanato."
NULL,p121,536,100,bodytext,,"‘‘Yathā vā panā’’tiādināpi udāharaṇantaradassanena hetupaccayānaṃ visesameva vibhāveti. Tattha duddhanti khīraṃ. Dadhi bhavatīti ekattanayena abhedopacārena vā vuttaṃ, na aññathā. Na hi khīraṃ dadhi hoti. Tenevāha – ‘‘na catthi ekakālasamavadhānaṃ duddhassa ca dadhissa cā’’ti. Atha vā ghaṭe duddhaṃ pakkhittaṃ dadhi bhavati, dadhi tattha kālantare jāyati paccayantarasamāyogena, tasmā na catthi ekakālasamavadhānaṃ duddhassa ca dadhissa ca rasakhīravipākādīhi bhinnasabhāvattā. Evamevanti yathā hetubhūtassa khīrassa phalabhūtena dadhinā na ekakālasamavadhānaṃ, evamaññassāpi hetussa phalena na ekakālasamavadhānaṃ, na tathā paccayassa, na hi paccayo ekantena phalena bhinnakālo evāti. Evampi hetupaccayānaṃ viseso veditabboti adhippāyo."
NULL,p121,537,100,bodytext,,"Evaṃ bāhiraṃ hetupaccayavibhāgaṃ dassetvā idāni ajjhattikaṃ dassetuṃ ‘‘ayañhi saṃsāro’’tiādi vuttaṃ. Tattha ‘‘avijjā avijjāya hetū’’ti vutte kiṃ ekasmiṃ cittuppāde anekā avijjā vijjantīti? Āha ‘‘purimikā avijjā pacchimikāya avijjāya hetū’’ti. Tena ekasmiṃ kāle hetuphalānaṃ samavadhānaṃ natthīti etamevatthaṃ samattheti. Tattha ‘‘purimikā avijjā’’tiādinā hetuphalabhūtānaṃ avijjānaṃ vibhāgaṃ dasseti. ‘‘Bījaṅkuro viyā’’tiādinā imamatthaṃ dasseti – yathā bījaṃ aṅkurassa hetu hontaṃ samanantarahetutāya hetu hoti. Yaṃ pana bījato phalaṃ nibbattati, tassa bījaṃ paramparahetutāya hetu hoti. Evaṃ avijjāyapi hetubhāve daṭṭhabbanti."
NULL,p121,538,100,bodytext,,"Puna ‘‘yathā vā panā’’tiādināpi hetupaccayavibhāgameva dasseti. Tattha thālakanti dīpakapallikā. Anaggikanti aggiṃ vinā. Dīpetunti jāletuṃ. Iti sabhāvo hetūti evaṃ padīpujjālanādīsu aggiādipadīpasadisaṃ kāraṇaṃ sabhāvo hetu. Parabhāvo paccayoti tattheva kapallikāvaṭṭitelādisadiso aggito añño sabhāvo paccayo. Ajjhattikoti niyakajjhattiko niyakajjhatte bhavo. Bāhiroti tato bahibhūto. Janakoti nibbattako. Pariggāhakoti upatthambhako. Asādhāraṇoti āveṇiko. Sādhāraṇoti aññesampi paccayuppannānaṃ samāno."
NULL,p121,539,100,bodytext,,"Idāni  yasmā kāraṇaṃ ‘‘parikkhāro’’ti vuttaṃ, kāraṇabhāvo ca phalāpekkhāya, tasmā kāraṇassa yo kāraṇabhāvo yathā ca so hoti, yañca phalaṃ yo ca tassa viseso, yo ca kāraṇaphalānaṃ sambandho, taṃ sabbaṃ vibhāvetuṃ ‘‘avupacchedattho’’tiādi vuttaṃ. Tattha kāraṇaphalabhāvena sambandhatā santati. Ko ca tattha sambandho, ko kāraṇaphalabhāvo ca? So eva avupacchedattho. Yo phalabhūto aññassa akāraṇaṃ hutvā nirujjhati, so vupacchinno nāma hoti, yathā taṃ arahato cuticittaṃ. Yo pana attano anurūpassa phalassa hetu hutvā nirujjhati, so anupacchinno eva nāma hoti, hetuphalasambandhassa vijjamānattāti āha – ‘‘avupacchedattho santatiattho’’ti."
NULL,p121,540,100,bodytext,,"Yasmā ca kāraṇato nibbattaṃ phalaṃ nāma, na anibbattaṃ, tasmā ‘‘nibbattiattho phalattho’’ti vuttaṃ. Yasmā pana purimabhavena anantarabhavapaṭisandhānavasena pavattā upapattikkhandhā punabbhavo, tasmā vuttaṃ – ‘‘paṭisandhiattho punabbhavattho’’ti. Tathā yassa puggalassa kilesā uppajjanti, taṃ palibundhenti sammā paṭipajjituṃ na denti. Yāva ca maggena asamugghātitā, tāva anusenti nāma, tena vuttaṃ – ‘‘palibodhattho pariyuṭṭhānattho, asamugghātattho anusayattho’’ti. Pariññābhisamayavasena pariññāte na kadāci taṃ nāmarūpaṅkurassa kāraṇaṃ hessatīti āha – ‘‘apariññātattho viññāṇassa bījattho’’ti. Yattha avupacchedo tattha santatīti yattha rūpārūpappavattiyaṃ yathāvutto avupacchedo, tattha santativohāro. Yattha santati tattha nibbattītiādi paccayaparamparadassanaṃ hetuphalasambandhavibhāvanameva."
NULL,p121,541,100,bodytext,,"‘‘Yathā vā pana cakkhuñca paṭiccā’’tiādinā ‘‘sabhāvo hetū’’ti vuttamevatthaṃ vibhāgena dasseti. Tattha sannissayatāyāti upanissayapaccayatāya. Manasikāroti kiriyāmanodhātu. Sā hi cakkhuviññāṇassa viññāṇabhāvena samānajātitāya sabhāvo hetu. Saṅkhārā viññāṇassa paccayo sabhāvo hetūti puññādiabhisaṅkhārā paṭisandhiviññāṇassa paccayo, tattha yo sabhāvo, so hetūti. Saṅkhārāti cettha sabbo lokiyo kusalākusalacittuppādo adhippeto. Iminā nayena sesapadesupi attho veditabbo. Evaṃ yo koci upanissayo sabbo so parikkhāroti yathāvuttappabhedo yo koci paccayo, so sabbo attano phalassa parikkharaṇato abhisaṅkharaṇato parikkhāro. Tassa niddhāretvā kathanaṃ parikkhāro hāroti."
NULL,p121,542,100,centered,,"Parikkhārahāravibhaṅgavaṇṇanā niṭṭhitā."
NULL,p121,543,4,subhead,"16. Samāropanahāravibhaṅgavaṇṇanā","16. Samāropanahāravibhaṅgavaṇṇanā"
NULL,p121,544,100,bodytext,,"50. Tatthakatamo samāropano hāroti samāropanahāravibhaṅgo. Tattha ekasmiṃ padaṭṭhāneti yasmiṃ kismiñci ekasmiṃ kāraṇabhūte dhamme suttena gahite. Yattakāni padaṭṭhānāni otarantīti yattakāni aññesaṃ kāraṇabhūtāni tasmiṃ dhamme samosaranti. Sabbāni tāni samāropayitabbānīti sabbāni tāni padaṭṭhānāni padaṭṭhānabhūtā dhammā sammā niddhāraṇavasena ānetvā desanāya āropetabbā, desanāruḷhe viya katvā kathetabbāti attho. Yathā āvaṭṭe hāre ‘‘ekamhi padaṭṭhāne, pariyesati sesakaṃ padaṭṭhāna’’nti (netti. 4 niddesavāra) vacanato anekesaṃ padaṭṭhānānaṃ pariyesanā vuttā, evamidhāpi bahūnaṃ padaṭṭhānānaṃ samāropanā kātabbāti dassento ‘‘yathā āvaṭṭe hāre’’ti āha. Na kevalaṃ padaṭṭhānavaseneva samāropanā, atha kho vevacanabhāvanāpahānavasenapi samāropanā kātabbāti dassento ‘‘tattha samāropanā catubbidhā’’tiādimāha."
NULL,p121,545,100,bodytext,,"Kasmā  panettha padaṭṭhānavevacanāni gahitāni, nanu padaṭṭhānavevacanahāre eva ayamattho vibhāvitoti? Saccametaṃ, idha pana padaṭṭhānavevacanaggahaṇaṃ bhāvanāpahānānaṃ adhiṭṭhānavisayadassanatthañceva tesaṃ adhivacanavibhāgadassanatthañca. Evañhi bhāvanāpahānāni suviññeyyāni honti sukarāni ca paññāpetuṃ. Idaṃ padaṭṭhānanti idaṃ tividhaṃ sucaritaṃ buddhānaṃ sāsanassa ovādassa visayādhiṭṭhānabhāvato padaṭṭhānaṃ. Tattha ‘‘kāyika’’ntiādinā tīhi sucaritehi sīlādayo tayo khandhe samathavipassanā tatiyacatutthaphalāni ca niddhāretvā dasseti, taṃ suviññeyyameva. Vanīyatīti vanaṃ, vanati, vanute iti vā vanaṃ. Tattha yasmā pañca kāmaguṇā kāmataṇhāya, nimittaggāho anubyañjanaggāhassa, ajjhattikabāhirāni āyatanāni tappaṭibandhachandarāgādīnaṃ, anusayā ca pariyuṭṭhānānaṃ kāraṇāni honti, tasmā tamatthaṃ dassetuṃ ‘‘pañca kāmaguṇā’’tiādi vuttaṃ."
NULL,p121,546,100,bodytext,,"51. Ayaṃ vevacanena samāropanāti yo ‘‘rāgavirāgā cetovimutti sekkhaphalaṃ, anāgāmiphalaṃ, kāmadhātusamatikkamana’’nti etehi pariyāyavacanehi tatiyaphalassa niddeso, tathā yo ‘‘avijjāvirāgā paññāvimutti asekkhaphalaṃ, aggaphalaṃ arahattaṃ, tedhātukasamatikkamana’’nti  etehi pariyāyavacanehi catutthaphalassa niddeso, yo ca ‘‘paññindriya’’ntiādīhi pariyāyavacanehi paññāya niddeso, ayaṃ vevacanehi ca samāropanā."
NULL,p121,547,100,bodytext,,"Tasmātiha tvaṃ, bhikkhu, kāye kāyānupassī viharāhītiādi lakkhaṇahāravibhaṅgavaṇṇanāyaṃ vuttanayena veditabbaṃ. Kevalaṃ tattha ekalakkhaṇattā avuttānampi vuttabhāvadassanavaseneva āgataṃ, idha bhāvanāsamāropanavasenāti ayameva viseso. Kāyānupassanā visesato asubhānupassanā eva kāmarāgatadekaṭṭhakilesānaṃ ekantapaṭipakkhāti asubhasaññā kabaḷīkārāhārapariññāya paribandhakilesā kāmupādānaṃ kāmayogo abhijjhākāyagantho kāmāsavo kāmogho rāgasallaṃ rūpadhammapariññāya paṭipakkhakilesā rūpadhammesu rāgo chandāgatigamananti etesaṃ pāpadhammānaṃ pahānāya saṃvattatīti imamatthaṃ dasseti ‘‘kāye kāyānupassī viharanto’’tiādinā."
NULL,p121,548,100,bodytext,,"Tathā  vedanānupassanā visesato dukkhānupassanāti, sā –"
NULL,p121,549,100,gatha1,,"‘‘Yo sukhaṃ dukkhato adda, dukkhamaddakkhi sallato;"
NULL,p121,550,100,gathalast,,"Adukkhamasukhaṃ santaṃ, adakkhi naṃ aniccato’’ti. (saṃ. ni. 4.253; itivu. 53) –"
NULL,p121,551,100,bodytext,,"Ādivacanato sabbaṃ vedanaṃ ‘‘dukkha’’nti passantī sukhasaññāya vedanāhetupariññāya paribandhakilesānaṃ gosīlādīhi bhavasuddhi hotīti vedanāssādena pavattassa bhavupādānasaṅkhātassa sīlabbatupādānassa vedanāvasena ‘‘anatthaṃ me acarī’’tiādinayappavattassa (dī. ni. 3.340; a. ni. 9.29; 10.79; dha. sa. 1237; vibha. 909, 960) byāpādakāyaganthassa dosasallassa vedanāssādavaseneva pavattassa bhavayogabhavābhavabhavoghasaṅkhātassa bhavarāgassa bhavapariññāya paribandhakakilesānaṃ vedanāvisayassa rāgassa dosāgatigamanassa ca pahānāya saṃvattatīti etamatthaṃ dasseti ‘‘vedanāsu vedanānupassī’’tiādinā."
NULL,p121,552,100,bodytext,,"Tathā cittānupassanā visesato aniccānupassanāti, sā cittaṃ ‘‘anicca’’nti passantī tattha yebhuyyena sattā niccasaññinoti niccasaññāya viññāṇāhārapariññāya paribandhakilesānaṃ niccābhinivesapaṭipakkhato eva diṭṭhupādānaṃ diṭṭhiyogasīlabbataparāmāsakāyaganthadiṭṭhāsavadiṭṭhoghasaṅkhātāya diṭṭhiyā niccasaññānimittassa ‘‘seyyohamasmī’’tiādinayappavattassa  (dha. sa. 1239; vibha. 832, 866, 962) mānasallassa saññāpariññāya paṭipakkhakilesānaṃ saññāya rāgassa diṭṭhābhinivesassa appahīnattā uppajjanakassa bhayāgatigamanassa ca pahānāya saṃvattatīti imamatthaṃ dasseti ‘‘citte cittānupassī’’tiādinā."
NULL,p121,553,100,bodytext,,"Tathā dhammānupassanā visesato anattasaññāti, sā saṅkhāresu attasaññāya manosañcetanāhārapariññāya paṭipakkhakilesānaṃ sakkāyadiṭṭhiyā ‘‘idameva sacca’’nti (ma. ni. 2.187, 202-203; 3.27) pavattassa micchābhinivesassa micchābhinivesahetukāya avijjāyogaavijjāsavaavijjoghamohasallasaṅkhātāya avijjāya saṅkhārapariññāya paribandhakilesānaṃ saṅkhāresu rāgassa mohāgatigamanassa  ca pahānāya saṃvattatīti imamatthaṃ dasseti ‘‘dhammesu dhammānupassī viharanto’’tiādinā. Sesaṃ uttānameva."
NULL,p121,554,100,centered,,"Samāropanahāravibhaṅgavaṇṇanā niṭṭhitā."
NULL,p121,555,100,centered,,"Niṭṭhitā ca hāravibhaṅgavaṇṇanā."
NULL,p121,556,4,subhead,"1. Desanāhārasampātavaṇṇanā","1. Desanāhārasampātavaṇṇanā"
NULL,p121,557,100,bodytext,,"Evaṃ suparikammakatāya bhūmiyā nānāvaṇṇāni muttapupphāni pakiranto viya susikkhitasippācariyavicāritesu surattasuvaṇṇālaṅkāresu nānāvidharaṃsijālasamujjalāni vividhāni maṇiratanāni bandhanto viya mahāpathaviṃ parivattetvā pappaṭakojaṃ khādāpento viya yojanikamadhugaṇḍaṃ pīḷetvā sumadhurasaṃ pāyento viya ca āyasmā mahākaccāno nānāsuttapadese udāharanto soḷasa hāre vibhajitvā idāni te ekasmiṃyeva sutte yojetvā dassento hārasampātavāraṃ ārabhi. Ārabhanto ca yāyaṃ niddesavāre –"
NULL,p121,558,8,hangnum,52.,52.
NULL,p121,559,100,gatha1,,"‘‘Soḷasa hārā paṭhamaṃ, disalocanato disā viloketvā;"
NULL,p121,560,100,gathalast,,"Saṅkhipiya aṅkusena hi, nayehi tīhi niddise sutta’’nti. –"
NULL,p121,561,100,unindented,,"Gāthā vuttā. Yasmā taṃ hāravibhaṅgavāro nappayojeti, vippakiṇṇavisayattā, nayavicārassa ca antaritattā. Anekehi suttapadesehi hārānaṃ vibhāgadassanameva hi hāravibhaṅgavāro. Hārasampātavāro pana taṃ payojeti, ekasmiṃyeva suttapadese soḷasa hāre yojetvāva tadanantaraṃ nayasamuṭṭhānassa kathitattā. Tasmā ‘‘soḷasa hārā paṭhama’’nti gāthaṃ paccāmasitvā ‘‘tassā niddeso kuhiṃ daṭṭhabbo, hārasampāte’’ti āha. Tassattho – ‘‘tassā gāthāya niddeso kattha daṭṭhabbo’’ti. Etena suttesu hārānaṃ yojanānayadassanaṃ hārasampātavāroti dasseti. Hārasampātapadassa attho vutto eva."
NULL,p121,562,100,bodytext,,"Arakkhitenacittenāti cakkhudvārādīsu satiārakkhābhāvena aguttena cittena. Micchādiṭṭhihatenāti sassatādimicchābhinivesadūsitena. Thinamiddhābhibhūtenāti cittassa kāyassa ca akalyatālakkhaṇehi thinamiddhehi ajjhotthaṭena. Vasaṃ mārassa gacchatīti kilesamārādīnaṃ yathākāmaṃ karaṇīyo hotīti ayaṃ tāva gāthāya padattho."
NULL,p121,563,100,bodytext,,"Pamādanti ‘‘arakkhitena cittenā’’ti idaṃ padaṃ chasu dvāresu sativosaggalakkhaṇaṃ pamādaṃ katheti. Taṃ maccuno padanti taṃ pamajjanaṃ guṇamāraṇato maccusaṅkhātassa mārassa vasavattanaṭṭhānaṃ, tena ‘‘arakkhitena cittena, vasaṃ mārassa gacchatī’’ti paṭhamapādaṃ catutthapādena sambandhitvā dasseti. So vipallāsoti yaṃ aniccassa khandhapañcakassa ‘‘nicca’’nti dassanaṃ, so vipallāso vipariyesaggāho. Tenevāha – ‘‘viparītaggāhalakkhaṇo vipallāso’’ti. Sabbaṃ vipallāsasāmaññena gahetvā tassa adhiṭṭhānaṃ pucchati ‘‘kiṃ vipallāsayatī’’ti. Sāmaññassa ca viseso adhiṭṭhānabhāvena voharīyatīti āha – ‘‘saññaṃ cittaṃ diṭṭhimitī’’ti. Taṃ ‘‘vipallāsayatī’’ti padena sambandhitabbaṃ. Tesu saññāvipallāso sabbamuduko, aniccādikassa visayassa micchāvasena upaṭṭhitākāraggahaṇamattaṃ migapotakānaṃ tiṇapurisakesu purisoti uppannasaññā viya. Cittavipallāso tato balavataro, amaṇiādike visaye maṇiādiākārena upaṭṭhahante tathā sanniṭṭhānaṃ viya niccādito sanniṭṭhānamattaṃ. Diṭṭhivipallāso pana sabbabalavataro yaṃ yaṃ ārammaṇaṃ yathā yathā upaṭṭhāti, tathā tathā naṃ sassatādivasena ‘‘idameva saccaṃ moghamañña’’nti abhinivisanto pavattati. Tattha saññāvipallāso cittavipallāsassa kāraṇaṃ, cittavipallāso diṭṭhivipallāsassa kāraṇaṃ hoti."
NULL,p121,564,100,bodytext,,"Idāni vipallāsānaṃ pavattiṭṭhānaṃ visayaṃ dassetuṃ ‘‘so kuhiṃ vipallāsayati, catūsu attabhāvavatthūsū’’ti āha. Tattha attabhāvavatthūsūti pañcasu upādānakkhandhesu. Te hi āhito ahaṃ  māno etthāti attā, ‘‘attā’’ti bhavati ettha buddhi vohāro cāti attabhāvo, so eva subhādīnaṃ vipallāsassa ca adhiṭṭhānabhāvato vatthu cāti ‘‘attabhāvavatthū’’ti vuccati. ‘‘Rūpaṃ attato samanupassatī’’tiādinā tesaṃ sabbavipallāsamūlabhūtāya sakkāyadiṭṭhiyā pavattiṭṭhānabhāvena attabhāvavatthutaṃ dassetvā puna vipallāsānaṃ pavattiākārena saddhiṃ  visayaṃ vibhajitvā dassetuṃ ‘‘rūpaṃ paṭhamaṃ vipallāsavatthu asubhe subha’’nti vuttaṃ. Taṃ sabbaṃ suviññeyyaṃ. Puna mūlakāraṇavasena vipallāse vibhajitvā dassetuṃ ‘‘dve dhammā cittassa saṃkilesā’’tiādimāha. Tattha kiñcāpi avijjārahitā taṇhā natthi, avijjā ca subhasukhasaññānampi paccayo eva, tathāpi taṇhā etāsaṃ sātisayaṃ paccayoti dassetuṃ ‘‘taṇhānivutaṃ…pe… dukkhe sukha’’nti vuttaṃ. Diṭṭhinivutanti diṭṭhisīsena avijjā vuttāti avijjānivutanti attho. Kāmañcettha taṇhārahitā diṭṭhi natthi, taṇhāpi diṭṭhiyā paccayo eva. Taṇhāpi ‘‘niccaṃ attā’’ti ayoniso ummujjantānaṃ tathāpavattamicchābhinivesassa moho visesapaccayoti dassetuṃ ‘‘diṭṭhinivutaṃ…pe… attā’’ti vuttaṃ."
