id,book,par_num,level,class,title,text
NULL,p134,698,100,bodytext,,"151. Aṭṭhame tathā hi panāti pubbe sovacassatāya, etarahi ca dovacassatāya kāraṇapaṭṭhapane nipāto. Tatrāti tesu theresu. Ko nāmāyaṃ bhikkhūti ko nāmo ayaṃ bhikkhu? Kiṃ tissatthero kiṃ nāgattheroti? Tatrāti tasmiṃ evaṃ sakkāre kayiramāne. Tathattāyāti tathābhāvāya, āraññikādibhāvāyāti attho. Sabrahmacārikāmoti ‘‘ime maṃ parivāretvā carantū’’ti evaṃ kāmeti icchati patthetīti sabrahmacārikāmo. Tathattāyāti lābhasakkāranibbattanatthāya. Brahmacārupaddavenāti yo sabrahmacārīnaṃ catūsu paccayesu adhimattacchandarāgo upaddavoti vuccati, tena upaddutā. Abhipatthanāti adhimattapatthanā. Brahmacāriabhipatthanenāti brahmacārīnaṃ adhimattapatthanāsaṅkhātena catupaccayabhāvena. Aṭṭhamaṃ."
NULL,p134,699,4,subhead,"9. Jhānābhiññasuttavaṇṇanā","9. Jhānābhiññasuttavaṇṇanā"
NULL,p134,700,100,bodytext,,"152. Navame yāvadeva ākaṅkhāmīti yāvadeva icchāmi. Yāni pana ito paraṃ vivicceva kāmehītiādinā nayena cattāri rūpāvacarajjhānāni, sabbaso rūpasaññānaṃ samatikkamātiādinā nayena catasso arūpasamāpattiyo, sabbaso nevasaññānāsaññāyatanaṃ samatikkamma saññāvedayitanirodhanti evaṃ nirodhasamāpatti, anekavihitaṃiddhividhantiādinā nayena pañca lokikābhiññā ca vuttā. Tattha yaṃ vattabbaṃ siyā, taṃ sabbaṃ anupadavaṇṇanāya ceva  bhāvanāvidhānena ca saddhiṃ visuddhimagge (visuddhi. 1.69) vitthāritameva. Chaḷabhiññāya pana āsavānaṃ khayāti āsavānaṃ khayena. Anāsavanti āsavānaṃ apaccayabhūtaṃ. Cetovimuttinti arahattaphalasamādhiṃ. Paññāvimuttinti arahattaphalapaññaṃ. Navamaṃ."
NULL,p134,701,4,subhead,"10. Upassayasuttavaṇṇanā","10. Upassayasuttavaṇṇanā"
NULL,p134,702,100,bodytext,,"153. Dasame āyāma, bhanteti kasmā bhikkhunīupassayagamanaṃ yācati? Na lābhasakkārahetu, kammaṭṭhānatthikā panettha bhikkhuniyo atthi, tā ussukkāpetvā kammaṭṭhānaṃ kathāpessāmīti yācati. Nanu ca so sayampi tepiṭako bahussuto, kiṃ sayaṃ kathetuṃ na sakkotīti? No na sakkoti. Buddhapaṭibhāgassa pana sāvakassa kathaṃ saddhātabbaṃ maññissantīti yācati. Bahukicco tvaṃ bahukaraṇīyoti kiṃ thero navakammādipasuto, yena naṃ evamāhāti? No, satthari pana parinibbute catasso parisā ānandattheraṃ upasaṅkamitvā, ‘‘bhante, idāni kassa pattacīvaraṃ gahetvā caratha, kassa pariveṇaṃ sammajjatha, kassa mukhodakaṃ dethā’’ti rodanti paridevanti. Thero ‘‘aniccā saṅkhārā, vuddhasarīrepi nillajjova maccurājā pahari. Esā saṅkhārānaṃ dhammatā, mā socittha, mā paridevitthā’’ti parisaṃ saññāpeti. Idamassa bahukiccaṃ. Taṃ sandhāya thero evamāha. Sandassesīti paṭipattiguṇaṃ dassesi. Samādapesīti gaṇhāpesi. Samuttejesīti samussāhesi. Sampahaṃsesīti paṭiladdhaguṇena modāpesi."
NULL,p134,703,100,bodytext,,"Thullatissāti sarīrena thūlā, nāmena tissā. Vedehamuninoti paṇḍitamunino. Paṇḍito hi ñāṇasaṅkhātena vedena īhati sabbakiccāni karoti, tasmā ‘‘vedeho’’ti vuccati. Vedeho ca so muni cāti, vedehamuni. Dhammaṃbhāsitabbaṃ maññatīti tipiṭakadharassa dhammabhaṇḍāgārikassa sammukhe sayaṃ araññavāsī paṃsukūliko samāno ‘‘dhammakathiko aha’’nti dhammaṃ bhāsitabbaṃ maññati. Idaṃ kiṃ pana, kathaṃ panāti? Avajānamānā bhaṇati. Assosīti aññena āgantvā ārocitavasena assosi. Āgamehi tvaṃ, āvusoti tiṭṭha tvaṃ, āvuso. Mā te saṅgho uttari upaparikkhīti mā bhikkhusaṅgho atirekaokāse taṃ upaparikkhīti. Idaṃ vuttaṃ hoti – ‘‘ānandena buddhapaṭibhāgo sāvako vārito, ekā bhikkhunī na vāritā, tāya saddhiṃ santhavo vā sineho vā bhavissatī’’ti mā taṃ saṅgho evaṃ amaññīti."
NULL,p134,704,100,bodytext,,"Idāni  attano buddhapaṭibhāgabhāvaṃ dīpento taṃ kiṃ maññasi, āvusotiādimāha? Sattaratananti sattahatthappamāṇaṃ. Nāganti hatthiṃ. Aḍḍhaṭṭharatanaṃ vāti aḍḍharatanena ūnaaṭṭharatanaṃ, purimapādato paṭṭhāya yāva kumbhā vidatthādhikasattahatthubbedhanti attho. Tālapattikāyāti taruṇatālapaṇṇena. Cavitthāti cutā, na matā vā naṭṭhā vā, buddhapaṭibhāgassa pana sāvakassa upavādaṃ vatvā mahākassapatthere chahi abhiññāhi sīhanādaṃ nadante tassā kāsāvāni kaṇṭakasākhā viya kacchusākhā viya ca sarīraṃ khādituṃ āraddhāni, tāni hāretvā setakāni nivatthakkhaṇeyevassā cittassādo udapādīti. Dasamaṃ."
NULL,p134,705,4,subhead,"11. Cīvarasuttavaṇṇanā","11. Cīvarasuttavaṇṇanā"
NULL,p134,706,100,bodytext,,"154. Ekādasame dakkhiṇāgirisminti rājagahaṃ parivāretvā ṭhitassa girino dakkhiṇabhāge janapado dakkhiṇāgiri nāma, tasmiṃ cārikaṃ caratīti attho. Cārikā ca nāma duvidhā hoti turitacārikā ca aturitacārikā ca. Tattha yaṃ ekacco ekaṃ kāsāvaṃ nivāsetvā ekaṃ pārupitvā pattacīvaraṃ aṃse laggetvā chattaṃ ādāya sarīrato sedehi paggharantehi divasena sattaṭṭhayojanāni gacchati, yaṃ vā pana buddhā kiñcideva  bodhaneyyasattaṃ disvā yojanasatampi yojanasahassampi khaṇena gacchanti, esā turitacārikā nāma. Devasikaṃ pana gāvutaṃ aḍḍhayojanaṃ tigāvutaṃ yojananti ettakaṃ addhānaṃ ajjatanāya nimantanaṃ adhivāsayato janasaṅgahaṃ karoto gamanaṃ, esā aturitacārikā nāma. Ayaṃ idha adhippetā."
NULL,p134,707,100,bodytext,,"Nanu ca thero pañcavīsati vassāni chāyā viya dasabalassa pacchato pacchato gacchantova ahosi, ‘‘kahaṃ ānando’’ti vacanassa okāsameva na adāsi, so kismiṃ kāle bhikkhusaṅghena saddhiṃ cārikaṃ carituṃ okāsaṃ labhatīti? Satthu parinibbānasaṃvacchare. Parinibbute kira satthari mahākassapatthero satthu parinibbāne sannipatitassa bhikkhusaṅghassa majjhe nisīditvā dhammavinayasaṅgāyanatthaṃ pañcasate bhikkhū uccinitvā, ‘‘āvuso, mayaṃ rājagahe vassaṃ vasantā dhammavinayaṃ saṅgāyissāma, tumhe pure  vassūpanāyikāya attano palibodhaṃ ucchinditvā rājagahe sannipatathā’’ti vatvā attanā rājagahaṃ gato. Ānandattheropi bhagavato pattacīvaraṃ ādāya mahājanaṃ saññāpento sāvatthiṃ gantvā tato nikkhamma rājagahaṃ gacchanto dakkhiṇāgirismiṃ cārikaṃ cari. Taṃ sandhāyetaṃ vuttaṃ."
NULL,p134,708,100,bodytext,,"Yebhuyyenakumārabhūtāti ye te hīnāyāvattā nāma, te yebhuyyena kumārakā daharā taruṇā ekavassikadvevassikā bhikkhū ceva anupasampannakumārakā ca. Kasmā panete pabbajitā, kasmā hīnāyāvattāti? Tesaṃ kira mātāpitaro cintesuṃ – ‘‘ānandatthero satthu vissāsiko aṭṭha vare yācitvā upaṭṭhahati, icchiticchitaṭṭhānaṃ satthāraṃ gahetvā gantuṃ sakkoti, amhākaṃ dārake etassa santike pabbājema, so satthāraṃ gahetvā āgamissati, tasmiṃ āgate mayaṃ mahāsakkāraṃ kātuṃ labhissāmā’’ti. Iminā tāva kāraṇena nesaṃ ñātakā te pabbājesuṃ. Satthari pana parinibbute tesaṃ sā patthanā upacchinnā, atha te ekadivaseneva uppabbājesuṃ."
NULL,p134,709,100,bodytext,,"Yathābhirantanti  yathāruciyā yathāajjhāsayena. Tikabhojanaṃ paññattanti, idaṃ ‘‘gaṇabhojane aññatra samayā pācittiya’’nti (pāci. 211). Idaṃ sandhāya vuttaṃ. Tattha hi tiṇṇaṃ janānaṃ akappiyanimantanaṃ sādiyitvā ekato paṭiggaṇhantānampi anāpatti, tasmā ‘‘tikabhojana’’nti vuttaṃ."
NULL,p134,710,100,bodytext,,"Dummaṅkūnaṃ puggalānaṃ niggahāyāti dussīlapuggalānaṃ niggaṇhanatthaṃ. Pesalānaṃ bhikkhūnaṃ phāsuvihārāyāti dummaṅkūnaṃ niggaheneva pesalānaṃ uposathapavāraṇā vattanti, samaggavāso hoti, ayaṃ tesaṃ phāsuvihāro hoti, imassa phāsuvihārassa atthāya. Mā pāpicchā pakkhaṃ nissāya saṅghaṃ bhindeyyunti yathā devadatto sapariso kulesu viññāpetvā bhuñjanto pāpicche nissāya saṅghaṃ bhindi, evaṃ aññepi pāpicchā gaṇabandhena kulesu viññāpetvā bhuñjamānā gaṇaṃ vaḍḍhetvā taṃ pakkhaṃ nissāya mā saṅghaṃ bhindeyyunti, iti iminā kāraṇena paññattanti attho. Kulānuddayatāya cāti bhikkhusaṅghe uposathapavāraṇaṃ katvā samaggavāsaṃ vasante  manussā salākabhattādīni datvā saggaparāyaṇā bhavanti, iti imāya kulānuddayatāya ca paññattanti attho."
NULL,p134,711,100,bodytext,,"Sassaghātaṃ maññe carasīti sassaṃ ghātento viya āhiṇḍasi. Kulūpaghātaṃ maññe carasīti kulāni upaghātento viya hananto viya āhiṇḍasi. Olujjatīti visesena palujjati bhijjati. Palujjanti kho te, āvuso, navappāyāti, āvuso, ete tuyhaṃ pāyena yebhuyyena navakā ekavassikaduvassikā daharā ceva sāmaṇerā ca palujjanti bhijjanti. Na vāyaṃ kumārako mattamaññāsīti ayaṃ kumārako attano pamāṇaṃ na jānātīti theraṃ tajjento āha."
NULL,p134,712,100,bodytext,,"Kumārakavādāna muccāmāti kumārakavādato na muccāma. Tathā hi pana tvanti idamassa evaṃ vattabbatāya kāraṇadassanatthaṃ vuttaṃ. Ayañhettha adhippāyo – yasmā tvaṃ imehi navehi bhikkhūhi indriyasaṃvararahitehi saddhiṃ vicarasi, tasmā kumārakehi saddhiṃ vicaranto kumārakoti vattabbataṃ arahasīti."
NULL,p134,713,100,bodytext,,"Aññatitthiyapubbo samānoti idaṃ yasmā therassa imasmiṃ sāsane neva ācariyo na upajjhāyo paññāyati, sayaṃ kāsāyāni gahetvā nikkhanto, tasmā anattamanatāya aññatitthiyapubbataṃ āropayamānā āha."
NULL,p134,714,100,bodytext,,"Sahasāti ettha rāgamohacāropi sahasācāro, idaṃ pana dosacāravasena vuttaṃ. Appaṭisaṅkhāti appaccavekkhitvā, idāni attano pabbajjaṃ sodhento yatvāhaṃ, āvusotiādimāha. Tattha aññaṃ satthāraṃ uddisitunti ṭhapetvā bhagavantaṃ aññaṃ mayhaṃ satthāti evaṃ uddisituṃ na jānāmi. Sambādho gharāvāsotiādīsu sacepi saṭṭhihatthe ghare yojanasatantarepi vā dve jāyampatikā vasanti, tathāpi tesaṃ sakiñcanasapalibodhaṭṭhena gharāvāso sambādhoyeva. Rajāpathoti rāgarajādīnaṃ uṭṭhānaṭṭhānanti mahāaṭṭhakathāyaṃ vuttaṃ. ‘‘Āgamanapatho’’tipi vattuṃ vaṭṭati. Alagganaṭṭhena abbhokāso viyāti abbhokāso. Pabbajito hi kūṭāgāraratanamayapāsādadevavimānādīsu pihitadvāravātapānesu paṭicchannesu vasantopi neva laggati na sajjati na bajjhati, tena vuttaṃ  ‘‘abbhokāso pabbajjā’’ti. Apica sambādho gharāvāso kusalakiriyāya okāsābhāvato rajāpatho asaṃvutasaṅkāraṭṭhānaṃ viya rajānaṃ, kilesarajānaṃ sannipātaṭṭhānato, abbhokāso pabbajjā kusalakiriyāya yathā sukhaṃ okāsasabbhāvato."
NULL,p134,715,100,bodytext,,"Nayidaṃ sukaraṃ…pe… pabbajeyyanti ettha ayaṃ saṅkhepakathā – yadetaṃ sikkhattayabrahmacariyaṃ ekampi divasaṃ akhaṇḍaṃ katvā carimakacittaṃ pāpetabbatāya ekantaparipuṇṇaṃ caritabbaṃ, ekadivasampi ca kilesamalena amalīnaṃ katvā carimakacittaṃ pāpetabbatāya ekantaparisuddhaṃ, saṅkhalikhitaṃ likhitasaṅkhasadisaṃ dhotasaṅkhasappaṭibhāgaṃ caritabbaṃ, idaṃ na sukaraṃ agāraṃ ajjhāvasatā agāramajjhe vasantena ekantaparipuṇṇaṃ…pe… carituṃ, yaṃnūnāhaṃ kesamassuṃ ohāretvā kasāyarasapītatāya kāsāyāni brahmacariyaṃ carantānaṃ anucchavikāni vatthāni acchādetvā paridahitvā agārasmā nikkhamitvā anagāriyaṃ pabbajjeyyanti. Ettha ca yasmā agārassa  hitaṃ kasivaṇijjādikammaṃ agāriyanti vuccati, taṃ pabbajjāya natthi, tasmā pabbajjā anagāriyāti ñātabbā, taṃ anagāriyaṃ. Pabbajeyyanti paṭipajjeyyaṃ."
NULL,p134,716,100,bodytext,,"Paṭapilotikānanti jiṇṇapilotikānaṃ terasahatthopi hi navasāṭako dasānaṃ chinnakālato paṭṭhāya pilotikāti vuccati. Iti mahārahāni vatthāni chinditvā kataṃ saṅghāṭiṃ sandhāya ‘‘paṭapilotikānaṃ saṅghāṭi’’nti vuttaṃ. Addhānamaggappaṭipannoti aḍḍhayojanato paṭṭhāya maggo addhānanti vuccati, taṃ addhānamaggaṃ paṭipanno, dīghamaggaṃ paṭipannoti attho."
NULL,p134,717,100,bodytext,,"Idāni yathā esa pabbajito, yathā ca addhānamaggaṃ paṭipanno, imassatthassa āvibhāvatthaṃ abhinīhārato paṭṭhāya anupubbikathā kathetabbā – atīte kira kappasatasahassamatthake padumuttaro nāma satthā udapādi, tasmiṃ haṃsavatīnagaraṃ upanissāya kheme migadāye viharante vedeho nāma kuṭumbiko asītikoṭidhanavibhavo pātova subhojanaṃ bhuñjitvā uposathaṅgāni adhiṭṭhāya gandhapupphādīni gahetvā vihāraṃ gantvā satthāraṃ pūjetvā vanditvā ekamantaṃ nisīdi. Tasmiṃ khaṇe satthā mahānisabhattheraṃ nāma tatiyasāvakaṃ ‘‘etadaggaṃ, bhikkhave, mama sāvakānaṃ  bhikkhūnaṃ dhutavādānaṃ yadidaṃ nisabho’’ti etadagge ṭhapesi. Upāsako  taṃ sutvā pasanno dhammakathāvasāne mahājane uṭṭhāya gate satthāraṃ vanditvā, ‘‘bhante, sve mayhaṃ bhikkhaṃ adhivāsethā’’ti āha. Mahā kho, upāsaka, bhikkhusaṅghoti. Kittako bhagavāti. Aṭṭhasaṭṭhibhikkhusatasahassanti. Bhante, ekaṃ sāmaṇerampi vihāre asesetvā bhikkhaṃ adhivāsethāti. Satthā adhivāsesi. Upāsako satthu adhivāsanaṃ viditvā gehaṃ gantvā mahādānaṃ sajjetvā punadivase satthu kālaṃ ārocāpesi. Satthā pattacīvaramādāya bhikkhusaṅghaparivuto upāsakassa gharaṃ gantvā paññattāsane nisinno dakkhiṇodakāvasāne yāgubhattādīni sampaṭicchanto bhattavissaggaṃ akāsi. Upāsakopi satthu santike nisīdi."
NULL,p134,718,100,bodytext,,"Tasmiṃ antare mahānisabhatthero piṇḍāya caranto tameva vīthiṃ paṭipajji. Upāsako disvā uṭṭhāya gantvā theraṃ vanditvā ‘‘pattaṃ, bhante, no dethā’’ti āha. Thero pattaṃ adāsi. Bhante, idheva pavisatha, satthāpi gehe nisinnoti. Na vaṭṭissati upāsakāti. Upāsako therassa pattaṃ gahetvā piṇḍapātassa pūretvā nīharitvā adāsi. Tato theraṃ anugantvā nivatto satthu santike nisīditvā evamāha – ‘‘bhante, mahānisabhatthero ‘satthā gehe nisinno’ti vuttepi pavisituṃ  na icchi, atthi nu kho etassa tumhākaṃ guṇehi atireko guṇo’’ti. Buddhānañca vaṇṇamaccheraṃ nāma natthi. Atha satthā evamāha – ‘‘upāsaka, mayaṃ bhikkhaṃ āgamayamānā gehe nisīdāma, so bhikkhu na evaṃ nisīditvā bhikkhaṃ udikkhati. Mayaṃ gāmantasenāsane vasāma, so araññasmiṃyeva vasati. Mayaṃ channe vasāma, so abbhokāsamhiyeva vasati. Iti tassa ayañca ayañca guṇo’’ti mahāsamuddaṃ pūrayamānova kathesi. Upāsako pakatiyāpi jalamānadīpo telena āsitto viya suṭṭhutaraṃ pasanno hutvā cintesi – ‘‘kiṃ mayhaṃ aññāya sampattiyā, anāgate ekassa buddhassa santike dhutavādānaṃ aggabhāvatthāya patthanaṃ karissāmī’’ti?"
NULL,p134,719,100,bodytext,,"So  punapi satthāraṃ nimantetvā teneva niyāmena satta divasāni dānaṃ datvā sattame divase aṭṭhasaṭṭhibhikkhusatasahassassa ticīvarāni datvā satthu pādamūle nipajjitvā evamāha – ‘‘yaṃ me, bhante, satta divasāni dānaṃ dentassa  mettaṃ kāyakammaṃ mettaṃ vacīkammaṃ mettaṃ manokammaṃ, imināhaṃ na aññaṃ devasampattiṃ vā sakkamārabrahmasampattiṃ vā patthemi, idaṃ pana me kammaṃ anāgate ekassa buddhassa santike mahānisabhattherena pattaṭṭhānantaraṃ pāpuṇanatthāya terasadhutaṅgadharānaṃ aggabhāvassa paccayo hotū’’ti. Satthā ‘‘mahantaṃ ṭhānaṃ iminā patthitaṃ, samijjhissati nu kho’’ti olokento samijjhanabhāvaṃ disvā āha – ‘‘manāpaṃ te ṭhānaṃ patthitaṃ, anāgate satasahassakappamatthake gotamo nāma buddho uppajjissati, tassa tvaṃ tatiyasāvako mahākassapatthero nāma bhavissasī’’ti. Taṃ sutvā upāsako ‘‘buddhānaṃ dve kathā nāma natthī’’ti punadivase pattabbaṃ viya taṃ sampattiṃ amaññittha. So yāvatāyukaṃ sīlaṃ rakkhitvā tattha kālaṅkato sagge nibbatti."
NULL,p134,720,100,bodytext,,"Tato paṭṭhāya devamanussesu sampattiṃ anubhavanto ito ekanavutikappe vipassimhi sammāsambuddhe bandhumatīnagaraṃ nissāya kheme migadāye viharante devalokā cavitvā aññatarasmiṃ parijiṇṇe brāhmaṇakule nibbatti. Tasmiñca kāle ‘‘vipassī bhagavā sattame sattame saṃvacchare dhammaṃ kathetī’’ti mahantaṃ kolāhalaṃ hoti. Sakalajambudīpe devatā ‘‘satthā dhammaṃ kathessatī’’ti ārocenti, brāhmaṇo taṃ sāsanaṃ assosi. Tassa ca nivāsanasāṭako eko hoti, tathā brāhmaṇiyā, pārupanaṃ pana dvinnampi ekameva. Sakalanagare ‘‘ekasāṭakabrāhmaṇo’’ti paññāyati. Brāhmaṇānaṃ kenacideva kiccena sannipāte sati brāhmaṇiṃ gehe ṭhapetvā sayaṃ gacchati, brāhmaṇīnaṃ sannipāte sati sayaṃ gehe tiṭṭhati, brāhmaṇī taṃ vatthaṃ pārupitvā gacchati. Tasmiṃ pana  divase brāhmaṇo brāhmaṇiṃ āha – ‘‘bhoti, kiṃ rattiṃ dhammassavanaṃ suṇissasi divā’’ti? ‘‘Mayaṃ mātugāmajātikā nāma rattiṃ sotuṃ na sakkoma, divā sossāmī’’ti brāhmaṇaṃ gehe ṭhapetvā vatthaṃ pārupitvā upāsikāhi saddhiṃ divā gantvā satthāraṃ vanditvā ekamante nisinnā dhammaṃ sutvā upāsikāhiyeva saddhiṃ āgamāsi. Atha brāhmaṇo brāhmaṇiṃ gehe ṭhapetvā vatthaṃ pārupitvā vihāraṃ gato."
NULL,p134,721,100,bodytext,,"Tasmiṃ ca samaye satthā parisamajjhe alaṅkatadhammāsane sannisinno cittabījaniṃ ādāya ākāsagaṅgaṃ otārento viya sineruṃ matthaṃ katvā  sāgaraṃ nimmathento viya dhammakathaṃ katheti. Brāhmaṇassa parisante nisinnassa dhammaṃ suṇantassa paṭhamayāmasmiṃyeva sakalasarīraṃ pūrayamānā pañcavaṇṇā pīti uppajji. So pārutavatthaṃ saṅgharitvā ‘‘dasabalassa dassāmī’’ti cintesi. Athassa ādīnavasahassaṃ dassayamānaṃ maccheraṃ uppajji, so ‘‘brāhmaṇiyā ca mayhañca ekameva vatthaṃ, aññaṃ kiñci pārupanaṃ natthi, apārupitvā ca nāma bahi carituṃ na sakkā’’ti sabbathāpi adātukāmo ahosi. Athassa nikkhante paṭhamayāme majjhimayāmepi tatheva pīti uppajji, so tatheva ca cintetvā tatheva adātukāmo ahosi. Athassa majjhimayāme nikkhante pacchimayāmepi tatheva pīti uppajji, so ‘‘taraṇaṃ vā hotu maraṇaṃ vā, pacchāpi jānissāmī’’ti vatthaṃ saṅgharitvā satthu pādamūle ṭhapesi. Tato vāmahatthaṃ ābhujitvā dakkhiṇena hatthena tikkhattuṃ apphoṭetvā ‘‘jitaṃ me jitaṃ me’’ti tayo vāre nadi."
NULL,p134,722,100,bodytext,,"Tasmiñca samaye bandhumarājā dhammāsanassa pacchato antosāṇiyaṃ nisinno dhammaṃ suṇāti. Rañño ca nāma ‘‘jitaṃ me’’ti saddo amanāpo hoti. So purisaṃ pesesi ‘‘gaccha etaṃ puccha kiṃ vadesī’’ti? So tena gantvā pucchito āha – ‘‘avasesā hatthiyānādīni āruyha asicammādīni gahetvā parasenaṃ jinanti, na taṃ acchariyaṃ, ahaṃ pana  pacchato āgacchantassa kūṭagoṇassa muggarena sīsaṃ bhinditvā taṃ palāpento viya maccheracittaṃ madditvā pārutavatthaṃ dasabalassa adāsiṃ, taṃ me macchariyaṃ jita’’nti āha. Puriso gantvā taṃ pavattiṃ rañño ārocesi. Rājā āha – ‘‘amhe bhaṇe dasabalassa anurūpaṃ na jānimhā, brāhmaṇo pana jānī’’ti vatthayugampi pesesi. Taṃ disvā brāhmaṇo cintesi – ‘‘ayaṃ mayhaṃ tuṇhī nisinnassa paṭhamaṃ kiñci adatvā satthu guṇe kathentassa adāsi, satthu guṇe paṭicca uppannena mayhaṃ  ko attho’’ti tampi vatthayugaṃ dasabalasseva adāsi. Rājā ‘‘kiṃ brāhmaṇena kata’’nti? Pucchitvā, ‘‘tampi tena vatthayugaṃ tathāgatasseva dinna’’nti sutvā aññāni dve vatthayugāni pesesi. So tānipi adāsi. Rājā aññānipi cattārīti evaṃ yāva dvattiṃsa vatthayugāni pesesi. Atha brāhmaṇo  ‘‘idaṃ vaḍḍhetvā gahaṇaṃ viya hotī’’ti attano atthāya ekaṃ brāhmaṇiyā atthāya ekanti dve vatthayugāni gahetvā tiṃsa yugāni tathāgatasseva adāsi. Tato paṭṭhāya ca satthu vissāsiko jāto."
NULL,p134,723,100,bodytext,,"Atha naṃ rājā ekadivasaṃ sītasamaye satthu santike dhammaṃ suṇantaṃ disvā satasahassagghanikaṃ attano pārutaṃ rattakambalaṃ datvā āha – ‘‘ito paṭṭhāya idaṃ pārupitvā dhammaṃ suṇāhī’’ti. So ‘‘kiṃ me iminā kambalena imasmiṃ pūtikāye upanītenā’’ti? Cintetvā, antogandhakuṭiyaṃ tathāgatamañcassa upari vitānaṃ katvā agamāsi. Atha ekadivasaṃ rājā pātova vihāraṃ gantvā antogandhakuṭiyaṃ satthu santike nisīdi. Tasmiñca samaye chabbaṇṇā buddharasmiyo kambalaṃ paṭihaññanti, kambalo ativiya virocati. Rājā uddhaṃ olokento sañjānitvā āha – ‘‘bhante, amhākaṃ esa kambalo, amhehi ekasāṭakabrāhmaṇassa dinno’’ti. Tumhehi, mahārāja, brāhmaṇo pūjito, brāhmaṇena ahaṃ pūjitoti. Rājā ‘‘brāhmaṇo yuttakaṃ aññāsi, na maya’’nti pasīditvā yaṃ manussānaṃ upakārabhūtaṃ, taṃ  sabbaṃ aṭṭhaṭṭhakaṃ katvā sabbaṭṭhakaṃ nāma dānaṃ datvā purohitaṭṭhāne ṭhapesi. Sopi ‘‘aṭṭhaṭṭhakaṃ nāma catusaṭṭhi hotī’’ti catusaṭṭhi salākabhattāni upanibandhāpetvā yāvajīvaṃ dānaṃ datvā sīlaṃ rakkhitvā tato cuto sagge nibbatti."
NULL,p134,724,100,bodytext,,"Puna tato cuto imasmiṃ kappe koṇāgamanassa ca bhagavato kassapadasabalassa cāti dvinnaṃ buddhānaṃ antare bārāṇasiyaṃ kuṭumbiyaghare nibbatto, so vuddhimanvāya gharāvāsaṃ vasanto ekadivasaṃ araññe jaṅghavihāraṃ carati. Tasmiñca samaye paccekabuddho nadītīre cīvarakammaṃ karonto anuvāte appahonte saṅgharitvā ṭhapetuṃ āraddho. So disvā, ‘‘kasmā, bhante, saṅgharitvā ṭhapethā’’ti? Āha. Anuvāto nappahotīti. ‘‘Iminā, bhante, karothā’’ti sāṭakaṃ datvā, ‘‘nibbattanibbattaṭṭhāne me kenaci parihāni mā hotū’’ti patthanaṃ paṭṭhapesi. Gharepissa bhaginiyā saddhiṃ bhariyāya kalahaṃ karontiyā paccekabuddho piṇḍāya pāvisi."
NULL,p134,725,100,bodytext,,"Athassa  bhaginī paccekabuddhassa piṇḍapātaṃ datvā tassa bhariyaṃ sandhāya ‘‘evarūpaṃ bālaṃ yojanasatena parivajjeyya’’nti patthanaṃ paṭṭhapesi. Sā gehadvāre ṭhitā taṃ sutvā, ‘‘imāya dinnaṃ bhattaṃ esa mā bhuñjatū’’ti pattaṃ gahetvā piṇḍapātaṃ chaḍḍetvā kalalassa pūretvā adāsi. Itarā disvā, ‘‘bāle maṃ tāva akkosa vā pahara vā. Evarūpassa pana dve asaṅkheyyāni pūritapāramissa pattato bhattaṃ chaḍḍetvā kalalaṃ dātuṃ na yutta’’nti āha. Athassa bhariyāya paṭisaṅkhānaṃ uppajji. Sā ‘‘tiṭṭhatha, bhante’’ti kalalaṃ chaḍḍetvā pattaṃ dhovitvā gandhacuṇṇena ubbaṭṭetvā pavarassa catumadhurassa pūretvā upari āsittena padumagabbhavaṇṇena sappinā vijjotamānaṃ paccekabuddhassa hatthe ṭhapetvā, ‘‘yathā ayaṃ piṇḍapāto obhāsajāto, evaṃ obhāsajātaṃ me sarīraṃ hotū’’ti patthanaṃ paṭṭhapesi. Paccekabuddho anumoditvā ākāsaṃ pakkhandi. Tepi jāyampatikā yāvatāyukaṃ kusalaṃ katvā sagge nibbattitvā  puna tato cavitvā upāsako bārāṇasiyaṃ asītikoṭivibhavassa seṭṭhino putto hutvā nibbatti, itarā tādisasseva dhītā hutvā nibbatti."
NULL,p134,726,100,bodytext,,"Tassa vuddhippattassa tameva seṭṭhidhītaraṃ ānayiṃsu. Tassā pubbe adinnavipākassa tassa kammassa ānubhāvena patikulaṃ paviṭṭhamattāya ummārabbhantare sakalasarīraṃ ugghāṭitavaccakuṭi viya duggandhaṃ jātaṃ. Seṭṭhikumāro ‘‘kassāyaṃ gandho’’ti pucchitvā ‘‘seṭṭhikaññāyā’’ti sutvā ‘‘nīharatha nīharathā’’ti ābhataniyāmeneva kulagharaṃ pesesi. Sā eteneva nīhārena sattasu ṭhānesu paṭinivattitā cintesi – ‘‘ahaṃ sattasu ṭhānesu paṭinivattā. Kiṃ me jīvitenā’’ti? Attano ābharaṇabhaṇḍaṃ bhañjāpetvā suvaṇṇiṭṭhakaṃ kāresi ratanāyataṃ vidatthivitthataṃ caturaṅgulubbedhaṃ. Tato haritālamanosilāpiṇḍaṃ gahetvā aṭṭha uppalahatthake ādāya kassapadasabalassa cetiyakaraṇaṭṭhānaṃ gatā. Tasmiñca khaṇe ekā iṭṭhakapanti parikkhipitvā āgacchamānā ghaṭaniṭṭhakāya ūnā hoti. Seṭṭhidhītā vaḍḍhakiṃ āha – ‘‘imaṃ iṭṭhakaṃ ettha ṭhapethā’’ti. Amma, bhaddake kāle āgatāsi, sayameva ṭhapehīti. Sā āruyha telena haritālamanosilaṃ yojetvā tena bandhanena iṭṭhakaṃ patiṭṭhapetvā upari  aṭṭhahi uppalahatthakehi pūjaṃ katvā vanditvā, ‘‘nibbattanibbattaṭṭhāne me kāyato candanagandho vāyatu, mukhato uppalagandho’’ti patthanaṃ katvā, cetiyaṃ vanditvā, padakkhiṇaṃ katvā agamāsi."
NULL,p134,727,100,bodytext,,"Atha tasmiṃyeva khaṇe yassa seṭṭhiputtassa paṭhamaṃ gehaṃ nītā, tassa taṃ ārabbha sati udapādi. Nagarepi nakkhattaṃ saṃghuṭṭhaṃ hoti. So upaṭṭhāke āha – ‘‘tadā idha ānītā seṭṭhidhītā atthi, kahaṃ sā’’ti? ‘‘Kulagehe sāmī’’ti. ‘‘Ānetha naṃ, nakkhattaṃ kīḷissāmā’’ti. Te gantvā, taṃ vanditvā ṭhitā ‘‘kiṃ, tātā, āgatatthā’’ti? Tāya puṭṭhā  taṃ pavattiṃ ācikkhiṃsu. ‘‘Tātā, mayā ābharaṇabhaṇḍena cetiyaṃ pūjitaṃ, ābharaṇaṃ me natthī’’ti. Te gantvā seṭṭhiputtassa ārocesuṃ. ‘‘Ānetha naṃ, piḷandhanaṃ labhissāmā’’ti. Te ānayiṃsu. Tassā saha gharappavesena sakalagehaṃ candanagandhañceva nīluppalagandhañca vāyi."
