id,book,par_num,level,class,title,text
NULL,p134,224,100,bodytext,,"Yena bhagavā tenupasaṅkamīti ‘‘imaṃ sutakāraṇaṃ bhagavato ārocessāmī’’ti upasaṅkami. Aññā byākatāti arahattaṃ byākataṃ. Khīṇā jātīti na therena evaṃ byākatā, ayaṃ pana thero tuṭṭho pasanno evaṃ padabyañjanāni āropetvā āha. Aññataraṃ bhikkhuṃ āmantesīti taṃ sutvā satthā cintesi – ‘‘sāriputto dhīro gambhīro. Na so kenaci kāraṇena evaṃ byākarissati. Saṃkhittena pana pañho byākato  bhavissati. Pakkosāpetvā naṃ pañhaṃ byākarāpessāmī’’ti aññataraṃ bhikkhuṃ āmantesi."
NULL,p134,225,100,bodytext,,"Sace taṃ sāriputtāti idaṃ bhagavā ‘‘na esa attano dhammatāya aññaṃ byākarissati, pañhametaṃ pucchissāmi, taṃ kathentova aññaṃ byākarissatī’’ti aññaṃ byākarāpetuṃ evaṃ pucchi. Yaṃnidānāvuso, jātīti, āvuso, ayaṃ jāti nāma yaṃpaccayā, tassa paccayassa khayā khīṇasmiṃ jātiyā paccaye jātisaṅkhātaṃ phalaṃ khīṇanti viditaṃ. Idhāpi ca thero pañhe akaṅkhitvā ajjhāsaye kaṅkhati. Evaṃ kirassa ahosi – ‘‘aññā nāma taṇhā khīṇā, upādānaṃ khīṇaṃ, bhavo khīṇo, paccayo khīṇo, kilesā khīṇātiādīhi bahūhi kāraṇehi sakkā byākātuṃ, kathaṃ kathento pana satthu ajjhāsayaṃ gahetuṃ sakkhissāmī’’ti."
NULL,p134,226,100,bodytext,,"Kiñcāpi evaṃ ajjhāsaye kaṅkhati, pañhaṃ pana aṭṭhapetvāva paccayākāravasena byākāsi. Satthāpi paccayākāravaseneva byākarāpetukāmo, tasmā esa byākarontova ajjhāsayaṃ gaṇhi. Tāvadeva ‘‘gahito me satthu ajjhāsayo’’ti aññāsi. Athassa nayasatena nayasahassena pañhabyākaraṇaṃ upaṭṭhāsi. Yasmā pana bhagavā uttari pañhaṃ pucchati, tasmā tena taṃ byākaraṇaṃ anumoditanti veditabbaṃ."
NULL,p134,227,100,bodytext,,"Kathaṃjānato pana teti idaṃ kasmā ārabhi? Savisaye sīhanādaṃ nadāpetuṃ. Thero kira sūkaranikhātaleṇadvāre dīghanakhaparibbājakassa vedanāpariggahasutte kathiyamāne tālavaṇṭaṃ gahetvā  satthāraṃ bījayamāno ṭhito tisso vedanā pariggahetvā sāvakapāramīñāṇaṃ adhigato, ayamassa savisayo. Imasmiṃ savisaye ṭhito sīhanādaṃ nadissatīti naṃ sandhāya satthā idaṃ pañhaṃ pucchi. Aniccāti hutvā abhāvaṭṭhena aniccā. Yadaniccaṃ taṃ dukkhanti ettha kiñcāpi sukhā vedanā ṭhitisukhā vipariṇāmadukkhā, dukkhā vedanā ṭhitidukkhā vipariṇāmasukhā, adukkhamasukhā ñāṇasukhā aññāṇadukkhā, vipariṇāmakoṭiyā pana sabbāva dukkhā nāma jātā. Viditanti yasmā evaṃ vedanāttayaṃ dukkhanti viditaṃ, tasmā yā tattha taṇhā, sā na upaṭṭhāsīti dasseti."
NULL,p134,228,100,bodytext,,"Sādhusādhūti therassa vedanāparicchedajānane sampahaṃsanaṃ. Thero hi vedanā ekāti vā dve tisso catassoti vā avuttepi vuttanayena tāsaṃ tissoti paricchedaṃ aññāsi, tena taṃ bhagavā sampahaṃsanto evamāha. Dukkhasminti idaṃ bhagavā iminā adhippāyena āha – ‘‘sāriputta, yaṃ tayā ‘iminā kāraṇena vedanāsu taṇhā na upaṭṭhāsī’ti byākataṃ, taṃ subyākataṃ. ‘Tisso vedanā’ti vibhajantena pana te atippapañco kato, taṃ ‘dukkhasmi’nti byākarontenapi hi te subyākatameva bhaveyya. Yaṃkiñci vedayitaṃ, taṃ dukkhanti ñātamattepi hi vedanāsu taṇhā na tiṭṭhati’’."
NULL,p134,229,100,bodytext,,"Kathaṃ vimokkhāti katarā vimokkhā, katarena vimokkhena tayā aññā byākatāti attho? Ajjhattaṃ vimokkhāti ajjhattavimokkhena, ajjhattasaṅkhāre pariggahetvā pattaarahattenāti attho. Tattha catukkaṃ veditabbaṃ – ajjhattaṃ abhiniveso ajjhattaṃ vuṭṭhānaṃ, ajjhattaṃ abhiniveso bahiddhā vuṭṭhānaṃ, bahiddhā abhiniveso bahiddhā vuṭṭhānaṃ, bahiddhā abhiniveso ajjhattaṃ  vuṭṭhānanti. Ajjhattañhi abhinivesitvā bahiddhādhammāpi daṭṭhabbāyeva, bahiddhā abhinivesitvā ajjhattadhammāpi. Tasmā koci bhikkhu ajjhattaṃ saṅkhāresu ñāṇaṃ otāretvā te vavatthapetvā bahiddhā otāreti, bahiddhāpi pariggahetvā puna ajjhattaṃ otāreti, tassa ajjhatta saṅkhāre sammasanakāle maggavuṭṭhānaṃ hoti. Iti ajjhattaṃ abhiniveso ajjhattaṃ vuṭṭhānaṃ nāma. Koci ajjhattaṃ saṅkhāresu ñāṇaṃ otāretvā te vavatthapetvā bahiddhā otāreti, tassa bahiddhā saṅkhāre sammasanakāle maggavuṭṭhānaṃ  hoti. Iti ajjhattaṃ abhiniveso bahiddhā vuṭṭhānaṃ nāma. Koci bahiddhā saṅkhāresu ñāṇaṃ otāretvā, te vavatthapetvā ajjhattaṃ otāreti, ajjhattampi pariggahetvā puna bahiddhā otāreti, tassa bahiddhā saṅkhāre sammasanakāle maggavuṭṭhānaṃ hoti. Iti bahiddhā abhiniveso bahiddhā vuṭṭhānaṃ nāma. Koci bahiddhā saṅkhāresu ñāṇaṃ otāretvā te vavatthapetvā ajjhattaṃ otāreti, tassa ajjhattasaṅkhāre sammasanakāle maggavuṭṭhānaṃ hoti. Iti bahiddhā abhiniveso ajjhattaṃ vuṭṭhānaṃ nāma. Tatra thero ‘‘ajjhattasaṅkhāre pariggahetvā tesaṃ vavatthānakāle maggavuṭṭhānena arahattaṃ pattosmī’’ti dassento ajjhattaṃ vimokkhā khvāhaṃ, āvusoti āha."
NULL,p134,230,100,bodytext,,"Sabbupādānakkhayāti  sabbesaṃ catunnampi upādānānaṃ khayena. Tathā sato viharāmīti tenākārena satiyā samannāgato viharāmi. Yathā sataṃ viharantanti yenākārena maṃ satiyā samannāgataṃ viharantaṃ. Āsavā nānussavantīti cakkhuto rūpe savanti āsavanti sandanti pavattantīti evaṃ chahi dvārehi chasu ārammaṇesu savanadhammā kāmāsavādayo āsavā nānussavanti nānuppavaḍḍhanti, yathā me na uppajjantīti attho. Attānañca nāvajānāmīti attānañca na avajānāmi. Iminā omānapahānaṃ kathitaṃ. Evañhi sati pajānanā pasannā hoti."
NULL,p134,231,100,bodytext,,"Samaṇenāti buddhasamaṇena. Tesvāhaṃ na kaṅkhāmīti tesu ahaṃ ‘‘kataro kāmāsavo, kataro bhavāsavo, kataro diṭṭhāsavo, kataro avijjāsavo’’ti evaṃ sarūpabhedatopi, ‘‘cattāro  āsavā’’ti evaṃ gaṇanaparicchedatopi na kaṅkhāmi. Te me pahīnāti na vicikicchāmīti te mayhaṃ pahīnāti vicikicchaṃ na uppādemi. Idaṃ bhagavā ‘‘evaṃ byākarontenapi tayā subyākataṃ bhaveyya ‘ajjhattaṃ vimokkhā khvāhaṃ, āvuso’tiādīni pana te vadantena atippapañco kato’’ti dassento āha."
NULL,p134,232,100,bodytext,,"Uṭṭhāyāsanā vihāraṃ pāvisīti paññattavarabuddhāsanato uṭṭhahitvā vihāraṃ antomahāgandhakuṭiṃ pāvisi asambhinnāya eva parisāya. Kasmā? Buddhā hi aniṭṭhitāya desanāya asambhinnāya parisāya uṭṭhāyāsanā gandhakuṭiṃ pavisantā puggalathomanatthaṃ vā pavisanti dhammathomanatthaṃ vā. Tattha puggalathomanatthaṃ pavisanto satthā evaṃ cintesi – ‘‘imaṃ mayā saṃkhittena uddesaṃ uddiṭṭhaṃ vitthārena ca avibhattaṃ dhammapaṭiggāhakā bhikkhū uggahetvā ānandaṃ vā kaccāyanaṃ vā upasaṅkamitvā pucchissanti, te mayhaṃ ñāṇena saṃsandetvā kathessanti, tatopi dhammapaṭiggāhakā puna maṃ pucchissanti. Tesamahaṃ ‘sukathitaṃ, bhikkhave, ānandena, sukathitaṃ kaccāyanena, maṃ cepi tumhe etamatthaṃ  puccheyyātha, ahampi naṃ evameva byākareyya’nti evaṃ te puggale thomessāmi. Tato tesu gāravaṃ janetvā bhikkhū upasaṅkamissanti, tepi bhikkhū atthe ca dhamme ca niyojessanti, te tehi niyojitā tisso sikkhā paripūretvā dukkhassantaṃ karissantī’’ti."
NULL,p134,233,100,bodytext,,"Atha  vā panassa evaṃ hoti – ‘‘esa mayi pakkante attano ānubhāvaṃ karissati, atha naṃ ahampi tatheva thomessāmi, taṃ mama thomanaṃ sutvā gāravajātā bhikkhū imaṃ upasaṅkamitabbaṃ, vacanañcassa sotabbaṃ saddhātabbaṃ maññissanti, taṃ tesaṃ bhavissati dīgharattaṃ hitāya sukhāyā’’ti dhammathomanatthaṃ pavisanto evaṃ cintesi yathā dhammadāyādasutte cintesi. Tatra hissa evaṃ ahosi – ‘‘mayi vihāraṃ paviṭṭhe āmisadāyādaṃ garahanto dhammadāyādañca thomento imissaṃyeva parisati nisinno sāriputto dhammaṃ desessati, evaṃ dvinnampi amhākaṃ ekajjhāsayāya matiyā desitā ayaṃ desanā aggā ca garukā ca bhavissati pāsāṇacchattasadisā’’ti."
NULL,p134,234,100,bodytext,,"Idha  pana āyasmantaṃ sāriputtaṃ ukkaṃsetvā pakāsetvā ṭhapetukāmo puggalathomanatthaṃ uṭṭhāyāsanā vihāraṃ pāvisi. Īdisesu ṭhānesu bhagavā nisinnāsaneyeva antarahito cittagatiyā vihāraṃ pavisatīti veditabbo. Yadi hi kāyagatiyā gaccheyya, sabbā parisā bhagavantaṃ parivāretvā gaccheyya, sā ekavāraṃ bhinnā puna dussannipātā bhaveyyāti bhagavā adissamānena kāyena cittagatiyā eva pāvisi."
NULL,p134,235,100,bodytext,,"Evaṃ paviṭṭhe pana bhagavati bhagavato adhippāyānurūpameva sīhanādaṃ naditukāmo tatra kho āyasmā sāriputto acirapakkantassa bhagavato bhikkhū āmantesi. Pubbe appaṭisaṃviditanti idaṃ nāma pucchissatīti pubbe mayā aviditaṃ aññātaṃ. Paṭhamaṃ pañhanti, ‘‘sace taṃ, sāriputta, evaṃ puccheyyuṃ kathaṃ jānatā pana tayā, āvuso sāriputta, kathaṃ passatā aññā byākatā khīṇā jātī’’ti imaṃ paṭhamaṃ pañhaṃ. Dandhāyitattanti satthu āsayajānanatthaṃ dandhabhāvo asīghatā. Paṭhamaṃ pañhaṃ anumodīti, ‘‘jāti panāvuso sāriputta, kiṃnidānā’’ti imaṃ dutiyaṃ pañhaṃ pucchanto, ‘‘yaṃnidānāvuso, jātī’’ti evaṃ vissajjitaṃ paṭhamaṃ pañhaṃ anumodi."
NULL,p134,236,100,bodytext,,"Etadahosīti bhagavatā anumodite nayasatena nayasahassena pañhassa ekaṅgaṇikabhāvena pākaṭībhūtattā  etaṃ ahosi. Divasampāhaṃ bhagavato etamatthaṃ byākareyyanti sakaladivasampi ahaṃ bhagavato etaṃ paṭiccasamuppādatthaṃ  puṭṭho sakaladivasampi aññamaññehi padabyañjanehi byākareyyaṃ. Yena bhagavā tenupasaṅkamīti evaṃ kirassa ahosi – ‘‘thero uḷārasīhanādaṃ nadati, sukāraṇaṃ etaṃ, dasabalassa naṃ ārocessāmī’’ti. Tasmā yena bhagavā tenupasaṅkami."
NULL,p134,237,100,bodytext,,"Sā hi bhikkhu sāriputtassa dhammadhātūti ettha dhammadhātūti paccayākārassa vivaṭabhāvadassanasamatthaṃ sāvakapāramīñāṇaṃ. Sāvakānañhi sāvakapāramīñāṇaṃ sabbaññutaññāṇagatikameva  hoti. Yathā buddhānaṃ atītānāgatapaccuppannā dhammā sabbaññutaññāṇassa pākaṭā honti, evaṃ therassa sāvakapāramīñāṇaṃ sabbepi sāvakañāṇassa gocaradhamme jānātīti. Dutiyaṃ."
NULL,p134,238,4,subhead,"3. Ñāṇavatthusuttavaṇṇanā","3. Ñāṇavatthusuttavaṇṇanā"
NULL,p134,239,100,bodytext,,"33. Tatiye taṃ suṇāthāti taṃ ñāṇavatthudesanaṃ suṇātha. Ñāṇavatthūnīti cettha ñāṇameva ñāṇavatthūti veditabbaṃ. Jarāmaraṇe ñāṇantiādīsu catūsu paṭhamaṃ savanamayañāṇaṃ sammasanañāṇaṃ paṭivedhañāṇaṃ paccavekkhaṇañāṇanti catubbidhaṃ vaṭṭati, tathā dutiyaṃ. Tatiyaṃ pana ṭhapetvā sammasanañāṇaṃ tividhameva hoti, tathā catutthaṃ. Lokuttaradhammesu hi sammasanaṃ nāma natthi. Jātiyā ñāṇantiādīsupi eseva nayo. Iminā dhammenāti iminā catusaccadhammena vā maggañāṇadhammena vā."
NULL,p134,240,100,bodytext,,"Diṭṭhenātiādīsu diṭṭhenāti ñāṇacakkhunā diṭṭhena. Viditenāti paññāya viditena. Akālikenāti kiñci kālaṃ anatikkamitvā paṭivedhānantaraṃyeva phaladāyakena. Pattenāti adhigatena. Pariyogāḷhenāti pariyogāhitena paññāya anupaviṭṭhena. Atītānāgate nayaṃ netīti ‘‘ye kho kecī’’tiādinā nayena atīte ca anāgate ca nayaṃ neti. Ettha ca na catusaccadhammena vā maggañāṇadhammena vā sakkā atītānāgate nayaṃ netuṃ, catusacce pana maggañāṇena paṭividdhe parato paccavekkhaṇañāṇaṃ nāma hoti. Tena nayaṃ netīti veditabbā. Abbhaññaṃsūti abhiaññaṃsu jāniṃsu. Seyyathāpāhaṃ, etarahīti yathā ahaṃ etarahi catusaccavasena jānāmi. Anvaye ñāṇanti anuaye ñāṇaṃ, dhammañāṇassa anugamane ñāṇaṃ, paccavekkhaṇañāṇassetaṃ  nāmaṃ. Dhamme ñāṇanti maggañāṇaṃ. Imasmiṃ sutte khīṇāsavassa sekkhabhūmi kathitā hoti. Tatiyaṃ."
NULL,p134,241,4,subhead,"4. Dutiyañāṇavatthusuttavaṇṇanā","4. Dutiyañāṇavatthusuttavaṇṇanā"
NULL,p134,242,100,bodytext,,"34. Catutthe sattasattarīti satta ca sattari ca. Byañjanabhāṇakā kira te bhikkhū, bahubyañjanaṃ katvā vuccamāne paṭivijjhituṃ sakkonti, tasmā tesaṃ ajjhāsayena idaṃ suttaṃ vuttaṃ. Dhammaṭṭhitiñāṇanti paccayākāre ñāṇaṃ. Paccayākāro hi dhammānaṃ pavattiṭṭhitikāraṇattā dhammaṭṭhitīti vuccati, ettha ñāṇaṃ dhammaṭṭhitiñāṇaṃ, etasseva chabbidhassa ñāṇassetaṃ adhivacanaṃ. Khayadhammanti khayagamanasabhāvaṃ. Vayadhammanti vayagamanasabhāvaṃ. Virāgadhammanti virajjanasabhāvaṃ. Nirodhadhammanti nirujjhanasabhāvaṃ. Sattasattarīti ekekasmiṃ satta satta katvā ekādasasu padesu sattasattari. Imasmiṃ sutte vipassanāpaṭivipassanā kathitā. Catutthaṃ."
NULL,p134,243,4,subhead,"5. Avijjāpaccayasuttavaṇṇanā","5. Avijjāpaccayasuttavaṇṇanā"
NULL,p134,244,100,bodytext,,"35. Pañcame samudayo hotīti satthā idheva desanaṃ osāpesi. Kiṃkāraṇāti? Diṭṭhigatikassa okāsadānatthaṃ. Tassañhi parisati upārambhacitto diṭṭhigatiko atthi, so pañhaṃ pucchissati, athassāhaṃ vissajjessāmīti tassa okāsadānatthaṃ desanaṃ osāpesi. No kallo pañhoti ayutto pañho. Duppañho esoti attho. Nanu ca ‘‘katamaṃ nu kho, bhante, jarāmaraṇa’’nti? Idaṃ supucchitanti. Kiñcāpi supucchitaṃ, yathā pana satasahassagghanike suvaṇṇathāle vaḍḍhitassa subhojanassa matthake āmalakamattepi gūthapiṇḍe ṭhapite sabbaṃ bhojanaṃ dubbhojanaṃ hoti chaḍḍetabbaṃ, evameva ‘‘kassa ca panidaṃ jarāmaraṇa’’nti? Iminā sattūpaladdhivādapadena gūthapiṇḍena taṃ bhojanaṃ dubbhojanaṃ viya ayampi sabbo duppañhova jātoti."
NULL,p134,245,100,bodytext,,"Brahmacariyavāsoti ariyamaggavāso. Taṃ jīvaṃ taṃ sarīranti yassa hi ayaṃ diṭṭhi, so ‘‘jīve ucchijjamāne sarīraṃ ucchijjati, sarīre ucchijjante jīvitaṃ ucchijjatī’’ti gaṇhāti. Evaṃ  gaṇhato sā diṭṭhi ‘‘satto ucchijjatī’’ti gahitattā ucchedadiṭṭhi nāma hoti. Sace pana saṅkhārāva uppajjanti ceva nirujjhanti cāti gaṇheyya, sāsanāvacarā sammādiṭṭhi nāma bhaveyya. Ariyamaggo ca nāmeso vaṭṭaṃ nirodhento vaṭṭaṃ samucchindanto uppajjati, tadeva taṃ vaṭṭaṃ ucchedadiṭṭhiyā gahitākārassa sambhave sati vināva maggabhāvanāya nirujjhatīti maggabhāvanā niratthakā hoti. Tena vuttaṃ ‘‘brahmacariyavāso na hotī’’ti."
NULL,p134,246,100,bodytext,,"Dutiyanaye aññaṃ jīvaṃ aññaṃ sarīranti yassa ayaṃ diṭṭhi, so ‘‘sarīraṃ idheva ucchijjati, na jīvitaṃ, jīvitaṃ pana pañjarato sakuṇo viya yathāsukhaṃ gacchatī’’ti gaṇhāti. Evaṃ gaṇhato sā diṭṭhi ‘‘imasmā lokā jīvitaṃ paralokaṃ gata’’nti gahitattā sassatadiṭṭhi nāma hoti. Ayañca ariyamaggo tebhūmakavaṭṭaṃ vivaṭṭento uppajjati, so ekasaṅkhārepi nicce dhuve sassate sati uppannopi vaṭṭaṃ vivaṭṭetuṃ na sakkotīti maggabhāvanā niratthakā hoti. Tena vuttaṃ ‘‘aññaṃ jīvaṃ aññaṃ sarīranti vā bhikkhu diṭṭhiyā sati brahmacariyavāso na hotī’’ti."
NULL,p134,247,100,bodytext,,"Visūkāyikānītiādi sabbaṃ micchādiṭṭhivevacanameva. Sā hi sammādiṭṭhiyā vinivijjhanaṭṭhena visūkamiva attānaṃ āvaraṇato visūkāyikaṃ, sammādiṭṭhiṃ ananuvattitvā tassā virodhena pavattanato visevitaṃ, kadāci ucchedassa kadāci sassatassa gahaṇato virūpaṃ phanditaṃ vipphanditanti vuccati. Tālāvatthukatānīti tālavatthu viya katāni, puna aviruhaṇaṭṭhena matthakacchinnatālo viya samūlaṃ tālaṃ uddharitvā tassa patiṭṭhitaṭṭhānaṃ viya ca katānīti attho. Anabhāvaṃkatānīti anuabhāvaṃ katānīti. Pañcamaṃ."
NULL,p134,248,4,subhead,"6. Dutiyaavijjāpaccayasuttavaṇṇanā","6. Dutiyaavijjāpaccayasuttavaṇṇanā"
NULL,p134,249,100,bodytext,,"36. Chaṭṭhe iti vā, bhikkhave, yo vadeyyāti tassaṃ parisati diṭṭhigatiko pañhaṃ pucchitukāmo atthi, so pana avisāradadhātuko uṭṭhāya dasabalaṃ pucchituṃ na sakkoti, tasmā tassa ajjhāsayena sayameva pucchitvā vissajjento satthā evamāha. Chaṭṭhaṃ."
NULL,p134,250,4,subhead,"7. Natumhasuttavaṇṇanā","7. Natumhasuttavaṇṇanā"
NULL,p134,251,100,bodytext,,"37. Sattame na tumhākanti attani hi sati attaniyaṃ nāma hoti. Attāyeva ca natthi, tasmā ‘‘na tumhāka’’nti āha. Napi aññesanti añño nāma paresaṃ attā, tasmiṃ sati aññesaṃ nāma siyā, sopi natthi, tasmā ‘‘napi aññesa’’nti āha. Purāṇamidaṃ, bhikkhave, kammanti nayidaṃ purāṇakammameva, purāṇakammanibbatto panesa kāyo, tasmā paccayavohārena evaṃ vutto. Abhisaṅkhatantiādi kammavohārasseva vasena purimaliṅgasabhāgatāya vuttaṃ, ayaṃ panettha attho – abhisaṅkhatanti paccayehi katoti daṭṭhabbo. Abhisañcetayitanti cetanāvatthuko cetanāmūlakoti daṭṭhabbo. Vedaniyanti vedaniyavatthūti daṭṭhabbo. Sattamaṃ."
NULL,p134,252,4,subhead,"8. Cetanāsuttavaṇṇanā","8. Cetanāsuttavaṇṇanā"
NULL,p134,253,100,bodytext,,"38. Aṭṭhame yañca, bhikkhave, cetetīti yaṃ cetanaṃ ceteti, pavattetīti attho. Yañca pakappetīti yaṃ pakappanaṃ pakappeti, pavatteticceva attho. Yañca anusetīti yañca anusayaṃ anuseti, pavatteticceva attho. Ettha ca cetetīti tebhūmakakusalākusalacetanā gahitā, pakappetīti aṭṭhasu lobhasahagatacittesu taṇhādiṭṭhikappā gahitā, anusetīti dvādasannaṃ cetanānaṃ sahajātakoṭiyā ceva upanissayakoṭiyā ca anusayo gahito. Ārammaṇametaṃ hotīti (cetanādidhammajāte sati kammaviññāṇassa uppattiyā avāritattā) etaṃ cetanādidhammajātaṃ paccayo hoti. Paccayo hi idha ārammaṇanti  adhippetā. Viññāṇassa ṭhitiyāti kammaviññāṇassa ṭhitatthaṃ. Ārammaṇe satīti tasmiṃ paccaye sati. Patiṭṭhā viññāṇassa hotīti tassa kammaviññāṇassa patiṭṭhā hoti. Tasmiṃ patiṭṭhite viññāṇeti tasmiṃ kammaviññāṇe patiṭṭhite. Virūḷheti kammaṃ javāpetvā paṭisandhiākaḍḍhanasamatthatāya nibbattamūle jāte. Punabbhavābhinibbattīti punabbhavasaṅkhātā abhinibbatti."
NULL,p134,254,100,bodytext,,"Noce, bhikkhave, cetetīti iminā tebhūmakacetanāya appavattanakkhaṇo vutto. No ce pakappetīti iminā taṇhādiṭṭhikappānaṃ appavattanakkhaṇo. Atha ce anusetīti iminā tebhūmakavipākesu parittakiriyāsu rūpeti ettha appahīnakoṭiyā anusayo gahito. Ārammaṇametaṃhotīti anusaye sati kammaviññāṇassa uppattiyā avāritattā etaṃ anusayajātaṃ paccayova hoti."
NULL,p134,255,100,bodytext,,"No ceva cetetītiādīsu paṭhamapade tebhūmakakusalākusalacetanā nivattā, dutiyapade aṭṭhasu cittesu taṇhādiṭṭhiyo, tatiyapade vuttappakāresu dhammesu yo appahīnakoṭiyā anusayito anusayo, so nivatto."
NULL,p134,256,100,bodytext,,"Apicettha asammohatthaṃ ceteti pakappeti anuseti, ceteti na pakappeti anuseti, na ceteti na pakappeti anuseti, na ceteti na pakappeti na anusetīti idampi catukkaṃ veditabbaṃ. Tattha paṭhamanaye dhammaparicchedo dassito. Dutiyanaye cetetīti tebhūmakakusalacetanā ceva catasso ca akusalacetanā gahitā. Na pakappetīti aṭṭhasu cittesu taṇhādiṭṭhiyo nivattā. Anusetīti tebhūmakakusale upanissayakoṭiyā, catūsu akusalacetanāsu sahajātakoṭiyā ceva upanissayakoṭiyā ca anusayo gahito. Tatiyanaye na cetetīti tebhūmakakusalākusalaṃ nivattaṃ, na pakappetīti aṭṭhasu cittesu taṇhādiṭṭhiyo nivattā, anusetīti sutte āgataṃ vāretvā tebhūmakakusalākusalavipākakiriyārūpesu appahīnakoṭiyā upanissayo gahito. Catutthanayo purimasadisova."
NULL,p134,257,100,bodytext,,"Tadappatiṭṭhiteti tasmiṃ appatiṭṭhite. Avirūḷheti kammaṃ javāpetvā  paṭisandhiākaḍḍhanasamatthatāya anibbattamūle. Ettha pana kiṃ kathitanti? Arahattamaggassa kiccaṃ, khīṇāsavassa kiccakaraṇantipi navalokuttaradhammātipi vattuṃ vaṭṭati. Ettha ca viññāṇassa ceva āyatiṃ punabbhavassa ca antare eko sandhi, vedanātaṇhānamantare eko, bhavajātīnamantare ekoti. Aṭṭhamaṃ."
NULL,p134,258,4,subhead,"9. Dutiyacetanāsuttavaṇṇanā","9. Dutiyacetanāsuttavaṇṇanā"
NULL,p134,259,100,bodytext,,"39. Navame  viññāṇanāmarūpānaṃ antare eko sandhi, vedanātaṇhānamantare eko, bhavajātīnamantare ekoti. Navamaṃ."
NULL,p134,260,4,subhead,"10. Tatiyacetanāsuttavaṇṇanā","10. Tatiyacetanāsuttavaṇṇanā"
NULL,p134,261,100,bodytext,,"40. Dasame natīti taṇhā. Sā hi piyarūpesu rūpādīsu namanaṭṭhena ‘‘natī’’ti vuccati. Āgati gati hotīti āgatimhi gati hoti, āgate paccupaṭṭhite kamme vā kammanimitte vā gahinimitte vā paṭisandhivasena viññāṇassa gati hoti. Cutūpapātoti evaṃ viññāṇassa āgate paṭisandhivisaye gatiyā sati ito cavanasaṅkhātā cuti, tatthūpapattisaṅkhāto upapātoti ayaṃ cutūpapāto nāma hoti. Evaṃ imasmiṃ sutte natiyā ca āgatigatiyā ca antare ekova sandhi kathitoti. Dasamaṃ."
NULL,p134,262,100,centered,,"Kaḷārakhattiyavaggo catuttho."
NULL,p134,263,3,title,"5. Gahapativaggo","5. Gahapativaggo"
NULL,p134,264,4,subhead,"1. Pañcaverabhayasuttavaṇṇanā","1. Pañcaverabhayasuttavaṇṇanā"
NULL,p134,265,100,bodytext,,"41. Gahapativaggassa paṭhame yatoti yadā. Bhayāni verānīti bhayaveracetanāyo. Sotāpattiyaṅgehīti duvidhaṃ sotāpattiyā aṅgaṃ, (sotāpattiyā ca aṅgaṃ,) yaṃ pubbabhāge sotāpattipaṭilābhāya saṃvattati, ‘‘sappurisasaṃsevo saddhammassavanaṃ yonisomanasikāro dhammānudhammappaṭipattī’’ti (dī. ni. 3.311) evaṃ āgataṃ, paṭiladdhaguṇassa ca sotāpattiṃ patvā ṭhitassa aṅgaṃ, yaṃ sotāpannassa  aṅgantipi vuccati, buddhe aveccappasādādīnaṃ etaṃ adhivacanaṃ. Idamidha adhippetaṃ. Ariyoti niddoso nirupārambho. Ñāyoti paṭiccasamuppannaṃ ñatvā ṭhitañāṇampi paṭiccasamuppādopi. Yathāha – ‘‘ñāyo vuccati paṭiccasamuppādo, ariyopi aṭṭhaṅgiko maggo ñāyo’’ti. Paññāyāti aparāparaṃ uppannāya vipassanāpaññāya. Sudiṭṭho hotīti aparāparaṃ uppajjitvā dassanavasena suṭṭhu diṭṭho."
NULL,p134,266,100,bodytext,,"Khīṇanirayotiādīsu  āyatiṃ tattha anuppajjanatāya khīṇo nirayo mayhanti so ahaṃ khīṇanirayo. Esa nayo sabbattha. Sotāpannoti maggasotaṃ āpanno. Avinipātadhammoti na vinipātasabhāvo. Niyatoti paṭhamamaggasaṅkhātena sammattaniyāmena niyato. Sambodhiparāyanoti uttarimaggattayasaṅkhāto sambodhi paraṃ ayanaṃ mayhanti sohaṃ sambodhiparāyano, taṃ sambodhiṃ avassaṃ abhisambujjhanakoti attho."
NULL,p134,267,100,bodytext,,"Pāṇātipātapaccayāti pāṇātipātakammakāraṇā. Bhayaṃ veranti atthato ekaṃ. Verañca nāmetaṃ duvidhaṃ hoti bāhiraṃ ajjhattikanti. Ekena hi ekassa pitā mārito hoti, so cintesi ‘‘etena kira me pitā mārito, ahampi taṃyeva māressāmī’’ti nisitaṃ satthaṃ ādāya carati. Yā tassa abbhantare uppannaveracetanā, idaṃ bāhiraṃ veraṃ nāma. Yā pana itarassa ‘‘ayaṃ kira maṃ māressāmīti carati, ahameva naṃ paṭhamataraṃ māressāmī’’ti cetanā uppajjati, idaṃ ajjhattikaṃ veraṃ nāma. Idaṃ tāva ubhayampi diṭṭhadhammikameva. Yā pana taṃ niraye uppannaṃ disvā ‘‘etaṃ paharissāmī’’ti jalitaṃ ayamuggaraṃ gaṇhato nirayapālassa cetanā uppajjati, idamassa samparāyikaṃ bāhiraveraṃ. Yā cassa ‘‘ayaṃ niddosaṃ maṃ paharissāmīti āgacchati, ahameva naṃ paṭhamataraṃ paharissāmī’’ti cetanā uppajjati, idamassa samparāyikaṃ ajjhattaveraṃ. Yaṃ panetaṃ bāhiraveraṃ, taṃ aṭṭhakathāyaṃ ‘‘puggalavera’’nti vuttaṃ. Dukkhaṃ domanassanti atthato ekameva. Yathā cettha, evaṃ sesapadesupi ‘‘iminā mama bhaṇḍaṃ haṭaṃ, mayhaṃ dāresu cārittaṃ āpannaṃ, musā vatvā attho bhaggo, surāmadamattena idaṃ nāma kata’’ntiādinā nayena veruppatti veditabbā. Aveccappasādenāti adhigatena acalappasādena. Ariyakantehīti pañcahi sīlehi. Tāni hi ariyānaṃ kantāni piyāni. Bhavantaragatāpi ariyā tāni na vijahanti, tasmā ‘‘ariyakantānī’’ti vuccanti. Sesamettha yaṃ vattabbaṃ siyā, taṃ sabbaṃ visuddhimagge anussatiniddese vuttameva. Paṭhamaṃ."
NULL,p134,268,4,subhead,"2. Dutiyapañcaverabhayasuttavaṇṇanā","2. Dutiyapañcaverabhayasuttavaṇṇanā"
NULL,p134,269,100,bodytext,,"42. Dutiye bhikkhūnaṃ kathitabhāvamattameva viseso. Dutiyaṃ."
NULL,p134,270,4,subhead,"3. Dukkhasuttavaṇṇanā","3. Dukkhasuttavaṇṇanā"
