id,book,par_num,level,class,title,text
NULL,p18,262,100,bodytext,,"Idāni sarūpādino visesanassa sakatthabhāvaṃ jātyādivisesassa dabbabhāvañca dassetuṃ ‘tatthā’tiādimāha, sarūpe vattate saddoti viyabhedopacārenāha-‘saddassa sarūpenā’ti, ettha pana goti jātimattavācini gosadde payutte gosaddo jātimattamāheti so jātiṃ viseseti nāma. Yaṭṭhiādisaddehi yaṭṭhiādisahacaritā upacārato gahitāti yaṭṭhiādidabbehi yaṭṭhiādisahacaritā purisā visesīyantīti āha-‘dabbampi dabbantarassa visesanabhūtambhavatī’ti, yaṭṭhiyopavesayāti yaṭṭhisaddavacanīya yaṭṭhidabbavisiṭṭhe purise pavesayāti attho, kuntepavesayāti etthāpi esevanayo, yathāvuttacatubbidhasakatthato paropi atthi sakatthoti āha-‘katthacī’tiādi, sambandhanimittoti sambandho nimittaṃ kāraṇaṃ  paccayappavattiyā assa paccayassa soti samāso, ettha hi daṇḍo assa atthīti assāti sāmino purisassa saṃsaṅkhātadaṇḍādidabbena sahayo sassāmisambandho, sopi paccayassa nimittaṃ, tathā ca vakkhati-‘daṇḍapurisasambandhā daṇḍīti paccayo’ti, (kiri)yā padatthassāpi visesanattena sakatthabhāvo jātipadatthādīnaṃ vutta ṭhāneyeva vattabboti pācakoti ettha kiriyākārakasambandhasaṅkhātaṃ parābhimataṃ sakatthampi paropadesenopadisitukāmo idha sambandhasakatthassa vuttaṭṭhāneyeva kiriyāsakatthaṃ dassetuṃ ‘katthaci kiriyāpī’tiādimāha. Nāmasabhāvena viññāyamānaṃ pañcamaṃ nāmasaṅkhātamatthaṃ dabbapadatthena saṅgahetvā jātiguṇakiriyādabbānīti hi catubbidho nāmattho, nāmampi anvattharuḷhivasena duvidhaṃ pumitthinapuṃsaka liṅgavasena tividhampi catubbidhaṃ hoti… yathāvutte catubbidhe atthe namati, te vā attani nāmetīti iminā kāraṇena. sāmaññaguṇa kiriyāyadicchāvasenāññathāpi catubbidhattaṃ nāmassa vadanti, tatthāpi yadicchānāmassa dabbanāmeneva saṅgaho veditabbo, itthattaṃ esāti pasiddhimā attho, yampanātiādinā vuttamevatthaṃ sādheti ‘tatthe’ccādinā, abhidhāyakattena jotakattena, ikārantatoti munisaddato, aññathāti ikārantato na bhavati ce, atoti ādesa bhavanato phalaṃ dassitaṃ na siyāti sambandho, vuttiyaṃ ‘evaṃ kumārī kumāriyo’tiādīsu evanti yathā pulliṅge ikārantato syādīnamudāharaṇamanādesatthaṃ vuttaṃ evamitthiyampi anākārantatoti dasseti, upalakkhaṇaṃ cetaminī-nī-ū-ti-paccayantādīnaṃ, asati…pe… vacaneti iminā pāṇiniyānaṃ vibhattisaññāvidhāyakassa suttantarassa atthibhāvaṃ dasseti, ‘‘vibhattica’’ (1-4-104) iti hi tesaṃ suttaṃ, tassattho ‘syādīnaṃ tyādīnañca vibhattisaññā hotī’ti, bhavantīti anvatthavasena vibhattisaddavacanīyāni bhavanti, so (yevattho) vibhatticcanena vibhajīyatīti vibhatti, kamme ktippaccayantoyaṃ vibhatti saddoti dasseti, kathampanetesu syādīsu vibhajīyaticcassa vākyatthāssānugamo yenevaṃ vuccaticcāsaṅkiya yena yathā ca vibhajīyati tamupadassento āha-‘tathā hi’ccādi."
NULL,p18,263,4,subhead,"2. Kamme","2. Kamme"
NULL,p18,264,100,bodytext,,"Vuttiyaṃ  kattukiriyāyāti kattusādyatāya taṃ sambandhiniyā kattukammaṭṭhāyapi duvidhāya kiriyāya, anekatthattā dhātūnaṃ karoti ettha sambandhanatthoti āha-‘karīyati abhisambandhīyatī’ti, yaṃkiñci padattharūpaṃ sambajjhatīti attho, iminā cānvatthavasenevāyaṃ kammavohāro siddhoti dasseti, sabbakārakānampi pana kiriyāsambandha sabbhāvepi kiriyābhisambandhīyamānatteneva yaṃ vattumicchitaṃ tadeva kammaṃ viññeyyaṃ, kattādi kattu kiriyāyābhisambandhīyamānattepi kattādittavacanicchāyeva kammaṃ na hoti… yasmā vacanicchāyeva kārakāni bhavanti, evaṃ sabbakārakānampi kārakantarappattiyaṃ tadabhāvo yathāyogaṃ vattabbo, vākyekadesenetyanena ‘‘dvedvekā’’dino vākyassa ‘‘kamme dutiyā’’iccādino ca ekavākyattaṃ sūceti, pakaraṇassa mahāvākyarūpattā vippakaṭṭhānipi vākyāni ākaṅkhādisabhāve aññamaññasambandhānubhavanenekavākyabhāvampaṭīpajjante, vuttī hi–"
NULL,p18,265,100,gatha1,,"‘‘Ākaṅkhāyoggatā sattā, bījaṃ sannidhino yato;"
NULL,p18,266,100,gathalast,,"Vippakaṭṭhāni vākyāni, mahāvākyaṃ karontyatoti."
NULL,p18,267,100,bodytext,,"Sāmaññenāti kammādyavisesena, pubbācariyasamaññāvasenāha ‘dutiyādikā’ti, tena yadyapi tyādinopi dvinnaṃ pūraṇiyā dutiyāti sakkā voharituṃ, tathāpi syādīnaṃ dukeyeva dutiyātatiyā ruḷhīti natyādīnaṃ dukāni dutiyādisaddena gayhanti, visiṭṭhesūti kammādinā visesitesu, tividhaṃ kammanti sakasamayappasiddhiyā kammassa tividhattamāha, aññe tu sattavidhamicchanti, kathaṃ–"
NULL,p18,268,100,gatha1,,"Nibbattivikatippatti, bhedena tividhaṃ mataṃ,"
NULL,p18,269,100,gatha2,,"Tatthecchitatamaṃ kammaṃ, kammaṃtvaññaṃ catubbidhaṃ;"
NULL,p18,270,100,gatha3,,"Icchitañcānicchitañca, nevicchitamanicchitaṃ,"
NULL,p18,271,100,gathalast,,"Tathāññapubbaṃ nāññapubbanti, evamaññaṃ catubbidhanti."
NULL,p18,272,100,bodytext,,"Tattha icchitādīni upariyevāpi bhavissanti, tatreccādinā tividhaṃ kammaṃ sarūpato dasseti, tattha nibbattikammameke-nekadhā parikappenti, tadiha pakāsayissāma–"
NULL,p18,273,100,gatha1,,"Satī-satī  vā pakati, na yattha pariṇāminī,"
NULL,p18,274,100,gatha2,,"Nissīyate taṃ nibbatti, kammamaññesamaññathā;"
NULL,p18,275,100,gatha3,,"Asantaṃ jāyate yaṃ vā, yaṃ santamappakāsati,"
NULL,p18,276,100,gathalast,,"Uppatyā-bhibyattiyā vā, tannibbattīti vuccatīti."
NULL,p18,277,100,bodytext,,"Ayamettha attho ‘‘kaṭavikārassa kāsasaṅkhātā vijjamānā pakati pariṇāminī kaṭavikārampati pariṇamantī yatthappayoge na nissīyate… kaṭaṃ karotītettha kevalamatthāvagamamattassa vattumicchitattā kāseti asuyyamānattā ca, pakatiyā tu suyya mānatte vikāriyaṃ siyā, teneva kāse kaṭaṃ karoti, taṇḍule odanaṃ pacatīti dvayattho karoti pacati ca, tasmā kāse karoti taṇḍule pacatīti vikārīyati, kaṭaṃ karoti odanampacatīti nibbattī yatīti attho, asatī vā pakati avijjamānattāyeva yattha na nissīyate… [(yathā) (potthake)] ( ) saṃyogaṃ janayati vibhāgamuppādayatīti saṃyogavibhāgānaṃ kassāpi pakatiyā avikārattā saṃyogavibhāgavante hyavikateheva tesaṃ jananato, tamevambhūtamanissitapakatikaṃ avijjamāna (pakati) kaṃ vā kāriyaṃ nibbattikammaṃ nāmāti eko, aññesamaññathāti vatvā tandasseti ‘asanta’miccādinā, yaṃ asantamavijjamānaṃ jāyate, tannibbattikammaṃ, yathā sukhaṃ janayati buddhimuppādayatīti, santaṃ vijjamānameva vā kevalamappakāsitapubbaṃ yaṃ uppattiyā abhibyattiyā vā pakāsati, tampi nibbattikammaṃ, yathā puttaṃ vijāyatisāmaññamabhibyañjayatī’’ti, tadevaṃ kesañci matena anissitapakatikaṃ avijjamānapakatikanti duvidhaṃ nibbattikammampi aññesammatena asantaṃ jāyamānaṃ santamappakāsamānanti duvidhaṃ nibbattikammampītisabbampi aṭṭhitapubbameva jāyatītyasato jānanā na byatiriccaticcāha-‘asato jananaṃ karīyatī’ti, avatthantaranti odanādino kledanādilakkhaṇamaññamavatthaṃ."
NULL,p18,278,100,gatha1,,"Pakatyucchedasambhūtaṃ, vikāriyaṃ kiñci kiñci tu;"
NULL,p18,279,100,gathalast,,"Guṇantarasamuppatyā, evaṃ sā vikati dvidhā."
NULL,p18,280,100,bodytext,,"Kiñci vikāriyaṃ kammaṃ pakatiyā kāraṇassa ucchedena sambhūtaṃ, yathā  kaṭṭhaṃ bhasmaṃ karotīti kaṭṭhassāccantaparāvatti [parāvattiyā (potthake)], kiñci pana guṇantarānamuppattiyā, yathā suvaṇṇaṃ kaṭakaṃ keyuraṃ vā karotīti evaṃ dvīdhā sā vikati hotīti attho, na vibhāvīyanteti na gamyante, sā patti‘pāpīyati visayīkarīyatī’ti katvā."
NULL,p18,281,100,gatha1,,"Yatra kriyākato koci, viseso nāvagamyate;"
NULL,p18,282,100,gathalast,,"Dassanā vānumānā vā, sā pattīti pakittitā."
NULL,p18,283,100,bodytext,,"Yattha kiriyākato kiriyāsampādito viseso atisayo koci nāvagamyate nappatīyate dassanā vā paccakkhappamāṇena anumānappamāṇena vā yathā nibbattivikatīnamatisayo paccakkhānumānā vagamanīyo, tatra hi nibbattiyaṃ visesasiddhiratipasiddhā… atthalābhākhyassa visesassāvijjamānassa kiriyākattā, vikāriye ( ) [(eva) (potthake)] tu kvaci paccakkhavisayo… kaṭṭhaṃ ḍahatīti kaṇhattādibhāvassa paccakkhenevopalabbhanato, kvacidanumānagammo… devadattaṃ roseti pasādayati veti visiṭṭhamukhavaṇṇādikāriyānumeyyattā rosādino, evaṃ yattha na visesasiddhi api tu pattimattaṃ, sā pattīti pakittitā kathitā, ādiccampassati dhammamajjhetīti ayamettha attho, kathañcarahi asantassa [santassa (potthake)] pattikammassa kiñci (akaronta)ssa kārakattaṃ, na hi kiñci akarontaṃ kārakambhavitumarahatīti uccate-"
NULL,p18,284,100,gatha1,,"Dassanakkhamatābhāso, pagamabyattiādayo;"
NULL,p18,285,100,gathalast,,"Visesā pattikammassa, kriyāsiddhiyamicchitā."
NULL,p18,286,100,bodytext,,"Atra daṭṭhuṃ sakkā iti dassane khamatā ābhāsopagamo visayattopagamo visayattopagamanaṃ byatti ceti evamādayo visesā yathāyogaṃ pattikammassa kiriyānipphattiyaṃ icchitā, tato tassa kārakattanti attho, ādiccaṃ passatīti ettha hi ādicco daṭṭhuṃ sakkā, tatova so dissati abhibyattiñcopayātīti dassanakiriyānipphādakatthenāssa kārakattamupapajjate, tathā ññatrāpyādisaddagahitavisesavasena kiriyāsiddhito kārakattaṃ veditabbaṃ, nanu vikāriyampi nibbattikammameva… tena rūpenāsatoyeva jananato, pattikammampi kiriyāsambandharūpenāsantameva pacchā tathā bhavatīti nibbattiyevāti saccaṃ-"
NULL,p18,287,100,gatha1,,"Atthesā vatthuṭṭhiti, sukhumabuddhigocarapatītyanurodhena,"
NULL,p18,288,100,gathalast,,"Tatra yampetaṃ ghaṭate, yathā patīti saddatthāvattānato."
NULL,p18,289,100,bodytext,,"Visesānupādānatoti ‘‘kamme dutiyā’’ti sāmaññena vuttattā vuttaṃ. Karīyati kaṭo, kato kaṭo ccevamādīsu tyādippabhutīhi atihitakammādinissayesupi ekattādīsu dutiyādayo papponti niyamābhāvā, tathāhi pañcake nāmatthe kaṭādivacanīyassa sambandhī kammādyattho, tyādippabhutīti anabhi hitassa saṅkhyākhyassāparassa vibhatyatthassābhidhānāya abhihitesupi kaṭādīsu kammādīsu dutiyādayo siyunti pāṇiniyā ‘‘kamme dutiyā’’ccādīsu (2-3-2) ‘‘anabhihite’’ti (2-3-1) vacanamadhikaronti, veyyattiyāyeva dutiyādīnappasaṅgepi tannissayabhūte-kattādyatthe jotanāyābhihitesu dutiyādayo siyuṃ, tike pana saṅkhyākammādayo vibhatti vacanīyā, tattha yajjapi kammādino paccayenābhidhānaṃ, tathāpyekattādayo nābhihitāti tassa saṅkhyākhyassāparassa vibhatyatthassāti dhānāya abhihitesupi kammādīsu dutiyādayo siyunti pāṇiniyā ‘‘kamme dutiyā’’ti ‘‘anabhihite’’ti vacanamadhikaronti, tamupadassento āha-‘tatridaṃ siyā’tiādi, tatra tasmiṃ dutiyādi vibhattividhāne idaṃ codyaṃ siyā, kinti āha-‘pañcake’iccādi, anabhihitakammādinissayesuti anabhihitā kammādayo nissayā yesamekattādīnaṃ, tesūtyattho, dutiyādayo vibhattiyo yathā siyunti jotanāyābhidhānāya cāti yujjamānavasena attho veditabbo, abhihitakammādinissayesupīti apisaddena anabhihitakammādinissayamekattādiṃ samuccinoti, āsaṅkiyāti pubbakiriyāya vuttanti aparakiriyā veditabbā, pañcake tike cā bhihitakammādinissaye sekattādīsu dutiyādippattimāsaṅkāvasena dassetvā catukkavādīnampi pakkhamubbhāviya pariharituṃ ‘yadiccā’dimāha, ayantesamadhippāyo  ‘‘yadesā saṅkhyā pāṭipadikattho tappaṭipajjane kammādayo vibhattivacanīyā, tadā ‘anabhihite kamme’tiādinā anabhihitaggahaṇaṃ kammādivisesānamanubhavantamanatthakaṃ… abhihite vibhattivāccābhāvato, yadā panāyaṃ pakkho ‘saṅkhyā vibhattivacanīyā’ti tadā ‘‘kamme dutiyā’’ tyevamādayo niddesā visayasandassanamattāyeva veditabbā’’ti, sabbathāti pañcakatikavādīnaṃ catukkavādīnañca matavasena sabbappakārena, saddatthābyatirittatthamattoyevāti byatireko byatirittaṃ, napuṃsake bhāve kto, na vijjate byatirittaṃ byatireko bhedo yassa taṃ abyatirittaṃ, abyatibhinnanti attho, saddatthato sakatthato abyatirittaṃ atthamattaṃ atthasāmaññaṃ yassa odanādisaddassa so tathā vutto."
NULL,p18,290,100,bodytext,,"Kiñcāpi vuttiyaṃ tabbādiṇādisamāsehi abhihitamavuttaṃ, tathāpi tehi abhihitepyevameva daṭṭhabbanti nidassento āha-‘eva’miccādi, kara-karaṇe karīyitthāti kato‘kto bhāvakammesu’ti (5-56) kamme kto, satikoti ettha kītoti kammatthe ‘‘dissantaññepi paccayā’’ti (4-120) iko, kammatāgamyate kitappaccayādīnaṃ kamme vihitattā, evañca dhuhi kimekamudāharaṇaṃ dattamācariyene tyato āha- ‘udāharaṇa’iccādi, anabhihiteti vacanaṃ vināpīti vacanaṃ vinā evāti avadhāraṇe-apisaddo, sambhāvanevā, yadyabhihitehi vacanaṃ vināpi dutiyādīnamappavatti bhaveyya, vacanasabbhāve tu kathāyeva natthīti attho, evañca panettha dutiyādīnamabhihite pasaṅgābhāvo jānitabbo ‘‘paccate odano, kato kaṭoccādopi yadi dutiyādayo siyuṃ paṭhamāvidhānassāvakāso na bhaveyya tato sāmatthiyānabhihiteyeva kammādo dutiyādayo sakiriyā (yaṃ tada)bhibyattiyā bhavissanti, paṭhamevatvabhihite’’ti, na nuca paṭhamāyākārakamavakāso rukkho pilakkhoti [rukkho pilakkhoti kriyāpadaṃ na sūyateti vibhatyantarassappatti maññatebhassāpadīpa] kimidamuccate akārakanti yadya kārakaṃ nedampayogamarahati tato yattha visesakiriyāna massavanaṃ tattha padatthasahacaritāya sattāya patītiyā ‘rukkho atthi  pilakkho atthī’ti apekkhīyatīti kārakattaṃ rukkhādīna mattheveti [attheveti ññataṃ vatthuṃ paraṃ patipādayituṃ saddo payujjate ññaṇañca satoiti yatra kriyāpadantarassa appayogo tatra ussaggato sattā patītitutthīti kriyāpadānusaṅgara kattari tatiyappasaṅgaranavakāsā paṭhamā tyattho-bhassapadīpa], na ca uccaṃ nīcaṃtyadhikaraṇavācitte [vācikā] nipātassa atthītyanena natthi sambandhoti uccamatthītyādheyyasseva kattuttaṃ nādhārassātya kārakattamādhārassātyavakāso-tthi paṭhamāyāti ‘‘paṭhamāvidhā nassāvakāso na bhaveyyā’’ti yathāvutto-yaṃ hetu asiddhoti ca sakkā vattuṃ, asaṅkhyato paṭhamātyavatvā ‘‘paṭhamāttha matte’’ti (2.39) sāmaññavidhānato siddhoyeva, yaṃ hetuttānabhihitavacanamanatthakamicceva ṭhitaṃ."
NULL,p18,291,100,bodytext,,"Yañcāti casaddo vattabbantarasamuccaye aparampi kiñci vattabbamatthīti attho, yañca phalaṃ maññateti sambandho, yadetthāna bhihitādhikāro natthi tadā yathā ‘kato kaṭo’ccatrattena kammassābhihitattā dutiyā na hoti tathā ‘kaṭaṃ karoti vipulaṃ dassanīya’nti kaṭasaddato uppannāya dutiyāya (vipulādigatassa) kammassā bhihitattā vipulādīhi visesanehi dutiyā na siyā, tato tyādi tabbādiṇādisamāsehi kammassāna bhihitattamattevāti vipulādīhipi dutiyāvidhānasaṅkhātaṃ anabhihite’’ti (2-3-1) anabhihita vacanassa adhikāre yañca phalaṃ cintayatīti attho, yuttassātimassa attho sambandhassāti, paccekaṃ karotyabhisambandhatāyāti ‘kaṭaṃ karoti vipulaṃ karoti dassanīyaṃ karoti’ccevaṃ paccekaṃ paccekaṃ karotissābhisambandhatāyāti attho, kammatā atthīti seso, evaṃ maññate-‘‘kaṭaṃ karomīti pavatto vipulaṃ karomī dassaniyaṃ karomīti ca pavattovāti vipulādīnampi paccekaṃ kammatā attheva, tatthekassābhidhāne parekassa sukhamavalokayantīti tadabhidhānāyapi dutiyā bhavissatī’’ti, pakārantarāvatāro nācariye noparodhitoti tampi panettha dassayissāma-‘‘kaṭasaddā uppajjamānā dutiyā  kaṭajāti kammamabhihitavatī, na vipulādiguṇakammaṃ, tato tadabhidhānāya ca dutiyāyeva bhavati, athavā kaṭova kammaṃ, taṃ sāmānādhikaraṇyena vipulādīhipi dutiyā bhavissati, kaṭaṃ karoti vipulo dassanīyoti hi vuccamāne vipulādayo kattusamānādhikaraṇatāyeva patīyeyyuṃ tasmā kaṭasaddasāmānādhikaraṇyampaṭipādayatā vassamettha dutiyā karaṇīyā’’ti. Nanvemiccādicodyaṃ, evanti evaṃ guṇayuttassa kammatāya sati, pappotīti kaṭa kamme-bhidhāniye (kato) ti ktappaccayassa katattā udārādito karotyabhisambandhā dutiyā pappotīti attho, evaṃ maññateccādi parihāro, avayavena kammaṃ na vadatīti sambandho, avayavenāti visuṃvisuṃ, kiñcarahīti āha-‘sabhāvato sabbaṃ kammaṃ vadatī’ti. Hotu kāmaṃ udārāditopi vuttena vidhinā paṭhamā, katasaddato kā pavattatīti āha-‘katasaddato pi’ccādi, antobhūto antogadho nāmassa saddassa attho yasmiṃ kammalakkhaṇattheso attho kammalakkhaṇo abhihito kathito sampanno sampajjatīti attho, nanu ‘kato kaṭo’ccādo sabhāvato sabbakammavuttiyā antobhūtanāmatthavuttiyā cātthamatte hoti sabbattha paṭhamāti ‘kaṭaṃ karoti uḷāraṃ sobhanaṃ dassanīya’nti kaṭāditopi uppannāya dutiyāya kammassābhihitattā uḷārādīhi paṭhamāppasaṅgo siyāti abhihitābhidhānappasaṅgopagataṃ codanaṃ manasi nidhāyāha-‘kaṭādisaddo tvi’ccādi, sāmaññenāti visuṃ visuṃ kaṭādisāmaññena."
NULL,p18,292,100,bodytext,,"‘‘Katturicchitatama’’ntyanena (1-4-49) kattuno kiriyāya sambandhi tumiṭṭhatamaṃ tasmiṃ icchitatame kammasaññaṃ vidhāya nibbatyādikesutīsu kammesu dutiyā vidhīyate pāṇinīyehi, icchitatamattañca tadatthattā kiriyāya, odanaṃ pacati gāvumpayo dohatityādo(hi) odanādyatthā pacanādikiriyārabbhateti odanapayādīnamicchitatamattaṃ, tadupadassento āha-‘yaṃ kattu’ccādi, vibhattiṃ vidhāya dutiyābhimatāti sambandho, puna payādinipphattinimittaṃ yaṃkiñci dohanādikiriyā yuttaṃ  karaṇādirūpena akathitaṃ gavādikamicchitaṃ kārakaṃ, tatthāpi ‘‘akathitañcā’’ti (1-4-51) kammasaññaṃ vidhāya teneva dutiyā vidhīyate, tadupadassetumāha-‘upayujjamāne’ccādi, atra cevamakathitaniyamo kato vāttikakārena-"
NULL,p18,293,100,gatha1,,"Pucchicibhikkhīnaṃ duhi,yācīnaṃ nimittamupayoge;"
NULL,p18,294,100,gathalast,,"Pubbavidhimhi-kathitaṃ, brūsāsīnañca guṇāsattanti."
NULL,p18,295,100,bodytext,,"Upayujjate iṭṭhatthasiddhiyaṃ byāpārīyatītyupayogo-payoppabhuti, tasmiṃ, nimittaṃ gavādi, apubbavidhimhi apādānādhikaraṇādi pubbasaññā vidhānābhāve, vidhāne hi māṇavakā maggaṃ pucchati, rukkhā phalānyavacinātyādi yathārahaṃ bhavati, guṇāsattanti guṇena sattaṃ sambandhī, guṇasaddenettha padhānasādhanaṃ dhammādikaṃ vattumicchitaṃ padhānasādhanañhi kiriyāyopakārakamupakāriyaṃ padhānabhūtaṃ kiriyamapekkhiya guṇo bhavati, co-nuttasamuccaye, padhānantu dhammādino pavattiyā tadatthattā, upayujjamānañca taṃ payopabhuticeti visesanasamāsaṃ katvā upayujjamānapayoppabhutino nimittanti chaṭṭhīsamāso, pabhuti saddena gavādino gahaṇaṃ, ādisaddena gomantādino, dutiyenādi saddena adhikaraṇādino, catutthena vinayādino, vidhānanti dutiyā vidhānaṃ, dutiyāvidhānamabhimatanti yojanīyaṃ. Pāṇiniyehi ‘‘tathā yuttañcānicchitaṃ’’ (1-4-50) iccanena kammasaññaṃ vidhāya ‘‘kamme dutiyā’’ (2-3-2) tyaneneva dutiyā vidhīyate, tandassetumāha-‘yene’ccādi, ‘‘tathā yuttañcānicchita’’ntīmassa attho yeneveccādipañcikāpāṭhānusārena veditabbo, yujjateti kiriyābhisambajjhate, yuttanti kiriyābhisambandhaṃ, atra tu–"
NULL,p18,296,100,gatha1,,"Yadyabuddhyāhilaṅghādi, tadāhyādimanicchitaṃ;"
NULL,p18,297,100,gathalast,,"Yadā lajjābhayādīhi, tadecchi tatamaṃ mataṃ."
NULL,p18,298,100,bodytext,,"‘‘Tathā yuttañcānicchita’’nti suttenassa pariyudāsavuttito icchitā aññamanicchitamanabhimatamitarañca, tatoyeva‘gāmaṃ gacchanto rukkhamūlamupasappatī’tyatra nevicchitanānicchitassapi rukkhamūlassa kamma saññā  siddhāti tattha ‘‘kamme dutiyā’’ti dutiyā vidhīyate, tandasseti’nevicchitanānicchitasmā’iccādi, rukkhamūlaṃ nevicchitaṃ pubbamanabhimatattā, nāpyanicchitaṃ appaṭikūlattā, gāmagamena hyassa tapparatā, rukkhamūlopasappanantu pasaṅgāgatanti rukkhamūlānampi kiriyābhisambandho attheva, atrāpi-"
NULL,p18,299,100,gatha1,,"Nevicchitānicchitantu, mabuddhiyupasappane;"
NULL,p18,300,100,gathalast,,"Mūlaṃ vissamanatthantu, tamicchitatamaṃ siyā."
NULL,p18,301,100,bodytext,,"Brūsāsinañcāti casaddopasaṅgahite dassetumāha-‘eva’miccādi, ettha gāmadevadattagaggānamakathitasaññā, ajādayo tvicchitatamā, ādisaddena ‘pattheti gāvuṃ purisaṃ dvijo’tyādayo saṅgahitā, nayatinī=pāpuṇane, vahati vaha=pāpuṇane, harati hara=haraṇe, jayatiji=jaye, sabbatthaleca ette ayādese ca rūpaṃ, daṇḍa=daṇḍane curādittā ṇimhi rūpaṃ, atha ‘‘adhisīṭṭhāsānaṃ kammaṃ’’tyādinā (1-4-46) tena tena kammasaññaṃ vidhāya ‘paṭhaviṃ adhisessatī’ti ādo (tattha) tattha ‘‘kamme dutiyā’’ti (2-3-2) dutiyā vidhīyate tehi tehi sattha kārehi, sabbatthevettha lokassa kammavacanicchāti kamenetaṃññasaññāpubbakaṃ kammamupadassento āha-‘adhipubba’iccādi, yāya vatticchāya dutiyā siyā tāya vatticchāya kammatā kathaṃhināmāti sambandho, neva upalabbhantīti kadācikassaci siyāti sambandho, payatitabbanti suttantaramārabbhanīyaṃ, tatthevaṃ kiṃ bhavato manasi dosadhijambhanenāti attho, dhammeti etthāpi evaṃ saddaṃ yojetvā attho veditabbo, yathā ādhāre kammavacanicchā, tathehāpi ādhāravacanicchāti attho, tenevāha-‘dhammeti ādhāravacanicchā’ti, dhamme abhinivisateti sambandho, evaṃsaddasamānatthattā tathā saddassa tadatthānusāreneva viññāyatīti tathāsaddassa attho visuṃ na vutto, pānañca ācāroca pānācāraṃ, taṃpānācāramassa ādhārassa tasmiṃ tappānācāre, pānatthācāratthadhātusambandhī yo nadyādi ko ādhāro so pānācāravāyevāti āha- ‘pānatthācāratthānaṃ dhātūnamādhāre’ti, kesañcīti aniyamena kesañci saddasatthakārānaṃ, etthāti etasmiṃ ādhāravacanicchāpakkhe, patiparīhi bhāgecetyavasiddhāti iminā patisaddassa dhātunā ayuttataṃ dasseti… yadi yujjeyya chaṭṭhiyābhāvā, tenāha-‘yadātvi’ccādi, vuttiyaṃ tenāti tasaddena, apisaddopasaṅgahitaṃ tatiyampi gahetvā vācāti bahuvacananiddeso."
NULL,p18,302,4,subhead,"3. Kāla","3. Kāla"
NULL,p18,303,100,bodytext,,"Yadā kāladdhānamiccādinā‘māsamāsate kosaṃ sayati’ccādo akammakehipi yoge kālabhāvaddhadesānaṃ parehi kammattamanuññātanti ca, yadātviccādinā tu kiriyāva sabbenasabbaṃ na sūyati, tathā sati kuto ca kammattanti teheva vuttantī ca dasseti, gamma mānakiriyāyogopi na nissito… māsamāsateccādīsu āsanādi [āsanādīsu (potthake)] kiriyānaṃ māsādiyogo viya kalyāṇittaguṇādiyogo ca lokassa patītipathamupayātīti, na sijjhatīti kiriyā na honti guṇadabbānīti kiriyāsambandhābhāvā kammattābhāvoti na sijjhati, guḷena missā dhānā bhajjitayavā guḷadhānā. Ajjhayanakiriyāya pabbatena ca māsakosānaṃ sākallena sambandhābhāvā accantasaṃyogābhāvoti māsassātiādīsu na dutiyā. Pubbaṇhe samayanti iminā pubbaṇhe samayoti sattamīāmādisamāsaṃ dasseti, accanta mevāti iminā samayassa sākallena viharaṇakiriyāya sambandhamāha, yaṃsamayaṃ karuṇāvihārena vihāsi, taṃ ekaṃsamayanti sambandho, upasaṅkamanakiriyāyaccantameva yuttoti iminā nivāsanaviharaṇa kiriyāhipi pubbaṇhasamayādīnamaccantameva yuttataṃ upalakkheti, pakārantarenāpi siddhiyamāsaṅkamubbhāvayati ‘yadā tvi’ccādinā, vibhattiyā vipallāso yathāpakatamatikkamma aññathā bhavanaṃ, idha pana sattami yampattāyaṃ sattamyatthe bāhulakena ‘‘kamme dutiyā’’cceva dutiyāppatti."
NULL,p18,304,100,bodytext,,"Tatiyābhimatāti ‘‘apavagge tatiyā’’ti (2-3-6) vacanena pāṇiniyānaṃpapañcattamabhimatā, kathampana kāladdhānaṃ karaṇattamiccāsaṅkiya karaṇattamesampaṭipādento  āha-‘tathāpi’ccādi, tathāpīti vuttakkamena karaṇattasambhavā tatiyāya vijjamānāyapi, siyāti tatiyā siyā, tañcāti taṃ karaṇañca. Kārakamajjheti ettha chaṭṭhī samāso kārakasaddena ca sattikārakaṃ gahitanti (āha) ‘dvinnaṃ kattusattīnaṃ majjhe’ti, abhinnassāpi hi ekassa devadattādikattuno bhinnānaṃ taṃsamavetānaṃ kattusattīnaṃ majjhe kāladdhānāni, sattibhedameva byañjayamāha-‘tathāhi’ccādi, ekatthāti ekasmiṃ devadatte, dvīhetīte (bhuñjikriyā) sādhananti sambandho, dvinnaṃ ahānaṃ samāhāro dvīhaṃ tasmiṃ. Isumasatīti vā, isumhi āso asseti vā nipphannena issāsasaddena gammamānaṃ kiriyaṃ dasseti ‘isvasane’ti, nanviccādi codyaṃ, dhanupañcasataṃ koso, evamaññateccādi parihāro, chaṭṭhiyāsampattāyanti kosassekadeseti evaṃ chaṭṭhiyā sampattāyaṃ, muttasaṃsayenedaṃ samānanti mutto saṃsayo yasmiṃ avadhyādo tenetaṃ tulyanti attho. Vuttiyaṃ abhimatāti ‘‘sattamī pañcamiyo kārakamajjhe’’ti (2-3-7) vacanena sattamīpañcamiyo papañcattamabhimatā, dvīhe bhuñjissatīti dvīsu divasesu gatesu bhuñjissatīti attho, ‘‘yabbhāvo bhāvalakkhaṇa’’nti (2-36) sattamī, sakasakakārakavacanicchāyevāti hi idaṃ bāhullaṃ nissāya vuttaṃ, dvīhā bhuñjissati kosā vijjhatīti dvīhā nikkhamma bhuñjissati, kosā nikkhamma ṭhitaṃ lakkhaṃ vijjhati upāttavisayo-yamavadhi, kose vijjhatīti kose ṭhitaṃ lakkhaṃ vijjhatīti attho."
NULL,p18,305,4,subhead,"4. Gati","4. Gati"
