id,book,par_num,level,class,title,text
NULL,p194,633,3,subhead,7. Saḷāyatanavibhaṅgasuttavaṇṇanā,7. Saḷāyatanavibhaṅgasuttavaṇṇanā
NULL,p194,634,100,bodytext,,"304. Veditabbānīti  ettha yathā viditāni cha ajjhattikāni āyatanāni vaṭṭadukkhasamatikkamāya honti, tathā vedanaṃ adhippetanti āha – ‘‘sahavipassanena maggena jānitabbānī’’ti. Tattha vipassanāya ārammaṇato maggena asammohato jānanaṃ daṭṭhabbaṃ. Sesapadesupi eseva nayo. Mano savisesaṃ upavicarati ārammaṇe pavattati etehīti manopavicārā, vitakkavicārā. Ārammaṇe hi abhiniropanānumajjanehi vitakkavicārehi saha cittaṃ pavattati, na tabbirahitaṃ. Tenāha ‘‘vitakkavicārā’’tiādi. Sattā pajjanti etehi yathārahaṃ vaṭṭaṃ vivaṭṭañcāti sattapadā, gehanissitā vaṭṭapadā. Yoggānaṃ damanaācariyā yoggācariyā. Tenāha ‘‘dametabbadamakāna’’nti. Sesanti vuttāvasesaṃ ekasattatividhaviññāṇaṃ saphassarūpakasseva adhippetattā."
NULL,p194,635,100,bodytext,,305. Idhāti imissaṃ chaviññāṇakāyadesanāyaṃ. Manodhātuttayavinimuttameva manoviññāṇadhātūti veditabbaṃ.
NULL,p194,636,100,bodytext,,Cakkhumhi samphassoti cakkhuṃ nissāya uppanno samphasso. Tenāha – ‘‘cakkhuviñāṇasampayuttasamphassassetaṃ adhivacana’’nti.
NULL,p194,637,100,bodytext,,"Yathā kevalena viññāṇena rūpadassanaṃ na hoti, evaṃ kevalena cakkhupasādenapīti vuttaṃ ‘‘cakkhuviññāṇenā’’ti. Tena pāḷiyaṃ cakkhunāti nissayamukhena nissitakiccaṃ vuttanti dasseti. Ārammaṇavasenāti ārammaṇapaccayabhāvena. ‘‘Upavicarati’’cceva kasmā vuttaṃ, nanu tattha vitakkabyāpāropi atthīti? Saccaṃ atthi. So panettha taggatikoti āha – ‘‘vitakko taṃsampayutto cā’’ti. Sampayuttadhammānampi upavicaraṇaṃ vitakkavicārānaṃyevettha kiccanti ‘‘vitakkavicārasaṅkhātā manopavicārā’’ti vuttaṃ. Somanassayutto upavicāro somanassūpavicāro yathā ‘‘ājaññaratho’’ti āha ‘‘somanassena saddhi’’ntiādi."
NULL,p194,638,100,bodytext,,"306. Upavicārānaṃ upassayaṭṭhena gehaṃ viyāti gehaṃ, rūpādayoti āha – ‘‘gehassitānīti kāmaguṇanissitānī’’ti. Niccasaññādinikkhamanato nekkhammaṃ vipassanāti, ‘‘nekkhammassitānītivipassanānissitānī’’ti vuttaṃ. Iṭṭhānanti kasivaṇijjādivasena pariyiṭṭhānanti āha ‘‘pariyesitāna’’nti. Piyabhāvo pana kantasaddeneva kathitoti kāmitabbānaṃ mano rametīti manoramānaṃ. Lokena āmasīyatīti lokāmisaṃ, taṇhā. Tāya gahetabbatāya iṭṭhabhāvāpādanena paṭisaṅkhatatāya ca paṭisaṃyuttānaṃ. Atīte kataṃ uppajjati ārammaṇikaanubhavanassa asambhavatoti adhippāyo. Edisaṃ anussaraṇaṃ diṭṭhaggahaṇānussarena ca hotīti dassetuṃ, ‘‘yathāha’’ntiādi vuttaṃ."
NULL,p194,639,100,bodytext,,"Aniccākāranti hutvā abhāvākāraṃ. Vipariṇāmavirāganirodhanti jarāya maraṇena cāti dvedhā vipariṇāmetabbañceva, tato eva palokitaṃ bhaṅgañca. Aṭṭhakathāyaṃ pana yasmā uppannaṃ rūpaṃ tenevākārena na tiṭṭhati, atha kho uppādāvatthāsaṅkhātaṃ pakatiṃ vijahati, vijahitañca jarāvatthāya tato vigacchati, vigacchantañca bhaṅguppattiyā nirujjhatīti imaṃ visesaṃ dassetuṃ, ‘‘pakativijahanenā’’tiādi vuttaṃ. Kāmañcettha ‘‘yathābhūtaṃ sammappaññāya passato’’ti vuttaṃ, anubodhañāṇaṃ pana adhippetaṃ vīthipaṭipannāya vipassanāya vasenāti ‘‘vipassanāpaññāyā’’ti vuttaṃ upavicāraniddesabhāvato. Tathā hi vakkhati – ‘‘chasudvāresu iṭṭhārammaṇe āpāthagate’’tiādi. Saṅkhārānaṃ bhedaṃ passatoti sabbesaṃ saṅkhārānaṃ khaṇe khaṇe bhijjanasabhāvaṃ vīthipaṭipannena vipassanāñāṇena passato. Tenāha ‘‘saṅkhāragatamhi tikkhe’’tiādi. Tattha saṅkhāgatamhīti saṅkhāragate visayabhūte. Tikkheti bhāvanābalena indriyānañca samatāya tibbe. Sūreti paṭipakkhehi anabhibhūtatāya, tesañca abhibhavanasamatthatāya visade paṭubhūte pavattante."
NULL,p194,640,100,bodytext,,"Kilesānaṃ vikkhambhanavasena vūpasantatāya santacittassa, saṃsāre bhayassa ikkhanato bhikkhuno, uttarimanussadhammasannissitattā amānusī ratīti vivekarati nekkhammarati. Yato yatoti yathā yathā nayavipassanādīsu yena yena sammasanākārenāti attho. Khandhānaṃ udayabbayanti pañcupādānakkhandhānaṃ uppādañca bhaṅgañca. Amatantaṃ vijānatanti vijānantānaṃ viññūnaṃ āraddhavipassanānaṃ taṃ pītipāmojjaṃ amatādhigamahetutāya amatanti veditabbaṃ."
NULL,p194,641,100,bodytext,,Chasu dvāresu iṭṭhārammaṇe āpāthagateti rūpādivasena chabbidhe iṭṭhārammaṇe yathārahaṃ chasu dvāresu āpāthagate. Visaye cetaṃ bhummavacanaṃ.
NULL,p194,642,100,bodytext,,"307. Paccuppannanti santatipaccuppannaṃ. Anuttaravimokkho nāma arahattaṃ idha adhippetaṃ ukkaṭṭhaniddesena. Kathaṃ pana tattha pihaṃ upaṭṭhapeti, na hi adhigataṃ arahattaṃ ārammaṇaṃ hoti, na  ca taṃ ārabbha pihā pavattatīti? Ko vā evamāha – ‘‘arahattaṃ ārammaṇaṃ katvā pihaṃ upaṭṭhapetī’’ti. Anussutiladdhaṃ pana parikappasiddhaṃ arahattaṃ uddissa patthanaṃ ṭhapeti, tattha cittaṃ paṇidahati. Tenāha bhagavā – ‘‘kudāssu nāmāhaṃ tadāyatanaṃ upasampajja viharissāmī’’ti. Āyatananti arahattameva chaḷaṅgasamannāgamādikāraṇabhāvato, manāyatanadhammāyatanabhāvato ca tathā vuttaṃ, taṃ panetaṃ domanassaṃ  patthanaṃ paṭṭhapentassa uppajjati patthanāya sahāvattanato. Na hi lobhadosānaṃ saha vutti atthi. Patthanāmūlakattāti iminā upaṭṭhāpayato padassa hetuatthajotakatamāha. Evanti ‘‘kudāssunāmā’’tiādinā vuttākārena. Ussukkāpetunti yathā maggena ghaṭeti, evaṃ ussukkāpetuṃ."
NULL,p194,643,100,bodytext,,"308. Aññāṇupekkhāti aññāṇasahitā upekkhā asamapekkhanapavattā. Tena tena maggodhinā tassa tassa apāyagamanīyakilesodhissa anavasesato jitattā khīṇāsavo nippariyāyato odhijino nāma; tadabhāvato puthujjano nippariyāyatova anodhijino nāma; sekho pana siyā pariyāyato odhijinoti. Tampi nivattento, ‘‘akhīṇāsavassāti attho’’ti āha. Āyatiṃ vipākaṃ jinitvāti appavattikaraṇavasena sabbaso āyatiṃ vipākaṃ jinitvā ṭhitattā khīṇāsavova nippariyāyato vipākajino nāma; tadabhāvato puthujjano nippariyāyato avipākajino nāma; sekho pana siyā pariyāyato vipākajinoti. Tampi nivattento ‘‘akhīṇāsavassevāti attho’’ti āha. Apassantassa rūpanti pāḷito padaṃ ānetvā sambandhitabbaṃ. Pāḷiyaṃ pubbe ‘‘puthujjanassā’’ti vatvā puna ‘‘assutavato puthujjanassā’’ti vacanaṃ andhaputhujjanassāyaṃ upekkhā, na kalyāṇaputhujjanassāti dassanatthaṃ. Gehassitā upekkhā hi yaṃ kiñci ārammaṇavatthuṃ apekkhasseva, na nirapekkhassāti iṭṭhe, iṭṭhamajjhatte vā ārammaṇe siyāti vuttaṃ ‘‘iṭṭhārammaṇe āpāthagate’’ti. Aññāṇena pana tattha ajjhupekkhanākārappatti hoti. Tenāha ‘‘guḷapiṇḍake’’tiādi."
NULL,p194,644,100,bodytext,,"Iṭṭhe arajjantassa aniṭṭhe adussantassāti idaṃ yebhuyyena sattānaṃ iṭṭhe rajjanaṃ, aniṭṭhe dussananti katvā vuttaṃ. Ayoniyomanasikāro hi taṃtaṃārammaṇavasena na katthacipi javananiyamaṃ karotīti vuttaviparītepi ārammaṇe rajjanadussanaṃ sambhavati, tathāpissa rajjanadussanaṃ atthato paṭikkhittamevāti daṭṭhabbaṃ. Asamapekkhaneti asamaṃ ayuttadassane ayoniso sammohapubbakaṃ ārammaṇassa gahaṇe."
NULL,p194,645,100,bodytext,,309. Pavattanavasenāti uppādanavasena ceva bahulīkaraṇavasena ca. Nissāya ceva āgammacāti āgamanaṭṭhānabhūte nissayapaccayabhūte ca  katvā. Atikkantāni nāma honti vikkhambhanena ussārentā samussārentā.
NULL,p194,646,100,bodytext,,"Somanassabhāvasāmaññaṃ gahetvā, ‘‘sarikkhakeneva sarikkhakaṃ jahāpetvā’’ti vuttaṃ. Idhāpi pahāyakaṃ nāma pahātabbato balavameva, saṃkilesadhammānaṃ balavabhāvato sātisayaṃ pana balavabhāvaṃ sandhāya ‘‘idāni balavatā’’tiādi vuttaṃ. Balavabhāvato vodānadhammānaṃ adhigamassa adhippetattā hettha nekkhammassitadomanassānampi pahānaṃ jotitaṃ."
NULL,p194,647,100,bodytext,,"Upekkhāya pahāyakabhāvena adhippetattā ‘‘upekkhākathā veditabbā’’ti vuttaṃ. Jhānassa alābhino ca lābhino ca pakiṇṇakasaṅkhārasammasanaṃ sandhāya, ‘‘suddhasaṅkhāre ca pādake katvā’’ti. Upekkhāsahagatāti bhāvanāya paguṇabhāvaṃ āgamma kadāci ajjhupekkhanavasenapi hi sammasanaṃ hotīti. Pādakajjhānavasena, sammasitadhammavasena vā āgamanavipassanāya bahulaṃ somanassasahagatabhāvato ‘‘vuṭṭhānagāminī pana vipassanā somanassasahagatāvā’’ti niyametvā vuttaṃ. Upekkhāsahagatā hotīti etthāpi eseva nayo. Catutthajjhānādīnīti ādi-saddena arūpajjhānāni saṅgaṇhāti. Purimasadisāvāti purimasadisā eva, upekkhāsahagatā vā hoti somanassasahagatā vāti attho. Idaṃ sandhāyāti yaṃ catutthajjhānādipādakato eva upekkhāsahagataṃ vuṭṭhānagāminivipassanaṃ nissāya somanassasahagatāya vipassanāya pahānaṃ, idaṃ sandhāya. Pahānanti cettha samatikkamalakkhaṇaṃ veditabbaṃ."
NULL,p194,648,100,bodytext,,"Etaṃ visesaṃ vipassanāya āvajjanaṭṭhānabhūtaṃ. Vuṭṭhānagāminiyā āsanne samāpannajjhānavipassanā pādakajjhānavipassanā, sammasitadhammoti vipassanāya ārammaṇabhūtā khandhā. Puggalajjhāsayoti pādakajjhānassa sammasitajjhānassa ca bhede sati paṭipajjanakassa puggalassa, ‘‘aho vata mayhaṃ pañcaṅgikaṃ jhānaṃ bhaveyya caturaṅgika’’ntiādinā pubbe pavattaajjhāsayo. Tesampi vādeti ettha paṭhamatheravāde. Ayameva…pe… niyameti tato tato dutiyādipādakajjhānato uppannassa saṅkhārupekkhāñāṇassa pādakajjhānātikkantānaṃ  aṅgānaṃ asamāpajjitukāmatā virāgabhāvanābhāvato itarassa ca atabbhāvato. Eteneva hi paṭhamatheravāde apādakapaṭhamajjhānapādakamaggā paṭhamajjhānikāva honti, itare ca dutiyajjhānikādimaggā pādakajjhānavipassanāniyamehi taṃtaṃjhānikāva. Evaṃ sesavādesupi vipassanāniyamo yathāsambhavaṃ yojetabbo. Tenāha – ‘‘tesampi vāde ayameva pubbabhāge vuṭṭhānagāminivipassanāva niyametī’’ti. Vuttāva, tasmā na idha vattabbāti adhippāyo."
NULL,p194,649,100,bodytext,,"310. Nānattādi  kāmāvacarādikusalādivibhāgato nānāvidhā. Tenāha ‘‘anekappakārā’’ti. Nānattasitāti rūpasaddādinānārammaṇanissayā. Ekattā ekasabhāvā jātibhūmiādivibhāgābhāvato. Ekārammaṇanissitāti ekappakāreneva ārammaṇe pavattā. Heṭṭhā aññāṇupekkhā vuttā ‘‘bālassa muḷhassā’’tiādinā (ma. ni. 3.308). Upari chaḷaṅgupekkhā vakkhati ‘‘upekkhako viharatī’’tiādinā (ma. ni. 3.311). Dve upekkhā gahitā dvinnampi ekattā, ekajjhaṃ gahetabbato, nānattasitāya upekkhāya pakāsitabhāvato ca."
NULL,p194,650,100,bodytext,,"Aññāṇupekkhā aññā saddādīsu tattha tattheva vijjamānattā. Rūpesūti ca iminā na kevalaṃ rūpāyatanavisesā eva gahitā, atha kho kasiṇarūpānipīti āha – ‘‘rūpe upekkhābhāvañca aññā’’tiādi. Ekattasitabhāvopi idha ekattavisayasampayogavaseneva icchito, na ārammaṇavasena cāti dassetuṃ, ‘‘yasmā panā’’tiādi vuttaṃ. Tenevāha ‘‘tatthā’’tiādi. Sampayuttavasenāti sampayogavasena. Ākāsānañcāyatanaṃ nissayatīti ākāsānañcāyatananissitā, ākāsānañcāyatanakhandhanissitā. Sesāsupīti viññāṇañcāyatananissitādīsupi."
NULL,p194,651,100,bodytext,,"Arūpāvacaravipassanupekkhāyāti arūpāvacaradhammārammaṇāya vipassanupekkhāya. Rūpāvacaravipassanupekkhanti etthāpi eseva nayo. Tāya kāmarūpārūpabhedāya taṇhāya nibbattāti tammayā, tebhūmakadhammā, tesaṃ bhāvo tammayatā, taṇhā yassa guṇassa vasena atthe saddaniveso, tadabhidhānakoti āha – ‘‘tammayatā nāma taṇhā’’ti. Atammayatā tammayatāya paṭipakkhoti katvā. Vipassanupekkhanti, ‘‘yadatthi yaṃ bhūtaṃ, taṃ pajahati upekkhaṃ paṭilabhatī’’ti (dī. ni. 3.71; a. ni. 7.55) evamāgataṃ saṅkhāravicinane majjhattabhūtaṃ upekkhaṃ."
NULL,p194,652,100,bodytext,,"311. Yadariyoti ettha da-kāro padasandhikaro, upayogaputhuvacane ca ya-saddoti dassento, ‘‘ye satipaṭṭhāne ariyo’’ti āha. Kāmaṃ ‘‘ariyo’’ti padaṃ sabbesampi paṭividdhasaccānaṃ sādhāraṇaṃ, vakkhamānassa pana visesassa buddhāveṇikattā, ‘‘ariyo sammāsambuddho’’ti vuttaṃ. Na hi paccekabuddhādīnaṃ ayamānubhāvo atthi. Tīsu ṭhānesūti na sussūsantīti vā, ekacce na sussūsanti ekacce sussūsantīti vā, sussūsantīti vā, paṭipannāpaṭipannānaṃ sāvakānaṃ paṭipattisaṅkhātesu tīsu satipaṭṭhānesu. Satiṃ paṭṭhapentoti paṭighānunayehi anavassutattā tadubhayanivattattā sabbadā satiṃ upaṭṭhapento. Buddhānameva sā niccaṃ upaṭṭhitasatitā, na itaresaṃ āveṇikadhammabhāvato. Ādarena sotumicchā idha sussūsāti tadabhāvaṃ  dassento, ‘‘saddahitvā sotuṃ na icchantī’’ti āha. Na aññāti ‘‘na aññāyā’’ti vattabbe yakāralopena niddesoti āha ‘‘na jānanatthāyā’’ti. Satthu ovādassa anādiyanameva vokkamananti āha – ‘‘atikkamitvā…pe… maññantī’’ti."
NULL,p194,653,100,bodytext,,"Gehassitadomanassavasenāti idaṃ idha paṭikkhipitabbamattadassanapadaṃ daṭṭhabbaṃ. Nekkhammassitadomanassassapi satthu pasaṅgavasena ‘‘na ceva attamano hotī’’ti attamanapaṭikkhepena anattamanatā vuttā viya hotīti taṃ paṭisedhento – ‘‘appatīto hotīti na evamattho daṭṭhabbo’’ti. Tassa setughāto hi tathāgatānaṃ. Yadi evaṃ kasmā attamanatāpaṭikkhepoti āha – ‘‘appaṭipannakesu pana anattamanatākāraṇassa abhāvenetaṃ vutta’’nti. Paṭighaavassavenāti chahi dvārehi paṭighavissandanena, paṭighappavattiyāti attho. Uppilāvitoti na evamattho daṭṭhabbo uppilāvitattassa bodhimūle eva pahīnattā. Paṭipannakesūti idaṃ adhikāravasena vuttaṃ, appaṭipannakesupi tathāgatassa anattamanatākāraṇaṃ nattheva. Etaṃ vuttanti etaṃ ‘‘attamano ceva hotī’’tiādivacanaṃ vuttaṃ  sāvakānaṃ sammāpaṭipattiyā satthu anavajjāya cittārādhanāya sambhavato."
NULL,p194,654,100,bodytext,,"312. Damitoti nibbisevanabhāvāpādanena sikkhāpito. Iriyāpathaparivattanavasena aparivattitvā ekadisāya eva sattadisāvidhāvanassa idhādhippetattā sāritānaṃ hatthidammādīnaṃ ekadisādhāvanampi anivattanavaseneva yuttanti āha – ‘‘anivattitvā dhāvanto ekaṃyeva disaṃ dhāvatī’’ti. Kāyena anivattitvāvāti kāyena aparivattitvā eva. Vimokkhavasena aṭṭha disā vidhāvati, na puratthimādidisāvasena. Ekappahārenevāti ekanīhāreneva, ekasmiṃyeva vā divase ekabhāgena. ‘‘Pahāro’’ti hi divasassa tatiyo bhāgo vuccati. Vidhāvanañcettha jhānasamāpajjanavasena akalaṅkamappatisātaṃ javanacittapavattanti āha ‘‘samāpajjatiyevā’’ti. Sesaṃ suviññeyyameva."
NULL,p194,655,100,centered,,Saḷāyatanavibhaṅgasuttavaṇṇanāya līnatthappakāsanā samattā.
NULL,p194,656,3,subhead,8. Uddesavibhaṅgasuttavaṇṇanā,8. Uddesavibhaṅgasuttavaṇṇanā
NULL,p194,657,100,bodytext,,"313. Desetabbassa  atthassa uddisanaṃ uddeso, vibhajanaṃ vibhaṅgoti āha – ‘‘mātikañca vibhajanañcā’’ti tuleyyātiādīni cattāripi padāni paññāvevacanāni. Atha vā tuleyyāti tulanabhūtāya paññāya tassa dhammassa paggahādividhinā parituleyya. Tīreyyāti tīraṇabhūtāya paññāya tattha ñāṇakiriyāsamāpanavasena tīreyya. Pariggaṇheyyāti tathāsamāpanno ānisaṃse assādaādīnave ca vicineyya. Paricchindeyyāti paricchindabhūtena ñāṇena atthaṃ paricchinditvā jāneyya. Ārammaṇesūti rūpādiputhuttārammaṇesu. Nikantivasenāti nikāmanavasena apekkhāvasena. Tiṭṭhamānanti pavattamānaṃ. Gocarajjhatteti jhānārammaṇabhūte. Tañhi bhāvanācittenābhibhuyya avissajjitvā gayhamānaṃ ajjhattaṃ viya hotīti ‘‘gocarajjhatta’’nti vuccati. Bhāvanaṃ āraddhassa bhikkhuno yadi bhāvanārammaṇe nikanti uppajjeyya, tāya nikantiyā upari bhāvanaṃ vissajjetvā cittasaṃkocavasena saṇṭhitaṃ nāma, tadabhāvena asaṇṭhitaṃ nāma hotīti, ‘‘ajjhattaṃ asaṇṭhita’’nti vuttanti dassento, ‘‘gocarajjhatte nikantivasena asaṇṭhita’’nti  āha. Tathā hi vakkhati – ‘‘nikantivasena hi atiṭṭhamānaṃ hānabhāgiyaṃ na hoti, visesabhāgiyameva hotī’’ti. Aggahetvāti rūpādīsu kiñci taṇhādiggāhavasena aggahetvā. Tathā aggahaṇeneva hi taṇhāparitāsādivasena na paritasseyya. Avasesassa ca dukkhassāti sokādidukkhassa. Avasesassa ca dukkhassāti vā jātijarāmaraṇasīsena vipākadukkhassa gahitattā kilesadukkhassa ceva saṃsāradukkhassa cāti attho."
NULL,p194,658,100,bodytext,,316. Rūpameva kilesuppattiyā kāraṇabhāvato rūpanimittaṃ. Rāgādivasena taṃ anudhāvatīti rūpanimittānusārī.
NULL,p194,659,100,bodytext,,318. Nikantivasena asaṇṭhitanti apekkhāvasena saṇṭhitaṃ nikantiṃ pahāya pavattamānaṃ upari visesāvahatoti. Tenāha ‘‘nikantivasena hī’’tiādi.
NULL,p194,660,100,bodytext,,"320. Aggahetvā aparitassanāti pañcupādānakkhandhe, ‘‘etaṃ mamā’’tiādinā taṇhādiggāhavasena upādiyitvā taṇhāparitāsādivasena paritassanā, vuttavipariyāyena aggahetvā aparitassanā veditabbā. Kathaṃ panesā anupādāparitassanā hotīti mahātherassa adhippāyaṃ  vivarituṃ codanaṃ samuṭṭhapeti? Upādātabbassa abhāvatoti tassa anupādāparitassanābhāve kāraṇavacanaṃ. Yadi hītiādi tassa samatthanaṃ. Upādāparitassanāva assa tathā upādātabbassa tatheva upādinnattā. Evanti niccādiākārena. Upādinnāpīti gahitaparāmaṭṭhāpi. Anupādinnāva honti ayoniso gahitattā, viññūsu nissāya jānitabbattā ca. Diṭṭhivasenāti micchādiṭṭhiyā gahaṇākāravasena, tassa pana ayathābhūtagāhitāya paramatthato ca abhāvato. Atthatoti paramatthato. Anupādāparitassanāyeva nāma hoti upādātabbākārassa abhāvena taṃ anupādiyitvā eva paritassanāti katvā."
NULL,p194,661,100,bodytext,,"Parivattatīti na tadeva rūpaṃ aññathā pavattaṃ parivattati, atha kho pakatijahanena sabhāvavigamena nassati bhijjati. Vipariṇatanti aññathattaṃ gataṃ vinaṭṭhaṃ. Kammaviññāṇanti abhisaṅkhāraviññāṇaṃ. ‘‘Rūpaṃ attā’’tiādi micchāgāhavasena viññāṇassa rūpabhedena vuttassa bhedānuparivatti hoti. Vipariṇāmaṃ anugantvā viparivattanataṃ ārabbha pavattaṃ vipariṇāmānuparivattaṃ; tato  samuppannā paritassanā vipariṇāmānuparivattajā paritassanāti dassento āha – ‘‘vipariṇāmassa…pe… paritassanā’’ti. Akusaladhammasamuppādā cāti, ‘‘yaṃ ahu vata me, taṃ vata me natthī’’tiādinā pavattā akusalacittuppādadhammā. Khepetvāti pavattituṃ appadānavasena anuppattinimittatāya khepetvā. Bhayatāsenāti bhāyanavasenapi cittutrāsena. Taṇhātāsenāti tassanena. Savighātoti cittavighātanavighātena savighāto. Tato eva cetodukkhena sadukkho. Maṇikaraṇḍakasaññāyāti rittakaraṇḍaṃyeva maṇiparipuṇṇakaraṇḍoti uppannasaññāya. Aggahetvā paritassanāti gahetabbassa abhāvena gahaṇampi avijjamānapakkhiyamevāti aggahetvā paritassanā nāma hoti."
NULL,p194,662,100,bodytext,,321. Kammaviññāṇameva natthi sati kammaviññāṇe rūpabhedānuparivatti siyāti kammaviññāṇābhāvadassanamukhena khīṇāsavassa sabbaso kilesābhāvaṃ dasseti. Sesaṃ suviññeyyameva.
NULL,p194,663,100,centered,,Uddesavibhaṅgasuttavaṇṇanāya līnatthappakāsanā samattā.
NULL,p194,664,3,subhead,9. Araṇavibhaṅgasuttavaṇṇanā,9. Araṇavibhaṅgasuttavaṇṇanā
NULL,p194,665,100,bodytext,,"323. Gehassitavasenāti  kilesanissitavasena anurodhavasena. Neva ukkhipeyyāti na anuggaṇheyya. Na avakkhipeyyāti gehassitavasena virodhavasena na niggaṇheyya. Anurodhena vinā sampahaṃsanavasena yathābhūtaguṇakathanaṃ nevussādanā vajjābhāvato; tathā virodhena vinā vivecanavasena yathābhūtadosakathanaṃ na apasādanaṃ. Sabhāvamevāti yathābhūtasabhāvameva kassaci puggalassa anādesakaraṇavasena katheyya, seyyathāpi āyasmā subhūtitthero. Vinicchitasukhanti, ‘‘ajjhattaṃ anavajja’’ntiādinā visesato vinicchitasukhāya hoti. Parammukhā avaṇṇanti svāyaṃ rahovādo pesuññūpasaṃhāravasena pavatto idhādhippetoti āha ‘‘pisuṇavācanti attho’’ti. Khīṇātīti khīṇo, yo bhāsati, yañca uddissa bhāsati, dvepi hiṃsati vibādhatīti attho, taṃ khīṇavādaṃ. Svāyaṃ yasmā kilesehi ākiṇṇo saṃkiliṭṭho eva ca hoti, tasmā vuttaṃ – ‘‘ākiṇṇaṃsaṃkiliṭṭhaṃ vāca’’nti. Tena avasiṭṭhaṃ tividhampi vacīduccaritamāha. Adhiṭṭhahitvāti, ‘‘idameva sacca’’nti ajjhosāya. Ādāyāti paggayha. Vohareyyāti samudācareyya. Lokasamaññanti lokasaṅketaṃ."
NULL,p194,666,100,bodytext,,"324. Ārammaṇato sampayogato kāmehi paṭisaṃhitattā kāmapaṭisandhi, kāmasukhaṃ. Tenāha ‘‘kāmūpasaṃhitena sukhenā’’ti. Sadukkhoti vipākadukkhena saṃkilesadukkhena sadukkho. Tathā sapariḷāhoti vipākapariḷāhena ceva kilesapariḷāhena ca sapariḷāho."
NULL,p194,667,100,bodytext,,"326. Vaṭṭato nissarituṃ adatvā tattheva sīdāpanato micchāpaṭipadābhāvena satte saṃyojetīti saṃyojanaṃ, visesato bhavasaṃyojanaṃ taṇhāti āha ‘‘taṇhāyetaṃ nāma’’nti. Na taṇhāyeva mānādayopi saṃyojanattaṃ sādhenti nāma sabbaso saṃyojanato suṭṭhu bandhanato. Tena vuttaṃ – ‘‘avijjānīvaraṇānaṃ, bhikkhave, sattānaṃ taṇhāsaṃyojanāna’’nti (saṃ. ni. 2.125-126)."
NULL,p194,668,100,bodytext,,"Imaṃ catukkanti, ‘‘ye kāmapaṭisandhisukhino somanassānuyogaṃ anuyuttā, ye attakilamathānuyogaṃ anuyuttā’’ti evamāgataṃ imaṃ catukkaṃ nissāya. ‘‘Etadagge ṭhapito’’ti, vatvā taṃ nissāya ṭhapitabhāvaṃ vitthārato dassetuṃ, ‘‘bhagavato hī’’tiādi vuttaṃ. Ussādanāapasādanāpaññāyanti tathāgatena vinetabbapuggalavasena dhammadesanāya pavattetabbato. Ayaṃ puggalo…pe… ācārasampannoti vā natthi paresaṃ anuddesakavasena dhammadesanāya pavattanato."
NULL,p194,669,100,bodytext,,"329. Parammukhā avaṇṇanti nindiyassa dosassa nindanaṃ. Na hi kadāci nindiyo pasaṃsiyo hoti, taṃ pana kālaṃ ñatvāva kathetabbanti āha, ‘‘yuttapattakālaṃ ñatvāvā’’ti. Khīṇavādepi eseva nayo tassa rahovādena samānayogakkhamattā."
NULL,p194,670,100,bodytext,,"330. Ghātīyatīti vadhīyati. Saddopi bhijjati nassati, bhedo hotīti attho. Gelaññappattoti khedaṃ parissamaṃ patto. Apalibuddhanti dosehi ananupatitaṃ."
NULL,p194,671,100,bodytext,,"331. Abhinivissavoharatīti evametaṃ, na ito aññathāti taṃ janapadaniruttiṃ abhinivisitvā samudācarati. Atidhāvananti samaññaṃ nāmetaṃ lokasaṅketasiddhā paññattīti paññattimatte aṭṭhatvā paramatthato thāmasā parāmassa voharaṇaṃ."
NULL,p194,672,100,bodytext,,332. Aparāmasantoti anabhinivisanto samaññāmattatova voharati.
NULL,p194,673,100,bodytext,,"333. Mariyādabhājanīyanti yathāvuttasammāpaṭipadāya micchāpaṭipadāya ca aññamaññaṃ saṅkarabhāvavibhājanaṃ. Raṇanti sattā etehi kandanti akandantāpi kandanakāraṇabhāvatoti raṇā; rāgadosamohā, dasapi vā kilesā, sabbepi vā ekantākusalā, tehi nānappakāradukkhanibbattakehi abhibhūtā sattā kandanti; saha raṇehīti saraṇo. Raṇasaddo vā rāgādireṇūsu niruḷho. Tenāha ‘‘sarajo sakileso’’ti. Pāḷiyaṃ pana ‘‘sadukkho eso dhammo’’tiādinā āgatattā kāmasukhānuyogādayopi ‘‘saraṇo’’ti vuttāti dukkhādīnaṃ raṇabhāvo tannibbattakasabhāvānaṃ akusalānaṃ saraṇatā ca veditabbā. Araṇotiādīnaṃ padānaṃ vuttavipariyāyena attho veditabbo."
NULL,p194,674,100,bodytext,,"Vatthuṃ sodhetīti nirodhasamāpajjanena mahapphalabhāvakaraṇena dakkhiṇeyyavatthubhūtaṃ attānaṃ visodheti; nirodhasamāpattiyā vatthuvisodhanaṃ nirodhaṃ samāpajjitvā vuṭṭhitānaṃ paccekabuddhānaṃ mahākassapattherādīnaṃ dinnadakkhiṇāvisuddhiyā dīpetabbaṃ. Tenāha ‘‘tathā hī’’tiādi. Tathevāti iminā ‘‘piṇḍāya caranto’’tiādiṃ upasaṃharati. Mettābhāvanāya mudubhūtacittabahumānapubbakaṃ dentīti, ‘‘subhūtitthero dakkhiṇaṃ visodhetī’’ti vuttaṃ. Tena dāyakatopi dakkhiṇāvisuddhiṃ dasseti. Vatthusodhanaṃ pana paṭibhāgato. Evaṃ pana kātuṃ sakkāti sāvakānampi kimevaṃ lahuvuṭṭhānādhiṭṭhānaṃ sāvakesu ciṇṇavasībhāvo sambhavatīti pucchati. Itaro aggasāvakamahāsāvakesu kiṃ vattabbaṃ, pakatisāvakesupi vasippattesu labbhatīti te dassento, ‘‘āma sakkā’’tiādimāha. Sesaṃ suviññeyyameva."
NULL,p194,675,100,centered,,Araṇavibhaṅgasuttavaṇṇanāya līnatthappakāsanā samattā.
NULL,p194,676,3,subhead,10. Dhātuvibhaṅgasuttavaṇṇanā,10. Dhātuvibhaṅgasuttavaṇṇanā
