id,book,par_num,level,class,title,text
NULL,p194,180,100,bodytext,,Sabbo diṭṭhiggāho taṇhāvasagatasseva hotīti āha ‘‘taṇhādhipateyyenā’’ti. Tesu tesu dhammesūti mayā desiyamānadassanadhammesu. Pakatikammaṭṭhānanti tassa therassa santike gahetvā parihariyamānakammaṭṭhānaṃ. Aññaṃ navakammaṭṭhānanti bhagavato desanānusārena gahitaṃ aññaṃ navaṃ kammaṭṭhānaṃ. Sesaṃ suviññeyyameva.
NULL,p194,181,100,centered,,Mahāpuṇṇamasuttavaṇṇanāya līnatthappakāsanā samattā.
NULL,p194,182,3,subhead,10. Cūḷapuṇṇamasuttavaṇṇanā,10. Cūḷapuṇṇamasuttavaṇṇanā
NULL,p194,183,100,bodytext,,"91. Tuṇhībhūtaṃtuṇhībhūtanti āmeḍitavacanaṃ byāpanicchāvasena vuttanti āha – ‘‘yaṃ yaṃ disa’’ntiādi. Anuviloketvāti ettha anusaddopi byāpanicchāyamevāti anu anu viloketvāti attho. Tenevāha – ‘‘tato tato viloketvā’’ti. Asanto nīco purisoti asappurisoti āha – ‘‘pāpapuriso lāmakapuriso’’ti. Soti asappuriso. Tanti asappurisaṃ jānituṃ na sakkoti asappurisadhammānaṃ yāthāvato ajānanato. Pāpadhammasamannāgatoti kāyaduccaritādiasantuṭṭhitādilāmakadhammasamannāgato. Asappurise bhatti etassāti asappurisabhatti. Tenāha – ‘‘asappurisasevano’’ti. Asappurisadhammo asappuriso uttarapadalopena, tesaṃ cintanasīloti asappurisacintī. Tenāha ‘‘asappurisacintāya cintako’’ti, duccintitacintīti attho. Asappurisamantananti asādhujanavicāraṃ asappurisavīmaṃsaṃ. Asappurisavācanti catubbidhaṃ dubbhāsitaṃ. Asappurisakammaṃ nāma tividhampi kāyaduccaritaṃ. Asappurisadiṭṭhi nāma visesato dasavatthukā micchādiṭṭhi, tāya samannāgato asappurisadiṭṭhiyā samannāgato, asappurisadānaṃ nāma asakkaccadānādi. Sabbopāyamattho pāḷito eva viññāyati."
NULL,p194,184,100,bodytext,,"‘‘Pāṇaṃ hanissāmī’’tiādikā cetanā kāmaṃ parabyābādhāyapi hotiyeva, yathā pana sā attano balavataradukkhatthāya hoti, tathā na parassāti imamatthaṃ dassetuṃ, ‘‘attano dukkhatthāya cinteti’’icceva vutto. Yathā asuko asukantiādīhi pāpako pāpavipākekadesaṃ balavaṃ garutaraṃ vā paccanubhontopi yathā paro paccanubhoti, na tathā sayanti dasseti. Tenāha ‘‘parabyābādhāyā’’ti. Gahetvāti pāpakiriyāya sahāyabhāvena gahetvā."
NULL,p194,185,100,bodytext,,"Asakkaccanti anādaraṃ katvā. Deyyadhammassa asakkaraṇaṃ appasannākāro, puggalassa asakkaraṇaṃ agarukaraṇanti imamatthaṃ dassento, ‘‘deyyadhammaṃ na sakkaroti nāmā’’tiādimāha. Acittīkatvāti na citte katvā, na pūjetvāti attho. Pūjento hi pūjetabbavatthuṃ citte ṭhapeti, tato na bahi karoti. Cittaṃ vā acchariyaṃ katvā paṭipatti cittīkaraṇaṃ, sambhāvanakiriyā. Tappaṭikkhepato acittīkaraṇaṃ, asambhāvanakiriyā. Apaviddhanti ucchiṭṭhādichaḍḍanīyadhammaṃ viya avakhittakaṃ. Tenāha – ‘‘chaḍḍetukāmo viyā’’tiādi. Rogaṃ pakkhipantoviyāti rogikasarīraṃ odanādīhi pamajjitvā vammike rogaṃ pakkhipanto viya. Addhā imassa dānassa phalaṃ mameva āgacchatīti evaṃ yassa tathā diṭṭhi atthi, so āgamanadiṭṭhiko, ayaṃ pana na tādisoti āha ‘‘anāgamanadiṭṭhiko’’ti. Tenāha – ‘‘no phalapāṭikaṅkhī hutvā detī’’ti."
NULL,p194,186,100,bodytext,,"Kāmañcāyaṃ yathāvuttapuggalo asaddhammādīhi pāpadhammehi samannāgato, tehi pana sabbehipi micchādassanaṃ mahāsāvajjanti dassetuṃ, ‘‘tāya micchādiṭṭhiyā niraye upapajjatī’’ti vuttaṃ. Vuttapaṭipakkhanayenāti kaṇhapakkhe vuttassa atthassa vipariyāyena sukkapakkhe attho veditabbo. ‘‘Sadevakaṃ loka’’ntiādīsu (pārā. 1) devasaddo chakāmāvacaradevesu, evamidhāti āha ‘‘chakāmāvacaradevā’’ti. Tattha brahmānaṃ visuṃ gahitattā kāmāvacaradevaggahaṇanti ce? Idha dānaphalassa adhippetattā kāmāvacaradevaggahaṇaṃ, tatthāpi chakāmāvacaraggahaṇaṃ daṭṭhabbaṃ devamahattatādivacanato. Tiṇṇaṃ kulānaṃ sampattīti khattiyamahattādīnaṃ tiṇṇaṃ kulānaṃ sampatti, na kevalaṃ kulasampadā eva adhippetā, atha kho tattha āyuvaṇṇayasabhogaissariyādisampadāpi adhippetāti daṭṭhabbaṃ uḷārassa dānamayapuññassa vasena tesampi samijjhanato. Suddhavaṭṭavaseneva kathitaṃ sukkapakkhepi sabbaso vivaṭṭassa anāmaṭṭhattā. Saddhādayo hi lokiyakusalasambhārā evettha adhippetāti. Sesaṃ suviññeyyameva."
NULL,p194,187,100,centered,,Cūḷapuṇṇamasuttavaṇṇanāya līnatthappakāsanā samattā.
NULL,p194,188,100,centered,,Niṭṭhitā ca devadahavaggavaṇṇanā.
NULL,p194,189,2,chapter,2. Anupadavaggo,2. Anupadavaggo
NULL,p194,190,3,subhead,1. Anupadasuttavaṇṇanā,1. Anupadasuttavaṇṇanā
NULL,p194,191,100,bodytext,,"93. Iddhimātiguṇo pākaṭo paratoghosena vinā pāsādakampanadevacārikādīhi sayameva pakāsabhāvato; dhutavādādiguṇānampi tathābhāve eteneva nayena tesaṃ guṇānaṃ pākaṭayogato ca paresaṃ nicchitabhāvato ca. Paññavato guṇāti paññāpabhedapabhāvite guṇavisese sandhāya vadati. Te hi yebhuyyena paresaṃ avisayā. Tenāha – ‘‘na sakkā akathitā jānitu’’nti. Visabhāgā sabhāgā nāma ayonisomanasikārabahulesu puthujjanesu, te pana appahīnarāgadosatāya parassa vijjamānampi guṇaṃ makkhetvā avijjamānaṃ avaṇṇameva ghosentīti āha – ‘‘visabhāga…pe… kathentī’’ti."
NULL,p194,192,100,bodytext,,"Yā aṭṭhārasannaṃ dhātūnaṃ samudayato atthaṅgamato assādato ādīnavato yathābhūtaṃ pajānanā, ayaṃ dhātukusalatā. Āyatanakusalatāyapi eseva nayo. Avijjādīsu dvādasasu paṭiccasamuppādaṅgesu kosallaṃ paṭiccasamuppādakusalatā. Idaṃ imassa phalassa ṭhānaṃ kāraṇaṃ, idaṃ aṭṭhānaṃ akāraṇanti evaṃ ṭhānañca ṭhānato, aṭṭhānañca aṭṭhānato yathābhūtaṃ pajānanā, ayaṃ ṭhānāṭṭhānakusalatā. Yo pana imesu dhātuādīsu pariññābhisamayādivasena nissaṅgagatiyā paṇḍāti laddhanāmena ñāṇena ito gato pavatto, ayaṃ paṇḍito nāmāti āha – ‘‘imehi catūhi kāraṇehi paṇḍito’’ti. Mahantānaṃ atthānaṃ pariggaṇhanato mahatī paññā etassāti mahāpañño. Sesapadesupi eseva nayoti āha – ‘‘mahāpaññādīhi samannāgatoti attho’’ti."
NULL,p194,193,100,bodytext,,"Nānattanti yāhi mahāpaññādīhi samannāgatattā thero ‘‘mahāpañño’’tiādinā kittīyati, tāsaṃ mahāpaññādīnaṃ idaṃ nānattaṃ ayaṃ vemattatā. Yassa kassaci (dī. ni. ṭī. 3.216; saṃ. ni. ṭī. 1.1.110; a. ni. ṭī. 1.1.584) visesato arūpadhammassa mahattaṃ nāma kiccasiddhiyā veditabbanti tadassa kiccasiddhiyā dassento, ‘‘mahantesīlakkhandhe pariggaṇhātīti mahāpaññā’’tiādimāha. Tattha hetumahantatāya paccayamahantatāya nissayamahantatāya pabhedamahantatāya kiccamahantatāya  phalamahantatāya ānisaṃsamahantatāya ca sīlakkhandhassa mahantabhāvo veditabbo. Tattha hetū alobhādayo, paccayā hirottappasaddhāsativīriyādayo. Nissayā sāvakabodhipaccekabodhisammāsambodhiniyatatā taṃsamaṅgino ca purisavisesā. Pabhedo cārittādivibhāgo. Kiccaṃ tadaṅgādivasena paṭipakkhassa vidhamanaṃ. Phalaṃ saggasampadā nibbānasampadā ca. Ānisaṃso piyamanāpatādi. Ayamettha saṅkhepo, vitthāro pana visuddhimagge (visuddhi. 1.9) ākaṅkheyyasuttādīsu (ma. ni. 1.64 ādayo) ca āgatanayena veditabbo. Iminā nayena samādhikkhandhādīnampi mahantatā yathārahaṃ niddhāretvā veditabbā, ṭhānāṭṭhānādīnaṃ pana mahantabhāvo mahāvisayatāya veditabbo. Tattha ṭhānāṭṭhānānaṃ mahāvisayatā bahudhātukasutte (ma. ni. 3.124 ādayo) sayameva āgamissati. Vihārasamāpattīnaṃ samādhikkhandhe niddhāritanayena veditabbā, ariyasaccānaṃ sakalasāsanasaṅgahaṇato saccavibhaṅge (vibha. 189 ādayo) taṃsaṃvaṇṇanāsu (vibha. aṭṭha. 189 ādayo) āgatanayena. Satipaṭṭhānādīnaṃ vibhaṅgādīsu (vibha. 355 ādayo) taṃsaṃvaṇṇanādīsu (vibha. aṭṭha. 355 ādayo) ca āgatanayena. Sāmaññaphalānaṃ mahato hitassa mahato sukhassa mahato atthassa mahato yogakkhemassa nipphattibhāvato santapaṇītanipuṇaatakkāvacarapaṇḍitavedanīyabhāvato ca. Abhiññānaṃ mahāsambhārato mahāvisayato mahākiccato mahānubhāvato mahānipphattito ca. Nibbānassa madanimmadanādimahatthasiddhito mahantatā veditabbā."
NULL,p194,194,100,bodytext,,"Puthupaññāti etthāpi vuttanayānusārena attho veditabbo. Ayaṃ pana viseso – nānākhandhesu ñāṇaṃ pavattatīti, ‘‘ayaṃ rūpakkhandho nāma…pe… ayaṃ viññāṇakkhandho nāmā’’ti, evaṃ pañcannaṃ khandhānaṃ nānākaraṇaṃ paṭicca ñāṇaṃ pavattati. Tesupi ‘‘ekavidhena rūpakkhandho, ekādasavidhena rūpakkhandho, ekavidhena vedanākkhandho, bahuvidhena vedanākkhandho, ekavidhena saññākkhandho…pe… ekavidhena viññāṇakkhandho, bahuvidhena viññāṇakkhandho’’ti evaṃ ekekassa khandhassa ekavidhādivasena atītādibhedavasenapi nānākaraṇaṃ paṭicca ñāṇaṃ pavattati. Tathā ‘‘idaṃ cakkhāyatanaṃ nāma…pe… idaṃ dhammāyatanaṃ nāma. Tattha dasāyatanā kāmāvacarā, dve catubhūmakā’’ti evaṃ āyatananānattaṃ paṭicca ñāṇaṃ pavattati."
NULL,p194,195,100,bodytext,,"Nānādhātūsūti  ‘‘ayaṃ cakkhudhātu nāma…pe… ayaṃ manoviññāṇadhātu nāma. Tattha soḷasa dhātuyo kāmāvacarā, dve catubhūmakā’’ti evaṃ nānādhātūsu paṭicca ñāṇaṃ pavattati. Tayidaṃ  upādiṇṇakadhātuvasena vuttanti veditabbaṃ. Paccekabuddhānañhi dvinnañca aggasāvakānaṃ upādiṇṇakadhātūsuyeva nānākaraṇaṃ paṭicca ñāṇaṃ pavattati. Tañca kho ekadesatova, no nippadesato, anupādiṇṇakadhātūnaṃ pana nānākaraṇaṃ na jānantiyeva. Sabbaññubuddhānaṃyeva pana, ‘‘imāya nāma dhātuyā ussannattā imassa rukkhassa khandho seto hoti, imassa kaṇho, imassa bahalattaco, imassa tanuttaco, imassa pattaṃ vaṇṇasaṇṭhānādivasena evarūpaṃ, imassa pupphaṃ nīlaṃ pītaṃ lohitaṃ odātaṃ sugandhaṃ duggandhaṃ, phalaṃ khuddakaṃ mahantaṃ dīghaṃ vaṭṭaṃ susaṇṭhānaṃ maṭṭhaṃ pharusaṃ sugandhaṃ madhuraṃ tittakaṃ ambilaṃ kaṭukaṃ kasāvaṃ, kaṇṭako tikhiṇo atikhiṇo ujuko kuṭilo lohito odāto hotī’’ti dhātunānattaṃ paṭicca ñāṇaṃ pavattati."
NULL,p194,196,100,bodytext,,"Atthesūti rūpādīsu ārammaṇesu. Nānāpaṭiccasamuppādesūti ajjhattabahiddhābhedato santānabhedato ca nānappabhedesu paṭiccasamuppādaṅgesu. Avijjādiaṅgānañhi paccekaṃ paṭiccasamuppādasaññitāti. Tenāha – saṅkhārapiṭake ‘‘dvādasa paccayā dvādasa paṭiccasamuppādā’’ti. Nānāsuññatamanupalabbhesūti nānāsabhāvesu niccasārādivirahato suññasabhāvesu, tato eva itthipurisaattaattaniyādivasena anupalabbhesu sabhāvesu. Ma-kāro hettha padasandhikaro. Nānāatthesūti atthapaṭisambhidāvisayesu paccayuppannādinānāatthesu. Dhammesūti dhammapaṭisambhidāvisayesu paccayādinānādhammesu. Niruttīsūti tesaṃyeva atthadhammānaṃ niddhāraṇavacanasaṅkhātāsu nānāniruttīsu. Paṭibhānesūti ettha atthapaṭisambhidādīsu visayabhūtesu, ‘‘imāni idamatthajotakānī’’ti (vibha. 725-745) tathā tathā paṭibhānato paṭibhānānīti laddhanāmesu ñāṇesu. Puthu nānāsīlakkhandhesūtiādīsu sīlassa puthuttaṃ nānattañca vuttameva. Itaresaṃ pana vuttanayānusārena suviññeyyattā pākaṭameva. Yaṃ pana abhinnaṃ ekameva nibbānaṃ, tattha upacāravasena puthuttaṃ gahetabbanti āha – ‘‘puthu nānājanasādhāraṇe dhamme samatikkammā’’ti. Tenassa madanimmadanādipariyāyena puthuttaṃ paridīpitaṃ hoti."
NULL,p194,197,100,bodytext,,"Evaṃ  visayavasena paññāya mahattaṃ puthuttañca dassetvā idāni sampayuttadhammavasena hāsabhāvaṃ, pavattiākāravasena javanabhāvaṃ, kiccavasena tikkhādibhāvañca dassetuṃ, ‘‘katamā hāsapaññā’’tiādi vuttaṃ. Tattha hāsabahuloti pītibahulo. Sesapadāni tasseva vevacanāni. Sīlaṃ paripūretīti haṭṭhapahaṭṭho udaggudaggo hutvā pītisahagatāya paññāya. Pītisomanassasahagatā hi paññā abhirativasena ārammaṇe phullā vikasitā viya pavattati; na upekkhāsahagatāti pātimokkhasīlaṃ ṭhapetvā hāsanīyaṃ paraṃ tividhampi sīlaṃ paripūretīti attho. Visuṃ vuttattā puna sīlakkhandhamāha. Samādhikkhandhantiādīsupi eseva nayo."
NULL,p194,198,100,bodytext,,"Rūpaṃaniccato khippaṃ javatīti rūpakkhandhaṃ aniccanti sīghaṃ vegena pavattiyā paṭipakkhadūrībhāvena pubbābhisaṅkhārassa sātisayattā indena vissaṭṭhavajiraṃ viya lakkhaṇaṃ paṭivijjhantī adandhāyantī rūpakkhandhe aniccalakkhaṇaṃ vegasā paṭivijjhati, tasmā sā javanapaññā nāmāti attho. Sesapadesupi eseva nayo. Evaṃ lakkhaṇārammaṇikavipassanāvasena javanapaññaṃ dassetvā balavavipassanāvasena dassetuṃ, ‘‘rūpa’’ntiādi vuttaṃ. Tattha khayaṭṭhenāti yattha yattha uppajjati, tattha tattheva bhijjanato khayasabhāvattā. Bhayaṭṭhenāti bhayānakabhāvato. Asārakaṭṭhenāti attasāravirahato niccasārādivirahato ca. Tulayitvāti tulābhūtāya vipassanāpaññāya tuletvā. Tīrayitvāti tāya eva tīraṇabhūtāya tīretvā. Vibhāvayitvāti yāthāvato pakāsetvā pañcakkhandhaṃ vibhūtaṃ katvā. Rūpanirodheti rūpakkhandhassa nirodhabhūte nibbāne ninnapoṇapabbhāravasena. Idāni sikhāppattavipassanāvasena javanapaññaṃ dassetuṃ, puna ‘‘rūpa’’ntiādi vuttaṃ. Vuṭṭhānagāminivipassanāvasenāti keci."
NULL,p194,199,100,bodytext,,"Ñāṇassa tikkhabhāvo nāma savisesaṃ paṭipakkhasamucchindanena veditabboti, ‘‘khippaṃ kilese chindatīti tikkhapaññā’’ti vatvā te pana kilese vibhāgena dassento, ‘‘uppannaṃ kāmavitakka’’ntiādimāha. Tikkhapañño hi khippābhiñño hoti, paṭipadā cassa na calatīti āha – ‘‘ekasmiṃ āsane cattāro ariyamaggā adhigatā hontī’’tiādi."
NULL,p194,200,100,bodytext,,"‘‘Sabbe saṅkhārā aniccā dukkhā vipariṇāmadhammā saṅkhatā paṭiccasamuppannā khayadhammā vayadhammā nirodhadhammā’’ti yāthāvato dassanena saccasampaṭivedho ijjhati, na aññathāti kāraṇamukhena nibbedhikapaññaṃ dassetuṃ, ‘‘sabbasaṅkhāresuubbegabahulo hotī’’tiādi vuttaṃ. Tattha ubbegabahuloti vuttanayena sabbasaṅkhāresu abhiṇhaṃ pavattasaṃvego. Uttāsabahuloti ñāṇutrāsavasena sabbasaṅkhāresu bahuso utrastamānaso. Tena ādīnavānupassanamāha. Ukkaṇṭhanabahuloti pana iminā nibbidānupassanaṃ āha – aratibahulotiādinā tassā eva aparāparuppattiṃ. Bahimukhoti sabbasaṅkhārato bahibhūtaṃ nibbānaṃ uddissa pavattañāṇamukho, tathā vā pavattitavimokkhamukho. Nibbijjhanaṃ nibbedho, so etissā atthi, nibbijjhatīti vā nibbedhā, sāva paññā nibbedhikā. Yaṃ panettha atthato avibhattaṃ, taṃ heṭṭhā vuttanayattā suviññeyyameva."
NULL,p194,201,100,bodytext,,"Pajjati etena vipassanādikoti padaṃ, samāpatti, tasmā anupadanti anusamāpattiyoti attho. Padaṃ vā sammasanupagā dhammā vipassanāya pavattiṭṭhānabhāvato. Tenāha ‘‘samāpattivasena vā’’ti. Jhānaṅgavasena vāti jhānaṅgavasenāti ca attho. Aṭṭhakathāyaṃ pana kamattho idha padasaddo, tasmā anupadaṃ anukkamenāti ayamettha atthoti āha ‘‘anupaṭipāṭiyā’’ti. Dhammavipassananti taṃtaṃsamāpatticittuppādapariyāpannānaṃ dhammānaṃ vipassanaṃ. Vipassatīti samāpattiyo jhānamukhena te te dhamme yāthāvato pariggahetvā, ‘‘itipi dukkhā’’tiādinā sammasati. Addhamāsena arahattaṃ patto ukkaṃsagatassa sāvakānaṃ sammasanacārassa nippadesena pavattiyamānattā, sāvakapāramīñāṇassa ca tathā paṭipādetabbattā. Evaṃ santepīti yadipi mahāmoggallānatthero na cirasseva arahattaṃ patto; dhammasenāpati pana tato cirena, evaṃ santepi yasmā moggallānattheropi mahāpaññova, tasmā sāriputtattherova mahāpaññataroti. Idāni tamatthaṃ pākaṭataraṃ kātuṃ, ‘‘mahāmoggallānatthero hī’’tiādi vuttaṃ. Sammasanaṃ carati etthāti sammasanacāro, vipassanābhūmi, taṃ sammasanacāraṃ. Ekadesamevāti sakaattabhāve saṅkhāre anavasesato pariggahetuñca sammasituñca asakkontaṃ attano abhinīhārasamudāgatañāṇabalānurūpaṃ ekadesameva pariggahetvā sammasanto. Nanu ca ‘‘sabbaṃ, bhikkhave, anabhijānaṃ aparijānaṃ avirājayaṃ appajahaṃ abhabbo dukkhakkhayāyā’’ti (saṃ. ni. 4.26) vacanato vaṭṭadukkhato muccitukāmena sabbaṃ pariññeyyaṃ parijānitabbameva? Saccametaṃ, tañca kho sammasanupagadhammavasena vuttaṃ. Tasmā sasantānagate sabbadhamme, parasantānagate ca tesaṃ santānavibhāgaṃ akatvā bahiddhābhāvasāmaññato sammasanaṃ, ayaṃ sāvakānaṃ sammasanacāro. Thero pana bahiddhādhammepi santānavibhāgena keci keci uddharitvā sammasi, tañca kho ñāṇena phuṭṭhamattaṃ katvā. Tena vuttaṃ – ‘‘yaṭṭhikoṭiyā uppīḷento viya ekadesameva sammasanto’’ti. Tattha ñāṇena nāma yāvatā neyyaṃ pavattitabbaṃ, tathā apavattanato ‘‘yaṭṭhikoṭiyā uppīḷento viyā’’tiādi vuttaṃ. Anupadadhammavipassanāya abhāvato ‘‘ekadesameva sammasanto’’ti vuttaṃ."
NULL,p194,202,100,bodytext,,"Buddhānaṃ sammasanacāro dasasahassilokadhātuyaṃ sattasantānagatā, anindriyabaddhā ca saṅkhārāti vadanti, koṭisatasahassacakkavāḷesūti apare. Tathā hi addhattayavasena paṭiccasamuppādanayaṃ osaritvā chattiṃsakoṭisatasahassamukhena buddhānaṃ mahāvajirañāṇaṃ pavattaṃ. Paccekabuddhānaṃ sasantānagatehi saddhiṃ majjhimadesavāsisattasantānagatā anindriyabaddhā ca sammasanacāroti vadanti, jambudīpavāsisattasantānagatāti keci. Dhammasenāpatinopi yathāvuttasāvakānaṃ vipassanābhūmiyeva sammasanacāro. Tattha pana thero sātisayaṃ niravasesaṃ anupadadhammaṃ vipassi. Tena vuttaṃ – ‘‘sāvakānaṃ sammasanacāraṃ nippadesaṃ sammasī’’ti."
NULL,p194,203,100,bodytext,,"Tattha ‘‘sāvakānaṃ vipassanābhūmī’’ti ettha sukkhavipassakā lokiyābhiññappattā pakatisāvakā  aggasāvakā paccekabuddhā sammāsambuddhāti chasu janesu sukkhavipassakānaṃ jhānābhiññāhi anadhigatapaññānepuññattā andhānaṃ viya icchitapadesokkamanaṃ vipassanākāle icchikicchitadhammavipassanā natthi. Te yathāpariggahitadhammamatteyeva ṭhatvā vipassanaṃ vaḍḍhenti. Lokiyābhiññappattā pana pakatisāvakā yena mukhena vipassanaṃ ārabhanti; tato aññena vipassanaṃ vitthārikaṃ kātuṃ sakkonti vipulañāṇattā. Mahāsāvakā abhinīhārasampannattā tato sātisayaṃ vipassanaṃ vitthārikaṃ kātuṃ sakkonti. Aggasāvakesu dutiyo abhinīhārasampattiyā samādhānassa sātisayattā vipassanaṃ tatopi vitthārikaṃ karoti. Paṭhamo pana tato mahāpaññatāya sāvakehi asādhāraṇaṃ vitthārikaṃ karoti. Paccekabuddho tehipi mahābhinīhāratāya attano abhinīhārānurūpaṃ tatopi vitthārikavipassanaṃ karonti. Buddhānaṃ, sammadeva, paripūritapaññāpāramipabhāvita-sabbaññutaññāṇādhigamanassa anurūpāyāti. Yathā  nāma katavālavedhaparicayena sarabhaṅgasadisena dhanuggahena khitto saro antarā rukkhalatādīsu asajjamāno lakkhaṇeyeva patati; na sajjati na virajjhati, evaṃ antarā asajjamānā avirajjhamānā vipassanā sammasanīyadhammesu yāthāvato nānānayehi pavattati. Yaṃ mahāñāṇanti vuccati, tassa pavattiākārabhedo gaṇato vuttoyeva."
NULL,p194,204,100,bodytext,,"Etesu ca sukkhavipassakānaṃ vipassanācāro khajjotapabhāsadiso, abhiññappattapakatisāvakānaṃ dīpapabhāsadiso, mahāsāvakānaṃ okkāpabhāsadiso, aggasāvakānaṃ osadhitārakāpabhāsadiso, paccekabuddhānaṃ candapabhāsadiso, sammāsambuddhānaṃ rasmisahassapaṭimaṇḍitasaradasūriyamaṇḍalasadiso upaṭṭhāsi. Tathā sukkhavipassakānaṃ vipassanācāro andhānaṃ yaṭṭhikoṭiyā gamanasadiso, lokiyābhiññappattapakatisāvakānaṃ daṇḍakasetugamanasadiso, mahāsāvakānaṃ jaṅghasetugamanasadiso, aggasāvakānaṃ sakaṭasetugamanasadiso, paccekabuddhānaṃ mahājaṅghamaggagamanasadiso, sammāsambuddhānaṃ mahāsakamaggagamanasadisoti veditabbo."
NULL,p194,205,100,bodytext,,"Arahattañca kira patvāti ettha kira-saddo anussavaladdhoyamatthoti dīpetuṃ vutto. Patvā aññāsi attano vipassanācārassa mahāvisayattā tikkhavisadasūrabhāvassa ca sallakkhaṇena. Kathaṃ panāyaṃ mahāthero dandhaṃ arahattaṃ pāpuṇanto sīghaṃ arahattaṃ pattato paññāya attānaṃ sātisayaṃ katvā aññāsīti āha – ‘‘yathā hī’’tiādi. Mahājaṭanti mahājālasākhaṃ ativiya sibbitajālaṃ. Yaṭṭhiṃ pana sāraṃ vā ujuṃ vā na labhati veṇuggahaṇe anuccinitvā veṇussa gahitattā. Evaṃsampadanti yathā tesu purisesu eko veḷuggahaṇe anuccinitvā veḷuyaṭṭhiṃ gaṇhāti, eko uccinitvā, evaṃ nipphattikaṃ. Padhānanti bhāvanānuyuñjanaṃ."
NULL,p194,206,100,bodytext,,"Sattasaṭṭhiñāṇānīti paṭisambhidāmagge (paṭi. ma. 1.73 mātikā) āgatesu tesattatiyā ñāṇesu ṭhapetvā cha asādhāraṇañāṇāni sutamayañāṇādīni paṭibhānapaṭisambhidāñāṇapariyosānāni sattasaṭṭhi ñāṇāni. Tāni hi sāvakehi pavicitabbāni, na itarāni. Soḷasavidhaṃ paññanti (saṃ. ni. aṭṭha. 3.5.379; saṃ. ni. ṭī. 3.5.379) mahāpaññādikā, navānupubbavihārasamāpattipaññāti idaṃ soḷasavidhaṃ paññaṃ."
NULL,p194,207,100,bodytext,,Tatrāti  tassa. Idaṃ hotīti idaṃ dāni vuccamānaṃ anupubbasammasanaṃ hoti. Vipassanākoṭṭhāsanti vitakkādisammasitabbadhammavibhāgena vibhattavipassanābhāgaṃ.
NULL,p194,208,100,bodytext,,"94. Paṭhame jhāneti upasilese bhummaṃ, tasmā ye paṭhame jhāne dhammāti ye paṭhamajjhānasaṃsaṭṭhā dhammāti attho. Antosamāpattiyanti ca samāpattisahagate cittuppāde samāpattisamaññaṃ āropetvā vuttaṃ. Vavatthitāti katavavatthanā nicchitā. Paricchinnāti ñāṇena paricchinnā salakkhaṇato paricchijja ñātā. Olokentoti ñāṇacakkhunā paccakkhato passanto. Abhiniropanaṃ ārammaṇe cittassa āropanaṃ. Anumajjanaṃ ārammaṇe cittassa anuvicāraṇaṃ. Pharaṇaṃ paṇītarūpehi kāyassa byāpanaṃ, vipphārikabhāvo vā. Sātanti sātamadhuratā. Adhikkhepo vikkhepassa paṭipakkhabhūtaṃ samādhānaṃ. Phusanaṃ indriyavisayaviññāṇassa tato uppajjitvā ārammaṇe phusanākārena viya pavatti. Vedayitaṃ ārammaṇānubhavanaṃ. Sañjānanaṃ nīlādivasena ārammaṇassa sallakkhaṇaṃ. Cetayitaṃ cetaso byāpāro. Vijānanaṃ ārammaṇūpaladdhi. Kattukamyatā cittassa ārammaṇena atthikatā. Tasmiṃ ārammaṇe adhimuccanaṃ, sanniṭṭhānaṃ vā adhimokkho. Kosajjapakkhe patituṃ adatvā cittassa paggaṇhanaṃ paggāho, adhiggahoti attho. Ārammaṇaṃ upagantvā ṭhānaṃ, anissajjanaṃ vā upaṭṭhānaṃ. Samappavattesu assesu sārathi viya sakiccapasutesu sampayuttesu ajjhupekkhanaṃ majjhattatā. Sampayuttadhammānaṃ ārammaṇe anunayanaṃ saṃcaraṇaṃ anunayo. Sabhāvatoti yathābhūtasabhāvato. Soḷasannaṃ eva cettha dhammānaṃ gahaṇaṃ tesaṃyeva therena vavatthāpitabhāvato, te evassa tadā upaṭṭhahiṃsu, na itareti vadanti. Vīriyasatiggahaṇena cettha indriyabhāvasāmaññato saddhāpaññā; satiggahaṇeneva ekantānavajjabhāvasāmaññato passaddhiādayo cha yugaḷā; alobhādosā ca saṅgahitā jhānacittuppādapariyāpannattā tesaṃ dhammānaṃ. Therena ca dhammā vavatthānasāmaññato āraddhā. Te na upaṭṭhahiṃsūti na sakkā vattunti apare."
NULL,p194,209,100,bodytext,,"Viditā uppajjantīti uppādepi nesaṃ vedanānaṃ pajānanaṃ hotiyevāti attho. Sesapadadvayepi  eseva nayo. Taṃ jānātīti taṃñāṇo, tassa  bhāvo taṃñāṇatā, ñāṇassa attasaṃvedananti attho. Taṃsamānayogakkhamāhi sampayuttadhammā. Ñāṇabahutāti ñāṇassa bahubhāvo, ekacittuppāde anekañāṇatāti attho. Idāni tamevatthaṃ vivarituṃ, ‘‘yathā hī’’tiādi vuttaṃ. Na sakkā jānituṃ ārammaṇakaraṇassa abhāvato. Asammohāvabodho ca īdisassa ñāṇassa natthi. Ekekameva ñāṇaṃ uppajjati tasmiṃ khaṇe ekasseva āvajjanassa uppajjanato, na ca āvajjanena vinā cittuppatti atthi. Vuttañhetaṃ –"
NULL,p194,210,100,gatha1,,"‘‘Cullāsītisahassāni, kappā tiṭṭhanti ye marū;"
NULL,p194,211,100,gathalast,,"Na tveva tepi jīvanti, dvīhi cittehi saṃyutā’’ti. (mahāni. 10, 39) ca,"
NULL,p194,212,100,indent,,‘‘Natthi citte yugā gahī’’ti ca –
