id,book,par_num,level,class,title,text
NULL,p119,404,100,bodytext,,"‘‘Kalyāṇamitto  daḷhabhatti ca hotī’’ti ettāvatā hi buddhasāvako vutto. Kataññutādīhi paccekabuddhā buddhāti, yo imesaṃ ariyānaṃ adassanasīlo, na ca dassane sādhukārī, so ariyānaṃ adassāvīti veditabbo. So cakkhunā adassāvī, ñāṇena adassāvīti duvidho, tesu ñāṇena adassāvī idha adhippeto. Maṃsacakkhunā hi dibbacakkhunā vā ariyā diṭṭhāpi adiṭṭhāva honti tesaṃ cakkhunā vaṇṇamattagahaṇato, na ariyabhāvagocarato. Soṇasiṅgālādayopi cakkhunā ariye passanti, na ca te ariyānaṃ dassāvino."
NULL,p119,405,100,bodytext,,"Tatridaṃ  vatthu – cittalapabbatavāsino kira khīṇāsavattherassa upaṭṭhāko vuḍḍhapabbajito ekadivasaṃ  therena saddhiṃ piṇḍāya caritvā therassa pattacīvaraṃ gahetvā piṭṭhito āgacchanto theraṃ pucchi – ‘‘ariyā nāma, bhante, kīdisā’’ti? Thero āha – ‘‘idhekacco mahallako ariyānaṃ pattacīvaraṃ gahetvā vattapaṭipattiṃ katvā saha carantopi neva ariye jānāti, evaṃ dujjānā, āvuso, ariyā’’ti. Evaṃ vuttepi so neva aññāsi. Tasmā cakkhunā dassanaṃ na dassanaṃ, ñāṇena dassanameva dassanaṃ. Yathāha – ‘‘alaṃ te, vakkali, kiṃ te iminā pūtikāyena diṭṭhena, yo kho, vakkali, dhammaṃ passati, so maṃ passatī’’ti (saṃ. ni. 3.87). Tasmā cakkhunā passantopi ñāṇena ariyehi diṭṭhaṃ aniccādilakkhaṇaṃ apassanto, ariyānaṃ adhigatañca dhammaṃ anadhigacchanto, ariyakaradhammānaṃ ariyabhāvassa ca adiṭṭhattā ‘‘ariyānaṃ adassāvī’’ti veditabbo."
NULL,p119,406,100,bodytext,,"Ariyadhammassa akovidoti satipaṭṭhānādibhede ariyadhamme akusalo. Ariyadhamme avinītoti ettha pana –"
NULL,p119,407,100,gatha1,,"Duvidho vinayo nāma, ekamekettha pañcadhā;"
NULL,p119,408,100,gathalast,,"Abhāvato tassa ayaṃ, ‘‘avinīto’’ti vuccati. (ma. ni. aṭṭha. 1.2; su. ni. aṭṭha. 1.uragasuttavaṇṇanā; paṭi. ma. aṭṭha. 2.1.130; dha. sa. aṭṭha. 1007);"
NULL,p119,409,100,bodytext,,"Ayañhi  saṃvaravinayo pahānavinayoti duvidho vinayo. Ettha ca duvidhepi vinaye ekamekopi vinayo pañcadhā bhijjati. Saṃvaravinayopi hi sīlasaṃvaro satisaṃvaro ñāṇasaṃvaro khantisaṃvaro vīriyasaṃvaroti pañcavidho. Pahānavinayopi tadaṅgappahānaṃ vikkhambhanappahānaṃ samucchedappahānaṃ paṭippassaddhippahānaṃ nissaraṇappahānanti pañcavidho."
NULL,p119,410,100,bodytext,,"Tattha ‘‘iminā pātimokkhasaṃvarena upeto hoti samupeto’’ti (vibha. 511) ayaṃ sīlasaṃvaro. ‘‘Rakkhati cakkhundriyaṃ, cakkhundriye saṃvaraṃ āpajjatī’’ti (ma. ni. 1.295; saṃ. ni. 4.239; a. ni. 3.16) ayaṃ satisaṃvaro."
NULL,p119,411,100,gatha1,,"‘‘Yāni  sotāni lokasmiṃ, (ajitāti bhagavā,)"
NULL,p119,412,100,gatha2,,"Sati tesaṃ nivāraṇaṃ;"
NULL,p119,413,100,gathalast,,"Sotānaṃ saṃvaraṃ brūmi, paññāyete pidhiyyare’’ti. (su. ni. 1041; cūḷani. ajitamāṇavapucchāniddesa 4; netti. 11, 45; dha. sa. aṭṭha. 1007) –"
NULL,p119,414,100,unindented,,"Ayaṃ ñāṇasaṃvaro. ‘‘Khamo hoti sītassa uṇhassā’’ti (ma. ni. 1.24; a. ni. 4.114; 6.58) ayaṃ khantisaṃvaro. ‘‘Uppannaṃ kāmavitakkaṃ nādhivāsetī’’ti (ma. ni. 1.26; a. ni. 4.114; 6.58) ayaṃ vīriyasaṃvaro. Sabbopi cāyaṃ saṃvaro yathāsakaṃ saṃvaritabbānaṃ vinetabbānañca kāyaduccaritādīnaṃ saṃvaraṇato ‘‘saṃvaro’’, vinayanato ‘‘vinayo’’ti vuccati. Evaṃ tāva saṃvaravinayo pañcadhā bhijjatīti veditabbo."
NULL,p119,415,100,bodytext,,"Tathā yaṃ nāmarūpaparicchedādīsu vipassanāñāṇesu paṭipakkhabhāvato dīpālokeneva tamassa, tena tena vipassanāñāṇena tassa tassa anatthassa pahānaṃ. Seyyathidaṃ – nāmarūpavavatthānena sakkāyadiṭṭhiyā, paccayapariggahena ahetuvisamahetudiṭṭhīnaṃ, tasseva aparabhāgena kaṅkhāvitaraṇena kathaṃkathībhāvassa, kalāpasammasanena ‘‘ahaṃ mamā’’ti gāhassa, maggāmaggavavatthānena amagge maggasaññāya, udayadassanena ucchedadiṭṭhiyā, vayadassanena sassatadiṭṭhiyā, bhayadassanena sabhaye abhayasaññāya, ādīnavadassanena assādasaññāya, nibbidānupassanāya abhiratisaññāya, muñcitukamyatāñāṇena amuñcitukāmatāya, upekkhāñāṇena anupekkhāya, anulomena dhammaṭṭhitiyaṃ nibbāne ca paṭilomabhāvassa, gotrabhunā saṅkhāranimittaggāhassa pahānaṃ. Etaṃ tadaṅgappahānaṃ nāma."
NULL,p119,416,100,bodytext,,"Yaṃ pana upacārappanābhedena samādhinā pavattibhāvanivāraṇato ghaṭappahāreneva udakapiṭṭhe sevālassa tesaṃ tesaṃ nīvaraṇādidhammānaṃ pahānaṃ, etaṃ vikkhambhanappahānaṃ nāma. Yaṃ catunnaṃ ariyamaggānaṃ bhāvitattā taṃtaṃmaggavato attano attano santāne ‘‘diṭṭhigatānaṃ pahānāyā’’tiādinā (dha. sa. 277; vibha. 628) nayena vuttassa samudayapakkhiyassa kilesagaṇassa accantaappavattibhāvena pahānaṃ, idaṃ samucchedappahānaṃ nāma. Yaṃ pana phalakkhaṇe paṭippassaddhattaṃ kilesānaṃ, etaṃ paṭippassaddhippahānaṃ nāma. Yaṃ sabbasaṅkhatanissaṭattā  pahīnasabbasaṅkhataṃ nibbānaṃ, etaṃ nissaraṇappahānaṃ nāma. Sabbampi cetaṃ pahānaṃ yasmā cāgaṭṭhena pahānaṃ, vinayanaṭṭhena vinayo, tasmā ‘‘pahānavinayo’’ti vuccati. Taṃ taṃ pahānavato vā tassa tassa vinayassa sambhavatopetaṃ ‘‘pahānavinayo’’ti vuccati. Evaṃ pahānavinayopi pañcadhā bhijjatīti veditabbo (ma. ni. aṭṭha. 1.2; su. ni. aṭṭha. 1.uragasuttavaṇṇanā; paṭi. ma. aṭṭha. 2.1.130)."
NULL,p119,417,100,bodytext,,"Evamayaṃ  saṅkhepato duvidho bhedato ca dasavidho vinayo bhinnasaṃvarattā, pahātabbassa ca appahīnattā yasmā etassa assutavato puthujjanassa natthi, tasmā abhāvato tassa ayaṃ ‘‘avinīto’’ti vuccatīti. Eseva nayo sappurisānaṃ adassāvī sappurisadhammassa akovido, sappurisadhamme avinītoti etthapi. Ninnānākaraṇañhi etamatthato. Yathāha – ‘‘yeva te ariyā, teva te sappurisā. Yeva te sappurisā, teva te ariyā. Yo eva so ariyānaṃ dhammo, so eva so sappurisānaṃ dhammo. Yo eva so sappurisānaṃ dhammo, so eva so ariyānaṃ dhammo. Yeva te ariyavinayā, teva te sappurisavinayā. Yeva te sappurisavinayā, teva te ariyavinayā. Ariyeti vā, sappuriseti vā, ariyadhammeti  vā, sappurisadhammeti vā, ariyavinayeti vā, sappurisavinayeti vā esese eke ekaṭṭhe same samabhāge tajjāte taññevāti (dha. sa. aṭṭha. 1007; paṭi. ma. aṭṭha. 2.1.130)."
NULL,p119,418,100,bodytext,,"Rūpaṃ attato samanupassatīti idhekacco rūpaṃ attato samanupassati, ‘‘yaṃ rūpaṃ, so ahaṃ, yo ahaṃ, taṃ rūpa’’nti rūpañca attānañca advayaṃ samanupassati. Seyyathāpi telappadīpassa jhāyato ‘‘yā acci, so vaṇṇo. Yo vaṇṇo, sā accī’’ti acciñca vaṇṇañca advayaṃ samanupassati, evameva idhekacco rūpaṃ attato…pe… samanupassatīti (paṭi. ma. 1.130-131) evaṃ rūpaṃ ‘‘attā’’ti diṭṭhipassanāya passati. Rūpavantaṃ vā attānanti arūpaṃ ‘‘attā’’ti gahetvā chāyāvantaṃ rukkhaṃ viya taṃ rūpavantaṃ ‘‘attā’’ti samanupassati. Attani vā rūpanti arūpameva ‘‘attā’’ti gahetvā pupphasmiṃ gandhaṃ viya attani rūpaṃ samanupassati. Rūpasmiṃ vā attānanti arūpameva ‘‘attā’’ti gahetvā karaṇḍake maṇiṃ viya taṃ attānaṃ rūpasmiṃ samanupassati. Vedanādīsupi eseva nayo."
NULL,p119,419,100,bodytext,,"Tattha  ‘‘rūpaṃ attato samanupassatī’’ti suddharūpaṃyeva ‘‘attā’’ti kathitaṃ. ‘‘Rūpavantaṃ vā attānaṃ, attani vā rūpaṃ, rūpasmiṃ vā attānaṃ. Vedanaṃ attato… saññaṃ… saṅkhāre… viññāṇaṃ attato samanupassatī’’ti (paṭi. ma. 1.131) imesu sattasu ṭhānesu arūpaṃ ‘‘attā’’ti kathitaṃ, ‘‘vedanāvantaṃ vā attānaṃ, attani vā vedanā, vedanāya vā attāna’’nti evaṃ catūsu khandhesu tiṇṇaṃ tiṇṇaṃ vasena dvādasasu ṭhānesu rūpārūpamissako attā kathito. Tattha rūpaṃ attato samanupassati. Vedanaṃ… saññaṃ… saṅkhāre… viññāṇaṃ attato samanupassatīti pañcasu ṭhānesu ucchedadiṭṭhi kathitā. Avasesesu sassatadiṭṭhi. Evamettha pannarasa bhavadiṭṭhiyo pañca vibhavadiṭṭhiyo honti. Tā sabbāpi maggāvaraṇā, na saggāvaraṇā, paṭhamamaggavajjhāti veditabbā."
NULL,p119,420,100,bodytext,,"Āraññikoti  araññe nivāsaṃ. Pavaneti mahante gambhīravane. Caramānoti tahiṃ tahiṃ vicaramāno. Vissattho gacchatīti nibbhayo nirāsaṅko carati. Anāpāthagato luddassāti  migaluddassa parammukhagato. Antamakāsi māranti kilesamāraṃ vā devaputtamāraṃ vā antaṃ akāsi. Apadaṃ vadhitvāti kilesapadaṃ hantvā nāsetvā. Māracakkhuṃ adassanaṃ gatoti mārassa adassanavisayaṃ patto. Anāpāthagatoti mārassa parammukhaṃ patto. Sesaṃ sabbattha pākaṭameva."
NULL,p119,421,100,bodytext,,"Evaṃ bhagavā idampi suttaṃ arahattanikūṭeneva desesi, desanāpariyosāne ca vuttasadisoyeva dhammābhisamayo ahosīti."
NULL,p119,422,100,centered,,"Saddhammappajjotikāya cūḷaniddesa-aṭṭhakathāya"
NULL,p119,423,100,centered,,"Mogharājamāṇavasuttaniddesavaṇṇanā niṭṭhitā."
NULL,p119,424,4,subhead,"16. Piṅgiyamāṇavasuttaniddesavaṇṇanā","16. Piṅgiyamāṇavasuttaniddesavaṇṇanā"
NULL,p119,425,100,bodytext,,"89. Soḷasame  piṅgiyasuttaniddese – jiṇṇohamasmi abalo vītavaṇṇoti so kira brāhmaṇo jarābhibhūto vīsavassasatiko jātiyā, dubbalo ca ‘‘idha pādaṃ karissāmī’’ti aññatreva karoti, vinaṭṭhapurimachavivaṇṇo ca. Tenāha – ‘‘jiṇṇohamasmi abalo vītavaṇṇo’’ti. Māhaṃnassaṃ momuho antarāvāti māhaṃ tuyhaṃ dhammaṃ asacchikatvā antarā eva avidvā hutvā anassiṃ. Jātijarāya idha vippahānanti idheva tava pādamūle pāsāṇake cetiye vā jātijarāya vippahānaṃ nibbānaṃ dhammarasaṃ ahaṃ vijaññaṃ, taṃ me ācikkha."
NULL,p119,426,100,bodytext,,"Abaloti balavirahito. Dubbaloti dubbalabalo. Appabaloti parittabalo. Appathāmoti parittavīriyo. Vītavaṇṇoti parivattitachavivaṇṇo. Vigatavaṇṇoti apagatachavivaṇṇo. Vigacchitavaṇṇoti dūrībhūtachavivaṇṇo. Yā sā purimā subhā vaṇṇanibhāti yā sā subhā sundarā purimakāle sati, sā vaṇṇanibhā etarahi antarahitā vigatā. Ādīnavo pātubhūtoti upaddavo pāturahosi. ‘‘Yā sā purimā subhā vaṇṇanibhā’’ti pāṭhaṃ ṭhapetvā ‘‘yā subhā assā’’ti eke vaṇṇayanti."
NULL,p119,427,100,bodytext,,"Asuddhāti paṭalādīhi asuddhā. Avisuddhāti timirādīhi avisuddhā. Aparisuddhāti samantato phoṭapaṭalādīhi pariyonaddhattā aparisuddhā. Avodātāti nappasannā pasannasadisā. No tathā cakkhunā rūpe passāmīti yathā porāṇacakkhunā rūpārammaṇaṃ passāmi olokemi, tathā  tena pakārena idāni na passāmi. Sotaṃ asuddhantiādīsupi eseva nayo. Māhaṃ nassanti ahaṃ mā vinassaṃ."
NULL,p119,428,100,bodytext,,"90. Idāni yasmā piṅgiyo kāye sāpekkhatāya ‘‘jiṇṇohamasmī’’tiādimāha. Tenassa bhagavā kāye sinehappahānatthaṃ ‘‘disvāna rūpesu vihaññamāne’’ti gāthamāha. Tattha rūpesūti rūpahetu rūpapaccayā. Vihaññamāneti kammakāraṇādīhi upahaññamāne. Ruppanti rūpesūti cakkhurogādīhi ca rūpahetuyeva janā ruppanti bādhiyanti."
NULL,p119,429,100,bodytext,,"Haññantīti ghaṭīyanti. Vihaññantīti vihesiyanti. Upavihaññantīti hatthapādacchedādiṃ labhanti. Upaghātiyantīti maraṇaṃ labhanti. Kuppantīti parivattanti. Pīḷayantīti vighātaṃ āpajjanti. Ghaṭṭayantīti ghaṭṭanaṃ pāpuṇanti. Byādhitāti bhītā. Domanassitāti cittavighātaṃ pattā. Vemāneti nassamāne."
NULL,p119,430,100,bodytext,,"91. Evaṃ  bhagavatā yāva arahattaṃ, tāva kathitaṃ paṭipattiṃ sutvā piṅgiyo jarādubbalatāya visesaṃ anadhigantvā ca puna ‘‘disā catasso’’ti imāya gāthāya bhagavantaṃ thomento desanaṃ yācati."
NULL,p119,431,100,bodytext,,"92. Athassa bhagavā punapi yāva arahattaṃ, tāva paṭipadaṃ dassento ‘‘taṇhādhipanne’’ti gāthamāha."
NULL,p119,432,100,bodytext,,"Taṇhādhipanneti taṇhāya vimuccitvā ṭhite. Taṇhānugeti taṇhāya saha gacchante. Taṇhānugateti taṇhāya anubandhante. Taṇhānusaṭeti taṇhāya saha dhāvante. Taṇhāya panneti taṇhāya nimugge. Paṭipanneti taṇhāya avatthaṭe. Abhibhūteti maddite. Pariyādinnacitteti pariyādiyitvā gahitakusalacitte."
NULL,p119,433,100,bodytext,,"Santāpajāteti sañjātacittasantāpe. Ītijāteti roguppanne. Upaddavajāteti ādīnavajāte. Upasaggajāteti uppannadukkhajāte."
NULL,p119,434,100,bodytext,,"Virajaṃ vītamalanti ettha virajanti vigatarāgādirajaṃ. Vītamalanti vītarāgādimalaṃ. Rāgādayo hi ajjhottharaṇaṭṭhena rajo nāma, dūsaṭṭhena malaṃ nāma. Dhammacakkhunti katthaci paṭhamamaggañāṇaṃ, katthaci ādīni tīṇi maggañāṇāni, katthaci catutthamaggañāṇampi. Idha pana jaṭilasahassassa catutthamaggañāṇaṃ. Piṅgiyassa tatiyamaggañāṇameva. Yaṃ kiñci samudayadhammaṃ, sabbaṃ taṃ nirodhadhammanti vipassanāvasena evaṃ pavattassa dhammacakkhuṃ udapādīti attho. Sesaṃ sabbattha pākaṭameva."
NULL,p119,435,100,bodytext,,"Evaṃ  idampi suttaṃ bhagavā arahattanikūṭeneva desesi, desanāpariyosāne ca piṅgiyo anāgāmiphale patiṭṭhāsi. So kira antarantarā cintesi – ‘‘evaṃ vicitrapaṭibhānaṃ nāma desanaṃ na labhati mayhaṃ mātulo bāvarī savanāyā’’ti. Tena sinehavikkhepena arahattaṃ pāpuṇituṃ nāsakkhi. Antevāsikā panassa sahassajaṭilā arahattaṃ pāpuṇiṃsu. Sabbeva iddhimayapattacīvaradharā ehibhikkhuno ahesunti."
NULL,p119,436,100,centered,,"Saddhammappajjotikāya cūḷaniddesa-aṭṭhakathāya"
NULL,p119,437,100,centered,,"Piṅgiyamāṇavasuttaniddesavaṇṇanā niṭṭhitā."
NULL,p119,438,4,subhead,"17. Pārāyanatthutigāthāniddesavaṇṇanā","17. Pārāyanatthutigāthāniddesavaṇṇanā"
NULL,p119,439,100,bodytext,,"93. Ito  paraṃ saṅgītikārā desanaṃ thomentā ‘‘idamavoca bhagavā’’tiādimāhaṃsu. Tattha idamavocāti idaṃ pārāyanaṃ avoca. Paricārakasoḷasānanti bāvarissa paricārakena piṅgiyena saha soḷasānaṃ, buddhassa vā bhagavato paricārakānaṃ soḷasānanti paricārakasoḷasānaṃ. Te eva ca brāhmaṇā tattha soḷasasu disāsu purato ca pacchato ca vāmapassato ca dakkhiṇapassato ca cha cha yojanā nisinnā ujukena dvādasayojanikā ahosi. Ajjhiṭṭhoti yācito."
NULL,p119,440,100,bodytext,,"94-97. Atthamaññāyāti pāḷiatthamaññāya. Dhammamaññāyāti pāḷimaññāya. Pārāyananti evaṃ imassa dhammapariyāyassa adhivacanaṃ āropetvā tesaṃ brāhmaṇānaṃ nāmāni kittayanto ‘‘ajito…pe… buddhaseṭṭhamupāgamu’’nti āhaṃsu. Tattha sampannacaraṇanti nibbānapadaṭṭhānabhūtena pātimokkhasīlādinā sampannaṃ. Isinti mahesiṃ."
NULL,p119,441,100,bodytext,,"Niddese upāgamiṃsūti samīpaṃ gamiṃsu. Upasaṅkamiṃsūti avidūraṭṭhānaṃ gamiṃsu. Payirupāsiṃsūti  samīpe nisīdiṃsu. Paripucchiṃsūti paripucchaṃ āhariṃsu. Parigaṇhiṃsūti tulayiṃsu. ‘‘Codayiṃsū’’ti keci."
NULL,p119,442,100,bodytext,,"Sīlācāranibbattīti uttamasīlācāranibbatti, maggena nipphannasīlanti attho."
NULL,p119,443,100,bodytext,,"Gambhīreti uttānabhāvapaṭikkhepavacanaṃ. Duddaseti gambhīrattā duddase, dukkhena daṭṭhabbe, na sakkā sukhena daṭṭhuṃ. Duddasattāva duranubodhe, dukkhena avabujjhitabbe, na sakkā sukhena avabujjhituṃ. Santeti nibbute. Paṇīteti atappake. Idaṃ dvayaṃ lokuttarameva sandhāya vuttaṃ. Atakkāvacareti takkena na avacaritabbe  na ogāhitabbe ñāṇeneva avacaritabbe. Nipuṇeti saṇhe. Paṇḍitavedanīyeti sammā paṭipannehi paṇḍitehi veditabbe."
NULL,p119,444,100,bodytext,,"98. Tosesīti tuṭṭhiṃ āpādesi. Vitosesīti vividhā tesaṃ somanassaṃ uppādesi. Pasādesīti tesaṃ cittappasādaṃ akāsi. Ārādhesīti ārādhayi siddhiṃ pāpesi. Attamane akāsīti somanassavasena sakamane akāsi."
NULL,p119,445,100,bodytext,,"99. Tato paraṃ brahmacariyamacariṃsūti maggabrahmacariyaṃ acariṃsu."
NULL,p119,446,100,bodytext,,"101. Tasmā pārāyananti tassa pārabhūtassa nibbānassa āyatananti vuttaṃ hoti."
NULL,p119,447,100,centered,,"Saddhammappajjotikāya cūḷaniddesa-aṭṭhakathāya"
NULL,p119,448,100,centered,,"Pārāyanatthutigāthāniddesavaṇṇanā niṭṭhitā."
NULL,p119,449,4,subhead,"18. Pārāyanānugītigāthāniddesavaṇṇanā","18. Pārāyanānugītigāthāniddesavaṇṇanā"
NULL,p119,450,100,bodytext,,"102. Pārāyanamanugāyissanti assa ayaṃ sambandho – bhagavatā hi pārāyane desite soḷasasahassajaṭilā arahattaṃ pāpuṇiṃsu, avasesānañca cuddasakoṭisaṅkhānaṃ devamanussānaṃ dhammābhisamayo ahosi. Vuttañhetaṃ porāṇehi –"
NULL,p119,451,100,gatha1,,"‘‘Tato  pāsāṇake ramme, pārāyanasamāgame;"
NULL,p119,452,100,gathalast,,"Amataṃ pāpayī buddho, cuddasa pāṇakoṭiyo’’ti. (su. ni. aṭṭha. 2.1138);"
NULL,p119,453,100,bodytext,,"Niṭṭhitāya pana dhammadesanāya tato tato āgatā manussā bhagavato ānubhāvena attano attano gāmanigamādīsveva pāturahesuṃ. Bhagavāpi sāvatthimeva agamāsi paricārakasoḷasādīhi anekehi bhikkhusahassehi parivuto. Tattha piṅgiyo bhagavantaṃ vanditvā āha – ‘‘gacchāmahaṃ, bhante, bāvarissa buddhuppādaṃ ārocetuṃ, paṭissutañhi tasseva mayā’’ti. Atha bhagavatā anuññāto ñāṇagamaneneva godhāvarītīraṃ gantvā pādagamanena assamābhimukho agamāsi. Tamenaṃ bāvarī brāhmaṇo maggaṃ olokento nisinno dūratova taṃ khārijaṭādivirahitaṃ bhikkhuvesenāgacchantaṃ disvā ‘‘buddho loke uppanno’’ti niṭṭhamagamāsi. Sampattañcāpi naṃ pucchi – ‘‘kiṃ, piṅgiya, buddho loke uppanno’’ti? ‘‘Āma, brāhmaṇa, uppanno, pāsāṇake cetiye nisinno amhākaṃ dhammaṃ desesi, tamahaṃ tuyhaṃ desessāmī’’ti. Tato bāvarī mahatā  sakkārena  sapariso taṃ pūjetvā āsanaṃ paññāpesi. Tattha nisīditvā piṅgiyo ‘‘pārāyanamanugāyissa’’ntiādimāha."
NULL,p119,454,100,bodytext,,"Tattha anugāyissanti bhagavato gītaṃ anugāyissaṃ. Yathāddakkhīti yathā sāmaṃ saccābhisambodhena asādhāraṇañāṇena ca addakkhi. Nikkāmoti pahīnakāmo. ‘‘Nikkamo’’tipi pāṭho, vīriyavāti attho. Nikkhanto vā akusalapakkhā. Nibbanoti kilesavanavirahito, taṇhāvirahito eva vā. Kissa hetu musā bhaṇeti yehi kilesehi musā bhaṇeyya, ete tassa pahīnāti dasseti. Etena brāhmaṇassa savane ussāhaṃ janeti (su. ni. aṭṭha. 2.1138)."
NULL,p119,455,100,bodytext,,"Amaloti kilesamalavirahito. Vimaloti vigatakilesamalo. Nimmaloti kilesamalasuddho. Malāpagatoti kilesamalā dūrībhūto hutvā carati. Malavippahīnoti kilesamalappahīno. Malavimuttoti kilesehi vimutto. Sabbamalavītivattoti vāsanādisabbakilesamalaṃ atikkanto. Te vanāti ete vuttappakārā kilesā."
NULL,p119,456,100,bodytext,,"103. Vaṇṇūpasaṃhitanti guṇūpasaṃhitaṃ."
NULL,p119,457,100,bodytext,,"104. Saccavhayoti  buddho hi sacceneva avhānena nāmena yutto. Brahmeti taṃ brāhmaṇaṃ ālapati."
NULL,p119,458,100,bodytext,,"Tattha lokoti lujjanaṭṭhena loko. Eko loko bhavalokoti tebhūmakavipāko. So hi bhavatīti bhavo, bhavo eva loko bhavaloko. Bhavaloko ca sambhavaloko cāti ettha ekeko dve dve hoti. Bhavaloko hi sampattibhavavipattibhavavasena duvidho. Sambhavalokopi sampattisambhavavipattisambhavavasena duvidho. Tattha sampattibhavalokoti sugatiloko. So hi iṭṭhaphalattā sundaro lokoti sampatti, bhavatīti bhavo, sampatti eva bhavo sampattibhavo, so eva loko sampattibhavaloko. Sampattisambhavalokoti sugatūpagaṃ kammaṃ. Tañhi sambhavati  etasmā phalanti sambhavo, sampattiyā sambhavo sampattisambhavo, sampattisambhavo eva loko sampattisambhavalokoti."
NULL,p119,459,100,bodytext,,"Vipattibhavalokoti apāyaloko. So hi aniṭṭhaphalattā virūpo lokoti vipatti, bhavatīti bhavo, vipatti eva bhavo vipattibhavo, vipattibhavo eva loko  vipattibhavaloko. Vipattisambhavalokoti apāyūpagaṃ kammaṃ. Tañhi sambhavati etasmā phalanti sambhavo, vipattiyā sambhavo vipattisambhavo, vipattisambhavo eva loko vipattisambhavalokoti. Tisso vedanāti sukhā vedanā, dukkhā vedanā, adukkhamasukhā vedanā lokiyā eva. Āhārāti paccayā. Paccayā hi attano phalaṃ āharantīti āhārā. Kabaḷīkārāhāro phassāhāro manosañcetanāhāro viññāṇāhāroti cattāro. Vatthuvasena kabaḷīkattabbattā kabaḷīkāro, ajjhoharitabbattā āhāro, odanakummāsādivatthukāya ojāyetaṃ nāmaṃ. Sā hi ojaṭṭhamakarūpāni āharatīti āhāro. Cakkhusamphassādiko chabbidho phasso tisso vedanā āharatīti āhāro. Manaso sañcetanā na sattassāti manosañcetanā yathā cittekaggatā, manasā vā sampayuttā sañcetanā manosañcetanā yathā ājaññaratho, tebhūmakakusalākusalacetanā. Sā hi tayo bhave āharatīti āhāro. Viññāṇanti ekūnavīsatibhedaṃ paṭisandhiviññāṇaṃ. Tañhi paṭisandhināmarūpaṃ āharatīti āhāro."
NULL,p119,460,100,bodytext,,"Upādānakkhandhāti upādānagocarā khandhā upādānakkhandhā, majjhe padalopo daṭṭhabbo. Upādānasambhūtā vā khandhā upādānakkhandhā yathā tiṇaggi, thusaggi. Upādānavidheyyā vā khandhā upādānakkhandhā yathā rājapuriso. Upādānappabhavā vā khandhā upādānakkhandhā yathā puppharukkho, phalarukkho. Upādānāni pana kāmupādānaṃ diṭṭhupādānaṃ sīlabbatupādānaṃ attavādupādānanti  cattāri. Atthato pana bhusaṃ ādānanti upādānaṃ. Rūpupādānakkhandho, vedanupādānakkhandho, saññupādānakkhandho, saṅkhārupādānakkhandho, viññāṇupādānakkhandhoti pañca. Cha ajjhattikāni āyatanānīti cakkhāyatanaṃ, sotāyatanaṃ, ghānāyatanaṃ, jivhāyatanaṃ, kāyāyatanaṃ, manāyatanaṃ. Satta viññāṇaṭṭhitiyo vuttanayā eva. Tathā aṭṭhalokadhammā. Api ca – lābho, alābho, yaso, ayaso, nindā, pasaṃsā, sukhaṃ, dukkhanti ime aṭṭha lokappavattiyā sati anuparivattanadhammakattā  lokassa dhammāti lokadhammā. Etehi mutto satto nāma natthi, buddhānampi hontiyeva. Yathāha –"
NULL,p119,461,100,indent,,"‘‘Aṭṭhime, bhikkhave, lokadhammā lokaṃ anuparivattanti, loko ca aṭṭha lokadhamme anuparivattati. Katame aṭṭha? Lābho ca alābho ca…pe… sukhañca dukkhañca. Ime kho, bhikkhave, aṭṭha lokadhammā lokaṃ anuparivattanti, loko ca ime aṭṭha lokadhamme anuparivattatī’’ti (a. ni. 8.6)."
NULL,p119,462,100,bodytext,,"Tattha anuparivattantīti anubandhanti nappajahanti, lokato na nivattantīti attho. Lābhoti pabbajitassa cīvarādi, gahaṭṭhassa dhanadhaññādilābho. Soyeva alabbhamāno lābho alābho na lābho alābhoti vuccati, no ca attābhāvappattito pariññeyyo siyā. Yasoti parivāro. Soyeva alabbhamāno yaso ayaso. Nindāti avaṇṇabhaṇanaṃ. Pasaṃsāti vaṇṇabhaṇanaṃ. Sukhanti kāmāvacarakāyikacetasikaṃ. Dukkhanti puthujjanasotāpannasakadāgāmīnaṃ kāyikacetasikaṃ, anāgāmiarahantānaṃ kāyikameva. Sattāvāsāti sattānaṃ āvāsā, vasanaṭṭhānānīti attho. Tāni pana tathā pakāsitā khandhā eva. Sattasu viññāṇaṭṭhitīsu asaññasattena ca nevasaññānāsaññāyatanena ca saddhiṃ nava sattāvāsā. Dasāyatanānīti cakkhāyatanaṃ, rūpāyatanaṃ, sotāyatanaṃ, saddāyatanaṃ, ghānāyatanaṃ, gandhāyatanaṃ, jivhāyatanaṃ, rasāyatanaṃ, kāyāyatanaṃ, phoṭṭhabbāyatananti evaṃ dasa. Dvādasāyatanānīti manāyatanadhammāyatanehi saddhiṃ evaṃ dvādasa. Aṭṭhārasa dhātuyoti cakkhudhātu, rūpadhātu, cakkhuviññāṇadhātu…pe… manodhātu, dhammadhātu, manoviññāṇadhātūti ekekasmiṃ tīṇi tīṇi katvā aṭṭhārasa dhātuyo."
NULL,p119,463,100,bodytext,,"Sadisanāmoti tesaṃ sadisanāmo ekaguṇavaṇṇanāmo. Sadisavhayoti ekaguṇavaṇṇanāmena avhāyano. Saccasadisavhayoti avitathaekaguṇavaṇṇanāmena aviparītena avhāyano."
NULL,p119,464,100,bodytext,,"Āsitoti  upasaṅkamito. Upāsitoti upagantvā sevito. Payirupāsitoti bhattivasena atīva sevito."
NULL,p119,465,100,bodytext,,"105. Kubbanakanti  parittavanaṃ. Bahupphalaṃ kānanamāvaseyyāti anekaphalādivikatibharitakānanaṃ āgamma vaseyya. Appadasseti bāvarippabhutike parittapaññe. Mahodadhinti anotattādiṃ mahantaṃ udakarāsiṃ."
