id,book,par_num,level,class,title,text
NULL,p119,561,100,bodytext,,"123. Tatiye  mettāyanavasena mittā. Suhadabhāvena suhajjā. Keci hi ekantahitakāmatāya mittāva honti, na suhajjā. Keci gamanāgamanaṭṭhānanisajjāsamullāpādīsu hadayasukhajananena suhajjāva honti, na mittā. Keci tadubhayavasena suhajjā ceva mittā ca. Te duvidhā honti agāriyā ca anagāriyā ca. Tattha agāriyā tividhā honti upakārā samānasukhadukkhā anukampakāti. Anagāriyā visesena atthakkhāyino. Evaṃ te catūhi catūhi aṅgehi samannāgatā honti."
NULL,p119,562,100,bodytext,,"Yathāha –"
NULL,p119,563,100,indent,,"‘‘Catūhi kho, gahapatiputta, ṭhānehi upakāro mitto suhado veditabbo. Pamattaṃ rakkhati, pamattassa sāpateyyaṃ rakkhati, bhītassa saraṇaṃ hoti, uppannesu kiccakaraṇīyesu taddiguṇaṃ bhogaṃ anuppadeti (dī. ni. 3.261)."
NULL,p119,564,100,bodytext,,"Tathā –"
NULL,p119,565,100,indent,,"‘‘Catūhi kho, gahapatiputta, ṭhānehi samānasukhadukkho mitto suhado veditabbo. Guyhamassa ācikkhati, guyhamassa parigūhati, āpadāsu na vijahati, jīvitampissa atthāya pariccattaṃ hoti (dī. ni. 3.262)."
NULL,p119,566,100,bodytext,,"Tathā –"
NULL,p119,567,100,indent,,"‘‘Catūhi kho, gahapatiputta, ṭhānehi anukampako mitto suhado veditabbo. Abhavenassa na nandati, bhavenassa nandati, avaṇṇaṃ bhaṇamānaṃ nivāreti, vaṇṇaṃ bhaṇamānaṃ pasaṃsati (dī. ni. 3.264)."
NULL,p119,568,100,bodytext,,"Tathā  –"
NULL,p119,569,100,indent,,"‘‘Catūhi kho, gahapatiputta, ṭhānehi atthakkhāyī mitto suhado veditabbo. Pāpā nivāreti, kalyāṇe niveseti, assutaṃ sāveti, saggassa maggaṃ ācikkhatī’’ti (dī. ni. 3.263)."
NULL,p119,570,100,bodytext,,"Tesu idha agāriyā adhippetā, atthato pana sabbepi yujjanti. Te mitte suhajje. Anukampamānoti anudayamāno, tesaṃ sukhaṃ upasaṃharitukāmo dukkhaṃ apaharitukāmo."
NULL,p119,571,100,bodytext,,"Hāpetiatthanti diṭṭhadhammikasamparāyikaparamatthavasena tividhaṃ, tathā attatthaparatthaubhayatthavasenāpi tividhaṃ atthaṃ laddhavināsanena aladdhānuppādanenāti dvidhāpi hāpeti vināseti. Paṭibaddhacittoti ‘‘ahaṃ imaṃ vinā na jīvāmi, eso me gati, eso me parāyaṇa’’nti evaṃ attānaṃ nīce ṭhāne ṭhapentopi paṭibaddhacitto hoti. ‘‘Ime maṃ vinā na jīvanti, ahaṃ tesaṃ gati, ahaṃ tesaṃ parāyaṇa’’nti evaṃ attānaṃ ucce ṭhāne ṭhapentopi paṭibaddhacitto hoti. Idha pana evaṃ paṭibaddhacitto adhippeto."
NULL,p119,572,100,bodytext,,"Etaṃ bhayanti etaṃ atthahāpanabhayaṃ, attano samāpattihāniṃ sandhāya bhaṇati. Santhaveti tividho santhavo taṇhādiṭṭhimittasanthavavasena. Tattha aṭṭhasatappabhedāpi taṇhā taṇhāsanthavo, dvāsaṭṭhippabhedāpi diṭṭhi diṭṭhisanthavo, paṭibaddhacittatāya mittānukampanā mittasanthavo. So idha adhippeto. Tena hissa samāpatti parihīnā. Tenāha – ‘‘etaṃ bhayaṃ santhave pekkhamāno’’ti. Sesaṃ pubbasadisamevāti veditabbaṃ. Niddese vattabbaṃ natthi (su. ni. aṭṭha. 1.37; apa. aṭṭha. 1.1.93-94)."
NULL,p119,573,100,centered,,Tatiyagāthāniddesavaṇṇanā.
NULL,p119,574,100,bodytext,,"124. Catutthe vaṃsoti veḷu. Visāloti vitthiṇṇo. Va-kāro avadhāraṇattho, evakāro vā ayaṃ. Sandhivasenettha e-kāro naṭṭho. Tassa parapadena sambandho, taṃ pacchā yojessāma. Yathāti paṭibhāge. Visattoti laggo jaṭito saṃsibbito. Puttesu dāresu cāti puttadhītubhariyāsu. Yā apekkhāti yā taṇhā yo sneho. Vaṃsakkaḷīrova asajjamānoti vaṃsakaḷīro viya alaggamāno. Kiṃ vuttaṃ hoti? Yathā vaṃso visālo visatto eva hoti, puttesu ca dāresu ca yā apekkhā, sāpi evaṃ tāni vatthūni saṃsibbitvā ṭhitattā visattā eva. Svāhaṃ tāya apekkhāya apekkhavā visālo vaṃso viya visattoti evaṃ apekkhāya ādīnavaṃ disvā taṃ apekkhaṃ maggañāṇena chindanto ayaṃ vaṃsakaḷīrova rūpādīsu vā diṭṭhādīsu vā lābhādīsu vā kāmabhavādīsu vā taṇhāmānadiṭṭhivasena asajjamāno paccekasambodhiṃ adhigatoti. Sesaṃ purimanayeneva veditabbaṃ. Imāyapi niddese atirekaṃ natthi (su. ni. aṭṭha. 1.38)."
NULL,p119,575,100,centered,,Catutthagāthāniddesavaṇṇanā.
NULL,p119,576,100,bodytext,,"125. Pañcame migoti sabbesaṃ āraññikacatuppadānaṃ eva etaṃ adhivacanaṃ. Idha pana pasadamigo  adhippeto. Araññamhīti gāmañca gāmūpacārañca ṭhapetvā avasesaṃ araññaṃ, idha pana uyyānaṃ adhippetaṃ, tasmā ‘‘uyyānamhī’’ti vuttaṃ hoti. Yathāti paṭibhāge. Abaddhoti rajjubandhanādīsu yena kenaci abaddho. Etena vissaṭṭhacariyaṃ dīpeti. Yenicchakaṃ gacchati gocarāyāti yena disābhāgena gantuṃ icchati, tena gocaratthaṃ gacchati. Tasmā tattha yattakaṃ icchati gantuṃ, tattakaṃ gacchati. Yaṃ icchati khādituṃ, taṃ khādatīti dīpeti. Viññū naroti paṇḍitapuriso. Seritanti  sacchandavuttitaṃ aparāyattabhāvaṃ. Pekkhamānoti paññācakkhunā olokayamāno. Atha vā dhammaseritaṃ puggalaseritañca. Lokuttaradhammā hi kilesavasaṃ agamanato serino tehi samannāgatā puggalā ca, tesaṃ bhāvaniddeso seritaṃ pekkhamānoti. Kiṃ vuttaṃ hoti? Migo araññamhi yathā abaddho, yenicchakaṃ gacchati gocarāya. Kadā nu kho ahampi taṇhābandhanaṃ chinditvā evaṃ gaccheyyanti iti me tumhehi ito cito ca parivāretvā ṭhitehi baddhassa yenicchakaṃ gantuṃ alabhantassa tasmiṃ yenicchakagamanābhāve ādīnavaṃ yenicchakagamane ānisaṃsaṃ disvā anukkamena samathavipassanāpāripūriṃ agamiṃ. Tato paccekabodhiṃ adhigatomhi. Tasmā aññopi viññū naro seritaṃ pekkhamāno, eko care khaggavisāṇakappoti (su. ni. aṭṭha. 1.39 ādayo)."
NULL,p119,577,100,centered,,Pañcamagāthāniddesavaṇṇanā.
NULL,p119,578,100,bodytext,,"126. Chaṭṭhe  ayaṃ piṇḍattho – sahāyamajjhe ṭhitassa divāseyyasaṅkhāte vāse ca mahāupaṭṭhānasaṅkhāte ṭhāne ca uyyānagamanasaṅkhāte gamane ca janapadacārikasaṅkhātāya cārikāya ca ‘‘idaṃ me suṇa, idaṃ me dehī’’tiādinā nayena tathā tathā āmantanā hoti, tasmā ahaṃ tattha tattha nibbijjitvā yāyaṃ ariyajanasevitā anekānisaṃsā ekantasukhā, evaṃ santepi lobhābhibhūtehi sabbakāpurisehi anabhijjhitā apatthitā pabbajjā, taṃ anabhijjhitaṃ paresaṃ avasavattanena bhabbapuggalavaseneva ca seritaṃ pekkhamāno vipassanaṃ ārabhitvā anukkamena paccekasambodhiṃ adhigatoti. Sesaṃ vuttanayameva (su. ni. aṭṭha. 1.39-42)."
NULL,p119,579,100,centered,,Chaṭṭhagāthāniddesavaṇṇanā.
NULL,p119,580,100,bodytext,,"127. Sattame khiḍḍāti kīḷanā. Sā duvidhā hoti kāyikā ca vācasikā ca. Tattha  kāyikā nāma hatthīhipi kīḷanti, assehipi rathehipi dhanūhipi tharūhipīti evamādi. Vācasikā nāma gītaṃ silokabhaṇanaṃ  mukhabherikanti evamādi. Ratīti pañcakāmaguṇarati. Vipulanti yāva aṭṭhimiñjaṃ āhacca ṭhānena sakalattabhāvabyāpakaṃ. Sesaṃ pākaṭameva. Anusandhiyojanāpi cettha saṃsaggagāthāya vuttanayeneva veditabbā (su. ni. aṭṭha. 1.41)."
NULL,p119,581,100,centered,,Sattamagāthāniddesavaṇṇanā.
NULL,p119,582,100,bodytext,,"128. Aṭṭhame cātuddisoti catūsu disāsu yathāsukhavihārī, ‘‘ekaṃ disaṃ pharitvā viharatī’’tiādinā (dī. ni. 1.556; 3.308; a. ni. 4.125; vibha. 643; cūḷani. khaggavisāṇasuttaniddesa 128) vā nayena brahmavihārabhāvanāpharitā catasso disā assa santītipi cātuddiso. Tāsu disāsu katthaci satte vā saṅkhāre vā bhayena na paṭihaññatīti appaṭigho. Santussamānoti dvādasavidhassa santosassa vasena santussako. Itarītarenāti uccāvacena paccayena. Parissayānaṃ sahitā achambhīti ettha parissayanti kāyacittāni, parihāpenti vā tesaṃ sampattiṃ, tāni vā paṭicca sayantīti parissayā, bāhirānaṃ sīhabyagghādīnaṃ abbhantarānañca kāmacchandādīnaṃ kāyacittupaddavānaṃ etaṃ adhivacanaṃ. Te parissaye adhivāsanakhantiyā ca vīriyādīhi ca dhammehi sahatīti parissayānaṃ sahitā. Thaddhabhāvakarabhayābhāvena achambhī. Kiṃ vuttaṃ hoti? Yathā te cattāro samaṇā, evaṃ itarītarena paccayena santussamāno ettha paṭipattipadaṭṭhāne santose ṭhito catūsu disāsu mettādibhāvanāya cātuddiso, sattasaṅkhāresu paṭihananakarabhayābhāvena appaṭigho ca hoti. So cātuddisattā vuttappakārānaṃ parissayānaṃ sahitā, appaṭighattā achambhī ca hotīti etaṃ paṭipattiguṇaṃ disvā yoniso paṭipajjitvā paccekasambodhiṃ adhigatomhīti."
NULL,p119,583,100,bodytext,,"Atha vā te samaṇā viya santussamāno itarītarena vuttanayeneva cātuddiso hotīti ñatvā evaṃ cātuddisabhāvaṃ patthayanto yoniso paṭipajjitvā adhigatomhi. Tasmā aññopi īdisaṃ ṭhānaṃ patthayamāno cātuddisatāya parissayānaṃ sahitā appaṭighatāya ca achambhī hutvā eko care khaggavisāṇakappoti (su. ni. aṭṭha. 1.42)."
NULL,p119,584,100,bodytext,,"Niddese mettāti atthato tāva mijjatīti mettā, sinehatīti attho. Mitte vā bhavā, mittassa vā esā pavattītipi mettā. Mettāsahagatenāti  mettāya samannāgatena. Cetasāti cittena. Ekaṃ disanti ekissā disāya paṭhamapariggahitaṃ sattaṃ upādāya ekaṃ disaṃ pariyāpannasattapharaṇavasena  vuttaṃ. Pharitvāti phusitvā ārammaṇaṃ katvā. Viharatīti brahmavihārādhiṭṭhitaṃ iriyāpathavihāraṃ pavatteti. Tathā dutiyanti yathā puratthimādīsu disāsu yaṃ kiñci ekaṃ disaṃ pharitvā viharati, tatheva tadanantaraṃ dutiyaṃ tatiyaṃ catutthañcāti attho."
NULL,p119,585,100,bodytext,,"Iti uddhanti eteneva ca nayena uparimaṃ disanti vuttaṃ hoti. Adho tiriyanti adhodisampi tiriyaṃ disampi evameva. Tattha ca adhoti heṭṭhā. Tiriyanti anudisā. Evaṃ sabbadisāsu assamaṇḍale assamiva mettāsahagataṃ cittaṃ sāretipi paccāsāretipīti. Ettāvatā ekamekaṃ disaṃ pariggahetvā odhiso mettāpharaṇaṃ dassitaṃ. Sabbadhītiādi pana anodhiso dassanatthaṃ vuttaṃ. Tattha sabbadhīti sabbattha. Sabbattatāyāti sabbesu hīnamajjhimaukkaṭṭhamittasapattamajjhattānippabhedesu attatāya, ‘‘ayaṃ parasatto’’ti vibhāgaṃ akatvā attasamatāyāti vuttaṃ hoti."
NULL,p119,586,100,bodytext,,"Atha  vā sabbattatāyāti sabbena cittabhāvena, īsakampi bahi avikkhipamānoti vuttaṃ hoti. Sabbāvantanti sabbasattavantaṃ, sabbasattayuttanti attho. Lokanti sattalokaṃ. Vipulenāti evamādipariyāyadassanato panettha puna ‘‘mettāsahagatenā’’ti vuttaṃ. Yasmā vā ettha odhiso pharaṇe viya puna tathā-saddo iti-saddo vā na vutto, tasmā puna ‘‘mettāsahagatena cetasā’’ti vuttaṃ. Nigamanavasena vā etaṃ vuttaṃ. Vipulenāti ettha ca pharaṇavasena vipulatā daṭṭhabbā. Bhūmivasena pana taṃ mahaggataṃ. Paguṇavasena appamāṇasattārammaṇavasena ca appamāṇaṃ. Byāpādapaccatthikappahānena averaṃ. Domanassappahānena abyāpajjaṃ. Niddukkhanti vuttaṃ hoti (visuddhi. 1.254). Karuṇā heṭṭhā vuttatthāyeva. Modanti tāya taṃsamaṅgino, sayaṃ vā modati, modanamattameva vā sāti muditā. ‘‘Averā hontū’’tiādibyāpādappahānena majjhattabhāvūpagamanena ca upekkhatīti upekkhā."
NULL,p119,587,100,bodytext,,"Lakkhaṇādito panettha hitākārappavattilakkhaṇā mettā, hitūpasaṃhārarasā, āghātavinayapaccupaṭṭhānā, sattānaṃ manāpabhāvadassanapadaṭṭhānā. Byāpādūpasamo etissā sampatti, sinehasambhavo vipatti. Dukkhāpanayanākārappavattilakkhaṇā karuṇā, paradukkhāsahanarasā, avihiṃsāpaccupaṭṭhānā, dukkhābhibhūtānaṃ anāthabhāvadassanapadaṭṭhānā. Vihiṃsūpasamo tassā sampatti, sokasambhavo vipatti. Pamodalakkhaṇā muditā, anissāyanarasā, arativighātapaccupaṭṭhānā, sattānaṃ sampattidassanapadaṭṭhānā. Arativūpasamo tassā sampatti, pahānasambhavo vipatti. Sattesu majjhattākārappavattilakkhaṇā upekkhā, sattesu samabhāvadassanarasā, paṭighānunayavūpasamapaccupaṭṭhānā, ‘‘kammassakā sattā, te kassa ruciyā sukhitā vā bhavissanti, dukkhato vā muccissanti, pattasampattito vā na parihāyissantī’’ti evaṃ pavattakammassakatādassanapadaṭṭhānā. Paṭighānunayavūpasamo tassā sampatti, gehassitāya aññāṇupekkhāya sambhavo vipatti."
NULL,p119,588,100,bodytext,,"Tattha santuṭṭho hotīti paccayasantosavasena santuṭṭho hoti. Itarītarena cīvarenāti na thūlasukhumalūkhapaṇītathirajiṇṇānaṃ yena  kenaci cīvarena, atha kho yathāladdhānaṃ itarītarena yena kenaci santuṭṭho hotīti attho. Cīvarasmiñhi tayo santosā – yathālābhasantoso, yathābalasantoso, yathāsāruppasantosoti. Piṇḍapātādīsupi eseva nayo. Iti ime tayo santose sandhāya ‘‘santuṭṭho hoti itarītarena cīvarena. Yathāladdhādīsu yena kenaci cīvarena santuṭṭho hotī’’ti vuttaṃ."
NULL,p119,589,100,bodytext,,"Ettha ca cīvaraṃ jānitabbaṃ, cīvarakhettaṃ jānitabbaṃ, paṃsukūlaṃ jānitabbaṃ, cīvarasantoso jānitabbo, cīvarapaṭisaṃyuttāni dhutaṅgāni jānitabbāni. Tattha cīvaraṃ jānitabbanti khomādīni cha cīvarāni dukūlādīni cha anulomacīvarānipi jānitabbāni. Imāni dvādasa kappiyacīvarāni. Kusacīraṃ vākacīraṃ phalakacīraṃ kesakambalaṃ vāḷakambalaṃ potthako cammaṃ ulūkapakkhaṃ rukkhadussaṃ latādussaṃ erakadussaṃ kadalidussaṃ veḷudussanti evamādīni pana akappiyacīvarāni."
NULL,p119,590,100,bodytext,,"Cīvarakhettanti  ‘‘saṅghato vā gaṇato vā ñātito vā mittato vā attano vā dhanena paṃsukūlaṃ vā’’ti evaṃ uppajjanato cha khettāni, aṭṭhannañca mātikānaṃ vasena aṭṭha khettāni jānitabbāni."
NULL,p119,591,100,bodytext,,"Paṃsukūlanti sosānikaṃ pāpaṇikaṃ rathiyaṃ saṅkārakūṭaṃ sotthiyaṃ sinānaṃ titthaṃ gatapaccāgataṃ aggiḍaḍḍhaṃ gokhāyitaṃ upacikākhāyitaṃ undūrakhāyitaṃ antacchinnaṃ dasacchinnaṃ dhajāhaṭaṃ thūpaṃ samaṇacīvaraṃ sāmuddiyaṃ ābhisekiyaṃ panthikaṃ vātāhaṭaṃ iddhimayaṃ devadattiyanti tevīsati paṃsukūlāni veditabbāni. Ettha ca sotthiyanti gabbhamalaharaṇaṃ. Gatapaccāgatanti matakasarīraṃ pārupitvā susānaṃ netvā ānītacīvaraṃ. Dhajāhaṭanti dhajaṃ ussāpetvā tato ānītaṃ. Thūpanti vammike pūjitacīvaraṃ. Sāmuddiyanti samuddavīcīhi thalaṃ pāpitaṃ. Panthikanti panthaṃ gacchantehi corabhayena pāsāṇehi koṭṭetvā pārutacīvaraṃ. Iddhimayanti ehibhikkhucīvaraṃ. Sesaṃ pākaṭameva."
NULL,p119,592,100,bodytext,,"Cīvarasantosoti  vīsati cīvarasantosā – cīvare vitakkasantoso gamanasantoso pariyesanasantoso paṭilābhasantoso mattapaṭiggahaṇasantoso loluppavivajjanasantoso yathālābhasantoso  yathābalasantoso yathāsāruppasantoso udakasantoso dhovanasantoso karaṇasantoso parimāṇasantoso suttasantoso sibbanasantoso rajanasantoso kappasantoso paribhogasantoso sannidhiparivajjanasantoso vissajjanasantosoti. Tattha sādakabhikkhuno temāsaṃ nibaddhavāsaṃ vasitvā ekamāsamattaṃ vitakkituṃ vaṭṭati. So hi pavāretvā cīvaramāse cīvaraṃ karoti. Paṃsukūliko addhamāseneva karoti. Idaṃ māsaddhamāsamattaṃ vitakkanaṃ vitakkasantoso. Cīvaratthāya gacchantassa pana ‘‘kattha labhissāmī’’ti acintetvā kammaṭṭhānasīseneva gamanaṃ gamanasantoso nāma. Pariyesantassa pana yena vā tena vā saddhiṃ apariyesitvā lajjiṃ pesalabhikkhuṃ gahetvā pariyesanaṃ pariyesanasantoso nāma. Evaṃ pariyesantassa āhariyamānaṃ cīvaraṃ dūratova disvā ‘‘etaṃ manāpaṃ bhavissati, etaṃ amanāpa’’nti evaṃ avitakketvā  thūlasukhumādīsu yathāladdheneva santussanaṃ paṭilābhasantoso nāma. Evaṃ laddhaṃ gaṇhantassāpi ‘‘ettakaṃ dupaṭṭassa bhavissati, ettakaṃ ekapaṭṭassā’’ti attano pahonakamatteneva santussanaṃ mattapaṭiggahaṇasantoso nāma. Cīvaraṃ pariyesantassa pana ‘‘asukassa gharadvāre manāpaṃ labhissāmī’’ti acintetvā dvārapaṭipāṭiyā caraṇaṃ loluppavivajjanasantoso nāma."
NULL,p119,593,100,bodytext,,"Lūkhapaṇītesu yena kenaci yāpetuṃ sakkontassa yathāladdheneva yāpanaṃ yathālābhasantoso nāma. Attano thāmaṃ jānitvā yena yāpetuṃ sakkoti, tena yāpanaṃ yathābalasantoso nāma. Manāpaṃ aññassa datvā attanā yena kenaci yāpanaṃ yathāsāruppasantoso nāma. ‘‘Kattha udakaṃ manāpaṃ, kattha amanāpa’’nti avicāretvā yena kenaci dhovanupagena udakena dhovanaṃ udakasantoso nāma. Tathā paṇḍumattikagerukapūtipaṇṇarasakiliṭṭhāni pana udakāni vajjetuṃ vaṭṭati. Dhovantassa pana muggarādīhi apaharitvā hatthehi madditvā dhovanaṃ dhovanasantoso nāma. Tathā asujjhantaṃ paṇṇāni pakkhipitvā tāpitaudakenāpi dhovituṃ vaṭṭati. Evaṃ dhovitvā karontassa ‘‘idaṃ thūlaṃ, idaṃ sukhuma’’nti akopetvā pahonakanīhāreneva karaṇaṃ karaṇasantoso nāma. Timaṇḍalapaṭicchādanamattasseva karaṇaṃ parimāṇasantoso nāma. Cīvarakaraṇatthāya pana ‘‘manāpaṃ suttaṃ pariyesissāmī’’ti avicāretvā rathikādīsu vā devaṭṭhāne vā āharitvā pādamūle vā ṭhapitaṃ yaṃ kiñcideva suttaṃ gahetvā karaṇaṃ suttasantoso nāma."
NULL,p119,594,100,bodytext,,"Kusibandhanakāle pana aṅgulimatte sattavāre na vijjhitabbaṃ. Evaṃ karontassa hi yo bhikkhu sahāyo na hoti, tassa vattabhedopi natthi. Tivaṅgulamatte pana sattavāre vijjhitabbaṃ. Evaṃ  karontassa maggapaṭipannenāpi sahāyena bhavitabbaṃ. Yo na hoti, tassa vattabhedo. Ayaṃ sibbanasantoso nāma. Rajantena pana kāḷakacchakādīni pariyesantena na rajitabbaṃ, somavakkalādīsu yaṃ labhati, tena rajitabbaṃ. Alabhantena  pana manussehi araññe vākaṃ gahetvā chaḍḍitarajanaṃ vā bhikkhūhi pacitvā chaḍḍitakasaṭaṃ vā gahetvā rajitabbaṃ. Ayaṃ rajanasantoso nāma. Nīlakaddamakāḷasāmesu yaṃ kiñci gahetvā hatthipiṭṭhe nisinnassa paññāyamānakappakaraṇaṃ kappasantoso nāma."
NULL,p119,595,100,bodytext,,"Hirikopīnapaṭicchādanamattavasena paribhuñjanaṃ paribhogasantoso nāma. Dussaṃ pana labhitvā suttaṃ vā sūciṃ vā kārakaṃ vā alabhantena ṭhapetuṃ vaṭṭati, labhantena na vaṭṭati. Katampi ce antevāsikādīnaṃ dātukāmo hoti, te ca asannihitā, yāva āgamanā ṭhapetuṃ vaṭṭati, āgatamattesu tesu dātabbaṃ. Dātuṃ asakkontena adhiṭṭhātabbaṃ. Aññasmiṃ cīvare sati paccattharaṇampi adhiṭṭhātuṃ vaṭṭati. Anadhiṭṭhitameva hi sannidhi hoti. Adhiṭṭhitaṃ na hotīti mahāsīvatthero āha. Ayaṃ sannidhiparivajjanasantoso nāma. Vissajjentena pana mukhaṃ oloketvā na dātabbaṃ, sāraṇīyadhamme ṭhatvāva vissajjetabbanti ayaṃ vissajjanasantoso nāma."
NULL,p119,596,100,bodytext,,"Cīvarapaṭisaṃyuttāni dhutaṅgāni nāma paṃsukūlikaṅgañceva tecīvarikaṅgañca. Iti cīvarasantosamahāariyavaṃsaṃ pūrayamāno paccekasambuddho imāni dve dhutaṅgāni gopeti, imāni gopento cīvarasantosamahāariyavaṃsavasena santuṭṭho hoti."
NULL,p119,597,100,bodytext,,"Vaṇṇavādīti eko santuṭṭho hoti, santosassa vaṇṇaṃ na katheti. Eko na santuṭṭho hoti, santosassa vaṇṇaṃ katheti. Eko neva santuṭṭho hoti, na santosassa vaṇṇaṃ katheti. Eko santuṭṭho ca hoti, santosassa ca vaṇṇaṃ katheti. Tathārūpo so paccekasambuddho taṃ dassetuṃ ‘‘itarītaracīvarasantuṭṭhiyā ca vaṇṇavādī’’ti vuttaṃ."
NULL,p119,598,100,bodytext,,"Anesananti dūteyyapahiṇagamanānuyogappabhedaṃ nānappakāraṃ anesanaṃ. Appatirūpanti ayuttaṃ. Aladdhā cāti alabhitvā. Yathā ekacco ‘‘kathaṃ nu kho cīvaraṃ labhissāmī’’ti puññavantehi bhikkhūhi saddhiṃ ekato hutvā kohaññaṃ karonto uttasati paritassati, paccekasambuddho evaṃ aladdhā ca cīvaraṃ na paritassati. Laddhācāti dhammena samena labhitvā. Adhigatoti vigatalobhagiddho. Amucchitoti adhimattataṇhāya mucchanaṃ anāpanno. Anajjhāpannoti  taṇhāya anotthaṭo apariyonaddho. Ādīnavadassāvīti anesanāpattiyañca gadhitaparibhoge ca ādīnavaṃ passamāno. Nissaraṇapaññoti ‘‘yāvadeva sītassa paṭighātāyā’’ti (ma. ni. 1.23; a. ni. 6.58) vuttaṃ nissaraṇameva pajānanto."
NULL,p119,599,100,bodytext,,"Itarītaracīvarasantuṭṭhiyāti yena kenaci cīvarena santuṭṭhiyā. Nevattānukkaṃsetīti yathā panidhekacco ‘‘ahaṃ paṃsukūliko, mayā upasampadamāḷeyeva paṃsukūlikaṅgaṃ gahitaṃ, ko mayā sadiso atthī’’ti attukkaṃsanaṃ karoti. Evaṃ so attukkaṃsanaṃ na karoti. Na paraṃ vambhetīti ‘‘ime panaññe bhikkhū na paṃsukūlikāti vā paṃsukūlikamattampi etesaṃ natthī’’ti vā evaṃ paraṃ na vambheti. Yo hi tattha dakkhoti yo tasmiṃ cīvarasantose vaṇṇavādī. Tāsu vā dakkho cheko byatto. Analasoti sātaccakiriyāya ālasiyavirahito. Sampajāno patissatoti sampajānapaññāya ceva satiyā ca yutto. Ariyavaṃse ṭhitoti ariyavaṃse patiṭṭhito."
NULL,p119,600,100,bodytext,,"Itarītarena piṇḍapātenāti yena kenaci piṇḍapātena. Etthapi piṇḍapāto jānitabbo, piṇḍapātakhettaṃ jānitabbaṃ, piṇḍapātasantoso jānitabbo, piṇḍapātapaṭisaṃyuttaṃ dhutaṅgaṃ jānitabbaṃ. Tattha piṇḍapātoti odano kummāso sattu maccho maṃsaṃ khīraṃ dadhi sappi navanītaṃ telaṃ madhu phāṇitaṃ yāgu khādanīyaṃ sāyanīyaṃ lehanīyanti soḷasa piṇḍapātā."
NULL,p119,601,100,bodytext,,"Piṇḍapātakhettanti  saṅghabhattaṃ uddesabhattaṃ nimantanaṃ salākabhattaṃ pakkhikaṃ uposathikaṃ pāṭipadikaṃ āgantukabhattaṃ gamikabhattaṃ gilānabhattaṃ gilānupaṭṭhākabhattaṃ dhurabhattaṃ kuṭibhattaṃ vārabhattaṃ vihārabhattanti pannarasa piṇḍapātakhettāni."
NULL,p119,602,100,bodytext,,"Piṇḍapātasantosoti piṇḍapāte vitakkasantoso gamanasantoso pariyesanasantoso paṭilābhasantoso paṭiggahaṇasantoso mattapaṭiggahaṇasantoso loluppavivajjanasantoso yathālābhasantoso yathābalasantoso yathāsāruppasantoso upakārasantoso parimāṇasantoso paribhogasantoso sannidhiparivajjanasantoso  vissajjanasantosoti pannarasa santosā. Tattha sādako bhikkhu mukhaṃ dhovitvā vitakketi. Piṇḍapātikena pana gaṇena saddhiṃ caratā sāyaṃ therupaṭṭhānakāle ‘‘sve kattha piṇḍāya carissāmā’’ti ‘‘asukagāme, bhante’’ti ettakaṃ cintetvā tato paṭṭhāya na vitakketabbaṃ. Ekacārikena vitakkamāḷake ṭhatvā vitakketabbaṃ. Tato paṭṭhāya vitakkento pana ariyavaṃsā cuto hoti paribāhiro. Ayaṃ vitakkasantoso nāma. Piṇḍāya  pavisantena pana ‘‘kuhiṃ labhissāmī’’ti acintetvā kammaṭṭhānasīsena gantabbaṃ. Ayaṃ gamanasantoso nāma. Pariyesantena yaṃ vā taṃ vā aggahetvā lajjiṃ pesalameva gahetvā pariyesitabbaṃ. Ayaṃ pariyesanasantoso nāma. Dūratova āhariyamānaṃ disvā ‘‘etaṃ manāpaṃ, etaṃ amanāpa’’nti cittaṃ na uppādetabbaṃ. Ayaṃ paṭilābhasantoso nāma. ‘‘Idaṃ manāpaṃ gaṇhissāmi, idaṃ amanāpaṃ na gaṇhissāmī’’ti acintetvā yaṃ kiñci yāpanamattaṃ gahetabbameva. Ayaṃ paṭiggahaṇasantoso nāma."
NULL,p119,603,100,bodytext,,"Ettha pana deyyadhammo bahu, dāyako appaṃ dātukāmo, appaṃ gahetabbaṃ. Deyyadhammo bahu, dāyakopi bahudātukāmo, pamāṇeneva gahetabbaṃ. Deyyadhammopi na bahu, dāyakopi appaṃ dātukāmo, appaṃ gahetabbaṃ. Deyyadhammo na bahu, dāyako pana bahudātukāmo, pamāṇena gahetabbaṃ. Paṭiggahaṇasmiñhi mattaṃ ajānanto manussānaṃ pasādaṃ makkheti, saddhādeyyaṃ vinipāteti, sāsanaṃ na karoti. Vijātamātuyāpissa cittaṃ gahetuṃ na sakkoti. Iti mattaṃ jānitvāva paṭiggahetabbanti ayaṃ mattapaṭiggahaṇasantoso nāma. Aḍḍhakulāniyeva agantvā dvārapaṭipāṭiyā  gantabbaṃ. Ayaṃ loluppavivajjanasantoso nāma. Yathālābhasantosādayo cīvare vuttanayā eva."
NULL,p119,604,100,bodytext,,"Piṇḍapātaṃ paribhuñjitvā ‘‘samaṇadhammaṃ anupālessāmī’’ti evaṃ upakāraṃ ñatvā paribhuñjanaṃ upakārasantoso nāma. Pattaṃ pūretvā ānītaṃ na paṭiggahetabbaṃ. Anupasampanne sati tena gāhāpetabbaṃ, asati āharāpetvā paṭiggahaṇaparimāṇamattaṃ gahetabbaṃ. Ayaṃ parimāṇasantoso nāma. Jighacchāya paṭivinodanaṃ ‘‘na idamettha nissaraṇa’’nti  evaṃ paribhuñjanaṃ paribhogasantoso nāma. Nidahitvā na paribhuñjitabbaṃ. Ayaṃ sannidhiparivajjanasantoso nāma. Mukhaṃ anoloketvā sāraṇīyadhamme ṭhitena vissajjetabbaṃ. Ayaṃ vissajjanasantoso nāma."
NULL,p119,605,100,bodytext,,"Piṇḍapātapaṭisaṃyuttāni pana pañca dhutaṅgāni piṇḍapātikaṅgaṃ sapadānacārikaṅgaṃ ekāsanikaṅgaṃ pattapiṇḍikaṅgaṃ khalupacchābhattikaṅganti. Iti piṇḍapātasantosamahāariyavaṃsaṃ pūrayamāno paccekasambuddho imāni pañca dhutaṅgāni gopeti, imāni gopento piṇḍapātasantosamahāariyavaṃsavasena santuṭṭho hoti. Vaṇṇavādītiādīni vuttanayeneva veditabbāni."
NULL,p119,606,100,bodytext,,"Senāsanānīti idha senāsanaṃ jānitabbaṃ, senāsanakhettaṃ jānitabbaṃ, senāsanasantoso jānitabbo, senāsanapaṭisaṃyuttadhutaṅgaṃ jānitabbaṃ. Tattha senāsananti mañco pīṭhaṃ bhisi bimbohanaṃ  vihāro aḍḍhayogo pāsādo hammiyaṃ guhā leṇaṃ aṭṭo māḷo veḷugumbo rukkhamūlaṃ yattha vā pana bhikkhū paṭikkamantīti imāni pannarasa senāsanāni."
NULL,p119,607,100,bodytext,,"Senāsanakhettanti saṅghato vā gaṇato vā ñātito vā mittato vā attano vā dhanena paṃsukūlaṃ vāti cha khettāni."
