id,book,par_num,level,class,title,text
NULL,p191,804,100,bodytext,,"Dukkhā paṭipadā dandhābhiññā mandapaññassa uppajjanato samathaṃ āvahantī hutvā samathassa padaṭṭhānaṃ hoti, sukhāpaṭipadā khippābhiññā ñāṇādhikassa uppajjanato vipassanāvahantī hutvā vipassanāya padaṭṭhānaṃ, avasesā dve paṭipadāpi nātipaññassa uppajjanato samathassa padaṭṭhānanti gahetabbā. Tena aṭṭhakathāyaṃ vuttaṃ – ‘‘itarā pana tissopi paṭipadā samathaṃ āvahantī’’tiādi (netti. aṭṭha. 34). Dānamayaṃ puññakiriyavatthu sayameva ekantena dhammassavanassa padaṭṭhānaṃ na hoti, vandanayācanapañhāpucchanādayopi padaṭṭhānaṃ honti, tasmā tehi kāraṇehi sādhāraṇaṃ hutvā paratoghosassa padaṭṭhānaṃ hoti, paratoghoso ca dhammassavanapañhāvissajjanādivasena pavatto. Dātabbavatthupariccajanavandanayācanakālesu hi yebhuyyena dhammaṃ desenti, pañhāpucchanādikālesu ca vissajjenti, paṭipucchasākacchādīni vā karonti. Sīlamayaṃ puññakiriyavatthu pāmojjapītipassaddhisukhasamādhīhi padaṭṭhānabhāvena sādhāraṇaṃ hutvā cintāmayiyā paññāya padaṭṭhānaṃ hoti. Sīlavantassa hi sīlaṃ paccavekkhantassa pāmojjādayo honti, samāhito ca dhammacintane samattho hoti."
NULL,p191,805,100,bodytext,,"Bhāvanāmayaṃ puññakiriyavatthūti purimā purimā samathabhāvanā ceva vipassanābhāvanā ca puññakiriyavatthudānasīlādīhi kāraṇehi sādhāraṇaṃ hutvā bhāvanāmayiyā paññāya pacchimāya pacchimāya samathabhāvanāya ceva vipassanābhāvanāya ca padaṭṭhānaṃ. Tena vuttaṃ aṭṭhakathāyaṃ – ‘‘sādhāraṇanti na bījaṃ viya aṅkurassa, dassanabhūmiādayo viya niyāmāvakkantiādīnaṃ āveṇikaṃ, atha kho sādhāraṇaṃ tadaññakāraṇehipī’’ti. ‘‘Dānamayasīlamayabhāvanāmayapuññakiriyavatthūnaṃ paratoghosacintāmayibhāvanāmayipaññānaṃ padaṭṭhānabhāvo ācariyena vibhatto, evaṃ sati tesaṃ dānamayādīnaṃ yathākkamaṃ pariyattibāhusaccakammaṭṭhānānuyogamaggasammādiṭṭhīnaṃ padaṭṭhānabhāvo na bhaveyyā’’ti vattabbattā tathāpavattaṃ padaṭṭhānabhāvampi dassetuṃ ‘‘dānamayaṃ puññakiriyavatthu parato ca ghosassa sutamayiyā ca paññāyā’’tiādi vuttaṃ. Aṭṭhakathāyaṃ pana –"
NULL,p191,806,100,indent,,"‘‘Idāni  yasmā dānaṃ, sīlaṃ, lokiyabhāvanā ca na kevalaṃ yathāvuttaparatoghosādīnaṃyeva, atha kho yathākkamaṃ pariyattibāhusaccakammaṭṭhānānuyogamaggasammādiṭṭhīnampi paccayā honti, tasmā tampi nayaṃ dassetuṃ puna ‘dānamaya’ntiādinā desanaṃ vaḍḍhesī’’ti (netti. aṭṭha. 34) –"
NULL,p191,807,100,unindented,,"Vuttaṃ. Tattha dānamayapuññakiriyavatthuno paratoghosassa sādhāraṇapadaṭṭhānabhāvo heṭṭhā vuttanayena ñātabbo. Dānaṃ pana datvā desanaṃ sutvā sutānusārena vitthāretvā cintentassa pavattamānāya sutamayiyā paññāya vandanayācanādīhi sādhāraṇaṃ hutvā padaṭṭhānaṃ hoti. Sīlamayapuññakiriyavatthunopi cintāmayiyā paññāya sādhāraṇapadaṭṭhānabhāvo vuttoyeva. Parisuddhasīlaṃ pana nissāya ‘‘jhānaṃ nibbattessāmi, maggaphalaṃ nibbattessāmī’’tiādinā paccavekkhantassa pavattamānassa yonisomanasikārassa pāmojjādīhi sādhāraṇaṃ hutvā padaṭṭhānaṃ hoti. Bhāvanāmayapuññakiriyavatthuno bhāvanāmayiyā paññāya sādhāraṇapadaṭṭhānabhāvopi vuttoyeva. Samathabhāvanāsaṅkhātaṃ pana jhānaṃ pādakaṃ katvā vā paripākaṃ vipassanābhāvaṃyeva vā nissāya pavattamānāya sammādiṭṭhiyā parisuddhasīlādīhi sādhāraṇaṃ hutvā padaṭṭhānaṃ hoti."
NULL,p191,808,100,bodytext,,"Dānamayapuññakiriyavatthuādīnaṃ paratoghosādīnaṃ padaṭṭhānabhāvo punappunaṃ ācariyena vibhatto, amhehi ca ñāto, ‘‘patirūpadesavāsādayopi imesaṃ dhammānaṃ padaṭṭhānānīti yathā vibhajitabbā, amhehi ca viññātabbā, tathā vibhajitvā dassethā’’ti vattabbattā tepi vibhajitvā dassetuṃ ‘‘patirūpadesavāso’’tiādimāha. Aṭṭhakathāyaṃ pana ‘‘tathā  patirūpadesavāsādayo kāyavivekacittavivekādīnaṃ kāraṇaṃ hontīti imaṃ nayaṃ dassetuṃ ‘patirūpadesavāso’tiādimāhā’’ti (netti. aṭṭha. 34) vuttaṃ. Patirūpadesaṃ nissāya vasantassa kāyavivekacittavivekavaḍḍhanato, samādhivaḍḍhanato ca patirūpadesavāso kāyacittavivekassa ca upacārasamādhiappanāsamādhissa ca sīlādīhi sādhāraṇaṃ hutvā padaṭṭhānaṃ. Sappurisūpanissayoti sappurisasantāne pavatto payirupāsato ālambitabbo pasādo, tato vā upanissayaṃ labhitvā payirupāsantānaṃ santāne pavatto pubbapasādo yathāvidho sappurisūpanissayo payirupāsantassa saddhāsampannassa ratanattaye tiṇṇaṃ aveccappasādānaṃ ratanattayaguṇādīhi sādhāraṇaṃ hutvā padaṭṭhānaṃ, samathassa labhananimittadāyakaṃ sappurisaṃ payirupāsitvā tena dinnanaye ṭhatvā pavattetabbassa samathassa sappurisūpanissayo sīlapāmojjapītādīhi  sādhāraṇaṃ hutvā padaṭṭhānaṃ. Attasammāpaṇihitassa pāpajigucchādīnaṃ sambhavato attasammāpaṇidhānaṃ jātivayādipaccavekkhaṇena sādhāraṇaṃ hutvā hiriyā ca padaṭṭhānaṃ, attasammāpaṇihitassa nibbidādīnaṃ sambhavato sīlādīhi sādhāraṇaṃ hutvā vipassanāya ca padaṭṭhānaṃ."
NULL,p191,809,100,bodytext,,"Tadaṅgādivasena akusalapariccāgo nibbidāñāṇādīhi sādhāraṇaṃ hutvā kusalavīmaṃsāya paṭisaṅkhānupassanāya paññāya ca ariyamaggasamādhindriyassa ca padaṭṭhānaṃ. Dhammasvākkhātatā svākkhātadhammassavanānusārena pavattakusalamūlakā lokiyalokuttarasampatti kusalamūlaropanā nāma, tāya ca tathāvidhakusalamūlakāya phalasamāpattiyā ca padaṭṭhānaṃ. Saṅghasuppaṭipannatā saṅghasuṭṭhutāya saṅghassa upaṭṭhākānaṃ suṭṭhubhāvāya sappatissavāya vacanasampaṭicchanabhāvāya padaṭṭhānaṃ. Satthusampadā satthari ceva dhammādīsu ca guṇaajānanatāya appasannānañca pasādāya pasannānañca appamattakapasādānañca bhiyyobhāvāya vaḍḍhanāya padaṭṭhānaṃ. Appaṭihatapātimokkhatā saṅghamajjhe vā parisamajjhe vā dummaṅkūnaṃ dummukhānaṃ dussīlānaṃ puggalānaṃ niggahāya, pesalānaṃ pātimokkhasaṃvarādisīlasampannānaṃ puggalānaṃ phāsuvihārāya ca padaṭṭhānaṃ hoti. Honto pana yathānurūpehi aññehi kāraṇehi sādhāraṇaṃ hutvā hotīti veditabbo."
NULL,p191,810,100,bodytext,,"‘‘Vāsanābhāgiyasuttādīsu  vuttadhammabhūmipadaṭṭhānānaṃ vibhattihārena vibhajitabbabhāvo amhehi kena jānitabbo saddahitabbo’’ti pucchitabbattā ‘‘tenāhā’’tiādi vuttaṃ. Tassattho vuttanayānusārena veditabbo."
NULL,p191,811,100,bodytext,,"‘‘Ettāvatā ca vibhattihāro paripuṇṇo, añño niyutto natthī’’ti vattabbattā ‘‘niyutto vibhattihāro’’ti vuttaṃ. Yattha yattha sutte ye ye dhammādayo vuttā, tattha tattha sutte vuttesu tesu tesu dhammādīsu yathālābhavasena yo yo vibhattihāro yojito, so so vibhattihāro niddhāretvā yutto yojitoti attho daṭṭhabbo."
NULL,p191,812,100,centered,,"Iti vibhattihāravibhaṅge sattibalānurūpā racitā"
NULL,p191,813,100,centered,,"Vibhāvanā niṭṭhitā."
NULL,p191,814,100,bodytext,,"Paṇḍitehi pana aṭṭhakathāṭīkānusāreneva gambhīrattho vitthārato vibhajitvā gahetabboti."
NULL,p191,815,4,subhead,"9. Parivattanahāravibhaṅgavibhāvanā","9. Parivattanahāravibhaṅgavibhāvanā"
NULL,p191,816,100,bodytext,,"35. Yena  yena saṃvaṇṇāvisesabhūtena vibhattihāravibhaṅgena sutte vuttā dhammādayo vibhattā, so saṃvaṇṇāvisesabhūto vibhaṅgo paripuṇṇo, ‘‘katamo parivattanahāravibhaṅgo’’ti pucchitabbattā ‘‘tattha katamo parivattano hāro’’tiādi vuttaṃ. Tattha tatthāti tesu niddiṭṭhesu soḷasasu desanāhārādīsu katamo saṃvaṇṇanāviseso parivattano hāro parivattanahāravibhaṅgo nāmāti pucchati. ‘‘Kusalākusale dhamme’’tiādiniddesassa idāni mayā vuccamāno ‘‘sammādiṭṭhissa purisapuggalassā’’tiādiko vitthārasaṃvaṇṇanāviseso parivattano hāro parivattanahāravibhaṅgo nāmāti attho gahetabbo."
NULL,p191,817,100,bodytext,,"‘‘Saṃvaṇṇiyamāne sutte niddiṭṭhassa katamassa bhāvitabbassa kusalassa katamo paṭipakkho, kathaṃ parivattetabbo’’ti pucchitabbattā imassa bhāvitabbassa kusalassa ayaṃ paṭipakkho, evaṃ pahātabbabhāvavasena parivattetabboti  dassento ‘‘sammādiṭṭhissa purisapuggalassā’’tiādimāha. Aṭṭhakathāyaṃ pana –"
NULL,p191,818,100,indent,,"‘‘Tattha yasmā saṃvaṇṇiyamāne sutte yathāniddiṭṭhānaṃ kusalākusaladhammānaṃ paṭipakkhabhūte akusalakusaladhamme pahātabbabhāvādivasena niddhāraṇaṃ paṭipakkhato parivattanaṃ, tasmā ‘sammādiṭṭhissa purisapuggalassa micchādiṭṭhi nijjiṇṇā bhavatī’tiādi āraddha’’nti (netti. aṭṭha. 35) –"
NULL,p191,819,100,unindented,,"Vuttaṃ. Pahāyakassa hi dhammassa pahātabbabhāvavasena niddhāraṇaṃ, pahātabbassa ca dhammassa pahāyakabhāvavasena niddhāraṇaṃ paṭipakkhato parivattanaṃ nāma hoti. Tattha sammādiṭṭhissāti sammā sundarā pasatthā diṭṭhi yassa puggalassāti sammādiṭṭhi. Puggalapadaṭṭhānā hi ayaṃ desanā. Tena vuttaṃ ‘‘purisapuggalassā’’ti. Sā pana sammādiṭṭhi kammakammaphalādisaddahanavasena vā aniccādivipassanāvasena vā maggasammādassanavasena vā pavattā niravasesāva gahitā. ‘‘Yāya bhāvitāya sammādiṭṭhiyā pahātabbā micchādiṭṭhi nijjiṇṇā bhavati, yadi kevalā micchādiṭṭhiyeva nijjiṇṇā bhavati, evaṃ sati tadavasesā akusalā dhammā ajiṇṇā"
NULL,p191,820,100,unindented,,"Bhaveyyu’’nti  vattabbattā ‘‘ye cassa micchādiṭṭhipaccayā’’tiādi vuttaṃ. Micchādiṭṭhipaccayā aneke pāpakā akusalāyeva dhammā ca uppajjeyyuṃ uppajjanārahā bhaveyyuṃ, te ca akusalā dhammā assa sammādiṭṭhisampannassa purisapuggalassa nijjiṇṇā pahātabbārahā anuppajjanasabhāvā honti. Tenāha bhagavā – ‘‘upādānanirodhā bhavanirodho’’ti (udā. 2; mahāva. 1)."
NULL,p191,821,100,bodytext,,"‘‘Yadi sammādiṭṭhissa purisapuggalassa micchādiṭṭhi, tappaccayā akusaladhammāyeva nijjiṇṇā bhavanti, evaṃ sati sammādiṭṭhipaccayā kusalā dhammā na sambhaveyyu’’nti vattabbattā ‘‘sammādiṭṭhipaccayā cā’’tiādi vuttaṃ. Assa sammādiṭṭhisampannassa purisapuggalassa uppajjanārahā sammādiṭṭhipaccayā aneke kusalā samathavipassanā vā bodhipakkhiyā vā dhammā sambhavanti, uppannā ca te dhammā assa sammādiṭṭhisampannassa purisapuggalassa santāne punappunaṃ pavattanavasena bhāvanāpāripūriṃ gacchanti."
NULL,p191,822,100,bodytext,,"Sammādiṭṭhiyā  paṭipakkhānaṃ micchādiṭṭhiyā, tappaccayānaṃ akusalānaṃ dhammānaṃ parivattanabhāvo ācariyena vibhatto, amhehi ca ñāto, ‘‘sammāsaṅkappassa dhammassa paṭipakkho dhammo kathaṃ parivattetabbo’’ti vattabbattā ‘‘sammāsaṅkappassa purisapuggalassā’’tiādi vuttaṃ. Yojanattha ādayo vuttanayānusārena veditabbā. Sammā sundarā pasatthā vācā yassa puggalassāti sammāvāco, tassa sammāvācassa. ‘‘Purisapuggalassā’’tiādīnaṃ atthopi vuttanayena veditabbo. Ayaṃ pana visesatthosammā aviparītato vimuttiñāṇadassanaṃ yassa puggalassāti sammāvimuttiñāṇadassano, tassa sammāvimuttiñāṇadassanassa paccavekkhaṇañāṇadassanasampannassa purisapuggalassa ‘‘avimuttāva samānā vimuttā maya’’nti micchābhinivesavasena pavattaṃ micchāvimuttiñāṇadassanaṃ nijjiṇṇaṃ vigataṃ bhavati. ‘‘Ye cassā’’tiādīnaṃ anusandhyādiko vuttanayānusārena veditabbo."
NULL,p191,823,100,bodytext,,"36. ‘‘Sammādiṭṭhissātiādinā sammādiṭṭhiādīnaṃ kusalānaṃ paṭipakkhā micchādiṭṭhādikāyeva akusalā pahātabbabhāvena parivattetabbā’’ti pucchitabbattā pāṇātipātāveramaṇiādīnaṃ kusalānaṃ paṭipakkhā pāṇātipātādikāpi akusalā pahātabbabhāvena parivattetabbāti dassetuṃ ‘‘yassa vā pāṇātipātā paṭiviratassā’’tiādi vuttaṃ. Aṭṭhakathāyaṃ pana ‘‘evaṃ sammādiṭṭhiādimukhena micchādiṭṭhiādiṃ dassetvā puna pāṇātipātaadinnādānakāmesumicchācārādito veramaṇiyādīhi pāṇātipātādīnaṃ parivattanaṃ dassetuṃ ‘yassā’tiādi āraddha’’nti (netti. aṭṭha. 36) vuttaṃ. Tadaṅgādivasenapahīno hoti. Kālavādissāti vaditabbakāle vaditabbaṃ vadati sīlenāti kālavādī, tassa."
NULL,p191,824,100,bodytext,,"‘‘Yathāvuttappakāreneva  parivattetabbā’’ti pucchitabbattā aññena pakārenapi parivattetabbāti dassetuṃ ‘‘ye ca kho kecī’’tiādi vuttaṃ. Aṭṭhakathāyaṃ pana ‘‘ye ca kho kecītiādinā sammādiṭṭhiādimukheneva micchādiṭṭhiādīhi eva parivattanaṃ pakārantarena dassetī’’ti (netti. aṭṭha. 36) vuttaṃ. Tattha keci micchādiṭṭhikamicchāsaṅkappādikāyeva puggalā paresaṃ ariyānaṃ ariyaṃ aṭṭhaṅgikaṃ maggaṃ garahanti. Sandiṭṭhikā sandiṭṭhe niyuttā, sahadhammikā saha dhammena kāraṇena ye vattanti sahadhammikā. Gārayhā garahitabbākāre yuttā. Vādā ca anuvādā ca vādānuvādā, te bhavanto sammādiṭṭhiñca dhammaṃ garahanti. Tena garahaṇena. Pujjā pūjitabbā ca na bhavanti, pāsaṃsā pasaṃsitabbā ca na bhavanti. Evantiādīsu sammāsaṅkappaṃ vā sammāvācādikaṃ vā visuṃ visuṃ sammāsaṅkappañca te bhavanto dhammaṃ garahanti. Tena hi ye micchāsaṅkappikā, te bhavanto na pujjā ca pāsaṃsā ca…pe… sammāvimuttiñca te bhavanto dhammaṃ garahanti. Tena hi ye micchādiṭṭhivācikā, te bhavanto na pujjā ca pāsaṃsā ca. Sammāvimuttiñāṇadassanañca te bhavanto dhammaṃ garahanti. Tena hi ye micchāvimuttikā, te bhavanto na pujjā ca pāsaṃsā ca. Sammāvimuttiñāṇadassanañca te bhavanto dhammaṃ garahanti. Tena hi ye micchāvimuttiñāṇadassanikā, te bhavanto na pujjā ca pāsaṃsā cāti yojanā kātabbā. ‘‘Micchāvimuttiñāṇadassanā’’tipi pāṭho atthi."
NULL,p191,825,100,bodytext,,"‘‘Ariyamaggasammādiṭṭhādīnaṃ garahavaseneva micchādiṭṭhādayo ca parivattetabbā, nāvasesānaṃ pasaṃsāvasenā’’ti vattabbattā kāmādīnaṃ pasaṃsāvasenapi kāmānaṃ paṭipakkhā veramaṇiyādayopi parivattetabbāti dassetuṃ ‘‘ye ca kho keci evamāhaṃsū’’tiādi vuttaṃ. Tattha bhuñjitabbā kāmā, paribhuñjitabbā kāmā, āsevitabbā kāmā, nisevitabbā kāmāti ettha kāmīyanteti kāmāti kammasādhanavasena vatthukāmā gahitā, nātipaṇītā kāmā bhuñjitabbā, atipaṇītā kāmā pari samantato bhuñjitabbā. Atipaṇītatarā kāmā ā bhuso sevitabbā, niyatā sevitabbā. Bhāvayitabbā kāmā, bahulīkātabbā kāmāti ettha pana kāmentīti kāmāti kattusādhanavasena kilesakāmā gahitā, punappunaṃ uppādanavasena bhāvayitabbā vaḍḍhāpetabbā pavattetabbā kilesakāmā, bahūnaṃ punappunaṃ uppādanavasena kātabbā vaḍḍhāpetabbā kilesakāmāti ye ca kāmavasikā puthujjanā keci evamāhaṃsu tesaṃ kāmavasikānaṃ puthujjanānaṃ kesañci tādisehi kāmehi veramaṇī kusalacetanā paṭipakkhavasena adhammo asevitabbo nāma āpajjeyyāti adhippāyo gahetabbo."
NULL,p191,826,100,bodytext,,"Antadvayavasena  parivattanaṃ dassetuṃ ‘‘ye vā pana kecī’’tiādi vuttaṃ. Attakilamathānuyogo dhammoti niyyānikoti ye vā pana pañcātapādipaṭipannakā tatthiyā evamāhaṃsu, tesaṃ pañcātapādipaṭipannakānaṃ niyyāniko dhammo majjhimāpaṭipadāsaṅkhāto vipassanāsahito ariyamaggo adhammo aniyyāniko abhāvetabbo nāma āpajjeyyāti. Sukhadukkhavasenapi parivattanaṃ dassetuṃ ‘‘ye ca kho’’tiādi vuttaṃ. ‘‘Pāpaṃ nijjarāpessāmā’’ti attahiṃsanādivasena paṭipannakānaṃ pavatto sarīratāpano dukkho dhammo niyyānikoti."
NULL,p191,827,100,bodytext,,"Ye ca tathāpaṭipannakā keci evamāhaṃsu, tesaṃ tathāpaṭipannakānaṃ anavajjapaccayaparibhogavasena pavatto sarīradukkhūpasamo sukho dhammo adhammo appavattetabbo āpajjeyyāti."
NULL,p191,828,100,bodytext,,"Antadvayādivasena parivattanaṃ ācariyena vibhattaṃ, amhehi ca ñātaṃ, ‘‘kathaṃ asubhasaññādivasena parivattetabbo’’ti pucchitabbattā evaṃ asubhasaññādivasena subhasaññādikā parivattetabbāti dassetuṃ ‘‘yathā vā panā’’tiādi vuttaṃ. Aṭṭhakathāyaṃ pana ‘‘idāni asubhasaññādimukhena subhasaññādiparivattanaṃ dassetuṃ ‘yathā vā panā’tiādi vutta’’nti (netti. aṭṭha. 36) vuttaṃ. Sabbasaṅkhāresūti tebhūmakasaṅkhāresu. Āraddhavipassakassa hi tebhūmakā dhammā kilesāsucipaggharaṇakattā asubhato upaṭṭhahanti."
NULL,p191,829,100,bodytext,,"‘‘Yadi sarūpatoyeva imesaṃ ime paṭipakkhāti aparivattetabbā siyuṃ, evaṃ sati niravasesā ca paṭipakkhā na sakkā parivattetuṃ, kathaṃ sakkā parivattetu’’nti vattabbattā parivattanalakkhaṇaṃ dassento ‘‘yaṃ yaṃ vā panā’’tiādimāha. Tattha kusalaṃ vā akusalaṃ vā yaṃ yaṃ dhammaṃ parivattetukāmo ācariyo cittena rocayati diṭṭhiyā upagacchati, kusalassa vā akusalassa vā tassa tassa rucikassa upagatassa dhammassa yo paṭipakkho, so paṭipakkhadhammo asaddhammo assa dhammassa aniṭṭhato paccanīkato ajjhāpanno pariññāto. Iṭṭhaṃ vā aniṭṭhaṃ vā yaṃ yaṃ dhammaṃ parivattetukāmo ācariyo cittena rocayati diṭṭhiyā upagacchati, iṭṭhassa vā aniṭṭhassa vā tassa tassa rucikassa dhammassa yo paṭipakkho, so paṭipakkhadhammo assa dhammassa aniṭṭhato paccanīkadhammato ajjhāpanno pariññāto bhavatīti parivattetukāmena icchitabbadhammānurūpapaṭipakkhavasena parivattanaṃ kātabbanti parivattane paṭipakkhalakkhaṇaṃ vuttaṃ. Tena aṭṭhakathāyaṃ vuttaṃ – ‘‘paṭipakkhassa lakkhaṇaṃ vibhāvetī’’ti."
NULL,p191,830,100,bodytext,,"‘‘Evaṃ  vuttappakāraṃ parivattanaṃ amhehi kathaṃ saddahitabba’’nti vattabbatā ‘‘tenāhā’’tiādi vuttaṃ."
NULL,p191,831,100,bodytext,,"‘‘Ettāvatā parivatto hāro paripuṇṇo, añño niyutto natthī’’ti vattabbattā ‘‘niyutto parivattano hāro’’ti vuttaṃ. Yasmiṃ sutte kusalākusale niddiṭṭhe paṭipakkhavasena nīharitvā yathāsambhavaṃ yo yo parivattano hāro niyutto, tasmiṃ sutte niddiṭṭhe paṭipakkhavasena nīharitvā so so parivattano hāro niyutto niddhāretvā yutto yojitoti attho gahetabboti."
NULL,p191,832,100,centered,,"Iti parivattanahāravibhaṅge sattibalānurūpā racitā"
NULL,p191,833,100,centered,,"Vibhāvanā niṭṭhitā."
NULL,p191,834,100,bodytext,,"Paṇḍitehi pana aṭṭhakathāṭīkānusārena gambhīrattho vitthārato vibhajitvā gahetabboti."
NULL,p191,835,4,subhead,"10. Vevacanahāravibhaṅgavibhāvanā","10. Vevacanahāravibhaṅgavibhāvanā"
NULL,p191,836,100,bodytext,,"37. Yena yena saṃvaṇṇanāvisesabhūtena pavattanahāravibhaṅgena parivattetabbā suttatthā vibhattā, so saṃvaṇṇanāvisesabhūto parivattanahāravibhaṅgo paripuṇṇo, ‘‘katamo vevacanahāravibhaṅgo’’ti pucchitabbattā ‘‘tattha katamo vevacano hāro’’tiādi vuttaṃ. Tattha tatthāti tesu niddiṭṭhesu soḷasasu desanāhārādīsu katamo saṃvaṇṇanāviseso vevacano hāro vevacanahāravibhaṅgo nāmāti pucchati. ‘‘Vevacanāni bahūnī’’tiādiniddesassa idāni mayā vuccamāno ‘‘ekaṃ bhagavā dhamma’’ntiādiko vitthārasaṃvaṇṇanāviseso vevacano hāro vevacanahāravibhaṅgo nāmāti attho gahetabbo. ‘‘Yāni vevacanāni niddhāritāni, katamāni tāni vevacanānī’’ti pucchitabbattā ‘‘yathā eka’’ntiādi vuttaṃ. Ekaṃ viññātabbaṃ dhammaṃ sabhāvadhammaṃ paññāpetabbaṃ vā dhammaṃ aññamaññehi yathā yehi pakārehi ceva vevacanehi ca bhagavā niddisati, tathāpakārāni vevacanāni viññātabbānīti attho. ‘‘Tāni vevacanāni kinti  bhagavā āhā’’ti vattabbattā ‘‘yathāha bhagavā’’tiādi vuttaṃ. Yathā yaṃyaṃpakārāni vevacanāni –"
NULL,p191,837,100,gatha1,,"‘‘Āsā  ca pihā ca abhinandanā ca, anekadhātūsu sarā patiṭṭhitā;"
NULL,p191,838,100,gathalast,,"Aññāṇamūlappabhavā pajappitā, sabbā mayā byantikatā samūlikā’’ti. –"
NULL,p191,839,100,unindented,,"Bhagavā āha, taṃtaṃpakārāni vevacanāni viññātabbānīti attho."
NULL,p191,840,100,bodytext,,"Ekasseva dhammassa anekehi pariyāyabhūtehi vevacanehi niddisane phalaṃ aṭṭhakathāyaṃ (netti. aṭṭha. 37) bahudhā vuttaṃ, tasmā amhehi na dassitaṃ. ‘‘Katamā āsā, katamā pihādī’’ti pucchitabbattā ‘‘āsā nāma vuccatī’’tiādi vuttaṃ. Yā bhavissassa atthassa āsīsanā avassaṃ āgamissatīti yā āsā assa āsīsantassa puggalassa uppajjati, tassa āsīsanā ‘‘āsā nāmā’’ti vuccati. Vattamānassa yā patthanā assa patthayantassa uppajjati, seyyataraṃ vā aññaṃ disvā ‘‘ediso ahaṃ bhaveyya’’nti yā pihā assa pihayantassa uppajjati, sā patthanā ‘‘pihā nāmā’’ti vuccati. Anāgatatthaṃ ārabbha pavattā taṇhā ‘‘āsā’’ti vuccati, anāgatapaccuppannatthaṃ ārabbha pavattā taṇhā ‘‘pihā’’ti vuccati, tathāpi taṇhābhāvena ekattā eko dhammova atthassa icchitassa nipphatti atthanipphatti, paṭipāleti etāya taṇhāyāti paṭipālanā, atthanipphattiyā paṭipālanāti atthanipphattipaṭipālanā. Yā taṇhā assa pālayantassa puggalassa uppajjati, sā taṇhā ‘‘abhinandanā’’ti vuccati."
NULL,p191,841,100,bodytext,,"‘‘Yā atthanipphatti taṇhāya paṭipāletabbā, katamā sā atthanipphattī’’ti pucchitabbattā taṃ atthanipphattiṃ sattato vā saṅkhārato vā vibhajitvā dassento ‘‘piyaṃ vā ñātiṃ, piyaṃ vā dhamma’’ntiādimāha. Tattha ‘‘ñāti’’nti iminā mittabandhavādayopi gahitā. Dhammaṃ pana piyarūpārammaṇādikaṃ chabbidhampi yāya taṇhāya taṇhiko abhinandati, sā taṇhā ‘‘abhinandanā nāmā’’ti vuccati. Paṭikkūlaṃ ñātiṃ vā dhammaṃ vā vipallāsavasena appaṭikkūlaṃ ñātiṃ vā dhammaṃ vā sabhāvavasena appaṭikkūlato yāya taṇhāya taṇhiko abhinandati, sā taṇhā vā ‘‘abhinandanā nāmā’’ti vuccatīti yojetvā attho gahetabbo."
NULL,p191,842,100,bodytext,,"‘‘Yāsu anekāsu dhātūsu vuttappakārā taṇhā ‘sarā’ti bhagavatā vuttā, katamā tā dhātuyo’’ti pucchitabbattā tā dhātuyo sarūpato dassetuṃ ‘‘cakkhudhātū’’tiādi vuttaṃ."
NULL,p191,843,100,bodytext,,"‘‘Tāsu dhātūsu katamāya dhātuyā katamā sarā patiṭṭhitā pavattā’’ti pucchitabbattā imāya dhātuyā ayaṃ sarā patiṭṭhitā pavattāti niyametvā dassetuṃ ‘‘sarāti keci rūpādhimuttā’’tiādi  vuttaṃ. Tattha kecīti sarāsaṅkhātāya rūpataṇhāya taṇhikā puggalā. Rūpādhimuttāti rūpadhātusaṅkhāte ārammaṇe adhimuttā ajjhositā. Iminā padena rūpataṇhāsaṅkhātā sarā rūpadhātuyā patiṭṭhitā pavattāti gahitā, ‘‘keci saddādhimuttā’’tiādīhipi saddataṇhāsaṅkhātādayo sarā saddadhātuyādīsu patiṭṭhitā pavattā sarāva gahitā. Keci dhammādhimuttāti ettha dhammaggahaṇena cakkhudhātusotadhātughānadhātujivhādhātukāyadhātusattaviññāṇadhātudhammadhātuyo gahitā, tasmā aṭṭhārasa dhātuyo patiṭṭhānabhāvena gahitāpi chabbidhāva gahitāti daṭṭhabbā. ‘‘Rūpādhimuttādīsu kittakāni padāni taṇhāpakkhe taṇhāya vevacanā’’ti pucchitabbattā etādisāni ettakāni padāni taṇhāpakkhe taṇhāvevacanānīti niyametvā dassetuṃ ‘‘tattha yāni cha gehasitānī’’tiādi vuttaṃ. Tatthāti tesu chasu rūpādīsu. Cha gehasitāni domanassānīti chasu rūpādīsu pavattaṃ taṇhāpemaṃ nissāya pavattāni cha domanassāni. Esa nayo sesesupi. ‘‘Cha upekkhā gehasitāpi bhagavatā vuttā, kasmā na gahitā’’ti vattabbattā ‘‘yā cha upekkhā gehasitā, ayaṃ diṭṭhipakkho’’ti vuttaṃ, diṭṭhipakkhattā na gahitāti attho."
NULL,p191,844,100,bodytext,,"38. ‘‘Kathaṃ vuttappakārā taṇhā eva gahitā’’ti vattabbattā ‘‘sāyeva patthanākārenā’’tiādi vuttaṃ. Sā vuttappakārā eva taṇhā patthanākārena pavattanato āsādipariyāyena vuttā, rūpādiārammaṇadhammesu nandanato ‘‘dhammanandī’’ti pariyāyena vuttā, rūpādiārammaṇadhammesu gilitvā pariniṭṭhapeti viya ajjhosāya tiṭṭhanato ‘‘dhammajjhosāna’’nti pariyāyena vuttā, tasmā taṇhāya vevacanāni honti."
NULL,p191,845,100,bodytext,,"Taṇhāya  vevacanāni ācariyena niddiṭṭhāni, amhehi ca ñātāni, ‘‘katamāni cittassa vevacanānī’’ti pucchitabbattā ‘‘cittaṃ mano’’tiādi vuttaṃ. ‘‘Ārammaṇaṃ cintetīti cittaṃ. Manati jānātīti mano. Vijānātīti viññāṇa’’ntiādinā attho pakaraṇesu (dha. sa. aṭṭha. 5) vuttova, tasmā amhehi na vitthārito. Vevacanāniyeva imāni imassa vevacanānīti ettakāniyeva kathayissāma. ‘‘Paññindriyaṃ paññābala’’ntiādīni paññāvevacanāni."
