id,book,par_num,level,class,title,text
NULL,p191,1188,100,bodytext,,"82. ‘‘Nandiyāvaṭṭassa nayassa samuṭṭhānabhūtā bhūmi dassitā, tassa nandiyāvaṭṭassa nayassa kattha katamā disā kittakena upaparikkhitabbā’’ti vattabbattā ‘‘veyyākaraṇesu hī’’tiādi vuttaṃ. Hi-saddo pakkhantarattho. Ye disābhūtā āhārādayo dhammā veyyākaraṇesu ‘‘kusalākusalā’’ti vuttaṃ, te disābhūtā āhārādayo dhammā duvidhena ‘‘ime akusalā dhammā saṃkilesadhammā, ime kusalā vodānadhammā’’ti duvidhena upaparikkhitabbā ālocitabbā. ‘‘Katamena duvidhenā’’ti pucchitabbattā ‘‘lokavaṭṭānusārī ca lokavivaṭṭānusārī cā’’ti vuttaṃ. ‘‘Katamaṃ vaṭṭaṃ, katamaṃ vivaṭṭa’’nti pucchitabbattā ‘‘vaṭṭaṃ nāma saṃsāro, vivaṭṭaṃ nibbāna’’nti vuttaṃ. ‘‘Saṃsārassa katamo hetū’’ti pucchitabbattā ‘‘kammakilesā hetu saṃsārassā’’ti vuttaṃ. ‘‘Katamaṃ kammaṃ nāma, cetanāyeva kammaṃ nāma kiṃ, udāhu cetasikañca phaladānasamatthāsamatthampi kammaṃ ki’’nti pucchitabbattā ‘‘tattha kamma’’ntiādi vuttaṃ. Tatthāti tesu kammakilesesu. ‘‘Taṃ kammaṃ kathaṃ kena pakārena daṭṭhabba’’nti ce vadeyya, yathā yena upacayena kataṃ kammaṃ phaladānasamatthaṃ hoti, tasmiṃ upacaye taṃ kammaṃ daṭṭhabbaṃ. ‘‘Te kilesā katamehi dhammehi niddisitabbā’’ti ce puccheyya, sabbepi kilesā catūhi vipallāsehi niddisitabbā. ‘‘Te kilesā kattha  daṭṭhabbā’’ti ce puccheyya, dasavatthuke kilesapuñje te kilesā daṭṭhabbā."
NULL,p191,1189,100,bodytext,,"‘‘Katamāni dasa vatthūnī’’ti ce puccheyya, cattāro āhārā, cattāro vipallāsā, cattāri upādānāni, cattāro yogā, cattāro ganthā, cattāro āsavā, cattāro oghā, cattāro sallā, catasso viññāṇaṭṭhitiyo, cattāri agatigamanānīti dasa vatthūnīti veditabbāni catunnaṃ kiccavasena ekattā. Ettha ca kilesānaṃ paccayo vatthukāmopi kilesopi kilesavatthu hoti purimānaṃ purimānaṃ kilesānaṃ pacchimānaṃ pacchimānaṃ kilesānaṃ paccayabhāvato."
NULL,p191,1190,100,bodytext,,"‘‘Katamo katamo katamassa katamassa vatthū’’ti pucchitabbattā ‘‘paṭhame āhāre’’tiādi vuttaṃ. Ālambitabbe paṭhame kabaḷīkārāhāre paṭhamo ‘‘rūpaṃ subha’’nti vipallāso ārammaṇakaraṇavasena pavattati. Ālambitabbe dutiye phassāhāre dutiyo ‘‘phassapaccayā vedanā sukhā’’ti vipallāso pavattati. Ālambitabbe tatiye cittāhāre tatiyo ‘‘cittaṃ nicca’’nti vipallāso pavattati, ālambitabbe catutthe manosañcetanāhāre ‘‘dhammo attā’’ti vipallāso ārammaṇakaraṇavasena pavattati. Ālambitabbe paṭhame ‘‘rūpaṃ subha’’nti vipallāso paṭhamaṃ kāmupādānaṃ ārammaṇakaraṇavasena pavattati. Sesesupi yathārahaṃ nayānusārena yojetvā attho veditabbo."
NULL,p191,1191,100,bodytext,,"83. ‘‘Tesu āhārādīsu katamo katamassa puggalassa upakkileso’’ti vattabbattā ‘‘tattha yo cā’’tiādi vuttaṃ. Tatthāti tesu āhārādīsu, taṇhācaritadiṭṭhicaritesu vā. Taṇhācaritassa rūpavedanāsu tibbacchandarāgassa uppajjanato yo ca kabaḷīkāro āhāro, yo ca phassāhāro pavattati, ime kabaḷīkārāhāraphassāhārā taṇhācaritassa puggalassa upakkilesā bhavanti. Diṭṭhicaritassa dhammacittesu balavaattaniccābhinivesassa uppajjanato yo ca manosañcetanāhāro, yo ca viññāṇāhāro pavattati, ime manosañcetanāhāraviññāṇāhārā diṭṭhicaritassa puggalassa upakkilesā bhavanti. ‘‘Tattha yo ca asubhe subha’’ntiādīsupi vuttanayānusārena attho gahetabboti. Purimānaṃ  dvinnaṃ dvinnaṃ taṇhāpadhānattā ceva taṇhāsabhāvattā ca, pacchimānaṃ dvinnaṃ dvinnaṃ diṭṭhipadhānattā ceva diṭṭhisabhāvattā cāti."
NULL,p191,1192,100,bodytext,,"84. ‘‘Katamasmiṃ paṭhamādike āhāre katamo paṭhamādiko vipallāso pavattatī’’ti pucchitabbattā ‘‘tattha kabaḷīkāre āhāre’’tiādinā nāmavasena niyametvā pubbe vuttatthameva dasseti. ‘‘Katamasmiṃ vipallāse ṭhito katamaṃ upādiyatī’’ti pucchitabbattā ‘‘paṭhame vipallāse ṭhito’’tiādi vuttaṃ. Paṭhame vipallāse ṭhito puggalo kāme yena upādānena upādiyati, idaṃ upādānaṃ ‘‘kāmupādānaṃ nāmā’’ti vuccati. Sesesu iminā nayena yojanā kātabbā."
NULL,p191,1193,100,bodytext,,"‘‘Yena kāmupādānena kāmehi puggalo saṃyujjati, ayaṃ kāmupādānadhammo ‘kāmayogo’ti vuccatī’’tiādinā yojanā kātabbā. Sesānaṃ yojanatthādayo pāḷito, aṭṭhakathāto ca pākaṭā."
NULL,p191,1194,100,bodytext,,"85. ‘‘Āhārādīsu katame katamā disā’’ti pucchitabbattā ‘‘tattha imā catasso disā’’tiādi vuttaṃ. Tattha tesu āhāracatukkādīsu dasasu catukkesu paṭhamo paṭhamo kabaḷīkārāhārādiko  paṭhamā disā, dutiyo dutiyo phassāhārādiko dutiyā disā, tatiyo tatiyo viññāṇāhārādiko tatiyā disā, catuttho catuttho manosañcetanāhārādiko catutthā disāti veditabbā."
NULL,p191,1195,100,bodytext,,"‘‘Tāsu catūsu disāsu tesu kabaḷīkārāhārādīsu dhammesu katame dhammā katamassa upakkilesā’’ti pucchitabbattā ime āhārādayo dhammā imassa puggalassa upakkilesāti vibhattāti dassetuṃ ‘‘tattha yo ca kabaḷīkāro āhāro…pe… ime diṭṭhicaritassa udattassa upakkilesā’’ti vuttaṃ. Aṭṭhakathāyaṃ pana – ‘‘kabaḷīkārāhāro āhārotiādi āhārādīsu ye yassa puggalassa upakkilesā, taṃ vibhajitvā dassetuṃ āraddha’’nti (netti. aṭṭha. 85) vuttaṃ. Dasannaṃ suttānanti ekadesabhūtānaṃ dasannaṃ suttānaṃ. Atthoti sabhāvadhammo. Saddattho hi asamānoti. ‘‘Byañjanameva nāna’’nti etena ca saddatthassa nānattaṃ dasseti."
NULL,p191,1196,100,bodytext,,"‘‘Kabaḷīkārāhārādīsu  katame āhārādayo katamena vimokkhamukhena pariññaṃ pahānaṃ gacchantī’’ti pucchitabbattā ‘‘tattha yo ca kabaḷīkāro’’tiādi vuttaṃ."
NULL,p191,1197,100,bodytext,,"Itīti evaṃ vuttappakārā. Sabbeti sabbe āhārādayo dhammā lokavaṭṭānusārino bhavanti. Teti te sabbe āhārādayo dhammā. Lokāti lokato vaṭṭato. Tīhi vimokkhamukhehi aniccānupassanādīhi niyyanti."
NULL,p191,1198,100,bodytext,,"86. Saṃkilesapakkhe disābhūtā āhāracatukkādayo dasa catukkā dhammā ācariyena niddhāretvā dassitā, amhehi ca ñātā, ‘‘vodānapakkhe katame disābhūtā dhammā’’ti pucchitabbattā vodānapakkhe disābhūte dhamme dassetuṃ ‘‘catasso paṭipadā’’tiādi vuttaṃ. Cattāro vihārāti dibbavihārā brahmavihārā ariyavihārā āneñjavihārāti cattāro vihārā. Tesu rūpāvacarasamāpattiyo dibbavihārā, catasso appamaññāyo brahmavihārā, catasso phalasamāpattiyo ariyavihārā, catasso arūpasamāpattiyo āneñjavihārācattāro acchariyā abbhutā dhammāti mānapahānaṃ ālayasamugghāto avijjāpahānaṃ bhavūpasamoti cattāro acchariyaabbhutadhammā. Cattāri adhiṭṭhānānīti saccādhiṭṭhānaṃ cāgādhiṭṭhānaṃ paññādhiṭṭhānaṃ upasamādhiṭṭhānanti cattāri adhiṭṭhānāni. Catasso samādhibhāvanāti chandasamādhibhāvanā vīriyasamādhibhāvanā cittasamādhibhāvanā vīmaṃsāsamādhibhāvanāti catasso samādhibhāvanā. Cattārosukhabhāgiyāti indriyasaṃvaro tapo bojjhaṅgo sabbūpadhipaṭinissaggoti cattāro sukhabhāgiyā. Avasesā pākaṭā."
NULL,p191,1199,100,bodytext,,"‘‘Catūsu catūsu paṭipadādīsu katamo paṭipadādiko paṭhamo satipaṭṭhānādiko bhavatī’’ti pucchitabbattā ‘‘paṭhamā paṭipadā paṭhamaṃ satipaṭṭhāna’’ntiādi vuttaṃ. ‘‘Paṭipadādayo paññāpadaṭṭhānādikā, satipaṭṭhānādayo pana satipadaṭṭhānādikā, tasmā ‘paṭhamā paṭipadā paṭhamaṃ satipaṭṭhāna’ntiādiyojanā kātabbā’’ti vattabbattā ‘‘paṭhamā paṭipadā bhāvitā bahulīkatā paṭhamaṃ satipaṭṭhānaṃ pūretī’’tiādi vuttaṃ, pūrakapūretabbabhāvato tathā yojanā kātabbāti adhippāyo. Atha  vā ‘‘bhāvitā bahulīkatā katame paṭipadādayo katame satipaṭṭhānādike pūrentī’’ti pucchitabbattā ‘‘paṭhamā paṭipadā bhāvitā bahulīkatā paṭhamaṃ satipaṭṭhānaṃ pūretī’’tiādi vuttaṃ."
NULL,p191,1200,100,bodytext,,"87. ‘‘Tesu dasasu paṭipadācatukkādīsu katame dhammā katamā disā, katame dhammā katamā disā’’ti pucchitabbattā ‘‘tattha imā catasso disā paṭhamā paṭipadā, paṭhamo satipaṭṭhāno’’tiādi vuttaṃ. Tatthāti tesu dasasu paṭipadācatukkādīsu. Imā mayā vuccamānā paṭhamā paṭipadādayo disā catasso disā bhavanti."
NULL,p191,1201,100,bodytext,,"‘‘Tesu catūsu disābhūtesu paṭipadācatukkādīsu katamo disābhūto attho katamassa puggalassa bhesajja’’nti pucchitabbattā ‘‘tattha paṭhamā paṭipadā…pe… diṭṭhicaritassa udattassa bhesajja’’nti vuttaṃ."
NULL,p191,1202,100,bodytext,,"‘‘Tesu dasasu paṭipadādicatukkesu dhammesu katamo katamo katamaṃ katamaṃ vimokkhamukha’’nti pucchitabbattā ‘‘tattha dukkhā ca paṭipadā’’tiādi vuttaṃ. Attho pana ṭīkāyaṃ vitthārena vutto pākaṭo. Saṃkilesapakkhe disābhūtā āhāracatukkādayo dasa catukkā samatikkamitabbapahātabbabhāvena niddhāritā, vodānapakkhe pana disābhūtā paṭipadācatukkādayo dasa catukkā samatikkamapahāyakabhāvena niddhāritā."
NULL,p191,1203,100,bodytext,,"‘‘Tesaṃ āhāracatukkādīnaṃ dasannaṃ catukkānaṃ samatikkamanapahānasaṅkhātaṃ yaṃ vikkīḷitañca tesaṃ paṭipadācatukkādīnaṃ dasannaṃ catukkānaṃ bhāvanāsaṅkhātaṃ yaṃ vikkīḷitañca sacchikiriyāsaṅkhātaṃ yaṃ vikkīḷitañca atthi, taṃ tividhaṃ vikkīḷitaṃ katamesaṃ puggalānaṃ vikkīḷitaṃ  bhavatī’’ti pucchitabbattā ‘‘tesaṃ vikkīḷita’’nti vuttaṃ. Atha vā ‘‘yathāvuttappakārehi vimokkhamukhehi ye buddhapaccekabuddhasāvakā vimucciṃsu, tesu buddhasseva vikkīḷitaṃ bhavati kiṃ, paccekabuddhasseva vikkīḷitaṃ bhavati kiṃ, sāvakasseva vikkīḷitaṃ bhavati kiṃ, udāhu sabbesaṃ buddhapaccekabuddhasāvakānaṃ vikkīḷitaṃ bhavati ki’’nti vicāraṇāya sambhavato ‘‘tesaṃ vikkīḷita’’nti vuttaṃ. Yathāvuttappakārehi vimokkhamukhehi ye buddhapaccekabuddhasāvakā mucciṃsu, tesaṃ buddhapaccekabuddhasāvakānaṃ vikkīḷitaṃ. Yaṃ āhāracatukkādīnaṃ dasannaṃ catukkānaṃ  saparasantāne samatikkamanapahānañca yā paṭipadācatukkādīnaṃ dasannaṃ catukkānaṃ saparasantāne bhāvanāsampādanā, sacchikiriyāsampādanā ca atthi, idaṃ sabbaṃ vikkīḷitaṃ nāma bhavatīti attho."
NULL,p191,1204,100,bodytext,,"‘‘Sabbesaṃ āhāracatukkādīnaṃ dasannaṃ catukkānaṃ sabbe paṭipadācatukkādayo dasa catukkā paṭipakkhā honti kiṃ, udāhu yathākkamaṃ catukkānaṃ catukkā paṭipakkhā honti ki’’nti vicāraṇāya sambhavato yathākkamaṃ catukkānaṃ catukkā paṭipakkhā honti pahātabbapahāyakabhāvenāti dassento ‘‘cattāro āhārā tesaṃ paṭipakkho catasso paṭipadā’’tiādimāha. Aṭṭhakathāyaṃ pana – ‘‘idāni āhārādīnaṃ paṭipadādīhi yena samatikkamanaṃ, taṃ nesaṃ paṭipakkhabhāvaṃ dassento ‘cattāro āhārā tesaṃ paṭipakkho catasso paṭipadā’tiādimāhā’’ti (netti. aṭṭha. 87) vuttaṃ. Tattha saṃkilesapakkhe cattāro ye āhārā niddhāritā, tesaṃ catunnaṃ āhārānaṃ vodānapakkhe yā catasso paṭipadā niddhāritā, tā catasso paṭipadā paṭipakkho āhārānaṃ pahātabbattā, paṭipadānaṃ pana pahāyakattā. Satipi āhārānaṃ appahātabbabhāve vipassanārammaṇattā āhārapaṭibaddhachandarāgappahānavasena pahātabbabhāvo vuttoti evamādiyojanā kātabbā."
NULL,p191,1205,100,bodytext,,"Sīhāti sīhasadisā buddhā ca sīhasadisā paccekabuddhā ca sīhasadisā sāvakā cāti sīhasadisā visuṃ visuṃ yojetabbā. Sāvakā pana ahatarāgadosamohāpi santi, tepi ‘‘sīhā’’ti maññeyyunti taṃ nivattāpanatthaṃ ‘‘hatarāgadosamohā’’ti vuttaṃ. Hanitabbāti hatā, rāgo ca doso ca moho ca rāgadosamohā, hatā rāgadosamohā etehi sāvakehīti hatarāgadosamohā, sāvakāti yojanā kātabbā sāvakānaṃyeva byabhicārasambhavatoti. Tesaṃ sīhānaṃ buddhānaṃ, tesaṃ sīhānaṃ paccekabuddhānaṃ, tesaṃ sīhānaṃ sāvakānaṃ bhāvanā vodānapakkhe bhāvitabbānaṃ bodhipakkhiyadhammānaṃ bhāvanā vaḍḍhanā ca, sacchikiriyā vodānapakkheyeva sacchikātabbānaṃ  phalanibbānānaṃ sacchikiriyā ca, byantīkiriyā saṃkilesapakkhe pahātabbānaṃ pahānasaṅkhātā byantīkiriyā ca vikkīḷitaṃ nāma bhavati."
NULL,p191,1206,100,bodytext,,"Indriyādhiṭṭhānanti  saddhindriyādīnaṃ indriyānaṃ adhiṭṭhānaṃ pavattanaṃ bhāvanā, sacchikiriyā ca. Vipariyāsānadhiṭṭhānanti vipallāsānaṃ adhiṭṭhānaṃ pahānavasena appavattanaṃ, anuppādanañca saṅkhepato vikkīḷitaṃ nāmāti gahitaṃ. Indriyāni saddhindriyādīni saddhammagocaro saddhammassa vodānapakkhassa gocaro pavattanahetūti adhippetāni. Vipariyāsā vipallāsā kilesagocaro saṃkilesapakkhassa gocaro pavattihetūti adhippetā."
NULL,p191,1207,100,bodytext,,"‘‘Cattāro āhārātiādinā saṃkilesapakkhe āhāracatukkādīnaṃ dasannaṃ catukkānaṃ taṇhācaritādīnaṃ catunnaṃ puggalānaṃ upakkilesavibhāvanāmukhena yā niddhāraṇā ācariyena katā, ‘catasso paṭipadā’tiādinā ca vodānapakkhe paṭipadācatukkādīnaṃ dasannaṃ catukkānaṃ taṇhācaritādīnaṃ catunnaṃ puggalānaṃ vodānavibhāvanāmukhena yā niddhāraṇā ācariyena katā, sā ayaṃ niddhāraṇā katamassa nayassa samuṭṭhānaṃ bhūmīti vuccatī’’ti pucchitabbattā ‘‘ayaṃ vuccati sīhavikkīḷitassa nayassa bhūmī’’ti vuttaṃ. Tattha ayanti yā ayaṃ vuttanayena dvippakārā niddhāraṇā katā, sā ayaṃ dvippakārā niddhāraṇā sīhavikkīḷitassa nayassa bhūmi pavattiṭṭhānaṃ samuṭṭhānanti nayasamuṭṭhānakosallehi puggalehi vuccatīti yojanā kātabbāti."
NULL,p191,1208,100,bodytext,,"‘‘Vuttappakārāya niddhāritāya nayassa bhūmibhāvo kasmā viññāyatī’’ti vattabbattā ‘‘tenāhā’’tiādi vuttaṃ. Tena vuttappakārāya niddhāraṇāya nayabhūmibhāvena ‘‘yo neti…pe… kusalāti cā’’ti yaṃ vacanaṃ ācariyo āha, tena vacanena viññāyatīti."
NULL,p191,1209,100,bodytext,,"Sīhavikkīḷitanayabhūmi ācariyena vibhāvitā, amhehi ca ñātā, ‘‘katamā tipukkhalanayabhūmī’’ti pucchitabbattā tipukkhalanayabhūmiṃ vibhāvetukāmo ‘‘tattha ye dukkhāya paṭipadāyā’’tiādimāha. Evaṃ sati ‘‘ayaṃ saṃkileso, tīṇi akusalamūlānī’’tiādivacanameva ācariyena vattabbaṃ, kasmā pana ‘‘tattha ye dukkhāya paṭipadāyā’’tiādivacanaṃ vattabbanti? Saccaṃ, tipukkhalanayabhūmibhāvanā pana ugghaṭitaññuādipuggalattayavasena pavattā, tasmā ugghaṭitaññuādipuggalattayaṃ vibhāvetuṃ ‘‘tattha ye dukkhāya paṭipadāyā’’tiādivacanaṃ vuttaṃ. Evamapi ‘‘tattha yo sukhāya paṭipadāya khippābhiññāya  niyyāti, ayaṃ ugghaṭitaññū’’tiādivacanameva vattabbaṃ, kasmā pana ‘‘tattha ye dukkhāya paṭipadāyā’’tiādivacanaṃ vattabbanti? Saccaṃ, ugghaṭitaññuādipuggalattayaṃ pana sīhavikkīḷitanayato tipukkhalanayassa niggacchanato nikkhamanato sīhavikkīḷitanayabhūmivibhāvanāyaṃ paṭipadāvibhāgato vibhāvitapuggalacatukkato niddhāritaṃ, sīhavikkīḷitanayabhūmivibhāvanāyaṃ paṭipadāvibhāgato vibhāvitaṃ puggalacatukkaṃ paṭhamaṃ vibhāvetuṃ ‘‘tattha ye dukkhāya paṭipadāyā’’tiādi vuttaṃ. Tatthāti yo paṭipadācatukko sīhavikkīḷitanayabhūmivibhāvanāyaṃ niddhārito, tasmiṃ paṭipadācatukke. Yeti ye dandhaudattā diṭṭhicaritapuggalā yathākkamaṃ sukhāya paṭipadāya dandhābhiññāya ca sukhāya paṭipadāya khippābhiññāya ca niyyanti, iti niyyakā dve puggalā ca niddhāritā. ‘‘Tesaṃ catunnaṃ puggalānaṃ katamo saṃkileso’’ti pucchitabbattā ‘‘tesaṃ catunnaṃ puggalānaṃ ayaṃ saṃkileso’’ti vissajjetuṃ ‘‘tesaṃ catunnaṃ puggalānaṃ ayaṃ saṃkileso’’tiādi vuttaṃ. Cattāro āhārā niddhāritā…pe… cattāri agatigamanāni niddhāritāni, iti ayaṃ dasavidho āhāracatukkādicatukko tesaṃ catunnaṃ puggalānaṃ saṃkileso hoti. Tesaṃ catunnaṃ puggalānaṃ saṃkileso ācariyena niddhārito, ‘‘katamaṃ vodāna’’nti pucchitabbattā ‘‘tesaṃ catunnaṃ puggalānaṃ idaṃ vodāna’’ntiādi vuttaṃ. Catasso paṭipadā niddhāritā, catasso appamāṇā niddhāritā, iti idaṃ dasavidhaṃ paṭipadācatukkādicatukkabhūtaṃ dhammajātaṃ tesaṃ catunnaṃ puggalānaṃ vodānaṃ hoti."
NULL,p191,1210,100,bodytext,,"88. ‘‘Tesu catūsu puggalesu katamo puggalo ugghaṭitaññū, katamo puggalo vipañcitaññū, katamo puggalo neyyo’’ti pucchitabbattā ‘‘tattha ye’’tiādi vuttaṃ. ‘‘Pubbepi ‘tattha ye’tiādinā cattāro puggalā niddhāritā, kasmā pana puna ‘‘tattha ye’tiādinā cattāro puggalā niddhāritā’’ti ce vadeyya? Pubbe saṃkilesavodānaṃ sāmibhāvena niddhāritā, pacchā pana ugghaṭitaññuādīnaṃ avayavānaṃ samūhabhāvena niddhāritāti visesattho gahetabbo. Tattha ye…pe… ime dve puggalāti ettha yojanattho heṭṭhā vuttasadisova. Tatthāti tesu catūsu puggalesu. Yoti udatto diṭṭhicarito. Ayanti ayaṃ niyato udatto diṭṭhicarito. Puna yoti udattova taṇhācarito ca mando diṭṭhicarito ca. Sādhāraṇāyāti dukkhāya paṭipadāya khippābhiññāya ca sukhāya paṭipadāya dandhābhiññāya ca."
NULL,p191,1211,100,bodytext,,"‘‘Ugghaṭitaññuādayo  tayo puggalā ācariyena niddhāritā, tesu tīsu puggalesu katamassa katamassa katamaṃ katamaṃ bhagavā upadisatī’’ti pucchitabbattā ‘‘tattha bhagavā’’tiādi vuttaṃ. Atha vā ‘‘paṭipadābhedena puggalabhedo ācariyena vibhāvito, kathaṃ desanābhedena  puggalabhedo vibhāvito’’ti vattabbattā desanābhedenapi puggalabhedaṃ vibhāvetuṃ ‘‘tattha bhagavā’’tiādi vuttaṃ. Tatthāti tesu tīsu ugghaṭitaññuādīsu puggalesu. ‘‘Samathadesanāvipassanādesanābhedeneva puggalabhedo vibhāvito’’ti vattabbattā mududhammadesanātikkhadhammadesanābhedenapi puggalabhedaṃ vibhāvetuṃ ‘‘tattha bhagavā’’tiādi vuttaṃ. Sesesupi evameva anusandhyattho vattabbo."
NULL,p191,1212,100,bodytext,,"Visuṃ visuṃ paṭipadābhedena cattāro hutvā visuṃ ca sampiṇḍitā ca paṭipadābhedena ceva desanābhedena ca tayo hontīti vibhāvetuṃ ‘‘tattha ye’’tiādiṃ puna vatvā ‘‘iti kho cattāri hutvā tīṇi bhavantī’’ti vuttaṃ. Tattha cattāri tīṇīti liṅgavipallāsaniddeso, ‘‘cattāro tayo’’ti pana pakatiliṅganiddeso kātabbova."
NULL,p191,1213,100,bodytext,,"‘‘Tesaṃ tiṇṇaṃ puggalānaṃ katamo saṃkileso’’ti pucchitabbattā ‘‘tesaṃ tiṇṇaṃ puggalānaṃ ayaṃ saṃkileso’’tiādi vuttaṃ. Tattha ayaṃ saṃkilesoti ‘‘tīṇi akusalamūlāni…pe… sīlavipatti diṭṭhivipatti ācāravipattī’’ti niddhāritānaṃ akusalānaṃ dhammānaṃ iti ayaṃ samūho saṃkileso hoti. ‘‘Tesaṃ tiṇṇaṃ puggalānaṃ saṃkileso ācariyena niddhārito, kathaṃ vodānaṃ niddhāritabba’’nti vattabbattā ‘‘tesaṃ tiṇṇaṃ puggalānaṃ idaṃ vodāna’’ntiādi vuttaṃ. Tattha idaṃ vodānanti ‘‘tīṇi kusalamūlāni…pe… tīṇi vimokkhamukhāni suññataṃ animittaṃ appaṇihita’’nti niddhāritānaṃ kusaladhammānaṃ samūhabhūtaṃ iti idaṃ dhammajātaṃ vodānaṃ hoti."
NULL,p191,1214,100,bodytext,,"‘‘Vuttappakārena cattāro hutvā tayo puggalā bhavantīti ācariyena vibhāvitā, tayo hutvā kittakā puggalā bhavantī’’ti vattabbabhāvato ‘‘iti kho cattāri hutvā tīṇi bhavanti, tīṇi hutvā dve bhavanti taṇhācarito ca diṭṭhicarito cā’’tiādi vuttaṃ. Itīti heṭṭhā vuttappakārena cattāri cattāro hutvā tīṇi tayo bhavanti. Tīṇi tayo hutvā taṇhācarito ca diṭṭhicarito cāti dve puggalā bhavanti."
NULL,p191,1215,100,bodytext,,"‘‘Tesaṃ  dvinnaṃ puggalānaṃ katamo saṃkileso’’ti vattabbabhāvato ‘‘tesaṃ dvinnaṃ puggalānaṃ ayaṃ saṃkileso’’tiādi vuttaṃ. Tattha ayaṃ saṃkilesoti ‘‘taṇhā ca avijjā ca…pe… sassatadiṭṭhi ca ucchedadiṭṭhi cā’’ti niddhāritānaṃ akusaladhammānaṃ iti ayaṃ samūho saṃkileso hoti."
NULL,p191,1216,100,bodytext,,"‘‘Tesaṃ  dvinnaṃ puggalānaṃ saṃkileso ācariyena niddhārito, kathaṃ vodāna’’nti vattabbabhāvato ‘‘tesaṃ dvinnaṃ puggalānaṃ idaṃ vodāna’’ntiādi vuttaṃ. Idaṃ vodānanti ‘‘samatho ca vipassanā ca…pe… saupādisesā ca nibbānadhātu, anupādisesā ca nibbānadhātū’’ti niddhāritānaṃ kusaladhammānaṃ samūhabhūtaṃ iti idaṃ dhammajātaṃ vodānaṃ hoti."
NULL,p191,1217,100,bodytext,,"‘‘Tīṇi akusalamūlānī’’tiādinā saṃkilesapakkhe akusalamūlatikādīnaṃ dvinnaṃ dvādasannaṃ tikānaṃ, tiṇṇaṃ ugghaṭitaññuādipuggalānaṃ saṃkilesavibhāvanāmukhena yā niddhāraṇā katā, ‘‘tīṇi kusalamūlānī’’tiādinā vodānapakkhe kusalamūlatikādīnaṃ dvinnaṃ dvādasannaṃ tikānaṃ, tiṇṇaṃ ugghaṭitaññuādipuggalānaṃ vodānavibhāvanāmukhena yā niddhāraṇā katā, ayaṃ vuttappakāraniddhāraṇā tipukkhalassa ca nayassa, aṅkusassa ca nayassa bhūmi samuṭṭhānaṃ pavattihetu nāmāti yojetvā ‘‘taṇhā ca avijjā cā’’tiādinā saṃkilesapakkhe taṇhāavijjādukādīnaṃ pannarasannaṃ dukānaṃ, dvinnaṃ taṇhācaritadiṭṭhicaritānaṃ puggalānaṃ vodānavibhāvanāmukhena yā niddhāraṇā katā, ‘‘samatho ca vipassanā cā’’tiādinā vodānapakkhe samathavipassanādukādīnaṃ ekūnavīsatidukānaṃ, dvinnaṃ taṇhācaritadiṭṭhicaritānaṃ puggalānaṃ vodānavibhāvanāmukhena yā niddhāraṇā katā, ayaṃ vuttappakārā nandiyāvaṭṭassa nayassa bhūmītipi nīharitvā yojetabbā. Puggalādhiṭṭhānavasena hi nandiyāvaṭṭanayato sīhavikkīḷitanayassa sambhavo, sīhavikkīḷitanayato ca tipukkhalanayassa sambhavo hoti. Dhammādhiṭṭhānavasena pana sīhavikkīḷitanayato tipukkhalanayassa sambhavo, tipukkhalanayato ca nandiyāvaṭṭanayassa sambhavo hoti. Tenāha aṭṭhakathāyaṃ ‘‘ante ‘taṇhā ca avijjā cā’tiādinā samathassa nayassa bhūmi dassitā. Teneva hi ‘cattāri hutvā tīṇi bhavanti, tīṇi hutvā dve bhavantī’ti vutta’’nti (netti. aṭṭha. 88)."
NULL,p191,1218,100,bodytext,,"‘‘Kasmā  pana ayaṃ vuttappakārāya niddhāraṇāya tipukkhalassa ca nayassa, aṅkusassa ca nayassa bhūmibhāvo viññāyatī’’ti vattabbabhāvato ‘‘tenāhā’’tiādi vuttaṃ. Tena yathāvuttassa niddhāraṇāya bhūmibhāvena ācariyo ‘‘yo akusale…pe… disālocanenāti cā’’ti yaṃ vacanaṃ āha, tena vacanena vuttappakārāya niddhāraṇāya tipukkhala…pe… yassa bhūmibhāvo viññāyatīti attho."
NULL,p191,1219,100,bodytext,,"‘‘Ettāvatā nayasamuṭṭhānaṃ paripuṇṇaṃ hoti, aññaṃ natthī’’ti vattabbattā ‘‘niyuttaṃ nayasamuṭṭhāna’’nti vuttaṃ. Yena yena nayasamuṭṭhānena saṃkilesapakkhe vā akusalā dhammā niddhāritā, vodānapakkhe vā kusalā dhammā niddhāritā, taṃ taṃ nayasamuṭṭhānaṃ niyuttaṃ yathārahaṃ niddhāretvā yujjitabbanti attho gahetabbo."
NULL,p191,1220,100,bodytext,,"Nayakkamena pana saṅkhepato dassayissāmi – dve puggalā, tayo puggalā, cattāro puggalāti puggalā tikoṭṭhāsā bhavanti, catudisā, chadisā, aṭṭhadisāti disāpi tikoṭṭhāsā bhavanti. Tattha dve puggalāti taṇhācarito puggalo, diṭṭhicarito puggaloti dve puggalā bhavanti. Tayo puggalāti ugghaṭitaññupuggalo, vipañcitaññupuggalo, neyyapuggaloti tayo puggalā bhavanti. Cattāro puggalāti dukkhāpaṭipadādandhābhiññādibhedena bhinnā mudindriyo taṇhācarito puggalo, mudindriyo diṭṭhicarito puggalo, tikkhindriyo taṇhācarito puggalo, tikkhindriyo diṭṭhicarito puggaloti cattāro puggalā bhavanti. Catudisāti saṃkilesapakkhe dve dve disā, vodānapakkhe dve dve disāti catudisā bhavanti. Chadisāti saṃkilesapakkhe tisso tisso disā, vodānapakkhe tisso tisso disāti chadisā bhavanti. Aṭṭhadisāti saṃkilesapakkhe catasso catasso disā, vodānapakkhe catasso catasso disāti aṭṭhadisā bhavanti. Tesu dve dve taṇhācaritadiṭṭhicarite puggale, catudisā ca nissāya nandiyāvaṭṭanayasamuṭṭhānaṃ bhavati. Tayo ugghaṭitaññuvipañcitaññuneyyapuggale ca chadisā ca nissāya tipukkhalanayasamuṭṭhānaṃ bhavati. Dukkhāpaṭipadādandhābhiññādibhedena bhinne cattāro mudindriyataṇhācaritatikkhindriyataṇhācaritamudindriyadiṭṭhicaritatikkhindriyadiṭṭhicarite puggale ca aṭṭhadisā ca nissāya sīhavikkīḷitanayasamuṭṭhānaṃ bhavati. Ekekasmiṃ nayasamuṭṭhāne vibhajite disālocanaaṅkusanayasamuṭṭhānānipi vibhajitāni bhavanti."
