id,book,par_num,level,class,title,text
NULL,p93,800,100,bodytext,,"421. Atha  kho te paribbājakā acirapakkantassa bhagavato poṭṭhapādaṃ paribbājakaṃ samantato vācā [vācāya (syā. ka.)] sannitodakena sañjhabbharimakaṃsu – ‘‘evameva panāyaṃ bhavaṃ poṭṭhapādo yaññadeva samaṇo gotamo bhāsati, taṃ tadevassa abbhanumodati – ‘evametaṃ bhagavā evametaṃ, sugatā’ti. Na kho pana mayaṃ kiñci [kañci (pī.)] samaṇassa gotamassa ekaṃsikaṃ dhammaṃ desitaṃ ājānāma – ‘sassato loko’ti vā, ‘asassato loko’ti vā, ‘antavā loko’ti vā, ‘anantavā loko’ti vā, ‘taṃ jīvaṃ taṃ sarīra’nti vā, ‘aññaṃ jīvaṃ aññaṃ sarīra’nti vā, ‘hoti tathāgato paraṃ maraṇā’ti vā, ‘na hoti tathāgato paraṃ maraṇā’ti  vā, ‘hoti ca na ca hoti tathāgato paraṃ maraṇā’ti vā, ‘neva hoti na na hoti tathāgato paraṃ maraṇā’ti vā’’ti."
NULL,p93,801,100,bodytext,,"Evaṃ vutte poṭṭhapādo paribbājako te paribbājake etadavoca – ‘‘ahampi kho, bho, na kiñci samaṇassa gotamassa ekaṃsikaṃ dhammaṃ desitaṃ ājānāmi – ‘sassato loko’ti vā, ‘asassato loko’ti vā…pe… ‘neva hoti na na hoti tathāgato paraṃ maraṇā’ti vā; api ca samaṇo gotamo bhūtaṃ tacchaṃ tathaṃ paṭipadaṃ paññapeti dhammaṭṭhitataṃ dhammaniyāmataṃ. Bhūtaṃ kho pana tacchaṃ tathaṃ paṭipadaṃ paññapentassa dhammaṭṭhitataṃ dhammaniyāmataṃ, kathañhi nāma mādiso viññū samaṇassa gotamassa subhāsitaṃ subhāsitato nābbhanumodeyyā’’ti?"
NULL,p93,802,4,subhead,Cittahatthisāriputtapoṭṭhapādavatthu,Cittahatthisāriputtapoṭṭhapādavatthu
NULL,p93,803,100,bodytext,,"422. Atha kho dvīhatīhassa accayena citto ca hatthisāriputto poṭṭhapādo ca paribbājako yena bhagavā tenupasaṅkamiṃsu; upasaṅkamitvā citto hatthisāriputto bhagavantaṃ abhivādetvā ekamantaṃ nisīdi. Poṭṭhapādo  pana paribbājako bhagavatā saddhiṃ sammodi. Sammodanīyaṃ kathaṃ sāraṇīyaṃ vītisāretvā ekamantaṃ nisīdi. Ekamantaṃ nisinno kho poṭṭhapādo paribbājako bhagavantaṃ etadavoca – ‘‘tadā maṃ, bhante, te paribbājakā acirapakkantassa bhagavato samantato vācāsannitodakena sañjhabbharimakaṃsu – ‘evameva panāyaṃ bhavaṃ poṭṭhapādo yaññadeva samaṇo  gotamo bhāsati, taṃ tadevassa abbhanumodati – ‘evametaṃ bhagavā evametaṃ sugatā’’ti. Na kho pana mayaṃ kiñci samaṇassa gotamassa ekaṃsikaṃ dhammaṃ desitaṃ ājānāma – ‘‘sassato loko’’ti vā, ‘‘asassato loko’’ti vā, ‘‘antavā loko’’ti vā, ‘‘anantavā loko’’ti vā, ‘‘taṃ jīvaṃ taṃ sarīra’’nti vā, ‘‘aññaṃ jīvaṃ aññaṃ sarīra’’nti vā, ‘‘hoti tathāgato paraṃ maraṇā’’ti vā, ‘‘na hoti tathāgato paraṃ maraṇā’’ti vā, ‘‘hoti ca na ca hoti tathāgato  paraṃ maraṇā’’ti vā, ‘‘neva hoti na na hoti tathāgato paraṃ maraṇā’’ti vā’ti. Evaṃ vuttāhaṃ, bhante, te paribbājake etadavocaṃ – ‘ahampi kho, bho, na kiñci samaṇassa gotamassa ekaṃsikaṃ dhammaṃ desitaṃ ājānāmi – ‘‘sassato loko’’ti vā, ‘‘asassato loko’’ti vā…pe… ‘‘neva hoti na na hoti tathāgato paraṃ maraṇā’’ti vā; api ca samaṇo gotamo bhūtaṃ tacchaṃ tathaṃ paṭipadaṃ paññapeti dhammaṭṭhitataṃ dhammaniyāmataṃ. Bhūtaṃ  kho pana tacchaṃ tathaṃ paṭipadaṃ paññapentassa dhammaṭṭhitataṃ dhammaniyāmataṃ, kathañhi nāma mādiso viññū samaṇassa gotamassa subhāsitaṃ subhāsitato nābbhanumodeyyā’’ti?"
NULL,p93,804,100,bodytext,,"423. ‘‘Sabbeva kho ete, poṭṭhapāda, paribbājakā andhā acakkhukā; tvaṃyeva nesaṃ eko cakkhumā. Ekaṃsikāpi hi kho, poṭṭhapāda, mayā dhammā desitā paññattā; anekaṃsikāpi hi kho, poṭṭhapāda, mayā dhammā desitā paññattā."
NULL,p93,805,100,bodytext,,"‘‘Katame ca te, poṭṭhapāda, mayā anekaṃsikā dhammā desitā paññattā? ‘Sassato loko’ti [lokoti vā (sī. ka.)] kho, poṭṭhapāda, mayā anekaṃsiko dhammo desito paññatto; ‘asassato loko’ti [lokoti vā (sī. ka.)] kho, poṭṭhapāda, mayā anekaṃsiko dhammo desito paññatto; ‘antavā loko’ti [lokoti vā (sī. ka.)] kho poṭṭhapāda…pe… ‘anantavā loko’ti [lokoti vā (sī. ka.)] kho poṭṭhapāda… ‘taṃ jīvaṃ taṃ sarīra’nti kho poṭṭhapāda… ‘aññaṃ jīvaṃ aññaṃ sarīra’nti kho poṭṭhapāda… ‘hoti tathāgato paraṃ maraṇā’ti kho poṭṭhapāda… na hoti tathāgato paraṃ maraṇā’ti kho poṭṭhapāda… ‘hoti ca na ca hoti tathāgato paraṃ maraṇā’ti kho poṭṭhapāda… ‘neva  hoti na na hoti tathāgato paraṃ maraṇā’ti kho, poṭṭhapāda, mayā anekaṃsiko dhammo desito paññatto."
NULL,p93,806,100,bodytext,,"‘‘Kasmā ca te, poṭṭhapāda, mayā anekaṃsikā dhammā desitā paññattā? Na hete, poṭṭhapāda, atthasaṃhitā na dhammasaṃhitā na ādibrahmacariyakā na nibbidāya na virāgāya na nirodhāya na upasamāya na abhiññāya na sambodhāya na nibbānāya saṃvattanti. Tasmā te mayā anekaṃsikā dhammā desitā paññattā’’."
NULL,p93,807,4,subhead,Ekaṃsikadhammo,Ekaṃsikadhammo
NULL,p93,808,100,bodytext,,"424. ‘‘Katame ca te, poṭṭhapāda, mayā ekaṃsikā dhammā desitā paññattā? Idaṃ dukkhanti kho, poṭṭhapāda, mayā ekaṃsiko  dhammo desito paññatto. Ayaṃ dukkhasamudayoti kho, poṭṭhapāda, mayā ekaṃsiko dhammo desito paññatto. Ayaṃ dukkhanirodhoti kho, poṭṭhapāda, mayā ekaṃsiko dhammo desito paññatto. Ayaṃ dukkhanirodhagāminī paṭipadāti kho, poṭṭhapāda, mayā ekaṃsiko dhammo desito paññatto."
NULL,p93,809,100,bodytext,,"‘‘Kasmā ca te, poṭṭhapāda, mayā ekaṃsikā dhammā desitā paññattā? Ete, poṭṭhapāda, atthasaṃhitā, ete dhammasaṃhitā, ete ādibrahmacariyakā ete nibbidāya virāgāya nirodhāya upasamāya abhiññāya sambodhāya nibbānāya saṃvattanti. Tasmā te mayā ekaṃsikā dhammā desitā paññattā."
NULL,p93,810,100,bodytext,,"425. ‘‘Santi, poṭṭhapāda, eke samaṇabrāhmaṇā evaṃvādino evaṃdiṭṭhino – ‘ekantasukhī attā hoti arogo paraṃ maraṇā’ti. Tyāhaṃ upasaṅkamitvā evaṃ vadāmi – ‘saccaṃ kira tumhe āyasmanto evaṃvādino evaṃdiṭṭhino – ‘‘ekantasukhī attā hoti arogo paraṃ maraṇā’ti? Te ce me evaṃ puṭṭhā ‘āmā’ti paṭijānanti. Tyāhaṃ evaṃ vadāmi – ‘api pana tumhe āyasmanto ekantasukhaṃ lokaṃ jānaṃ passaṃ viharathā’ti? Iti puṭṭhā ‘no’ti vadanti."
NULL,p93,811,100,bodytext,,"‘‘Tyāhaṃ evaṃ vadāmi – ‘api pana tumhe āyasmanto ekaṃ vā rattiṃ ekaṃ vā divasaṃ upaḍḍhaṃ vā rattiṃ upaḍḍhaṃ vā divasaṃ ekantasukhiṃ attānaṃ sañjānāthā’ti [sampajānāthāti (sī. syā. ka.)]? Iti puṭṭhā ‘no’ti vadanti. Tyāhaṃ evaṃ vadāmi – ‘api pana tumhe āyasmanto  jānātha – ‘‘ayaṃ maggo ayaṃ paṭipadā ekantasukhassa lokassa sacchikiriyāyā’’’ti? Iti puṭṭhā ‘no’ti vadanti."
NULL,p93,812,100,bodytext,,"‘‘Tyāhaṃ evaṃ vadāmi – ‘api pana tumhe āyasmanto yā tā devatā ekantasukhaṃ lokaṃ upapannā, tāsaṃ bhāsamānānaṃ saddaṃ suṇātha – ‘‘suppaṭipannāttha, mārisā, ujuppaṭipannāttha, mārisā, ekantasukhassa lokassa sacchikiriyāya; mayampi hi, mārisā, evaṃpaṭipannā ekantasukhaṃ lokaṃ upapannā’ti? Iti puṭṭhā ‘no’ti vadanti."
NULL,p93,813,100,bodytext,,"‘‘Taṃ kiṃ maññasi, poṭṭhapāda, nanu evaṃ sante tesaṃ samaṇabrāhmaṇānaṃ appāṭihīrakataṃ bhāsitaṃ sampajjatī’’ti? ‘‘Addhā kho, bhante, evaṃ sante tesaṃ samaṇabrāhmaṇānaṃ appāṭihīrakataṃ bhāsitaṃ sampajjatī’’ti."
NULL,p93,814,100,bodytext,,"426. ‘‘Seyyathāpi, poṭṭhapāda, puriso evaṃ vadeyya – ‘ahaṃ yā imasmiṃ janapade janapadakalyāṇī, taṃ icchāmi taṃ kāmemī’ti. Tamenaṃ evaṃ vadeyyuṃ – ‘ambho purisa, yaṃ tvaṃ janapadakalyāṇiṃ icchasi kāmesi, jānāsi taṃ janapadakalyāṇiṃ khattiyī vā brāhmaṇī vā vessī vā suddī vā’ti? Iti puṭṭho ‘no’ti vadeyya. Tamenaṃ evaṃ vadeyyuṃ – ‘ambho purisa, yaṃ tvaṃ janapadakalyāṇiṃ icchasi kāmesi, jānāsi taṃ janapadakalyāṇiṃ evaṃnāmā evaṃgottāti vā, dīghā vā rassā vā majjhimā vā kāḷī vā sāmā vā maṅguracchavī vāti, amukasmiṃ gāme vā nigame vā nagare vā’ti? Iti puṭṭho ‘no’ti vadeyya. Tamenaṃ evaṃ vadeyyuṃ – ‘ambho purisa, yaṃ tvaṃ na jānāsi na passasi, taṃ tvaṃ icchasi kāmesī’ti? Iti puṭṭho ‘āmā’ti vadeyya."
NULL,p93,815,100,bodytext,,"‘‘Taṃ kiṃ maññasi, poṭṭhapāda, nanu evaṃ sante tassa purisassa appāṭihīrakataṃ bhāsitaṃ sampajjatī’’ti? ‘‘Addhā kho, bhante, evaṃ sante tassa purisassa appāṭihīrakataṃ bhāsitaṃ sampajjatī’’ti."
NULL,p93,816,100,bodytext,,"‘‘Evameva kho, poṭṭhapāda, ye te samaṇabrāhmaṇā evaṃvādino evaṃdiṭṭhino – ‘ekantasukhī attā hoti arogo paraṃ maraṇā’ti. Tyāhaṃ upasaṅkamitvā evaṃ vadāmi – ‘saccaṃ kira tumhe āyasmanto evaṃvādino evaṃdiṭṭhino  – ‘‘ekantasukhī attā hoti arogo paraṃ maraṇā’’’ti? Te ce me evaṃ puṭṭhā ‘āmā’ti paṭijānanti. Tyāhaṃ evaṃ vadāmi – ‘api pana tumhe āyasmanto ekantasukhaṃ lokaṃ jānaṃ passaṃ viharathā’ti? Iti  puṭṭhā ‘no’ti vadanti."
NULL,p93,817,100,bodytext,,"‘‘Tyāhaṃ evaṃ vadāmi – ‘api pana tumhe āyasmanto ekaṃ vā rattiṃ ekaṃ vā divasaṃ upaḍḍhaṃ vā rattiṃ upaḍḍhaṃ vā divasaṃ ekantasukhiṃ attānaṃ sañjānāthā’ti? Iti puṭṭhā ‘no’ti vadanti. Tyāhaṃ evaṃ vadāmi – ‘api pana tumhe āyasmanto jānātha – ‘‘ayaṃ maggo ayaṃ paṭipadā ekantasukhassa lokassa sacchikiriyāyā’ti? Iti puṭṭhā ‘no’ti vadanti."
NULL,p93,818,100,bodytext,,"‘‘Tyāhaṃ evaṃ vadāmi – ‘api pana tumhe āyasmanto yā tā devatā ekantasukhaṃ lokaṃ upapannā, tāsaṃ bhāsamānānaṃ saddaṃ suṇātha – ‘‘suppaṭipannāttha, mārisā, ujuppaṭipannāttha, mārisā, ekantasukhassa lokassa sacchikiriyāya; mayampi hi, mārisā, evaṃpaṭipannā ekantasukhaṃ lokaṃ upapannā’’’ti? Iti puṭṭhā ‘no’ti vadanti."
NULL,p93,819,100,bodytext,,"‘‘Taṃ kiṃ maññasi, poṭṭhapāda, nanu evaṃ sante tesaṃ samaṇabrāhmaṇānaṃ appāṭihīrakataṃ bhāsitaṃ  sampajjatī’’ti? ‘‘Addhā kho, bhante, evaṃ sante tesaṃ samaṇabrāhmaṇānaṃ appāṭihīrakataṃ bhāsitaṃ sampajjatī’’ti."
NULL,p93,820,100,bodytext,,"427. ‘‘Seyyathāpi, poṭṭhapāda, puriso cātumahāpathe nisseṇiṃ kareyya pāsādassa ārohaṇāya. Tamenaṃ evaṃ vadeyyuṃ – ‘ambho purisa, yassa tvaṃ [yaṃ tvaṃ (sī. ka.)] pāsādassa ārohaṇāya nisseṇiṃ karosi, jānāsi taṃ pāsādaṃ puratthimāya vā disāya dakkhiṇāya vā disāya pacchimāya vā disāya uttarāya vā disāya ucco vā nīco vā majjhimo vā’ti? Iti puṭṭho ‘no’ti vadeyya. Tamenaṃ evaṃ vadeyyuṃ – ‘ambho purisa, yaṃ tvaṃ na jānāsi na passasi, tassa tvaṃ pāsādassa ārohaṇāya nisseṇiṃ karosī’ti? Iti puṭṭho ‘āmā’ti vadeyya."
NULL,p93,821,100,bodytext,,"‘‘Taṃ kiṃ maññasi, poṭṭhapāda, nanu evaṃ sante tassa purisassa appāṭihīrakataṃ bhāsitaṃ sampajjatī’’ti? ‘‘Addhā kho, bhante, evaṃ sante tassa purisassa appāṭihīrakataṃ bhāsitaṃ sampajjatī’’ti."
NULL,p93,822,100,bodytext,,"‘‘Evameva  kho, poṭṭhapāda, ye te samaṇabrāhmaṇā evaṃvādino evaṃdiṭṭhino – ‘ekantasukhī attā hoti arogo paraṃ maraṇā’ti. Tyāhaṃ upasaṅkamitvā evaṃ vadāmi – ‘saccaṃ kira tumhe āyasmanto evaṃvādino evaṃdiṭṭhino – ‘‘ekantasukhī attā hoti arogo paraṃ maraṇā’ti? Te ce me evaṃ puṭṭhā ‘āmā’ti paṭijānanti. Tyāhaṃ evaṃ vadāmi – ‘api pana tumhe āyasmanto ekantasukhaṃ lokaṃ jānaṃ passaṃ viharathā’ti? Iti puṭṭhā ‘no’ti vadanti."
NULL,p93,823,100,bodytext,,"‘‘Tyāhaṃ evaṃ vadāmi – ‘api pana tumhe āyasmanto ekaṃ  vā rattiṃ ekaṃ vā divasaṃ upaḍḍhaṃ vā rattiṃ upaḍḍhaṃ vā divasaṃ ekantasukhiṃ attānaṃ sañjānāthā’ti? Iti puṭṭhā ‘no’ti vadanti. Tyāhaṃ evaṃ vadāmi – ‘api pana tumhe āyasmanto jānātha ayaṃ maggo ayaṃ paṭipadā ekantasukhassa lokassa sacchikiriyāyā’ti? Iti puṭṭhā ‘no’ti vadanti."
NULL,p93,824,100,bodytext,,"‘‘Tyāhaṃ evaṃ vadāmi – ‘api pana tumhe āyasmanto yā tā devatā ekantasukhaṃ lokaṃ upapannā’ tāsaṃ devatānaṃ bhāsamānānaṃ saddaṃ suṇātha- ‘‘suppaṭipannāttha, mārisā, ujuppaṭipannāttha, mārisā, ekantasukhassa lokassa sacchikiriyāya; mayampi hi, mārisā, evaṃ paṭipannā ekantasukhaṃ lokaṃ upapannā’ti? Iti puṭṭhā ‘‘no’’ti vadanti."
NULL,p93,825,100,bodytext,,"‘‘Taṃ kiṃ maññasi, poṭṭhapāda, nanu evaṃ sante tesaṃ samaṇabrāhmaṇānaṃ appāṭihīrakataṃ bhāsitaṃ sampajjatī’’ti? ‘‘Addhā kho, bhante, evaṃ sante tesaṃ samaṇabrāhmaṇānaṃ appāṭihīrakataṃ bhāsitaṃ sampajjatī’’ti."
NULL,p93,826,4,subhead,"Tayo attapaṭilābhā","Tayo attapaṭilābhā"
NULL,p93,827,100,bodytext,,"428. ‘‘Tayo kho me, poṭṭhapāda, attapaṭilābhā – oḷāriko attapaṭilābho, manomayo attapaṭilābho, arūpo attapaṭilābho. Katamo ca, poṭṭhapāda, oḷāriko attapaṭilābho? Rūpī cātumahābhūtiko kabaḷīkārāhārabhakkho [kabaḷīkārabhakkho (syā. ka.)], ayaṃ oḷāriko attapaṭilābho. Katamo manomayo attapaṭilābho? Rūpī manomayo sabbaṅgapaccaṅgī ahīnindriyo, ayaṃ manomayo attapaṭilābho. Katamo arūpo attapaṭilābho? Arūpī saññāmayo, ayaṃ arūpo attapaṭilābho."
NULL,p93,828,100,bodytext,,"429. ‘‘Oḷārikassapi  kho ahaṃ, poṭṭhapāda, attapaṭilābhassa pahānāya  dhammaṃ desemi – yathāpaṭipannānaṃ vo saṃkilesikā dhammā pahīyissanti, vodāniyā dhammā abhivaḍḍhissanti, paññāpāripūriṃ vepullattañca diṭṭheva dhamme sayaṃ abhiññā sacchikatvā upasampajja viharissathāti. Siyā kho pana te, poṭṭhapāda, evamassa – saṃkilesikā dhammā pahīyissanti, vodāniyā dhammā abhivaḍḍhissanti, paññāpāripūriṃ vepullattañca diṭṭheva  dhamme sayaṃ abhiññā sacchikatvā upasampajja viharissati, dukkho ca kho vihāroti, na kho panetaṃ, poṭṭhapāda, evaṃ daṭṭhabbaṃ. Saṃkilesikā ceva dhammā pahīyissanti, vodāniyā ca dhammā abhivaḍḍhissanti, paññāpāripūriṃ vepullattañca diṭṭheva dhamme sayaṃ abhiññā sacchikatvā upasampajja viharissati, pāmujjaṃ ceva bhavissati pīti ca passaddhi ca sati ca sampajaññañca sukho ca vihāro."
NULL,p93,829,100,bodytext,,"430. ‘‘Manomayassapi kho ahaṃ, poṭṭhapāda, attapaṭilābhassa pahānāya dhammaṃ desemi yathāpaṭipannānaṃ vo saṃkilesikā dhammā pahīyissanti, vodāniyā dhammā abhivaḍḍhissanti, paññāpāripūriṃ vepullattañca diṭṭheva dhamme sayaṃ abhiññā sacchikatvā upasampajja viharissathāti. Siyā kho pana te, poṭṭhapāda, evamassa – ‘saṃkilesikā dhammā pahīyissanti, vodāniyā dhammā abhivaḍḍhissanti, paññāpāripūriṃ vepullattañca diṭṭheva dhamme sayaṃ abhiññā sacchikatvā upasampajja viharissati, dukkho ca kho vihāro’ti, na kho panetaṃ, poṭṭhapāda, evaṃ daṭṭhabbaṃ. Saṃkilesikā ceva dhammā pahīyissanti, vodāniyā ca dhammā abhivaḍḍhissanti, paññāpāripūriṃ vepullattañca diṭṭheva dhamme sayaṃ abhiññā sacchikatvā upasampajja viharissati, pāmujjaṃ ceva bhavissati pīti ca passaddhi ca sati ca sampajaññañca sukho ca vihāro."
NULL,p93,830,100,bodytext,,"431. ‘‘Arūpassapi kho ahaṃ, poṭṭhapāda, attapaṭilābhassa pahānāya dhammaṃ desemi yathāpaṭipannānaṃ vo saṃkilesikā dhammā pahīyissanti, vodāniyā dhammā abhivaḍḍhissanti, paññāpāripūriṃ vepullattañca diṭṭheva dhamme sayaṃ abhiññā sacchikatvā upasampajja viharissathāti. Siyā kho pana te, poṭṭhapāda, evamassa – ‘saṃkilesikā dhammā pahīyissanti, vodāniyā dhammā abhivaḍḍhissanti, paññāpāripūriṃ vepullattañca diṭṭheva dhamme sayaṃ abhiññā sacchikatvā upasampajja viharissati, dukkho ca kho vihāro’ti, na kho panetaṃ, poṭṭhapāda, evaṃ daṭṭhabbaṃ. Saṃkilesikā ceva dhammā pahīyissanti, vodāniyā ca dhammā abhivaḍḍhissanti, paññāpāripūriṃ vepullattañca diṭṭheva dhamme sayaṃ abhiññā sacchikatvā upasampajja viharissati, pāmujjaṃ ceva bhavissati pīti ca passaddhi ca sati ca sampajaññañca sukho ca vihāro."
NULL,p93,831,100,bodytext,,"432. ‘‘Pare ce, poṭṭhapāda, amhe evaṃ puccheyyuṃ – ‘katamo pana so, āvuso, oḷāriko attapaṭilābho, yassa tumhe pahānāya dhammaṃ desetha, yathāpaṭipannānaṃ vo saṃkilesikā dhammā pahīyissanti, vodāniyā dhammā abhivaḍḍhissanti, paññāpāripūriṃ vepullattañca diṭṭheva dhamme sayaṃ abhiññā sacchikatvā upasampajja viharissathā’ti, tesaṃ mayaṃ evaṃ puṭṭhā evaṃ byākareyyāma – ‘ayaṃ vā so, āvuso, oḷāriko attapaṭilābho, yassa mayaṃ pahānāya dhammaṃ desema, yathāpaṭipannānaṃ vo saṃkilesikā dhammā pahīyissanti, vodāniyā dhammā abhivaḍḍhissanti, paññāpāripūriṃ vepullattañca diṭṭheva dhamme sayaṃ abhiññā sacchikatvā upasampajja viharissathā’ti."
NULL,p93,832,100,bodytext,,"433. ‘‘Pare ce, poṭṭhapāda, amhe evaṃ puccheyyuṃ – ‘katamo pana so, āvuso, manomayo attapaṭilābho, yassa tumhe pahānāya dhammaṃ desetha, yathāpaṭipannānaṃ vo saṃkilesikā dhammā  pahīyissanti, vodāniyā dhammā abhivaḍḍhissanti, paññāpāripūriṃ vepullattañca diṭṭheva dhamme sayaṃ abhiññā sacchikatvā upasampajja viharissathā’ti? Tesaṃ mayaṃ evaṃ puṭṭhā evaṃ byākareyyāma – ‘ayaṃ vā so, āvuso, manomayo attapaṭilābho yassa mayaṃ pahānāya dhammaṃ desema, yathāpaṭipannānaṃ vo saṃkilesikā dhammā pahīyissanti, vodāniyā dhammā abhivaḍḍhissanti, paññāpāripūriṃ vepullattañca diṭṭheva dhamme sayaṃ abhiññā sacchikatvā upasampajja viharissathā’ti."
NULL,p93,833,100,bodytext,,"434. ‘‘Pare ce, poṭṭhapāda, amhe evaṃ puccheyyuṃ – ‘katamo pana so, āvuso, arūpo attapaṭilābho, yassa tumhe pahānāya dhammaṃ desetha, yathāpaṭipannānaṃ vo saṃkilesikā dhammā pahīyissanti, vodāniyā dhammā abhivaḍḍhissanti, paññāpāripūriṃ vepullattañca diṭṭheva dhamme sayaṃ abhiññā sacchikatvā upasampajja viharissathā’ti, tesaṃ mayaṃ evaṃ puṭṭhā  evaṃ byākareyyāma – ‘ayaṃ vā so, āvuso, arūpo attapaṭilābho yassa mayaṃ pahānāya dhammaṃ desema, yathāpaṭipannānaṃ vo saṃkilesikā dhammā pahīyissanti, vodāniyā dhammā abhivaḍḍhissanti, paññāpāripūriṃ vepullattañca diṭṭheva dhamme sayaṃ abhiññā sacchikatvā upasampajja viharissathā’ti."
NULL,p93,834,100,bodytext,,"‘‘Taṃ kiṃ maññasi, poṭṭhapāda, nanu evaṃ sante sappāṭihīrakataṃ bhāsitaṃ sampajjatī’’ti? ‘‘Addhā kho, bhante, evaṃ sante sappāṭihīrakataṃ bhāsitaṃ sampajjatī’’ti."
NULL,p93,835,100,bodytext,,"435. ‘‘Seyyathāpi, poṭṭhapāda, puriso nisseṇiṃ kareyya pāsādassa ārohaṇāya tasseva pāsādassa heṭṭhā. Tamenaṃ evaṃ vadeyyuṃ – ‘ambho purisa, yassa tvaṃ pāsādassa ārohaṇāya nisseṇiṃ karosi, jānāsi taṃ pāsādaṃ, puratthimāya vā disāya dakkhiṇāya vā disāya pacchimāya vā disāya uttarāya vā disāya ucco vā nīco vā majjhimo vā’ti? So evaṃ vadeyya – ‘ayaṃ vā so, āvuso, pāsādo, yassāhaṃ ārohaṇāya nisseṇiṃ karomi, tasseva pāsādassa heṭṭhā’ti."
NULL,p93,836,100,bodytext,,"‘‘Taṃ kiṃ maññasi, poṭṭhapāda, nanu evaṃ sante tassa purisassa sappāṭihīrakataṃ bhāsitaṃ sampajjatī’’ti? ‘‘Addhā kho, bhante, evaṃ sante tassa purisassa sappāṭihīrakataṃ bhāsitaṃ sampajjatī’’ti."
NULL,p93,837,100,bodytext,,"436. ‘‘Evameva  kho, poṭṭhapāda, pare ce amhe evaṃ puccheyyuṃ – ‘katamo pana so, āvuso, oḷāriko attapaṭilābho…pe… katamo pana so, āvuso, manomayo attapaṭilābho…pe… katamo pana so, āvuso, arūpo attapaṭilābho, yassa tumhe pahānāya dhammaṃ desetha, yathāpaṭipannānaṃ vo saṃkilesikā dhammā pahīyissanti, vodāniyā dhammā abhivaḍḍhissanti, paññāpāripūriṃ vepullattañca diṭṭheva dhamme sayaṃ abhiññā sacchikatvā upasampajja viharissathā’ti, tesaṃ mayaṃ evaṃ puṭṭhā evaṃ byākareyyāma – ‘ayaṃ vā so, āvuso, arūpo attapaṭilābho, yassa mayaṃ pahānāya dhammaṃ desema, yathāpaṭipannānaṃ vo saṃkilesikā dhammā pahīyissanti, vodāniyā dhammā abhivaḍḍhissanti, paññāpāripūriṃ  vepullattañca diṭṭheva dhamme sayaṃ abhiññā sacchikatvā upasampajja viharissathā’ti."
NULL,p93,838,100,bodytext,,"‘‘Taṃ kiṃ maññasi, poṭṭhapāda, nanu evaṃ sante sappāṭihīrakataṃ bhāsitaṃ sampajjatī’’ti? ‘‘Addhā kho, bhante, evaṃ sante sappāṭihīrakataṃ bhāsitaṃ sampajjatī’’ti."
NULL,p93,839,100,bodytext,,"437. Evaṃ vutte citto hatthisāriputto bhagavantaṃ etadavoca – ‘‘yasmiṃ, bhante, samaye oḷāriko attapaṭilābho hoti, moghassa tasmiṃ samaye manomayo attapaṭilābho hoti, mogho arūpo attapaṭilābho hoti; oḷāriko vāssa attapaṭilābho tasmiṃ samaye sacco hoti. Yasmiṃ, bhante, samaye manomayo attapaṭilābho hoti, moghassa tasmiṃ samaye oḷāriko attapaṭilābho hoti, mogho arūpo attapaṭilābho hoti; manomayo vāssa attapaṭilābho tasmiṃ samaye sacco hoti. Yasmiṃ, bhante, samaye arūpo attapaṭilābho hoti, moghassa tasmiṃ samaye oḷāriko attapaṭilābho hoti, mogho manomayo attapaṭilābho hoti; arūpo vāssa attapaṭilābho tasmiṃ samaye sacco hotī’’ti."
NULL,p93,840,100,bodytext,,"‘‘Yasmiṃ, citta, samaye oḷāriko attapaṭilābho hoti, neva tasmiṃ samaye manomayo attapaṭilābhoti saṅkhaṃ  gacchati, na arūpo attapaṭilābhoti saṅkhaṃ gacchati; oḷāriko attapaṭilābhotveva tasmiṃ samaye saṅkhaṃ gacchati. Yasmiṃ, citta, samaye manomayo attapaṭilābho hoti, neva tasmiṃ samaye oḷāriko attapaṭilābhoti saṅkhaṃ gacchati, na arūpo attapaṭilābhoti saṅkhaṃ gacchati; manomayo attapaṭilābhotveva tasmiṃ samaye saṅkhaṃ gacchati. Yasmiṃ, citta, samaye arūpo attapaṭilābho hoti, neva tasmiṃ samaye oḷāriko attapaṭilābhoti saṅkhaṃ gacchati, na manomayo attapaṭilābhoti saṅkhaṃ gacchati; arūpo attapaṭilābhotveva tasmiṃ samaye saṅkhaṃ gacchati."
NULL,p93,841,100,bodytext,,"438. ‘‘Sace  taṃ, citta, evaṃ puccheyyuṃ – ‘ahosi tvaṃ atītamaddhānaṃ, na tvaṃ nāhosi; bhavissasi tvaṃ anāgatamaddhānaṃ, na tvaṃ na bhavissasi; atthi tvaṃ  etarahi, na tvaṃ natthī’ti, evaṃ puṭṭho tvaṃ, citta, kinti byākareyyāsī’’ti?"
NULL,p93,842,100,bodytext,,"‘‘Sace maṃ, bhante, evaṃ puccheyyuṃ – ‘ahosi tvaṃ atītamaddhānaṃ, na tvaṃ na ahosi; bhavissasi tvaṃ anāgatamaddhānaṃ, na tvaṃ na bhavissasi; atthi tvaṃ etarahi, na tvaṃ natthī’ti. Evaṃ puṭṭho ahaṃ, bhante, evaṃ byākareyyaṃ – ‘ahosāhaṃ atītamaddhānaṃ, nāhaṃ na ahosiṃ; bhavissāmahaṃ anāgatamaddhānaṃ, nāhaṃ na bhavissāmi; atthāhaṃ etarahi, nāhaṃ natthī’ti. Evaṃ puṭṭho ahaṃ, bhante, evaṃ byākareyya’’nti."
NULL,p93,843,100,bodytext,,"‘‘Sace pana taṃ, citta, evaṃ puccheyyuṃ – ‘yo te ahosi atīto attapaṭilābho, sova [sveva (sī. pī.), soyeva (syā.)] te attapaṭilābho sacco, mogho anāgato, mogho paccuppanno? Yo [yo vā (pī.)] te bhavissati anāgato attapaṭilābho, sova  te attapaṭilābho sacco, mogho atīto, mogho paccuppanno? Yo [yo vā (pī.)] te etarahi paccuppanno attapaṭilābho, sova [so ca (ka.)] te attapaṭilābho sacco, mogho atīto, mogho anāgato’ti. Evaṃ puṭṭho tvaṃ, citta, kinti byākareyyāsī’’ti?"
NULL,p93,844,100,bodytext,,"‘‘Sace pana maṃ, bhante, evaṃ puccheyyuṃ – ‘yo te ahosi  atīto attapaṭilābho, sova te attapaṭilābho sacco, mogho anāgato, mogho paccuppanno. Yo te bhavissati anāgato attapaṭilābho, sova te attapaṭilābho sacco, mogho atīto, mogho paccuppanno. Yo te etarahi paccuppanno attapaṭilābho, sova te attapaṭilābho sacco, mogho atīto, mogho anāgato’ti. Evaṃ puṭṭho ahaṃ, bhante, evaṃ byākareyyaṃ – ‘yo me ahosi atīto attapaṭilābho, sova me attapaṭilābho tasmiṃ samaye sacco ahosi, mogho anāgato, mogho paccuppanno. Yo me bhavissati anāgato attapaṭilābho, sova me attapaṭilābho tasmiṃ samaye sacco bhavissati, mogho atīto, mogho paccuppanno. Yo me etarahi paccuppanno attapaṭilābho, sova me attapaṭilābho sacco, mogho atīto, mogho anāgato’ti. Evaṃ puṭṭho ahaṃ, bhante, evaṃ byākareyya’’nti."
