id,book,par_num,level,class,title,text
NULL,p132,819,100,bodytext,,"313. Evaṃme sutanti uddesavibhaṅgasuttaṃ. Tattha uddesavibhaṅganti uddesañca vibhaṅgañca, mātikañca vibhajanañcāti attho. Upaparikkheyyāti tuleyya tīreyya pariggaṇheyya paricchindeyya. Bahiddhāti bahiddhāārammaṇesu. Avikkhittaṃ avisaṭanti nikantivasena ārammaṇe tiṭṭhamānaṃ vikkhittaṃ visaṭaṃ nāma hoti, taṃ paṭisedhento evamāha. Ajjhattaṃ asaṇṭhitanti gocarajjhatte nikantivasena asaṇṭhitaṃ. Anupādāya na paritasseyyāti anupādiyitvā aggahetvā taṃ viññāṇaṃ na paritasseyya. Yathā viññāṇaṃ bahiddhā avikkhittaṃ avisaṭaṃ, ajjhattaṃ asaṇṭhitaṃ anupādāya na paritasseyya, evaṃ bhikkhu upaparikkheyyāti vuttaṃ hoti. Jātijarāmaraṇadukkhasamudayasambhavoti jātijarāmaraṇassa ceva avasesassa ca dukkhassa nibbatti na hotīti attho."
NULL,p132,820,100,bodytext,,316. Rūpanimittānusārīti  rūpanimittaṃ anussarati anudhāvatīti rūpanimittānusārī.
NULL,p132,821,100,bodytext,,"318. Evaṃ kho, āvuso, ajjhattaṃ asaṇṭhitanti nikantivasena  asaṇṭhitaṃ. Nikantivasena hi atiṭṭhamānaṃ hānabhāgiyaṃ na hoti, visesabhāgiyameva hoti."
NULL,p132,822,100,bodytext,,"320. Anupādā paritassanāti satthārā khandhiyavagge ‘‘upādāparitassanañca vo, bhikkhave, desessāmi anupādāaparitassanañcā’’ti (saṃ. ni. 3.7) evaṃ gahetvā paritassanā, aggahetvāva aparitassanā ca kathitā, taṃ mahāthero upādāparitassanameva anupādāparitassananti katvā dassento evamāha. Kathaṃ panesā anupādāparitassanā hotīti. Upādātabbassa abhāvato. Yadi hi koci saṅkhāro nicco vā dhuvo vā attā vā attaniyo vāti gahetabbayuttako abhavissa, ayaṃ paritassanā upādāparitassanāva assa. Yasmā pana evaṃ upādātabbo saṅkhāro nāma natthi, tasmā rūpaṃ attātiādinā nayena rūpādayo  upādinnāpi anupādinnāva honti. Evamesā diṭṭhivasena upādāparitassanāpi samānā atthato anupādāparitassanāyeva nāma hotīti veditabbā."
NULL,p132,823,100,bodytext,,"Aññathā hotīti parivattati pakatijahanena nassati, rūpavipariṇāmānuparivattīti ‘‘mama rūpaṃ vipariṇata’’nti vā, ‘‘yaṃ ahu, taṃ vata me natthī’’ti vā ādinā (ma. ni. 1.242) nayena kammaviññāṇaṃ rūpassa bhedānuparivatti hoti. Vipariṇāmānuparivattajāti vipariṇāmassa anuparivattanato vipariṇāmārammaṇacittato jātā. Paritassanā dhammasamuppādāti taṇhāparitassanā ca akusaladhammasamuppādā ca. Cittaṃ pariyādāya tiṭṭhantīti kusalacittaṃ pariyādiyitvā gahetvā khepetvā tiṭṭhanti. Uttāsavāti bhayatāsenapi sauttāso taṇhātāsenapi sauttāso. Vighātavāti  savighāto sadukkho. Apekkhavāti sālayo sasineho. Evaṃ kho, āvuso, anupādā paritassanā hotīti evaṃ maṇikaraṇḍakasaññāya tucchakaraṇḍakaṃ gahetvā tasmiṃ naṭṭhe pacchā vighātaṃ āpajjantassa viya pacchā aggahetvā paritassanā hoti."
NULL,p132,824,100,bodytext,,"321. Naca rūpavipariṇāmānuparivattīti khīṇāsavassa kammaviññāṇameva natthi, tasmā rūpabhedānuparivatti na hoti. Sesaṃ sabbattha uttānamevāti."
NULL,p132,825,100,centered,,Papañcasūdaniyā majjhimanikāyaṭṭhakathāya
NULL,p132,826,100,centered,,Uddesavibhaṅgasuttavaṇṇanā niṭṭhitā.
NULL,p132,827,3,subhead,9. Araṇavibhaṅgasuttavaṇṇanā,9. Araṇavibhaṅgasuttavaṇṇanā
NULL,p132,828,100,bodytext,,"323. Evaṃme sutanti araṇavibhaṅgasuttaṃ. Tattha nevussādeyya na apasādeyyāti gehasitavasena kañci puggalaṃ neva ukkhipeyya na avakkhipeyya. Dhammameva deseyyāti sabhāvameva katheyya. Sukhavinicchayanti vinicchitasukhaṃ. Raho vādanti parammukhā avaṇṇaṃ, pisuṇavācanti attho. Sammukhā na khīṇanti sammukhāpi khīṇaṃ ākiṇṇaṃ saṃkiliṭṭhaṃ vācaṃ na bhaṇeyya. Nābhiniveseyyāti na adhiṭṭhahitvā ādāya vohareyya. Samaññanti lokasamaññaṃ lokapaṇṇattiṃ. Nātidhāveyyāti nātikkameyya."
NULL,p132,829,100,bodytext,,324. Kāmapaṭisandhisukhinoti  kāmapaṭisandhinā kāmūpasaṃhitena sukhena sukhitassa. Sadukkhoti vipākadukkhena saṃkilesadukkhenapi sadukkho. Saupaghātoti vipākūpaghātakilesūpaghāteheva saupaghāto. Tathā sapariḷāho. Micchāpaṭipadāti ayāthāvapaṭipadā akusalapaṭipadā.
NULL,p132,830,100,bodytext,,"326. Ittheke apasādetīti evaṃ gehasitavasena ekacce puggale apasādeti. Ussādanepi eseva nayo. Bhavasaṃyojananti bhavabandhanaṃ, taṇhāyetaṃ nāmaṃ."
NULL,p132,831,100,bodytext,,"Subhūtitthero kira imaṃ catukkaṃ nissāya etadagge ṭhapito. Bhagavato hi dhammaṃ desentassa puggalānaṃ ussādanāapasādanā paññāyanti, tathā sāriputtattherādīnaṃ. Subhūtittherassa pana dhammadesanāya ‘‘ayaṃ puggalo appaṭipannako anārādhako’’ti vā, ‘‘ayaṃ sīlavā guṇavā lajjipesalo ācārasampanno’’ti vā natthi, dhammadesanāya panassa ‘‘ayaṃ micchāpaṭipadā, ayaṃ  sammāpaṭipadā’’tveva paññāyati. Tasmā bhagavā ‘‘etadaggaṃ, bhikkhave, mama sāvakānaṃ bhikkhūnaṃ araṇavihārīnaṃ yadidaṃ subhūtī’’ti āha."
NULL,p132,832,100,bodytext,,329. Kālaññūassāti asampatte ca atikkante ca kāle akathetvā ‘‘idāni vuccamānaṃ mahājano gaṇhissatī’’ti yuttapattakālaṃ ñatvāva parammukhā avaṇṇaṃ bhāseyya. Khīṇavādepi eseva nayo.
NULL,p132,833,100,bodytext,,330. Upahaññatīti ghātiyati. Saropi upahaññatīti saddopi bhijjati. Āturīyatīti āturo hoti gelaññappatto sābādho. Avissaṭṭhanti vissaṭṭhaṃ apalibuddhaṃ na hoti.
NULL,p132,834,100,bodytext,,"331. Tadevāti  taṃyeva bhājanaṃ. Abhinivissa voharatīti pattanti sañjānanajanapadaṃ gantvā ‘‘pattaṃ āharatha dhovathā’’ti sutvā ‘‘andhabālaputhujjano, nayidaṃ pattaṃ, pāti namesā, evaṃ vadāhī’’ti abhinivissa voharati. Evaṃ sabbapadehi yojetabbaṃ. Atisāroti atidhāvanaṃ."
NULL,p132,835,100,bodytext,,"332. Tathā tathā voharati aparāmasanti amhākaṃ janapade bhājanaṃ pātīti vuccati, ime pana naṃ pattanti vadantīti tato paṭṭhāya janapadavohāraṃ muñcitvā pattaṃ pattanteva aparāmasanto voharati. Sesapadesupi eseva nayo."
NULL,p132,836,100,bodytext,,"333. Idāni mariyādabhājanīyaṃ karonto tatra, bhikkhavetiādimāha. Tattha saraṇoti sarajo sakileso. Araṇoti arajo nikkileso. Subhūti ca pana, bhikkhaveti ayaṃ thero dvīsu ṭhānesu etadaggaṃ āruḷho ‘‘araṇavihārīnaṃ yadidaṃ subhūti, dakkhiṇeyyānaṃ yadidaṃ subhūtī’’ti (a. ni. 1.202)."
NULL,p132,837,100,bodytext,,"Dhammasenāpati kira vatthuṃ sodheti, subhūtitthero dakkhiṇaṃ sodheti. Tathā hi dhammasenāpati piṇḍāya caranto gehadvāre ṭhito yāva bhikkhaṃ āharanti, tāva pubbabhāge paricchinditvā nirodhaṃ samāpajjati, nirodhā vuṭṭhāya deyyadhammaṃ paṭiggaṇhāti. Subhūtitthero ca tatheva mettājhānaṃ samāpajjati, mettājhānā vuṭṭhāya deyyadhammaṃ paṭiggaṇhāti. Evaṃ pana kātuṃ sakkāti. Āma sakkā, neva acchariyañcetaṃ, yaṃ  mahābhiññappattā sāvakā evaṃ kareyyuṃ. Imasmimpi  hi tambapaṇṇidīpe  porāṇakarājakāle piṅgalabuddharakkhitatthero nāma uttaragāmaṃ nissāya vihāsi. Tattha satta kulasatāni honti, ekampi taṃ kuladvāraṃ natthi, yattha thero samāpattiṃ na samāpajji. Sesaṃ sabbattha uttānamevāti."
NULL,p132,838,100,centered,,Papañcasūdaniyā majjhimanikāyaṭṭhakathāya
NULL,p132,839,100,centered,,Araṇavibhaṅgasuttavaṇṇanā niṭṭhitā.
NULL,p132,840,3,subhead,10. Dhātuvibhaṅgasuttavaṇṇanā,10. Dhātuvibhaṅgasuttavaṇṇanā
NULL,p132,841,100,bodytext,,"342. Evaṃme sutanti dhātuvibhaṅgasuttaṃ. Tattha cārikanti turitagamanacārikaṃ. Sace te bhaggava agarūti sace tuyhaṃ bhāriyaṃ aphāsukaṃ kiñci natthi. Sace so anujānātīti bhaggavassa kira etadahosi – ‘‘pabbajitā nāma nānāajjhāsayā, eko gaṇābhirato hoti, eko ekābhirato. Sace so ekābhirato bhavissati, ‘āvuso, mā pāvisi, mayā sālā laddhā’ti vakkhati. Sace ayaṃ ekābhirato bhavissati, ‘āvuso, nikkhama, mayā sālā laddhā’ti vakkhati. Evaṃ sante ahaṃ ubhinnaṃ vivādakāretā nāma bhavissāmi, dinnaṃ nāma dinnameva vaṭṭati, kataṃ katamevā’’ti. Tasmā evamāha."
NULL,p132,842,100,bodytext,,Kulaputtoti jātikulaputtopi ācārakulaputtopi. Vāsūpagatoti vāsaṃ upagato. Kuto āgantvāti? Takkasīlanagarato.
NULL,p132,843,100,bodytext,,"Tatrāyaṃ anupubbikathā – majjhimappadese kira rājagahanagare bimbisāre rajjaṃ kārente paccante takkasīlanagare pukkusāti rājā rajjaṃ kāresi. Atha takkasīlato bhaṇḍaṃ gahetvā vāṇijā rājagahaṃ āgatā paṇṇākāraṃ gahetvā rājānaṃ addasaṃsu. Rājā  te vanditvā ṭhite ‘‘katthavāsino tumhe’’ti pucchi. Takkasīlavāsino devāti. Atha ne rājā janapadassa khemasubhikkhatādīni nagarassa ca pavattiṃ pucchitvā ‘‘ko nāma tumhākaṃ rājā’’ti pucchi. Pukkusāti nāma devāti. Dhammikoti? Āma deva dhammiko. Catūhi saṅgahavatthūhi janaṃ saṅgaṇhāti, lokassa mātāpitiṭṭhāne  ṭhito, aṅge nipannadārakaṃ viya janaṃ tosetīti. Katarasmiṃ vaye vattatīti? Athassa vayaṃ ācikkhiṃsu. Vayesupi bimbisārena samavayo jāto. Atha te rājā āha – ‘‘tātā tumhākaṃ rājā dhammiko, vayena ca me samāno, sakkuṇeyyātha tumhākaṃ rājānaṃ mama mittaṃ kātu’’nti. Sakkoma devāti. Rājā tesaṃ suṅkaṃ vissajjetvā gehañca dāpetvā – ‘‘gacchatha bhaṇḍaṃ vikkiṇitvā gamanakāle maṃ disvā gaccheyyāthā’’ti āha. Te tathā katvā gamanakāle rājānaṃ addasaṃsu. ‘‘Gacchatha tumhākaṃ rājānaṃ  mama vacanena punappunaṃ ārogyaṃ pucchitvā ‘rājā tumhehi saddhiṃ mittabhāvaṃ icchatī’ti vadathā’’ti āha."
NULL,p132,844,100,bodytext,,"Te sādhūti paṭissuṇitvā gantvā bhaṇḍaṃ paṭisāmetvā bhuttapātarāsā rājānaṃ upasaṅkamitvā vandiṃsu. Rājā ‘‘kahaṃ bhaṇe tumhe ettake ime divase na dissathā’’ti pucchi. Te sabbaṃ pavattiṃ ārocesuṃ. Rājā – ‘‘sādhu, tātā, tumhe nissāya mayā majjhimappadese rājā mitto laddho’’ti attamano ahosi. Aparabhāge rājagahavāsinopi vāṇijā takkasīlaṃ agamaṃsu. Te paṇṇākāraṃ gahetvā āgate pukkusāti rājā ‘‘kuto āgatatthā’’ti pucchitvā ‘‘rājagahato’’ti sutvā ‘‘mayhaṃ sahāyassa nagarato āgatā tumhe’’ti. Āma devāti. Ārogyaṃ me sahāyassāti ārogyaṃ pucchitvā ‘‘ajja paṭṭhāya ye mayhaṃ sahāyassa nagarato jaṅghasatthena vā sakaṭasatthena vā vāṇijā āgacchanti, sabbesaṃ mama visayaṃ paviṭṭhakālato  paṭṭhāya vasanagehāni, rājakoṭṭhāgārato nivāpañca dentu, suṅkaṃ vissajjentu, kiñci upaddavaṃ mā karontū’’ti bheriṃ carāpesi. Bimbisāropi attano nagare tatheva bheriṃ carāpesi."
NULL,p132,845,100,bodytext,,"Atha bimbisāro pukkusātissa paṇṇaṃ pahiṇi – ‘‘paccantadese nāma maṇimuttādīni ratanāni uppajjanti, yaṃ mayhaṃ sahāyassa rajje dassanīyaṃ vā savanīyaṃ vā ratanaṃ uppajjati, tattha me mā maccharāyatū’’ti. Pukkusātipi – ‘‘majjhimadeso nāma mahājanapado, yaṃ tattha evarūpaṃ ratanaṃ uppajjati, tattha me sahāyo mā maccharāyatū’’ti paṭipaṇṇaṃ pahiṇi. Evaṃ te gacchante gacchante kāle aññamaññaṃ adisvāpi daḷhamittā ahesuṃ."
NULL,p132,846,100,bodytext,,"Evaṃ  tesaṃ katikaṃ katvā vasantānaṃ paṭhamataraṃ pukkusātissa paṇṇākāro uppajji. Rājā kira aṭṭha pañcavaṇṇe anagghakambale labhi. So – ‘‘atisundarā ime kambalā, ahaṃ sahāyassa pesissāmī’’ti lākhāguḷamatte aṭṭha sārakaraṇḍake likhāpetvā tesu te kambale pakkhipitvā lākhāya vaṭṭāpetvā setavatthena veṭhetvā samugge pakkhipitvā vatthena veṭhetvā rājamuddikāya lañchetvā ‘‘mayhaṃ sahāyassa dethā’’ti amacce pesesi. Sāsanañca adāsi – ‘‘ayaṃ paṇṇākāro nagaramajjhe amaccādiparivutena daṭṭhabbo’’ti. Te gantvā bimbisārassa adaṃsu."
NULL,p132,847,100,bodytext,,"So  sāsanaṃ sutvā amaccādayo sannipatantūti bheriṃ carāpetvā nagaramajjhe amaccādiparivuto setacchattena dhāriyamānena pallaṅkavare nisinno lañchanaṃ bhinditvā vatthaṃ apanetvā samuggaṃ vivaritvā anto bhaṇḍikaṃ muñcitvā lākhāguḷe disvā ‘‘mayhaṃ sahāyo pukkusāti ‘jutavittako me sahāyo’ti maññamāno maññe imaṃ paṇṇākāraṃ pahiṇī’’ti ekaṃ guḷaṃ gahetvā hatthena  vaṭṭetvā tulayantova anto dussabhaṇḍikaṃ atthīti aññāsi. Atha naṃ pallaṅkapāde paharitvā tāvadeva lākhā paripati, so nakhena karaṇḍakaṃ vivaritvā anto kambalaratanaṃ disvā itarepi vivarāpesi, sabbepi kambalā ahesuṃ. Atha ne pattharāpesi, te vaṇṇasampannā phassasampannā dīghato soḷasahatthā tiriyaṃ aṭṭhahatthā ahesuṃ. Mahājano disvā aṅguliyo poṭhesi, celukkhepaṃ akāsi, – ‘‘amhākaṃ rañño adiṭṭhasahāyo pukkusāti adisvāva evarūpaṃ paṇṇākāraṃ pesesi, yuttaṃ evarūpaṃ mittaṃ kātu’’nti attamano ahosi. Rājā ekamekaṃ kambalaṃ agghāpesi, sabbe anagghā ahesuṃ. Tesu cattāro sammāsambuddhassa pesesi, cattāro attano ghare akāsi. Tato cintesi – ‘‘pacchā pesentena paṭhamaṃ pesitapaṇṇākārato atirekaṃ pesetuṃ vaṭṭati, sahāyena ca me anaggho paṇṇākāro pesito, kiṃ nu kho pesemī’’ti?"
NULL,p132,848,100,bodytext,,"Kiṃ pana rājagahe tato adhikaṃ ratanaṃ natthīti? No natthi, mahāpuñño rājā, apica kho panassa sotāpannakālato paṭṭhāya ṭhapetvā tīṇi ratanāni aññaṃ ratanaṃ somanassaṃ janetuṃ samatthaṃ nāma natthi. So ratanaṃ vicinituṃ āraddho – ratanaṃ nāma saviññāṇakaṃ aviññāṇakanti duvidhaṃ. Tattha aviññāṇakaṃ suvaṇṇarajatādi, saviññāṇakaṃ indriyabaddhaṃ. Aviññāṇakaṃ saviññāṇakasseva alaṅkārādivasena paribhogaṃ hoti, iti imesu dvīsu ratanesu saviññāṇakaṃ seṭṭhaṃ. Saviññāṇakampi duvidhaṃ tiracchānaratanaṃ manussaratananti. Tattha tiracchānaratanaṃ hatthiassaratanaṃ, tampi manussānaṃ upabhogatthameva nibbattati, iti imesupi dvīsu manussaratanaṃ seṭṭhaṃ. Manussaratanampi duvidhaṃ itthiratanaṃ purisaratananti. Tattha cakkavattino rañño uppannaṃ itthiratanampi purisasseva upabhogaṃ. Iti imesupi dvīsu purisaratanameva seṭṭhaṃ."
NULL,p132,849,100,bodytext,,"Purisaratanampi duvidhaṃ agāriyaratanaṃ anagāriyaratanañca. Tattha agāriyaratanesupi cakkavattirājā ajja pabbajitasāmaṇeraṃ pañcapatiṭṭhitena vandati, iti imesupi dvīsu anagāriyaratanameva  seṭṭhaṃ. Anagāriyaratanampi duvidhaṃ sekkharatanañca asekkharatanañca. Tattha satasahassampi sekkhānaṃ asekkhassa padesaṃ na pāpuṇāti, iti imesupi dvīsu asekkharatanameva seṭṭhaṃ. Tampi duvidhaṃ buddharatanaṃ sāvakaratananti. Tattha satasahassampi sāvakaratanānaṃ buddharatanassa padesaṃ na pāpuṇāti, iti imesupi dvīsū buddharatanameva seṭṭhaṃ."
NULL,p132,850,100,bodytext,,"Buddharatanampi duvidhaṃ paccekabuddharatanaṃ sabbaññubuddharatananti. Tattha satasahassampi paccekabuddhānaṃ sabbaññubuddhassa padesaṃ na pāpuṇāti, iti imesupi dvīsu sabbaññubuddharatanaṃyeva seṭṭhaṃ. Sadevakasmiñhi loke buddharatanasamaṃ ratanaṃ nāma natthi. Tasmā asadisameva ratanaṃ mayhaṃ sahāyassa pesessāmīti cintetvā takkasīlavāsino pucchi – ‘‘tātā tumhākaṃ janapade buddho dhammo saṅghoti imāni tīṇi ratanāni dissantī’’ti. Ghosopi so mahārāja tāva tattha natthi, dassanaṃ pana kutoti."
NULL,p132,851,100,bodytext,,"‘‘Sundaraṃ tātā’’ti rājā tuṭṭho cintesi – ‘‘sakkā bhaveyya janasaṅgahatthāya mayhaṃ sahāyassa vasanaṭṭhānaṃ sammāsambuddhaṃ pesetuṃ, buddhā pana  paccantimesu janapadesu na aruṇaṃ uṭṭhapenti. Tasmā satthārā gantuṃ na sakkā. Sāriputtamoggallānādayo mahāsāvake pesetuṃ sakkā bhaveyya. Mayā  pana ‘therā paccante vasantī’ti sutvāpi manusse pesetvā te attano samīpaṃ āṇāpetvā upaṭṭhātumeva yuttaṃ. Tasmā na therehipi sakkā gantuṃ. Yena panākārena sāsane pesite satthā ca mahāsāvakā ca gatā viya honti, tenākārena sāsanaṃ pahiṇissāmī’’ti. Cintetvā caturatanāyāmaṃ vidatthimattaputhulaṃ nātitanuṃ nātibahalaṃ suvaṇṇapaṭṭaṃ kārāpetvā ‘‘tattha ajja akkharāni likhissāmī’’ti. Pātova sīsaṃ nhāyitvā uposathaṅgāni adhiṭṭhāya bhuttapātarāso apanītagandhamālābharaṇo suvaṇṇasarakena jātihiṅgulikaṃ ādāya heṭṭhato paṭṭhāya dvārāni pidahanto pāsādamāruyha pubbadisāmukhaṃ sīhapañjaraṃ vivaritvā ākāsatale nisīditvā suvaṇṇapaṭṭe akkharāni likhanto – ‘‘idha tathāgato loke uppanno arahaṃ sammāsambuddho vijjācaraṇasampanno sugato lokavidū anuttaro purisadammasārathi satthā devamanussānaṃ buddho bhagavā’’ti. Buddhaguṇe tāva ekadesena likhi."
NULL,p132,852,100,bodytext,,"Tato ‘‘evaṃ dasa pāramiyo pūretvā tusitabhavanato cavitvā mātukucchimhi paṭisandhiṃ gaṇhi, evaṃ lokavivaraṇaṃ ahosi, mātukucchiyaṃ vasamāne idaṃ nāma ahosi, agāramajjhe vasamāne idaṃ nāma ahosi, evaṃ mahābhinikkhamanaṃ nikkhanto evaṃ mahāpadhānaṃ padahi. Evaṃ dukkarakārikaṃ katvā mahābodhimaṇḍaṃ āruyha aparājitapallaṅke nisinno sabbaññutaññāṇaṃ paṭivijjhi, sabbaññutaññāṇaṃ paṭivijjhantassa  evaṃ lokavivaraṇaṃ ahosi. Sadevake loke aññaṃ evarūpaṃ ratanaṃ nāma natthīti."
NULL,p132,853,100,gatha1,,"Yaṃkiñci vittaṃ idha vā huraṃ vā,"
NULL,p132,854,100,gatha2,,Saggesu vā yaṃ ratanaṃ paṇītaṃ;
NULL,p132,855,100,gatha3,,"Na no samaṃ atthi tathāgatena,"
NULL,p132,856,100,gatha2,,Idampi buddhe ratanaṃ paṇītaṃ;
NULL,p132,857,100,gathalast,,Etena saccena suvatthi hotū’’ti. (khu. pā. 6.3; su. ni. 226) –
NULL,p132,858,100,unindented,,Evaṃ ekadesena buddhaguṇepi likhitvā dutiyaṃ dhammaratanaṃ thomento – ‘‘svākkhāto bhagavatā dhammo…pe… paccattaṃ veditabbo viññūhī’’ti. ‘‘Cattāro satipaṭṭhānā…pe… ariyo aṭṭhaṅgiko maggo’’ti. ‘‘Satthārā desitadhammo nāma evarūpo ca evarūpo cā’’ti sattatiṃsa bodhipakkhiye ekadesena likhitvā –
NULL,p132,859,100,gatha1,,"‘‘Yaṃ  buddhaseṭṭho parivaṇṇayī suciṃ,"
NULL,p132,860,100,gatha2,,Samādhimānantarikaññamāhu;
NULL,p132,861,100,gatha3,,"Samādhinā tena samo na vijjati,"
NULL,p132,862,100,gatha2,,Idampi dhamme ratanaṃ paṇītaṃ;
NULL,p132,863,100,gathalast,,Etena saccena suvatthi hotū’’ti. (khu. pā. 6.5; su. ni. 228) –
NULL,p132,864,100,unindented,,"Evaṃ ekadesena dhammaguṇe likhitvā tatiyaṃ saṅgharatanaṃ thomento – ‘‘suppaṭipanno bhagavato sāvakasaṅgho…pe… puññakkhettaṃ lokassā’’ti. ‘‘Kulaputtā nāma satthu dhammakathaṃ sutvā evaṃ nikkhamitvā pabbajanti, keci setacchattaṃ pahāya pabbajanti, keci uparajjaṃ, keci senāpatiṭṭhānādīni pahāya pabbajanti. Pabbajitvā ca pana imañca paṭipattiṃ pūrentī’’ti cūḷasīlamajjhimasīlamahāsīlādīni  ekadesena likhitvā chadvārasaṃvaraṃ satisampajaññaṃ catupaccayasantosaṃ navavidhaṃ  senāsanaṃ, nīvaraṇappahānaṃ parikammaṃ jhānābhiññā aṭṭhatiṃsa kammaṭṭhānāni yāva āsavakkhayā ekadesena likhi, soḷasavidhaṃ ānāpānassatikammaṭṭhānaṃ vitthāreneva likhitvā ‘‘satthu sāvakasaṅgho nāma evarūpehi ca guṇehi samannāgato."
NULL,p132,865,100,gatha1,,"Ye puggalā aṭṭhasataṃ pasaṭṭhā,"
NULL,p132,866,100,gatha2,,Cattāri etāni yugāni honti;
NULL,p132,867,100,gatha3,,"Te dakkhiṇeyyā sugatassa sāvakā,"
NULL,p132,868,100,gatha2,,Etesu dinnāni mahapphalāni;
NULL,p132,869,100,gatha3,,"Idampi saṅghe ratanaṃ paṇītaṃ,"
NULL,p132,870,100,gathalast,,Etena saccena suvatthi hotū’’ti. (khu. pā. 6.6; su. ni. 229) –
NULL,p132,871,100,unindented,,"Evaṃ ekadesena saṅghaguṇe likhitvā – ‘‘bhagavato sāsanaṃ svākkhātaṃ niyyānikaṃ, sace mayhaṃ sahāyo sakkoti, nikkhamitvā pabbajatū’’ti likhitvā suvaṇṇapaṭṭaṃ saṃharitvā sukhumakambalena veṭhetvā sārasamugge pakkhipitvā taṃ samuggaṃ suvaṇṇamaye, suvaṇṇamayaṃ, rajatamaye rajatamayaṃ maṇimaye, maṇimayaṃ pavāḷamaye, pavāḷamayaṃ lohitaṅkamaye, lohitaṅkamayaṃ masāragallamaye, masāragallamayaṃ phalikamaye, phalikamayaṃ dantamaye, dantamayaṃ sabbaratanamaye, sabbaratanamayaṃ kilañjamaye, kilañjamayaṃ samuggaṃ sārakaraṇḍake ṭhapesi."
NULL,p132,872,100,bodytext,,"Puna  sārakaraṇḍakaṃ suvaṇṇakaraṇḍaketi purimanayeneva haritvā sabbaratanamayaṃ karaṇḍakaṃ kilañjamaye karaṇḍake ṭhapesi. Tato kilañjamayaṃ karaṇḍakaṃ sāramayapeḷāyāti puna vuttanayeneva haritvā sabbaratanamayaṃ peḷaṃ kilañjamayapeḷāya ṭhapetvā bahi vatthena veṭhetvā rājamuddikāya lañchetvā amacce āṇāpesi – ‘‘mama āṇāpavattiṭṭhāne maggaṃ alaṅkārāpetha maggo aṭṭhusabhavitthato hotu, catuusabhaṭṭhānaṃ sodhitamattakameva  hotu, majjhe catuusabhaṃ rājānubhāvena paṭiyādethā’’ti. Tato maṅgalahatthiṃ alaṅkārāpetvā tassa upari pallaṅkaṃ paññapetvā setacchattaṃ ussāpetvā nagaravīthiyo sittasammaṭṭhā samussitaddhajapaṭākā kadalipuṇṇaghaṭagandhadhūmapupphādīhi  suppaṭimaṇḍitā kāretvā ‘‘attano attano visayappadese evarūpaṃ pūjaṃ kārentū’’ti antarabhogikānaṃ javanadūte pesetvā sayaṃ sabbālaṅkārena alaṅkaritvā – ‘‘sabbatāḷāvacarasammissabalakāyaparivuto paṇṇākāraṃ pesemī’’ti attano visayapariyantaṃ gantvā amaccassa mukhasāsanaṃ adāsi – ‘‘tāta mayhaṃ sahāyo pukkusāti imaṃ paṇṇākāraṃ paṭicchanto orodhamajjhe apaṭicchitvā pāsādaṃ āruyha paṭicchatū’’ti. Evaṃ sāsanaṃ datvā paccantadesaṃ satthā gacchatīti pañcapatiṭṭhitena vanditvā nivatti. Antarabhogikā teneva niyāmena maggaṃ paṭiyādetvā paṇṇākāraṃ nayiṃsu."
NULL,p132,873,100,bodytext,,"Pukkusātipi attano rajjasīmato paṭṭhāya teneva niyāmena maggaṃ paṭiyādetvā nagaraṃ alaṅkārāpetvā paṇṇākārassa paccuggamanaṃ akāsi. Paṇṇākāro takkasīlaṃ pāpuṇanto uposathadivase pāpuṇi, paṇṇākāraṃ gahetvā gataamaccopi rañño vuttasāsanaṃ ārocesi. Rājā taṃ sutvā paṇṇākārena saddhiṃ āgatānaṃ kattabbakiccaṃ vicāretvā paṇṇākāraṃ ādāya pāsādaṃ āruyha ‘‘mā idha koci pavisatū’’ti dvāre ārakkhaṃ kāretvā sīhapañjaraṃ vivaritvā paṇṇākāraṃ uccāsane ṭhapetvā sayaṃ nīcāsane nisinno lañchanaṃ bhinditvā nivāsanaṃ apanetvā kilañjapeḷato paṭṭhāya anupubbena vivaranto sāramayaṃ samuggaṃ disvā cintesi – ‘‘mahāparihāro nāyaṃ aññassa ratanassa bhavissati, addhā majjhimadese sotabbayuttakaṃ ratanaṃ uppanna’’nti. Atha taṃ samuggaṃ vivaritvā rājalañchanaṃ bhinditvā sukhumakambalaṃ ubhato viyūhitvā suvaṇṇapaṭṭaṃ addasa."
NULL,p132,874,100,bodytext,,"So  taṃ pasāretvā – ‘‘manāpāni  vata akkharāni samasīsāni samapantīni caturassānī’’tiādito paṭṭhāya vācetuṃ ārabhi. Tassa – ‘‘idha tathāgato loke uppanno’’ti buddhaguṇe vācentassa balavasomanassaṃ uppajji, navanavutilomakūpasahassāni uddhaggalomāni ahesuṃ. Attano ṭhitabhāvaṃ vā nisinnabhāvaṃ vā na jānāti. Athassa – ‘‘kappakoṭisatasahassehipi etaṃ dullabhasāsanaṃ sahāyaṃ nissāya sotuṃ labhāmī’’ti bhiyyo balavapīti udapādi. So hi upari vācetuṃ asakkonto yāva pītivegapassaddhiyā nisīditvā parato – ‘‘svākkhāto bhagavatā dhammo’’ti dhammaguṇe ārabhi. Tatrāpissa tatheva ahosi. So puna yāva pītivegapassaddhiyā nisīditvā parato ‘‘suppaṭipanno’’ti saṅghaguṇe ārabhi. Tatrāpissa tatheva ahosi. Atha sabbapariyante ānāpānassatikammaṭṭhānaṃ vācetvā catukkapañcakajjhānāni nibbattesi, so jhānasukheneva vītināmesi. Añño koci daṭṭhuṃ na labhati, ekova cūḷupaṭṭhāko pavisati. Evaṃ addhamāsamattaṃ vītināmesi."
NULL,p132,875,100,bodytext,,"Nāgarā rājaṅgaṇe sannipatitvā ukkuṭṭhiṃ akaṃsu ‘‘paṇṇākāraṃ paṭicchitadivasato paṭṭhāya baladassanaṃ vā nāṭakadassanaṃ vā natthi, vinicchayadānaṃ natthi, rājā sahāyena pahitaṃ paṇṇākāraṃ yassicchati tassa dassetu, rājāno nāma ekaccassa paṇṇākāravasenapi vañcetvā rajjaṃ attano kātuṃ vāyamanti. Kiṃ nāma amhākaṃ rājā karotī’’ti? Rājā ukkuṭṭhisaddaṃ sutvā – ‘‘rajjaṃ nu kho dhāremi, udāhu  satthāra’’nti cintesi. Athassa etadahosi – ‘‘rajjakāritaattabhāvo nāma neva gaṇakena, na gaṇakamahāmattena gaṇetuṃ sakko. Satthusāsanaṃ dhāressāmī’’ti sayane ṭhapitaṃ asiṃ gahetvā kese chinditvā sīhapañjaraṃ vivaritvā – ‘‘etaṃ gahetvā rajjaṃ kārethā’’ti saddhiṃ cūḷāmaṇinā kesakalāpaṃ parisamajjhe pātesi, mahājano taṃ ukkhipitvā – ‘‘sahāyakasantikā laddhapaṇṇākārā nāma rājāno tumhādisā honti devā’’ti ekappahāreneva viravi. Raññopi dvaṅgulamattaṃ kesamassu ahosi. Bodhisattassa pabbajjāsadisameva kira jātaṃ."
