id,book,par_num,level,class,title,text
NULL,p132,225,100,bodytext,,"94. Paṭhame jhāneti ye paṭhame jhāne antosamāpattiyaṃ dhammā. Tyāssāti te assa. Anupadavavatthitā hontīti anupaṭipāṭiyā vavatthitā paricchinnā ñātā viditā honti. Kathaṃ? Thero hi te dhamme olokento abhiniropanalakkhaṇo vitakko vattatīti jānāti. Tathā anumajjanalakkhaṇo vicāro, pharaṇalakkhaṇā pīti, sātalakkhaṇaṃ sukhaṃ, avikkhepalakkhaṇā  cittekaggatā, phusanalakkhaṇo phasso vedayitalakkhaṇā vedanā, sañjānanalakkhaṇā saññā, cetayitalakkhaṇā cetanā, vijānanalakkhaṇaṃ  viññāṇaṃ, kattukamyatālakkhaṇo chando, adhimokkhalakkhaṇo adhimokkho, paggāhalakkhaṇaṃ vīriyaṃ  upaṭṭhānalakkhaṇā sati, majjhattalakkhaṇā upekkhā, anunayamanasikāralakkhaṇo manasikāro vattatīti jānāti. Evaṃ jānaṃ abhiniropanaṭṭhena vitakkaṃ sabhāvato vavatthapeti…pe… anunayamanasikāraṇaṭṭhena manasikāraṃ sabhāvabhāvato vavatthapeti. Tena vuttaṃ ‘‘tyāssa dhammā anupadavavatthitā hontī’’ti."
NULL,p132,226,100,bodytext,,"Viditā uppajjantīti uppajjamānā viditā pākaṭāva hutvā uppajjanti. Viditā upaṭṭhahantīti tiṭṭhamānāpi viditā pākaṭāva hutvā tiṭṭhanti. Viditā abbhatthaṃ gacchantīti nirujjhamānāpi viditā pākaṭāva hutvā nirujjhanti. Ettha pana taṃñāṇatā ceva ñāṇabahutā ca mocetabbā. Yathā hi teneva aṅgulaggena taṃ aṅgulaggaṃ na sakkā phusituṃ, evameva teneva cittena tassa cittassa uppādo vā ṭhiti vā bhaṅgo vā na sakkā jānitunti. Evaṃ tāva taṃñāṇatā mocetabbā. Yadi pana dve cittāni ekato uppajjeyyuṃ, ekena cittena ekassa uppādo vā ṭhiti vā bhaṅgo vā sakkā bhaveyya jānituṃ. Dve pana phassā vā vedanā vā saññā vā cetanā vā cittāni vā ekato uppajjanakāni nāma natthi, ekekameva uppajjati. Evaṃ ñāṇabahutā mocetabbā. Evaṃ sante kathaṃ? Mahātherassa antosamāpattiyaṃ soḷasa dhammā viditā pākaṭā hontīti. Vatthārammaṇānaṃ pariggahitatāya. Therena hi vatthu ceva ārammaṇañca pariggahitaṃ, tenassa tesaṃ dhammānaṃ uppādaṃ āvajjantassa uppādo pākaṭo hoti, ṭhānaṃ āvajjantassa ṭhānaṃ pākaṭaṃ hoti, bhedaṃ āvajjantassa  bhedo pākaṭo hoti. Tena vuttaṃ ‘‘viditā uppajjanti viditā upaṭṭhahanti viditā abbhatthaṃ gacchantī’’ti. Ahutvā sambhontīti iminā udayaṃ passati. Hutvā paṭiventīti iminā vayaṃ passati."
NULL,p132,227,100,bodytext,,Anupāyoti rāgavasena anupagamano hutvā. Anapāyoti paṭighavasena anapagato. Anissitoti taṇhādiṭṭhinissayehi anissito. Appaṭibaddhoti chandarāgena abaddho. Vippamuttoti kāmarāgato vippamutto. Visaṃyuttoti catūhi yogehi sabbakilesehi vā visaṃyutto. Vimariyādīkatenāti nimmariyādīkatena. Cetasāti evaṃvidhena cittena viharati.
NULL,p132,228,100,bodytext,,"Tattha  dve mariyādā kilesamariyādā ca ārammaṇamariyādā ca. Sace hissa antosamāpattiyaṃ pavatte soḷasa dhamme ārabbha rāgādayo uppajjeyyuṃ, kilesamariyādā tena katā bhaveyya, tesu panassa ekopi na uppannoti kilesamariyādā natthi. Sace panassa antosamāpattiyaṃ pavatte soḷasa dhamme āvajjantassa ekacce āpāthaṃ nāgaccheyyuṃ. Evamassa ārammaṇamariyādā bhaveyyuṃ. Te panassa soḷasa dhamme āvajjantassa āpāthaṃ anāgatadhammo nāma natthīti ārammaṇamariyādāpi natthi."
NULL,p132,229,100,bodytext,,"Aparāpi dve mariyādā vikkhambhanamariyādā ca samucchedamariyādā ca. Tāsu samucchedamariyādā upari āgamissati, imasmiṃ pana ṭhāne vikkhambhanamariyādā adhippetā. Tassa vikkhambhitapaccanīkattā natthīti vimariyādikatena cetasā viharati."
NULL,p132,230,100,bodytext,,"Uttarinissaraṇanti ito uttari nissaraṇaṃ. Aññesu ca suttesu ‘‘uttari nissaraṇa’’nti nibbānaṃ vuttaṃ, idha pana anantaro viseso adhippetoti veditabbo. Tabbahulīkārāti tassa pajānanassa bahulīkaraṇena. Atthitvevassa hotīti tassa therassa atthītiyeva daḷhataraṃ hoti. Iminā nayena sesavāresupi attho veditabbo."
NULL,p132,231,100,bodytext,,Dutiyavāre pana sampasādanaṭṭhena sampasādo. Sabhāvato vavatthapeti.
NULL,p132,232,100,bodytext,,"Catutthavāre upekkhāti sukhaṭṭhāne vedanupekkhāva. Passaddhattā cetaso anābhogoti yo so ‘‘yadeva tattha sukha’’nti cetaso ābhogo, etenetaṃ oḷārikamakkhāyatīti evaṃ passaddhattā cetaso anābhogo vutto, tassa abhāvāti attho. Satipārisuddhīti parisuddhāsatiyeva. Upekkhāpi pārisuddhiupekkhā."
NULL,p132,233,100,bodytext,,"95. Sato vuṭṭhahatīti satiyā samannāgato ñāṇena sampajāno hutvā vuṭṭhāti. Te dhamme samanupassatīti yasmā nevasaññānāsaññāyatane buddhānaṃyeva anupadadhammavipassanā hoti, na sāvakānaṃ, tasmā ettha kalāpavipassanaṃ dassento evamāha."
NULL,p132,234,100,bodytext,,"Paññāyacassa disvā āsavā parikkhīṇā hontīti maggapaññāya cattāri saccāni disvā cattāro āsavā khīṇā honti. Sāriputtattherassa samathavipassanaṃ yuganaddhaṃ āharitvā  arahattaṃ pattavāropi atthi, nirodhasamāpattisamāpannavāropi. Arahattaṃ pattavāro idha gahito, nirodhaṃ pana ciṇṇavasitāya aparāparaṃ samāpajjissatīti vadanti."
NULL,p132,235,100,bodytext,,"Tatthassa yasmiṃ kāle nirodhasamāpatti sīsaṃ hoti, nirodhassa vāro āgacchati, phalasamāpatti gūḷhā hoti. Yasmiṃ kāle phalasamāpatti sīsaṃ hoti, phalasamāpattiyā vāro āgacchati, nirodhasamāpatti gūḷhā hoti. Jambudīpavāsino therā pana vadanti ‘‘sāriputtatthero samathavipassanaṃ yuganaddhaṃ āharitvā anāgāmiphalaṃ sacchikatvā nirodhaṃ samāpajji, nirodhā vuṭṭhāya arahattaṃ patto’’ti. Te dhammeti antosamāpattiyaṃ pavatte tisamuṭṭhānikarūpadhamme, heṭṭhā nevasaññānāsaññāyatanasamāpattiyaṃ pavattadhamme vā. Tepi hi imasmiṃ vāre vipassitabbadhammāva, tasmā te vā vipassatīti dassetuṃ idaṃ vuttanti veditabbaṃ."
NULL,p132,236,100,bodytext,,"97. Vasippatoti ciṇṇavasitaṃ patto. Pāramippattoti nipphattiṃ patto. Orasotiādīsu thero bhagavato ure nibbattasaddaṃ sutvā jātoti oraso, mukhena pabhāvitaṃ saddaṃ sutvā jātoti mukhato jāto, dhammena pana jātattā nimmitattā dhammajo dhammanimmito, dhammadāyassa ādiyanato dhammadāyādo, āmisadāyassa anādiyanato no āmisadāyādoti veditabbo. Sesaṃ sabbattha uttānamevāti."
NULL,p132,237,100,centered,,Papañcasūdaniyā majjhimanikāyaṭṭhakathāya
NULL,p132,238,100,centered,,Anupadasuttavaṇṇanā niṭṭhitā.
NULL,p132,239,3,subhead,2. Chabbisodhanasuttavaṇṇanā,2. Chabbisodhanasuttavaṇṇanā
NULL,p132,240,100,bodytext,,"98. Evaṃme sutanti chabbisodhanasuttaṃ. Tattha khīṇā jātītiādīsu ekenāpi padena aññā byākatāva hoti, dvīhipi. Idha pana catūhi padehi aññabyākaraṇaṃ āgataṃ. Diṭṭhe diṭṭhavāditātiādīsu yāya  cetanāya diṭṭhe diṭṭhaṃ meti vadati, sā diṭṭhe diṭṭhavāditā nāma. Sesapadesupi eseva nayo. Ayamanudhammoti ayaṃ sabhāvo. Abhinanditabbanti na kevalaṃ abhinanditabbaṃ, parinibbutassa panassa sabbopi khīṇāsavassa sakkāro kātabbo. Uttariṃ pañhoti sace panassa veyyākaraṇena asantuṭṭhā hotha, uttarimpi ayaṃ pañho pucchitabboti dasseti. Ito paresupi tīsu vāresu ayameva nayo."
NULL,p132,241,100,bodytext,,"99. Abalanti dubbalaṃ. Virāgunanti vigacchanasabhāvaṃ. Anassāsikanti assāsavirahitaṃ. Upāyūpādānāti taṇhādiṭṭhīnametaṃ adhivacanaṃ. Taṇhādiṭṭhiyo hi tebhūmakadhamme upentīti upāyā, upādiyantīti upādānā. Cetaso adiṭṭhānābhinivesānusayātipi tāsaṃyeva nāmaṃ. Cittañhi taṇhādiṭṭhīhi sakkāyadhammesu tiṭṭhati adhitiṭṭhatīti taṇhādiṭṭhiyo cetaso adhiṭṭhānā, tāhi taṃ abhinivisatīti abhinivesā, tāhiyeva taṃ anusetīti anusayāti vuccanti. Khayāvirāgātiādīsu khayena virāgenāti attho. Sabbāni cetāni aññamaññavevacanāneva."
NULL,p132,242,100,bodytext,,"100. Pathavīdhātūti patiṭṭhānadhātu. Āpodhātūti ābandhanadhātu. Tejodhātūti paripācanadhātu. Vāyodhātūti vitthambhanadhātu. Ākāsadhātūti asamphuṭṭhadhātu. Viññāṇadhātūti vijānanadhātu. Na anattato upagacchinti ahaṃ attāti attakoṭṭhāsena na upagamiṃ. Na ca pathavīdhātunissitanti pathavīdhātunissitā sesadhātuyo ca upādārūpañca arūpakkhandhā ca. Tepi hi nissitavatthurūpānaṃ pathavīdhātunissitattā ekena pariyāyena pathavīdhātunissitāva. Tasmā ‘‘na ca pathavīdhātunissita’’nti vadanto sesarūpārūpadhammepi attato na upagacchinti vadati. Ākāsadhātunissitapade pana avinibbhogavasena sabbampi bhūtupādārūpaṃ ākāsadhātunissitaṃ nāma, tathā taṃnissitarūpavatthukā arūpakkhandhā. Evaṃ idhāpi rūpārūpaṃ gahitameva hoti. Viññāṇadhātunissitapade pana sahajātā tayo khandhā cittasamuṭṭhānarūpañca viññāṇadhātunissitanti rūpārūpaṃ gahitameva hoti."
NULL,p132,243,100,bodytext,,"101. Rūpe cakkhuviññāṇe cakkhuviññāṇaviññātabbesu dhammesūti ettha yaṃ atīte cakkhudvārassa āpāthaṃ āgantvā niruddhaṃ, yañca anāgate āpāthaṃ  āgantvā nirujjhissati, yampi etarahi āgantvā niruddhaṃ, taṃ sabbaṃ rūpaṃ nāma. Yaṃ pana atītepi āpāthaṃ anāgantvā niruddhaṃ, anāgatepi anāgantvā nirujjhissati, etarahipi anāgantvā niruddhaṃ, taṃ cakkhuviññāṇaviññātabbadhammesu saṅgahitanti vutte tipiṭakacūḷābhayatthero  āha – ‘‘imasmiṃ ṭhāne dvidhā karotha, upari chandovāre kinti karissatha, nayidaṃ labbhatī’’ti. Tasmā tīsu kālesu āpāthaṃ āgataṃ vā anāgataṃ vā sabbampi taṃ rūpameva, cakkhuviññāṇasampayuttā pana tayo khandhā cakkhuviññāṇaviññātabbadhammāti veditabbā. Ayañhettha attho ‘‘cakkhuviññāṇena saddhiṃ viññātabbesu dhammesū’’ti. Chandoti taṇhāchando. Rāgoti sveva rajjanavasena rāgo. Nandīti sveva abhinandanavasena nandī. Taṇhāti sveva taṇhāyanavasena taṇhā. Sesadvāresupi eseva nayo."
NULL,p132,244,100,bodytext,,"102. Ahaṅkāramamaṅkāramānānusayāti ettha ahaṅkāro māno, mamaṅkāro taṇhā, sveva mānānusayo. Āsavānaṃ khayañāṇāyāti idaṃ pubbenivāsaṃ dibbacakkhuñca avatvā kasmā vuttaṃ? Bhikkhū lokiyadhammaṃ na pucchanti, lokuttarameva pucchanti, tasmā pucchitapañhaṃyeva kathento evamāha. Ekavissajjitasuttaṃ nāmetaṃ, chabbisodhanantipissa nāmaṃ. Ettha hi cattāro vohārā pañca khandhā cha dhātuyo cha ajjhattikabāhirāni āyatanāni attano saviññāṇakakāyo paresaṃ saviññāṇakakāyoti ime cha koṭṭhāsā visuddhā, tasmā ‘‘chabbisodhaniya’’nti vuttaṃ. Parasamuddavāsittherā pana attano ca parassa ca viññāṇakakāyaṃ ekameva katvā catūhi  āhārehi saddhinti cha koṭṭhāse vadanti."
NULL,p132,245,100,bodytext,,"Ime pana cha koṭṭhāsā ‘‘kiṃ te adhigataṃ, kinti te adhigataṃ, kadā te adhigataṃ, kattha  te adhigataṃ, katame te kilesā pahīnā, katamesaṃ tvaṃ dhammānaṃ lābhī’’ti (pārā. 198) evaṃ vinayaniddesapariyāyena sodhetabbā."
NULL,p132,246,100,bodytext,,"Ettha hi kiṃ te adhigatanti adhigamapucchā, jhānavimokkhādīsu sotāpattimaggādīsu vā kiṃ tayā adhigataṃ. Kinti te adhigatanti upāyapucchā. Ayañhi etthādhippāyo – kiṃ tayā aniccalakkhaṇaṃ dhuraṃ katvā adhigataṃ, dukkhānattalakkhaṇesu aññataraṃ vā, kiṃ vā samādhivasena abhinivisitvā, udāhu vipassanāvasena, tathā kiṃ rūpe abhinivisitvā, udāhu arūpe, kiṃ vā ajjhattaṃ abhinivisitvā, udāhu bahiddhāti. Kadā te adhigatanti kālapucchā, pubbaṇhamajjhanhikādīsu katarasmiṃ kāleti vuttaṃ hoti."
NULL,p132,247,100,bodytext,,"Kattha te adhigatanti okāsapucchā, kismiṃ okāse, kiṃ rattiṭṭhāne divāṭṭhāne rukkhamūle maṇḍape katarasmiṃ vā vihāreti vuttaṃ hoti. Katame te kilesā pahīnāti pahīnakilese pucchati, kataramaggavajjhā tava kilesā pahīnāti vuttaṃ hoti."
NULL,p132,248,100,bodytext,,"Katamesaṃ tvaṃ dhammānaṃ lābhīti paṭiladdhadhammapucchā, paṭhamamaggādīsu katamesaṃ tvaṃ dhammānaṃ lābhīti vuttaṃ hoti."
NULL,p132,249,100,bodytext,,"Tasmā idāni cepi koci bhikkhu uttarimanussadhammādhigamaṃ byākareyya, na so ettāvatāva sakkātabbo. Imesu pana chasu ṭhānesu sodhanatthaṃ vattabbo ‘‘kiṃ te adhigataṃ, kiṃ jhānaṃ udāhu vimokkhādīsu aññatara’’nti? Yo hi yena adhigato dhammo, so tassa pākaṭo hoti. Sace ‘‘idaṃ nāma me adhigata’’nti vadati, tato ‘‘kinti te adhigata’’nti pucchitabbo. Aniccalakkhaṇādīsu kiṃ dhuraṃ katvā, aṭṭhatiṃsāya vā ārammaṇesu  rūpārūpaajjhattabahiddhādibhedesu vā dhammesu kena mukhena abhinivisitvāti? Yo hi yassābhiniveso, so tassa pākaṭo hoti."
NULL,p132,250,100,bodytext,,"Sace pana ‘‘ayaṃ nāma me abhiniveso, evaṃ mayā adhigata’’nti vadati, tato ‘‘kadā te adhigata’’nti pucchitabbo, ‘‘kiṃ pubbaṇhe, udāhu majjhanhikādīsu aññatarasmiṃ kāle’’ti? Sabbesañhi attanā adhigatakālo pākaṭo hoti. Sace ‘‘amukasmiṃ nāma me kāle adhigata’’nti vadati, tato ‘‘kattha te adhigata’’nti pucchitabbo, ‘‘kiṃ divāṭṭhāne, udāhu rattiṭṭhānādīsu aññatarasmiṃ okāse’’ti? Sabbesañhi attanā adhigatokāso pākaṭo hoti. Sace ‘‘amukasmiṃ nāma me okāse adhigata’’nti vadati, tato ‘‘katame te kilesā pahīnā’’ti pucchitabbo, ‘‘kiṃ paṭhamamaggavajjhā, udāhu dutiyādimaggavajjhā’’ti? Sabbesañhi attanā adhigatamaggena pahīnakilesā pākaṭā honti."
NULL,p132,251,100,bodytext,,"Sace  ‘‘ime nāma me kilesā pahīnā’’ti vadati, tato ‘‘katamesaṃ tvaṃ dhammānaṃ lābhī’’ti pucchitabbo, ‘‘kiṃ sotāpattimaggassa, udāhu sakadāgāmimaggādīsu aññatarassā’’ti? Sabbesañhi attanā adhigatadhammo pākaṭo hoti. Sace ‘‘imesaṃ nāmāhaṃ dhammānaṃ lābhī’’ti vadati, ettāvatāpissa vacanaṃ na saddhātabbaṃ. Bahussutā hi uggahaparipucchākusalā bhikkhū imāni cha ṭhānāni sodhetuṃ sakkonti. Imassa bhikkhuno āgamanapaṭipadā sodhetabbā, yadi āgamanapaṭipadā na sujjhati, ‘‘imāya paṭipadāya lokuttaradhammā nāma na labbhantī’’ti apanetabbo."
NULL,p132,252,100,bodytext,,"Yadi panassa āgamanapaṭipadā sujjhati, ‘‘dīgharattaṃ tīsu sikkhāsu appamatto jāgariyamanuyutto catūsu paccayesu alaggo ākāse pāṇisamena cetasā viharatī’’ti paññāyati, tassa bhikkhuno byākaraṇaṃ paṭipadāya  saddhiṃ saṃsandati sameti. ‘‘Seyyathāpi nāma gaṅgodakaṃ yamunodakena saddhiṃ saṃsandati sameti, evameva supaññattā tena bhagavatā sāvakānaṃ nibbānagāminī paṭipadā saṃsandati sameti nibbānañca paṭipadā cā’’ti (dī. ni. 2.296) vuttasadisaṃ hoti."
NULL,p132,253,100,bodytext,,"Apica kho ettakenāpi sakkāro na kātabbo. Kasmā? Ekaccassa hi puthujjanassāpi sato khīṇāsavapaṭipattisadisā paṭipadā hoti. Tasmā so bhikkhu tehi tehi upāyehi uttāsetabbo. Khīṇāsavassa nāma asaniyāpi matthake patamānāya bhayaṃ vā chambhitattaṃ vā lomahaṃso vā na hoti, puthujjanassa appamattakenāpi hoti."
NULL,p132,254,100,bodytext,,"Tatrimāni  vatthūni – dīghabhāṇakaabhayatthero kira ekaṃ piṇḍapātikaṃ pariggahetuṃ asakkonto daharassa saññaṃ adāsi. So taṃ nhāyamānaṃ kalyāṇīnadīmukhadvāre nimujjitvā pāde aggahesi. Piṇḍapātiko kumbhīloti saññāya mahāsaddamakāsi, tadā naṃ puthujjanoti sañjāniṃsu. Candamukhatissarājakāle pana mahāvihāre saṅghatthero khīṇāsavo dubbalacakkhuko vihāreyeva acchi. Rājā theraṃ pariggaṇhissāmīti bhikkhūsu bhikkhācāraṃ gatesu appasaddo upasaṅkamitvā sappo viya pāde aggahesi. Thero silāthambho viya niccalo hutvā ko etthāti āha? Ahaṃ, bhante, tissoti. Sugandhaṃ vāyasi no tissāti? Evaṃ khīṇāsavassa bhayaṃ nāma natthīti."
NULL,p132,255,100,bodytext,,"Ekacco pana puthujjanopi atisūro hoti nibbhayo. So rañjanīyena ārammaṇena pariggaṇhitabbo. Vasabharājāpi hi ekaṃ theraṃ pariggaṇhamāno ghare nisīdāpetvā tassa  santike badarasāḷavaṃ maddamāno nisīdi. Mahātherassa kheḷo cali, tato therassa puthujjanabhāvo āvibhūto. Khīṇāsavassa hi rasataṇhā nāma suppahīnā, dibbesupi rasesu nikanti nāma na hoti. Tasmā imehi upāyehi pariggahetvā sacassa bhayaṃ vā chambhitattaṃ vā lomahaṃso vā rasataṇhā vā uppajjati, na tvaṃ arahāti apanetabbo. Sace pana abhīrū acchambhī anutrāsī hutvā sīho viya nisīdati, dibbārammaṇepi nikantiṃ na janeti. Ayaṃ bhikkhu sampannaveyyākaraṇo samantā rājarājamahāmattādīhi pesitaṃ sakkāraṃ arahatīti."
NULL,p132,256,100,centered,,Papañcasūdaniyā majjhimanikāyaṭṭhakathāya
NULL,p132,257,100,centered,,Chabbisodhanasuttavaṇṇanā niṭṭhitā.
NULL,p132,258,3,subhead,3. Sappurisadhammasuttavaṇṇanā,3. Sappurisadhammasuttavaṇṇanā
NULL,p132,259,100,bodytext,,"105. Evaṃme sutanti sappurisadhammasuttaṃ. Tattha sappurisadhammanti sappurisānaṃ dhammaṃ. Asappurisadhammanti pāpapurisānaṃ dhammaṃ. Evaṃ mātikaṃ ṭhapetvāpi puna yathā nāma maggakusalo puriso vāmaṃ muñcitvā dakkhiṇaṃ gaṇhāti. Paṭhamaṃ muñcitabbaṃ katheti, evaṃ pahātabbaṃ dhammaṃ paṭhamaṃ desento katamo ca, bhikkhave, asappurisadhammotiādimāha. Tattha uccākulāti khattiyakulā vā brāhmaṇakulā vā. Etadeva hi kuladvayaṃ ‘‘uccākula’’nti vuccati. So tattha pujjoti so bhikkhu tesu bhikkhūsu pūjāraho. Antaraṃ karitvāti abbhantaraṃ katvā."
NULL,p132,260,100,bodytext,,Mahākulāti khattiyakulā vā brāhmaṇakulā vā vessakulā  vā. Idameva hi kulattayaṃ ‘‘mahākula’’nti vuccati. Mahābhogakulāti mahantehi  bhogehi samannāgatā kulā. Uḷārabhogakulāti uḷārehi paṇītehi bhogehi sampannakulā. Imasmiṃ padadvaye cattāripi kulāni labbhanti. Yattha katthaci kule jāto hi puññabalehi mahābhogopi uḷārabhogopi hotiyeva.
NULL,p132,261,100,bodytext,,106. Yasassīti parivārasampanno. Appaññātāti rattiṃ khittasarā viya saṅghamajjhādīsu na paññāyanti. Appesakkhāti appaparivārā.
NULL,p132,262,100,bodytext,,"107. Āraññikoti samādinnaāraññikadhutaṅgo. Sesadhutaṅgesupi eseva nayo. Imasmiñca sutte pāḷiyaṃ naveva dhutaṅgāni āgatāni, vitthārena panetāni terasa honti. Tesu yaṃ vattabbaṃ, taṃ sabbaṃ sabbākārena visuddhimagge dhutaṅganiddese vuttameva."
NULL,p132,263,100,bodytext,,"108. Atammayatāti tammayatā vuccati taṇhā, nittaṇhāti attho. Atammayataññeva antaraṃ karitvāti nittaṇhataṃyeva kāraṇaṃ katvā abbhantaraṃ vā katvā, citte uppādetvāti attho."
NULL,p132,264,100,bodytext,,"Nirodhavāre  yasmā anāgāmikhīṇāsavāva taṃ samāpattiṃ samāpajjanti, puthujjanassa sā natthi, tasmā asappurisavāro parihīno. Na kañci maññatīti kañci puggalaṃ tīhi maññanāhi na maññati. Nakuhiñci maññatīti kismiñci okāse na maññati. Na kenaci maññatīti kenaci vatthunāpi taṃ puggalaṃ na maññati. Sesaṃ sabbattha uttānamevāti."
NULL,p132,265,100,centered,,Papañcasūdaniyā majjhimanikāyaṭṭhakathāya
NULL,p132,266,100,centered,,Sappurisadhammasuttavaṇṇanā niṭṭhitā.
NULL,p132,267,3,subhead,4. Sevitabbāsevitabbasuttavaṇṇanā,4. Sevitabbāsevitabbasuttavaṇṇanā
NULL,p132,268,100,bodytext,,"109. Evaṃme sutanti sevitabbāsevitabbasuttaṃ. Tattha tañca aññamaññaṃ kāyasamācāranti aññaṃ sevitabbaṃ kāyasamācāraṃ, aññaṃ asevitabbaṃ vadāmi, sevitabbameva kenaci pariyāyena asevitabbanti, asevitabbaṃ vā sevitabbanti ca na vadāmīti attho. Vacīsamācārādīsu eseva nayo. Iti  bhagavā sattahi padehi mātikaṃ ṭhapetvā vitthārato avibhajitvāva desanaṃ niṭṭhāpesi. Kasmā? Sāriputtattherassa okāsakaraṇatthaṃ."
NULL,p132,269,100,bodytext,,113. Manosamācāre micchādiṭṭhisammādiṭṭhiyo diṭṭhipaṭilābhavasena visuṃ aṅgaṃ hutvā ṭhitāti na gahitā.
NULL,p132,270,100,bodytext,,114. Cittuppāde akammapathappattā abhijjhādayo veditabbā.
NULL,p132,271,100,bodytext,,115. Saññāpaṭilābhavāre abhijjhāsahagatāya saññāyātiādīni kāmasaññādīnaṃ dassanatthaṃ vuttāni.
NULL,p132,272,100,bodytext,,"117. Sabyābajjhanti sadukkhaṃ. Apariniṭṭhitabhāvāyāti bhavānaṃ apariniṭṭhitabhāvāya. Ettha ca sabyābajjhattabhāvā nāma cattāro honti. Puthujjanopi hi yo tenattabhāvena bhavaṃ pariniṭṭhāpetuṃ na sakkoti, tassa paṭisandhito paṭṭhāya akusalā dhammā vaḍḍhanti, kusalā dhammā ca parihāyanti, sadukkhameva  attabhāvaṃ abhinibbatteti nāma. Tathā sotāpannasakadāgāmianāgāmino. Puthujjanādayo tāva hontu, anāgāmī kathaṃ sabyābajjhaṃ attabhāvaṃ abhinibbatteti, kathañcassa akusalā dhammā abhivaḍḍhanti, kusalā dhammā parihāyantīti. Anāgāmīpi hi suddhāvāse nibbatto uyyānavimānakapparukkhe oloketvā ‘‘aho sukhaṃ aho sukha’’nti udānaṃ udāneti, anāgāmino bhavalobho bhavataṇhā appahīnāva honti, tassa appahīnataṇhatāya akusalā vaḍḍhanti nāma, kusalā parihāyanti nāma, sadukkhameva attabhāvaṃ abhinibbatteti, apariniṭṭhitabhavoyeva hotīti veditabbo."
NULL,p132,273,100,bodytext,,"Abyābajjhanti  adukkhaṃ. Ayampi catunnaṃ janānaṃ vasena veditabbo. Yo hi puthujjanopi tenattabhāvena bhavaṃ pariniṭṭhāpetuṃ sakkoti, puna paṭisandhiṃ na gaṇhāti, tassa paṭisandhiggahaṇato paṭṭhāya akusalā parihāyanti, kusalāyeva vaḍḍhanti, adukkhameva attabhāvaṃ nibbatteti, pariniṭṭhitabhavoyeva nāma hoti. Tathā sotāpannasakadāgāmianāgāmino. Sotāpannādayo tāva hontu, puthujjano kathaṃ abyābajjhaattabhāvaṃ nibbatteti, kathañcassa akusalaparihāniādīni hontīti. Puthujjanopi pacchimabhaviko tenattabhāvena bhavaṃ pariniṭṭhāpetuṃ samattho hoti. Tassa  aṅgulimālassa viya ekenūnapāṇasahassaṃ ghātentassāpi attabhāvo abyābajjhoyeva nāma, bhavaṃ pariniṭṭhāpetiyeva nāma. Akusalameva hāyati, vipassanameva gabbhaṃ gaṇhāpeti nāma."
NULL,p132,274,100,bodytext,,"119. Cakkhuviññeyyantiādīsu yasmā ekaccassa tasmiṃyeva rūpe rāgādayo uppajjanti, abhinandati assādeti, abhinandanto  assādento anayabyasanaṃ pāpuṇāti, ekaccassa nuppajjanti, nibbindati virajjati, nibbindanto virajjanto nibbutiṃ pāpuṇāti, tasmā ‘‘tañca aññamañña’’nti na vuttaṃ. Esa nayo sabbattha."
NULL,p132,275,100,bodytext,,"Evaṃ vitthārena atthaṃ ājāneyyunti ettha ke bhagavato imassa bhāsitassa atthaṃ ājānanti, ke na ājānantīti? Ye tāva imassa suttassa pāḷiñca aṭṭhakathañca uggaṇhitvā takkarā na honti, yathāvuttaṃ anulomapaṭipadaṃ na paṭipajjanti, te na ājānanti nāma. Ye pana takkarā honti, yathāvuttaṃ anulomapaṭipadaṃ paṭipajjanti, te ājānanti nāma. Evaṃ santepi sapaṭisandhikānaṃ tāva dīgharattaṃ hitāya sukhāya hotu, appaṭisandhikānaṃ kathaṃ hotīti. Appaṭisandhikā anupādānā viya jātavedā parinibbāyanti, kappasatasahassānampi accayena tesaṃ puna dukkhaṃ nāma natthi. Iti ekaṃsena tesaṃyeva dīgharattaṃ hitāya sukhāya hoti. Sesaṃ sabbattha uttānamevāti."
NULL,p132,276,100,centered,,Papañcasūdaniyā majjhimanikāyaṭṭhakathāya
NULL,p132,277,100,centered,,Sevitabbāsevitabbasuttavaṇṇanā niṭṭhitā.
NULL,p132,278,3,subhead,5. Bahudhātukasuttavaṇṇanā,5. Bahudhātukasuttavaṇṇanā
NULL,p132,279,100,bodytext,,"124. Evaṃme sutanti bahudhātukasuttaṃ. Tattha bhayānītiādīsu bhayanti cittutrāso. Upaddavoti anekaggatākāro. Upasaggoti upasaṭṭhākāro tattha tattha lagganākāro. Tesaṃ evaṃ nānattaṃ veditabbaṃ – pabbatādivisamanissitā corā janapadavāsīnaṃ pesenti ‘‘mayaṃ asukadivase nāma tumhākaṃ gāmaṃ paharissāmā’’ti. Taṃ pavattiṃ sutakālato  paṭṭhāya bhayaṃ santāsaṃ āpajjanti. Ayaṃ cittutrāso nāma. ‘‘Idha no corā kupitā anatthampi āvaheyyu’’nti hatthasāraṃ gahetvā dvipadacatuppadehi saddhiṃ araññaṃ pavisitvā tattha tattha bhūmiyaṃ nipajjanti, ḍaṃsamakasādīhi khajjamānā gumbantarāni pavisanti, khāṇukaṇṭake maddanti. Tesaṃ evaṃ vicarantānaṃ vikkhittabhāvo anekaggatākāro nāma. Tato coresu yathāvutte divase anāgacchantesu ‘‘tucchakasāsanaṃ taṃ bhavissati, gāmaṃ pavisissāmā’’ti saparikkhārā gāmaṃ pavisanti, atha tesaṃ paviṭṭhabhāvaṃ ñatvā gāmaṃ parivāretvā dvāre aggiṃ datvā manusse ghātetvā corā sabbaṃ vibhavaṃ vilumpetvā gacchanti. Tesu ghātitāvasesā aggiṃ nibbāpetvā koṭṭhacchāyabhitticchāyādīsu tattha tattha laggitvā nisīdanti naṭṭhaṃ anusocamānā. Ayaṃ upasaṭṭhākāro lagganākāro nāma."
