id,book,par_num,level,class,title,text
NULL,p47,1083,100,gatha1,,"Kā ca suphassayaṃ dānaṃ mañcapīṭhādikaṃ adā;"
NULL,p47,1084,100,gathalast,,"Kāyo nānāvidhaṃ puññaṃ katvāna tidivaṃ gatā."
NULL,p47,1085,100,gatha1,,"Kaṃ  bhāvanañca bhāveti kaṃ sīlaṃ paripālayī;"
NULL,p47,1086,100,gathalast,,"Kā nāma dāsiyo kamme kārāpayati sāmiko."
NULL,p47,1087,100,gatha1,,"Kāya upāsikāyassu dhammo ca sūyate sadā;"
NULL,p47,1088,100,gathalast,,"Kāhi ca sīlavatīhi dhammo ca sūyate sadā."
NULL,p47,1089,100,gatha1,,"Kāya vijjāya me putto pāpuṇāti idaṃ sukhaṃ;"
NULL,p47,1090,100,gathalast,,"Kāhi sikkhāhi me puttā pāpuṇanti idaṃ sukhaṃ."
NULL,p47,1091,100,gatha1,,"Kassā upāsikāyassu dānaṃ dadeyya dhanavā;"
NULL,p47,1092,100,gathalast,,"Kāsaṃ upāsikānañca dānaṃ dadeyya guṇavā."
NULL,p47,1093,100,gatha1,,"Kāya gaṅgāya sabbāca pabhavantīti kunnadī;"
NULL,p47,1094,100,gathalast,,"Kāhi ca pana nadīhi pabhavanti mahānadī."
NULL,p47,1095,100,gatha1,,"Kassā kho pana gaṅgāya mahogho hoti sabbadā;"
NULL,p47,1096,100,gathalast,,"Kāsaṃ kho pana kaññānaṃ ābharaṇā bhavanti ca."
NULL,p47,1097,100,gatha1,,"Kassaṃ nadiṃ pana macchā niccaṃ vicaranti sadā;"
NULL,p47,1098,100,gathalast,,"Kāsu gaṅgāsu kho macchā niccaṃ vicaranti sadā."
NULL,p47,1099,100,centered,,"Iti chabbīsatimo pāṭho."
NULL,p47,1100,100,centered,,"Napuṃsakaliṅgarūpāni vuccante."
NULL,p47,1101,100,gatha1,,"Kiṃ te jaṭāhi dummedha kiṃ te ajinasāṭiyā;"
NULL,p47,1102,100,gathalast,,"Kāni cittāni jāyanti kathaṃ jānema taṃ mayaṃ."
NULL,p47,1103,100,gatha1,,"Kiṃ tvaṃ attavasaṃ disvā mama dajjāsimaṃ dhanaṃ;"
NULL,p47,1104,100,gathalast,,"Kāni puññāni katvāna kittakā tidivaṃ gatā."
NULL,p47,1105,100,gatha1,,"Kenassu nīyati loko kenassu parikassati;"
NULL,p47,1106,100,gathalast,,"Kehi me puññakammassa nāntamevañca dissati."
NULL,p47,1107,100,gatha1,,"Kenāsi dummano tāta purisaṃ kannu yocasi;"
NULL,p47,1108,100,gathalast,,"Kehi pupphehi sakkaccaṃ saddho yajati gotamaṃ."
NULL,p47,1109,100,gatha1,,"Kassa so kayirā mettiṃ tamāhu cariyaṃ budhā;"
NULL,p47,1110,100,gathalast,,"Kesaṃ dānavaraṃ etaṃ dātabbañca sadādarā."
NULL,p47,1111,100,gatha1,,"Kasmā coro ahu me tvaṃ iti rājā apucchitaṃ;"
NULL,p47,1112,100,gathalast,,"Kehi nāmapi hetūhi jāyantīti ime janā."
NULL,p47,1113,100,gatha1,,"Kassa te dhammamaññāya acchiduṃ bhavabhandhanaṃ;"
NULL,p47,1114,100,gathalast,,"Kesaṃ majjhagato bhāti candova nabhamajjhago."
NULL,p47,1115,100,gatha1,,"Kasmiṃ me sivayo kuddhā nāhaṃ passāmi dukkaṭaṃ;"
NULL,p47,1116,100,gathalast,,"Kesu puññesu yojeti sakhīnaṃ so sakhāhitoti."
NULL,p47,1117,100,centered,,"Iti  sattavīsatimo pāṭho."
NULL,p47,1118,100,centered,,"Iti padamañjariyā sabbanāmānaṃ."
NULL,p47,1119,100,centered,,"Catuttho paricchedo."
NULL,p47,1120,100,centered,,"Atha aliṅgatumhāmhasaddā vuccante."
NULL,p47,1121,100,unindented,,"Tvaṃ pana puriso puññaṃ karohi"
NULL,p47,1122,100,unindented,,"Tumhe purisā puññaṃ karotha"
NULL,p47,1123,100,unindented,,"Tuvaṃ pana purisaṃ puññaṃ kārāpeti"
NULL,p47,1124,100,unindented,,"Tumhe purise puññāni kārāpeti"
NULL,p47,1125,100,unindented,,"Tayā purisena odano paccate"
NULL,p47,1126,100,unindented,,"Tumhehi purisehi odanā paccante"
NULL,p47,1127,100,unindented,,"Tayā purisena ekacco jīvati"
NULL,p47,1128,100,unindented,,"Tumhehi purisehi ekacce jīvanti"
NULL,p47,1129,100,unindented,,"Tuyhaṃ purisassa dhanaṃ deti dhanī"
NULL,p47,1130,100,unindented,,"Tumhākaṃ purisānaṃ dhanaṃ deti dhanī"
NULL,p47,1131,100,unindented,,"Tayā purisamhā apeti yo koci"
NULL,p47,1132,100,unindented,,"Tumhehi purisehi apenti ye keci"
NULL,p47,1133,100,unindented,,"Tuyhaṃ purisassa nāma gottādayo"
NULL,p47,1134,100,unindented,,"Tumhākaṃ purisānaṃ pariggaho"
NULL,p47,1135,100,unindented,,"Tayi purisasmiṃ koci pasīdati"
NULL,p47,1136,100,unindented,,"Tumhesu purisesu keci pasīdanti."
NULL,p47,1137,100,centered,,"Iti paṭhamo pāṭho."
NULL,p47,1138,100,unindented,,"Tvaṃ itthīpi odanaṃ bhutvā gacchāhi"
NULL,p47,1139,100,unindented,,"Tumhe itthiyo odanaṃ bhutvā gacchatha"
NULL,p47,1140,100,unindented,,"Tuvaṃ itthiṃ puññaṃ kārayati puriso"
NULL,p47,1141,100,unindented,,"Tumhe itthiyo puññāni kārenti purisā"
NULL,p47,1142,100,unindented,,"Tayā itthiyāpi dhaññaṃ bhajjate"
NULL,p47,1143,100,unindented,,"Tumhehi itthīhi dhaññāni bhajjante"
NULL,p47,1144,100,unindented,,"Tayā itthiyā dukkhaṃ pāpuṇāti koci"
NULL,p47,1145,100,unindented,,"Tumhehi itthīhi sukhaṃ pāpuṇāti sāmi"
NULL,p47,1146,100,unindented,,"Tuyhaṃ itthiyā ābharaṇaṃ deti sāmi"
NULL,p47,1147,100,unindented,,"Tumhākaṃ itthīnaṃ ābharaṇaṃ deti sāmi"
NULL,p47,1148,100,unindented,,"Tayā itthiyā apeti yo koci"
NULL,p47,1149,100,unindented,,"Tumhehi itthīhi apenti ye keci"
NULL,p47,1150,100,unindented,,"Tuyhaṃ itthiyā puttāpi bahavo honti"
NULL,p47,1151,100,unindented,,"Tumhākaṃ itthīnaṃ vatthābharaṇāni honti"
NULL,p47,1152,100,unindented,,"Tvayi itthiyā pana manaṃ patiṭṭhitaṃ"
NULL,p47,1153,100,unindented,,"Tumhesu itthīsu pana manāni patiṭṭhitāni."
NULL,p47,1154,100,centered,,"Iti  dutiyo pāṭho."
NULL,p47,1155,100,unindented,,"Tvaṃ cittaṃ pana ārammaṇaṃ cintesi"
NULL,p47,1156,100,unindented,,"Tumhe cittāni ārammaṇaṃ cintetha"
NULL,p47,1157,100,unindented,,"Tvaṃ cittaṃ saññamessanti ye keci"
NULL,p47,1158,100,unindented,,"Tumhe cittāni saññamessanti ye keci"
NULL,p47,1159,100,unindented,,"Tayā cittena kammaphalaṃ anubhuttaṃ"
NULL,p47,1160,100,unindented,,"Tumhehi cittehi kammaphalaṃ anubhuttaṃ"
NULL,p47,1161,100,unindented,,"Tayā cittena buddhaṃ sarati sappuriso"
NULL,p47,1162,100,unindented,,"Tumhehi cittehi buddhaṃ saranti sappurisā"
NULL,p47,1163,100,unindented,,"Tuyhaṃ cittassa ovādaṃ deti koci"
NULL,p47,1164,100,unindented,,"Tumhākaṃ cittānaṃ ovādaṃ denti keci"
NULL,p47,1165,100,unindented,,"Tayā cittamhā kho pana bhayaṃ uppajjati"
NULL,p47,1166,100,unindented,,"Tumhehi cittehi pana bhayāni uppajjanti"
NULL,p47,1167,100,unindented,,"Tuyhaṃ cittassa parivitakko udapādi"
NULL,p47,1168,100,unindented,,"Tumhākaṃ cittānaṃ parivitakko udapādi"
NULL,p47,1169,100,unindented,,"Tayi citte kho pana kusalacittaṃ patiṭhitaṃ"
NULL,p47,1170,100,unindented,,"Tumhesu cittesu kusalacittāni patiṭṭhitāni."
NULL,p47,1171,100,centered,,"Iti tatiyo pāṭho."
NULL,p47,1172,100,unindented,,"Ahaṃ purisopi puññaṃ karomi"
NULL,p47,1173,100,unindented,,"Mayaṃ purisā pana puññaṃ karoma"
NULL,p47,1174,100,unindented,,"Mamaṃ purisaṃ puññaṃ kārāpeti"
NULL,p47,1175,100,unindented,,"Amhe purise puññāni kārāpeti"
NULL,p47,1176,100,unindented,,"Mayā purisena kammaphalaṃ anubhuttaṃ"
NULL,p47,1177,100,unindented,,"Amhehi purisehi kammaphalaṃ anubhuttaṃ"
NULL,p47,1178,100,unindented,,"Mayā purisena ekacco sucarati"
NULL,p47,1179,100,unindented,,"Amhehi purisehi ekacce sucaranti"
NULL,p47,1180,100,unindented,,"Amhaṃ purisassa dhanaṃ dadāti dhanavā"
NULL,p47,1181,100,unindented,,"Amhākaṃ purisānaṃ phalaṃ dadāti phalavā"
NULL,p47,1182,100,unindented,,"Mayā purisasmā apeti ekacco"
NULL,p47,1183,100,unindented,,"Amhehi purisehi bhayāni uppajjanti"
NULL,p47,1184,100,unindented,,"Amhaṃ purisassa nāma gottādi"
NULL,p47,1185,100,unindented,,"Amhākaṃ purisānaṃ pariggaho hoti"
NULL,p47,1186,100,unindented,,"Mayi purisasmiṃ pasīdati yo koci"
NULL,p47,1187,100,unindented,,"Amhesu purisesu ekacco sūratamo."
NULL,p47,1188,100,centered,,"Iti catuttho pāṭho."
NULL,p47,1189,100,unindented,,"Ahaṃ kaññā pana puññaṃ karomi"
NULL,p47,1190,100,unindented,,"Mayaṃ kaññāyo puññāni karoma"
NULL,p47,1191,100,unindented,,"Mamaṃ kaññaṃ puññaṃ kārāpeti"
NULL,p47,1192,100,unindented,,"Amhe  kaññāyo puññaṃ kārāpeti"
NULL,p47,1193,100,unindented,,"Mayā kaññāya odano paccate"
NULL,p47,1194,100,unindented,,"Amhehi kaññāhi odano paccate"
NULL,p47,1195,100,unindented,,"Mayā kaññāya sukhadukkhā pāpuṇāti"
NULL,p47,1196,100,unindented,,"Amhehi kaññāhi sukhadukkhaṃ pāpuṇāti"
NULL,p47,1197,100,unindented,,"Amhaṃ kaññāya ābharaṇaṃ deti"
NULL,p47,1198,100,unindented,,"Amhākaṃ kaññānaṃ ābharaṇaṃ deti"
NULL,p47,1199,100,unindented,,"Mayā kaññāya ayaṃ kaññā hīṇā"
NULL,p47,1200,100,unindented,,"Amhehi kaññāhi ayaṃ kaññā adhikā"
NULL,p47,1201,100,unindented,,"Amhaṃ kaññāya vatthābharaṇāni honti"
NULL,p47,1202,100,unindented,,"Amhākaṃ kaññānaṃ pariggaho hoti"
NULL,p47,1203,100,unindented,,"Mayi kaññāyaṃ me manaṃ napatiṭṭhitaṃ"
NULL,p47,1204,100,unindented,,"Amhesu kaññāsu me manaṃ patiṭṭhitaṃ."
NULL,p47,1205,100,centered,,"Iti pañcamo pāṭho."
NULL,p47,1206,100,unindented,,"Ahaṃ cittaṃ pana ārammaṇaṃ vijānāhi"
NULL,p47,1207,100,unindented,,"Mayaṃ cittāni ārammaṇaṃ vijānātha"
NULL,p47,1208,100,unindented,,"Mamaṃ cittaṃ saññamessanti ekacce"
NULL,p47,1209,100,unindented,,"Amhe cittāni saññamessanti keci"
NULL,p47,1210,100,unindented,,"Mayā cittena kammaphalaṃ anubhuttaṃ"
NULL,p47,1211,100,unindented,,"Amhehi cittehi kammaphalaṃ anubhuttaṃ"
NULL,p47,1212,100,unindented,,"Mayā cittena buddhaṃ sarati sappuriso"
NULL,p47,1213,100,unindented,,"Amhehi cittehi buddhaṃ sarati saddho"
NULL,p47,1214,100,unindented,,"Mamaṃ cittassa ovādaṃ deti koci"
NULL,p47,1215,100,unindented,,"Amhākaṃ cittānaṃ ovādaṃ denti keci"
NULL,p47,1216,100,unindented,,"Mayā cittasmā pana bhayaṃ uppajjati"
NULL,p47,1217,100,unindented,,"Amhehi cittehi bhayāni uppajjanti"
NULL,p47,1218,100,unindented,,"Mamaṃ cittassa parivitakko udapādi"
NULL,p47,1219,100,unindented,,"Amhākaṃ cittānaṃ parivitakko hoti"
NULL,p47,1220,100,unindented,,"Mayi citte pana kusalacittaṃ patiṭṭhitaṃ"
NULL,p47,1221,100,unindented,,"Amhesu cittesu kusalacittāni patiṭṭhitāni."
NULL,p47,1222,100,centered,,"Iti chaṭṭho pāṭho."
NULL,p47,1223,100,unindented,,"Gāmaṃ vo pana gaccheyyātha"
NULL,p47,1224,100,unindented,,"Gāmaṃ no pana gaccheyyāma"
NULL,p47,1225,100,unindented,,"Pahāya vo bhikkhave gamissāmi"
NULL,p47,1226,100,unindented,,"Mā no ajja pana vikantisu"
NULL,p47,1227,100,unindented,,"Katameva te pana taṃ kammaṃ"
NULL,p47,1228,100,unindented,,"Katameva  me pana taṃ kammaṃ"
NULL,p47,1229,100,unindented,,"Katameva vo pana kusalakammaṃ"
NULL,p47,1230,100,unindented,,"Katameva no pana kusalakammaṃ"
NULL,p47,1231,100,unindented,,"Dadāmi te pana gāmavarāni pañca"
NULL,p47,1232,100,unindented,,"Dadāhi me gāmavaraṃ tvampi"
NULL,p47,1233,100,unindented,,"Dhammaṃ vo bhikkhave desissāmi"
NULL,p47,1234,100,unindented,,"Saṃvibhājetha no rajjena"
NULL,p47,1235,100,unindented,,"Manussasseva te sīsaṃ pana"
NULL,p47,1236,100,unindented,,"Pahūtaṃ me pana dhanaṃ sakka"
NULL,p47,1237,100,unindented,,"Tuṭṭhosmiyā vo pana pakatiyā"
NULL,p47,1238,100,unindented,,"Satthā no bhagavā anuppatto."
NULL,p47,1239,100,gatha1,,"Vo no te meti rūpāni padāni padato yato;"
NULL,p47,1240,100,gathalast,,"Tato nāmikapantīsu natū vuttāni tāni me."
NULL,p47,1241,100,gatha1,,"Paccatte upayoge ca karaṇe sampadāniye;"
NULL,p47,1242,100,gathalast,,"Sāmissa vacane ceva vo no saddo pavattati."
NULL,p47,1243,100,gatha1,,"Karaṇe sampadāne ca sāmiatthe ca āgato;"
NULL,p47,1244,100,gathalast,,"Te me saddoti viññeyyo viññunā nayadassināti."
NULL,p47,1245,100,centered,,"Iti sattamo pāṭho."
NULL,p47,1246,100,centered,,"Iti padamañjariyā aliṅgasabbanāmānaṃ."
NULL,p47,1247,100,centered,,"Pañcamo paricchedo."
NULL,p47,1248,100,unindented,,"Imāni pulliṅgarūpāni vuccante"
NULL,p47,1249,100,unindented,,"Dve mahārājāno rajjaṃ kārenti"
NULL,p47,1250,100,unindented,,"Dvepi mahārājāno upasaṅkamati"
NULL,p47,1251,100,unindented,,"Dvīhi mahārājehi saṅgāmo kato"
NULL,p47,1252,100,unindented,,"Dvīhi mahārājehi raṭṭhavāsino jīvanti"
NULL,p47,1253,100,unindented,,"Dvinnaṃ mahārājānaṃ pannākāraṃ deti"
NULL,p47,1254,100,unindented,,"Dvīhi mahārājehi bhayāni uppajjanti"
NULL,p47,1255,100,unindented,,"Dvinnaṃ mahārājānaṃ pariggaho hoti"
NULL,p47,1256,100,unindented,,"Dvīsu mahārājesu manāni patiṭṭhitāni."
NULL,p47,1257,100,centered,,"Imāni itthiliṅgarūpāni vuccante."
NULL,p47,1258,100,unindented,,"Dve kaññāyo puññāni karonti"
NULL,p47,1259,100,unindented,,"Dve kaññāyo puññāni kārāpeti"
NULL,p47,1260,100,unindented,,"Dvīhi kaññāhi puññāni katāni"
NULL,p47,1261,100,unindented,,"Dvīhi kaññāhi sukhadukkhaṃ pāpuṇāti"
NULL,p47,1262,100,unindented,,"Dvinnaṃ kaññānaṃ ābharaṇāni deti"
NULL,p47,1263,100,unindented,,"Dvīhi  kaññāhi ayaṃ kaññā adhikā"
NULL,p47,1264,100,unindented,,"Dvinnaṃ kaññānaṃ vatthābharaṇaṃ hoti"
NULL,p47,1265,100,unindented,,"Dvīsu kaññāsu manāni patiṭṭhitāni"
NULL,p47,1266,100,centered,,"Imāni napuṃsakaliṅgarūpāni vuccante."
NULL,p47,1267,100,unindented,,"Dve kulāni dānādikusalaṃ karonti"
NULL,p47,1268,100,unindented,,"Dve kulāni dānādikusalaṃ kārāpeti"
NULL,p47,1269,100,unindented,,"Dvīhi kulehi saṅgho bhattaṃ bhojāpito"
NULL,p47,1270,100,unindented,,"Dvīhi kulehi sukhaṃ pāpuṇāti saṅgho"
NULL,p47,1271,100,unindented,,"Dvinnaṃ kulānaṃ sakkāraṃ karonti keci"
NULL,p47,1272,100,unindented,,"Dvīhi kulehi apeti ekacco puggalo"
NULL,p47,1273,100,unindented,,"Dvinnaṃ kulānaṃ nāma gottādayo"
NULL,p47,1274,100,unindented,,"Dvīsu kulesu me cittaṃ patiṭṭhitaṃ."
NULL,p47,1275,100,centered,,"Iti paṭhamo pāṭho."
NULL,p47,1276,100,centered,,"Imāni pulliṅgarūpāni vuccante."
NULL,p47,1277,100,unindented,,"Tayo purisā pana vihāraṃ karonti"
NULL,p47,1278,100,unindented,,"Tayo purise upagacchati ekacco"
NULL,p47,1279,100,unindented,,"Tīhi purisehi vihāro kārāpito"
NULL,p47,1280,100,unindented,,"Tīhi purisehi jīvanti ye keci"
NULL,p47,1281,100,unindented,,"Tiṇṇannaṃ purisānaṃ dhanaṃ deti dhanavā"
NULL,p47,1282,100,unindented,,"Tīhi purisehi bhayāni uppajjanti"
NULL,p47,1283,100,unindented,,"Tiṇṇannaṃ purisānaṃ pariggaho hoti"
NULL,p47,1284,100,unindented,,"Tīsu purisesu pasīdati yo koci."
NULL,p47,1285,100,centered,,"Imāni itthiliṅgarūpāni vuccante."
NULL,p47,1286,100,unindented,,"Tisso itthiyo puññāni karonti"
NULL,p47,1287,100,unindented,,"Tisso itthiyo puññāni kārāpeti"
NULL,p47,1288,100,unindented,,"Tīhi itthīhi saṅgho bhattaṃ bhojāpito"
NULL,p47,1289,100,unindented,,"Tīhi itthīhi jīvanti ekacco puriso"
NULL,p47,1290,100,unindented,,"Tissannaṃ itthīnaṃ ābharaṇāni deti"
NULL,p47,1291,100,unindented,,"Tīhi itthīhi apeti ekacco puriso"
NULL,p47,1292,100,unindented,,"Tissannaṃ itthīnaṃ ābharaṇāni honti"
NULL,p47,1293,100,unindented,,"Tīsu itthīsu pasīdati ekacco puriso."
NULL,p47,1294,100,centered,,"Imāni napuṃsakaliṅgarūpāni vuccante."
NULL,p47,1295,100,unindented,,"Tīni kulāni puññāni karonti"
NULL,p47,1296,100,unindented,,"Tīni kulāni puññāni kārāpeti"
NULL,p47,1297,100,unindented,,"Tīhi kulehi puññāni kariyyante"
NULL,p47,1298,100,unindented,,"Tīhi kulehi jīvanti ye keci"
NULL,p47,1299,100,unindented,,"Tiṇṇannaṃ  kulānaṃ dhanaṃ deti dhanavā"
NULL,p47,1300,100,unindented,,"Tīhi kulehi bhayāni na uppajjanti"
NULL,p47,1301,100,unindented,,"Tiṇṇannaṃ kulānaṃ mahābhogo hoti"
NULL,p47,1302,100,unindented,,"Tīsu kulesu pasīdati ekacco puriso."
NULL,p47,1303,100,centered,,"Iti dutiyo pāṭho."
NULL,p47,1304,100,centered,,"Imāni pulliṅgarūpāni vuccante."
NULL,p47,1305,100,unindented,,"Cattāro mahārājā rajjaṃ karonti"
NULL,p47,1306,100,unindented,,"Cattāro mahārāje upagacchati ekacco"
NULL,p47,1307,100,unindented,,"Catūhi mahārājehi puññāni kariyyante"
NULL,p47,1308,100,unindented,,"Catūhi mahārājehi jīvanti mahājanā"
NULL,p47,1309,100,unindented,,"Catunnaṃ mahārājānaṃ pannākāraṃ denti"
NULL,p47,1310,100,unindented,,"Catūhi mahārājehi bhayāni uppajjanti"
NULL,p47,1311,100,unindented,,"Catunnaṃ mahārājānaṃ ābharaṇaṃ hoti"
NULL,p47,1312,100,unindented,,"Catūsu mahārājesu pasīdati mahājano."
NULL,p47,1313,100,centered,,"Imāni itthiliṅgarūpāni vuccante."
NULL,p47,1314,100,unindented,,"Catasso kaññāyo puññāni karonti"
NULL,p47,1315,100,unindented,,"Catasso kaññāyo puññāni kārāpeti"
NULL,p47,1316,100,unindented,,"Catūhi kaññāhi saṅgho bhattaṃ bhojāpito"
NULL,p47,1317,100,unindented,,"Catūhi kaññāhi vadhaṃ pāpuṇanti purisā"
NULL,p47,1318,100,unindented,,"Catassannaṃ kaññānaṃ ābharaṇāni denti"
NULL,p47,1319,100,unindented,,"Catūhi kaññāhi ayaṃ kaññā adhikā"
NULL,p47,1320,100,unindented,,"Catassannaṃ kaññānaṃ ābharaṇaṃ hoti"
NULL,p47,1321,100,unindented,,"Catūsu kaññāsu pasīdati ekacco puriso."
NULL,p47,1322,100,centered,,"Imāni napuṃsakaliṅgarūpāni vuccante."
NULL,p47,1323,100,unindented,,"Cattāri kulāni bahuṃ puññaṃ karonti"
NULL,p47,1324,100,unindented,,"Cattāri kulāni upagacchanti ekacce"
NULL,p47,1325,100,unindented,,"Catūhi kulehi vihāro kārāpīyate"
NULL,p47,1326,100,unindented,,"Catūhi kulehi jīvanti ekacce purisā"
NULL,p47,1327,100,unindented,,"Catunnaṃ kulānaṃ sakkāraṃ karonti"
NULL,p47,1328,100,unindented,,"Catūhi kulehi apenti ekacce"
NULL,p47,1329,100,unindented,,"Catunnaṃ kulānaṃ nāma gottādayo"
NULL,p47,1330,100,unindented,,"Catusu kulesu pasīdati mahājano."
NULL,p47,1331,100,centered,,"Iti tatiyo pāṭho."
NULL,p47,1332,100,unindented,,"Pañca mahābhūtā tiṭṭhanti"
NULL,p47,1333,100,unindented,,"Pañca mahābhūte passati"
NULL,p47,1334,100,unindented,,"Pañcahi  mahābhūtehi katāni"
NULL,p47,1335,100,unindented,,"Pañcahi mahābhūtehi sucarati"
NULL,p47,1336,100,unindented,,"Pañcannaṃ mahābhūtānaṃ dīyate"
NULL,p47,1337,100,unindented,,"Pañcahi mahābhūtehi apeti"
NULL,p47,1338,100,unindented,,"Pañcannaṃ mahābhūtānaṃ santakaṃ"
NULL,p47,1339,100,unindented,,"Pañcasu mahābhūtesu patiṭṭhitaṃ."
NULL,p47,1340,100,centered,,"Tiliṅgarūpāni vuccante."
NULL,p47,1341,100,unindented,,"Pañca-mahābhūtā pana tiṭṭhanti"
NULL,p47,1342,100,unindented,,"Pañca-abhibhavitāro tiṭṭhanti"
NULL,p47,1343,100,unindented,,"Pañca-purisā pana tiṭṭhanti"
NULL,p47,1344,100,unindented,,"Pañca-bhūmiyo pana honti"
NULL,p47,1345,100,unindented,,"Pañca-kaññāyo pana tiṭṭhanti"
NULL,p47,1346,100,unindented,,"Pañca-mahābhūtāni tiṭṭhanti"
NULL,p47,1347,100,unindented,,"Pañca-cittāni uppajjanti"
NULL,p47,1348,100,unindented,,"Evaṃ sabbattha yojetabbaṃ."
NULL,p47,1349,100,centered,,"Iti catuttho pāṭho."
NULL,p47,1350,100,centered,,"Tiliṅgarūpāni vuccante."
NULL,p47,1351,100,unindented,,"Cha mahābhūtā pana tiṭṭhanti"
NULL,p47,1352,100,unindented,,"Cha abhibhavitāro passati"
NULL,p47,1353,100,unindented,,"Chahi purisehi kammaṃ kataṃ"
NULL,p47,1354,100,unindented,,"Channaṃ bhūmīnaṃ ruccati koci"
NULL,p47,1355,100,unindented,,"Chahi kaññāhi apeti ekacco"
NULL,p47,1356,100,unindented,,"Channaṃ bhūtānaṃ santakaṃ hoti"
NULL,p47,1357,100,unindented,,"Chasu pana cittesu patiṭṭhitaṃ."
NULL,p47,1358,100,centered,,"Tiliṅgarūpāni vuccante."
NULL,p47,1359,100,unindented,,"Satta mahābhūtā pana tiṭṭhanti"
NULL,p47,1360,100,unindented,,"Satta abhibhavitāro passati"
NULL,p47,1361,100,unindented,,"Sattahi purisehi kammaṃ kataṃ"
NULL,p47,1362,100,unindented,,"Sattannaṃ bhūmīnaṃ ruccati koci"
NULL,p47,1363,100,unindented,,"Sattahi kaññāhi apeti ekacco"
NULL,p47,1364,100,unindented,,"Sattannaṃ bhūtānaṃ santakaṃ hoti"
NULL,p47,1365,100,unindented,,"Sattasu pana cittesu patiṭṭhitaṃ."
NULL,p47,1366,100,centered,,"Iti  pañcamo pāṭho."
NULL,p47,1367,100,centered,,"Tiliṅgarūpāni vuccante."
NULL,p47,1368,100,unindented,,"Aṭṭha mahābhūtā pana tiṭṭhanti"
NULL,p47,1369,100,unindented,,"Aṭṭha abhibhavitāro passati"
NULL,p47,1370,100,unindented,,"Aṭṭhahipurisehi kammaṃ kataṃ"
NULL,p47,1371,100,unindented,,"Aṭṭhannaṃ bhūmīnaṃ ruccati koci"
NULL,p47,1372,100,unindented,,"Aṭṭhahi kaññāhi apeti koci"
NULL,p47,1373,100,unindented,,"Aṭṭhannaṃbhūtānaṃ santakaṃ hoti"
NULL,p47,1374,100,unindented,,"Aṭṭhasu pana cittesu patiṭṭhitaṃ."
NULL,p47,1375,100,centered,,"Tiliṅgarūpāni vuccante."
NULL,p47,1376,100,unindented,,"Nava mahābhūtā pana tiṭṭhanti"
NULL,p47,1377,100,unindented,,"Nava abhibhavitāro passati"
NULL,p47,1378,100,unindented,,"Navahi purisehi kammaṃ kataṃ"
NULL,p47,1379,100,unindented,,"Navannaṃ bhūmīnaṃ ruccati koci"
NULL,p47,1380,100,unindented,,"Navahi kaññāhi apeti koci"
NULL,p47,1381,100,unindented,,"Navannaṃ bhūtānaṃ santakaṃ hoti"
NULL,p47,1382,100,unindented,,"Navasu pana cittesu patiṭṭhitaṃ."
NULL,p47,1383,100,centered,,"Iti chaṭṭho pāṭho."
NULL,p47,1384,100,centered,,"Tiliṅgarūpāni vuccante."
NULL,p47,1385,100,unindented,,"Dasa mahābhūtā pana tiṭṭhanti"
NULL,p47,1386,100,unindented,,"Dasa abhibhavitāro passati"
NULL,p47,1387,100,unindented,,"Dasahi purisehi kammaṃ kataṃ"
NULL,p47,1388,100,unindented,,"Dasannaṃ bhūtānaṃ ruccati koci"
NULL,p47,1389,100,unindented,,"Dasahi kaññāhi apeti koci"
NULL,p47,1390,100,unindented,,"Dasannaṃ bhūtānaṃ santakaṃ hoti"
NULL,p47,1391,100,unindented,,"Dasasu pana cittesu patiṭṭhitaṃ."
NULL,p47,1392,100,centered,,"Tiliṅgarūpāni vuccante."
NULL,p47,1393,100,unindented,,"Ekādasa-mahābhūtā tiṭṭhanti"
NULL,p47,1394,100,unindented,,"Dvādasa-abhibhavitāro tiṭṭhanti"
NULL,p47,1395,100,unindented,,"Terasa-purisā pana tiṭṭhanti"
NULL,p47,1396,100,unindented,,"Cuddasa-bhūmiyo pana honti"
NULL,p47,1397,100,unindented,,"Pañcadasa-kaññāyo pana tiṭṭhanti"
NULL,p47,1398,100,unindented,,"Solasa-bhūtāni pana tiṭṭhanti"
NULL,p47,1399,100,unindented,,"Sattarasa-cittāni uppajjanti."
NULL,p47,1400,100,centered,,"Tiliṅgarūpāni  vuccante."
NULL,p47,1401,100,unindented,,"Aṭṭhārasa mahābhūtā pana tiṭṭhanti"
NULL,p47,1402,100,unindented,,"Aṭṭhārasa abhibhavitāro passati"
NULL,p47,1403,100,unindented,,"Aṭṭhārasahi purisehi kammaṃ kataṃ"
NULL,p47,1404,100,unindented,,"Aṭṭhārasannaṃ bhūmīnaṃ ruccati"
NULL,p47,1405,100,unindented,,"Aṭṭhārasahi kaññāhi apeti koci"
NULL,p47,1406,100,unindented,,"Aṭṭhārasannaṃ bhūtānaṃ santakaṃ"
NULL,p47,1407,100,unindented,,"Aṭṭhārasasu cittesu patiṭṭhitaṃ."
NULL,p47,1408,100,centered,,"Iti sattamo pāṭho."
NULL,p47,1409,100,centered,,"Iti padamañjariyā bahuvacanasaṅkhyānāmānaṃ chaṭṭho paricchedo."
NULL,p47,1410,100,centered,,"Tiliṅgarūpāni vuccante."
NULL,p47,1411,100,unindented,,"Ekūnavīsati ekūnavīsaṃ iccādipi"
NULL,p47,1412,100,unindented,,"Ekūnavīsāya ekūnavīsāyaṃ"
NULL,p47,1413,100,unindented,,"Ekūnavīsati bhikkhūpi tiṭṭhanti"
NULL,p47,1414,100,unindented,,"Ekūnavīsaṃ bhikkhūpi passati"
NULL,p47,1415,100,unindented,,"Ekūnavīsāya bhikkhūhi dhammo desito"
NULL,p47,1416,100,unindented,,"Ekūnavīsāya kaññāhi kammaṃ kataṃ"
NULL,p47,1417,100,unindented,,"Ekūnavīsāya cittehi kammaṃ kataṃ"
NULL,p47,1418,100,unindented,,"Ekūnavīsāya bhikkhūnaṃ cīvaraṃ deti"
NULL,p47,1419,100,unindented,,"Ekūnavīsāya kaññānaṃ dhanaṃ deti"
NULL,p47,1420,100,unindented,,"Ekūnavīsāya cittānaṃ pana ruccati"
NULL,p47,1421,100,unindented,,"Ekūnavīsāya bhikkhūhi apeti koci"
NULL,p47,1422,100,unindented,,"Ekūnavīsāya kaññāhi apeti koci"
NULL,p47,1423,100,unindented,,"Ekūnavīsāya cittehi apeti koci"
NULL,p47,1424,100,unindented,,"Ekūnavīsāya bhikkhūnaṃ santakaṃ"
NULL,p47,1425,100,unindented,,"Ekūnavīsāya kaññānaṃ santakaṃ"
NULL,p47,1426,100,unindented,,"Ekūnavīsāya cittānaṃ santakaṃ"
NULL,p47,1427,100,unindented,,"Ekūnavīsāya bhikkhūsu patiṭṭhitaṃ"
NULL,p47,1428,100,unindented,,"Ekūnavīsāya kaññāsu patiṭṭhitaṃ"
NULL,p47,1429,100,unindented,,"Ekūnavīsāyaṃ cittesu patiṭṭhitaṃ."
NULL,p47,1430,100,centered,,"Iti  paṭhamo pāṭho."
NULL,p47,1431,100,centered,,Pulliṅgarūpāni.
NULL,p47,1432,100,unindented,,"Ekūnavīsati bhikkhūpi tiṭṭhanti"
NULL,p47,1433,100,unindented,,"Ekūnavīsatiṃ bhikkhūpi passati"
NULL,p47,1434,100,unindented,,"Ekūnavīsatiyā bhikkhūhi desito"
NULL,p47,1435,100,unindented,,"Ekūnavīsatiyaṃ bhikkhūsu patiṭṭhitaṃ."
NULL,p47,1436,100,centered,,Itthiliṅgarūpāni.
NULL,p47,1437,100,unindented,,"Ekūnavīsati kaññāyo tiṭṭhanti"
NULL,p47,1438,100,unindented,,"Ekūnavīsatiṃ kaññāyo passati"
NULL,p47,1439,100,unindented,,"Ekūnavīsatiyā kaññāhi kammaṃ kataṃ"
NULL,p47,1440,100,unindented,,"Ekūnavīsatiyaṃ kaññāsu patiṭṭhitaṃ."
NULL,p47,1441,100,centered,,Napuṃsakaliṅgarūpāni.
NULL,p47,1442,100,unindented,,"Ekūnavīsati cittāni uppajjanti"
NULL,p47,1443,100,unindented,,"Ekūnavīsatiṃ cittāni passati"
NULL,p47,1444,100,unindented,,"Ekūnavīsatiyā cittehi kammaṃ kataṃ"
NULL,p47,1445,100,unindented,,"Ekūnavīsatiyaṃ cittesu patiṭṭhitaṃ."
NULL,p47,1446,100,centered,,"Iti dutiyo pāṭho."
NULL,p47,1447,100,centered,,Pulliṅgarūpāni.
NULL,p47,1448,100,unindented,,"Vīsati bhikkhavo tiṭṭhanti"
NULL,p47,1449,100,unindented,,"Vīsatiṃ bhikkhavo passati"
NULL,p47,1450,100,unindented,,"Vīsatiyā bhikkhūhi desito"
NULL,p47,1451,100,unindented,,"Vīsatiyaṃ bhikkhūsu patiṭṭhitaṃ."
