id,book,par_num,level,class,title,text
NULL,p56,264,100,gatha2,,"Namāmi vīra pāde te cakkaṅkita tale subhe;"
NULL,p56,265,100,gathalast,,"Vandite naradevehi amataṃ dehi vandite."
NULL,p56,266,100,gatha1,,"Lokanātha tuvaṃ eko saraṇaṃ sabbapāṇinaṃ;"
NULL,p56,267,100,gathalast,,"Loke tayā samo natthi tārehi janataṃ bahuṃ."
NULL,p56,268,100,gatha1,,"Mahaṇṇave mayaṃ bhante nimuggā dīghasambhave;"
NULL,p56,269,100,gathalast,,"Appatissā appatiṭṭhā saṃsarāma ciraṃ tahiṃ."
NULL,p56,270,100,gatha1,,"Etarahi tumhe āpajja patiṭṭhaṃ adhigacchare;"
NULL,p56,271,100,gathalast,,"Tumhākaṃ vandanaṃ katvā uttiṇṇamha bhavaṇṇavā’ti.)"
NULL,p56,272,100,bodytext,,"Tasmiṃ khaṇe dhātuto rasmiyo nikkhamiṃsu. Sakala laṅkādīpaṃ suvaṇṇarasadhārāhi sañchannaṃ viya ahosi. Mahantaṃ pītisomanassaṃ uppajji. Rājā mahantaṃ somanassaṃ patto hutvā haṭṭhatuṭṭho ahosi. So dhātugharato nikkhamitvā therena saddhiṃ alaṅkatamaṇḍape ekamantaṃ nisīdi. Ekamantaṃ nisinno (nisajjādose vajjetvā seyyathidaṃ? Atiduraccāsanta-uparivāta-unnatappadesa-atisammukha-atipacachā’ti.  Atidūre nisinno sace kathetukāmo uccāsaddena kathetabbaṃ hoti. Accāsanne nisinno saṅkaraṃ karoti. Uparivāte nisinno sarīragandho vāyati. Unnatappadese nisinno agāravaṃ karoti. Atisammukhe nisinno cakkhunā cakkhuṃ paharitvā daṭṭhabbaṃ hoti. Atipacchā nisinno gīvaṃ parivattetvā daṭṭhabbaṃ hoti. Iti nisajjādosaṃ vajjetvā nisinno). Evamāha. Bhante imaṃ dhātuṃ mayhaṃ detha. Mahantaṃ pūjāsakkaraṃ katvā pariharāmīti. Bhaddakaṃ mahārāja imāya dhātuyā sammāsambuddho dharamānoyeva vyākaraṇaṃ akāsi. Tumhākaṃ vaṃse jāto kākavaṇṇatisso nāma rājā imasmiṃ dīpe mahāvālukagaṅgāya dakkhiṇatīre seru nāma dahassa ante varāha nāma soṇḍiyā matthake patiṭṭhapetvā mahantaṃ thūpaṃ karissatī’ti vatvā satthā tattha samāpattiṃ samāpajjitvā pañcasatakhīṇāsavehi saddhiṃ tikkhattuṃ padakkhiṇaṃ katvā gato. Tasmā gaṇhatha mahārājā’ti vatvā dhātuṃ adāsi."
NULL,p56,273,100,bodytext,,"Rājā dhātuṃ gahetvā caturassapallaṅke dhātukaraṇḍakaṃ nidahitvā karaṇḍake dhātuṃ patiṭṭhāpetvā taṃ kumudapattasannihamaṅgalasindhavayuttarathe ṭhapetvā samantā ārakkhaṃ saṃvidahitvā (rājā dhātuṃ gahetvā) pañcaṅgaturiye paggaṇhāpayamāno pacchā āgacchatu’ti mahājanassa sāsanaṃ vatvā mahādevattherassa santikaṃ gantvā? Tumhe bhante, dhātuyā upaṭṭhānaṃ karonto āgacchathā’ti āha. Thero tassa kathaṃ sutvā;’mahārāja ayaṃ dhātu paramparā āgatā. Ahaṃ bhagavato dhammabhaṇḍāgārikaānandatthero viya imaṃ dhātuṃ pariharissāmī’ti vatvā attano paccayadāyakaṃ kuṭumbikaṃ āpucchitvā pattacīvaramādāya dhātuṃ upaṭṭhahiyamāno pacchato pacchato gacchati. Rājā dhātuṃ gahetvā anupubbena mahāgāmaṃ patto mahāsenaguttaṃ pakkosāpetvā nagaraṃ alaṅkarāpehī’ti āha. So nagare bheriṃ carāpetvā aṭṭhārasa vīthiyo sammajjantu, puṇṇaghaṭe ṭhapentu, dhajapatākādayo ussāpentu, toraṇāni ussāpentu, pañcavaṇṇāni pupphāni  okirantu, sakalanagaraṃ alaṅkarontu, gandhamālādayo gahetvā suddhuttarāsaṅgā hutvā sakalanāgarā paṭipathaṃ āgacchantuti āṇāpesi. Tato mahājano sabbaturiyāni ghosāpayamāno gandhamālādihattho paṭipathaṃ nikkhanto. Devamanussā bhikkhubhikkhuniyo upāsakopāsikā appamāṇā ahesuṃ. (Gandhamālādi puṇṇaghaṭasamussitadhajākiṇṇā) parisā velukkhepasahassāni pavattayiṃsu. Sugandhavātābhighātasamuddaghoso viya sakalanagaraṃ ekaninnādajātaṃ. So rājā nagare bandhanāgāre sabbasatte bandhanā muñcantu, dhammena samena anusāsantuti vatvā dhātuṃ gahetvā attano nagaraṃ pavesetvā attano rājanivesanaṃ āgantvā nāṭakīnaṃ saññamadāsi dhātuṃ vandantuti. Nāṭakī nānābharaṇehi patimaṇḍitā rājagehato nikkhamitvā dhātuṃ vanditvā attano attano hatthagatāni turiyabhaṇḍāni sādhukaṃ paggaṇhitvā mahantaṃ pūjamakaṃsu."
NULL,p56,274,100,bodytext,,"Tato vaḍḍhakiṃ pakkosāpetvā rājanivesanato nātidūre nāccāsante subhumitale dhātugharaṃ kārāpetvā mālākammalatākammādiṃ patiṭṭhāpetvā dhātughare vicittamaṇḍapaṃ kārāpetvāna sattaratanamayaṃ dhātukaraṇḍakaṃ kārāpetvā dhātukaraṇḍake dhātuṃ ṭhapetvā ratanapallaṅka matthake dhātuṃ ṭhapetvā upari vicittavitānaṃ bandhitvā sāṇiyā parikkhipāpetvā mahantena parivārena mahantaṃ dhātupūjaṃ akāsi. Mahājanā gandhamālaṃ gahetvā māsassa aṭṭhūposathadivase dhātuyā mahantaṃ pūjaṃ akaṃsu. Dhātuto raṃsiyo samuggacchanti. Mahājanā vimbhayajātā sādhukāraṃ karonti. Somanassabhūtā sakalanagaravāsino buddhārammaṇa pītiṃ gahetvā divase divase dhātuyā mahantaṃ pūjaṃ karontā vītināmenti. Pañcasīlāni rakkhanti, buddhamāmakā dhammamāmakā saṅghamāmakā hutvā saraṇāni gacchanti. Rājā mahājanassa ovadati. ‘‘Mettaṃ bhāvetha, karuṇaṃ muditaṃ upekkhaṃ bhāvetha, kule jeṭṭhāpacāyanakammaṃ karothā‘‘ti. Ovaditvā bhikkhusaṅghassapi cattāro paccaye gaṅgāya maho-ghappavattanakālo  viya mahādānaṃ pavattesi. Mātāpituṭṭhāne ṭhatvā bhikkhusaṅghaṃ saṅgaṇhi. Mahājanā tassa ovāde ṭhatvā dānādīni puññāni katvā yebhuyyena tasmiṃ kāle matā saggaṃ gatā."
NULL,p56,275,100,gatha1,,"Kalyāṇavaggamhi patiṭṭhitā janā,"
NULL,p56,276,100,gatha2,,"Dānādi puññāni karitva sabbadā;"
NULL,p56,277,100,gatha3,,"Cutā cutā sabbajanā sumānasā,"
NULL,p56,278,100,gathalast,,"Gatā asesaṃ sugatiṃ subhe ratā."
NULL,p56,279,100,bodytext,,"Rājā dhātuyā mahantaṃ pūjaṃ karonto mahagāme vihāsi. Tena patiṭṭhāpitavihārā kathetabbā? Kathaṃ? Lenavihāraṃ candagirivihāraṃ koṭipabbatavihāraṃ nagaraṅgaṇavihāraṃ selakā vihāraṃ talākāvihāranti evamādayo vihāre patiṭṭhāpetvā tipiṭakamahāariṭṭhattherassa dakkhiṇodakaṃ datvā mahāvihāre niyyādesi. Evaṃ so rājā yāvajīvaṃ dhātuṃ pariharitvā pacchime kāle maraṇamañce nipanno attano puttaṃ yaṭālatissa kumāraṃ pakkosāpetvā; tāta tissa, amhehi pariharita nalāṭadhātu pūjehī’ti dhātuvaṃsaṃ kathetvā puttaṃ anusāsitvā kālaṃ katvā saggapuraṃ gato."
NULL,p56,280,100,gatha1,,"Rājā mahānāgavaro yasassi,"
NULL,p56,281,100,gatha2,,"Katvāpi rajjaṃ matimā susaddho;"
NULL,p56,282,100,gatha3,,"Mānetva saṅghaṃ catupaccayehi,"
NULL,p56,283,100,gathalast,,"Agā asoko varadevalokaṃ;"
NULL,p56,284,100,bodytext,,"Tassa putto yaṭālatissakumāro pitu accayena pitarā vuttaniyāmeneva dhātuyā mahantaṃ pūjaṃ kāresi. So’pi divasassa tayo vāre dhātupaṭṭhānaṃ karonto rajjaṃ kāretvā ciraṃ vihāsi. Iminā’pi patiṭṭhāpitavihārā kathetabbā; dhammasālavihāraṃ mahādhammasālavihāraṃ selābhayavihāranti evamādayo  patiṭṭhāpetvā-tipiṭakamahāariṭṭhattherassa saddhivihāriko tipiṭakamahāabhayatthero uparājassa mahānāgassa ayyako. Tassa therassa dakkhiṇodakaṃ adāsi. So’pi rājā yāvajīvaṃ dhātuṃ pariharitvā pacchime kāle maraṇamañce nipanno attano puttaṃ goṭhābhayakumāraṃ pakkosāpetvā’dhātuyā mahantaṃ pūjaṃ karonto appamatto hohī’ti vatvā dhātuvaṃsaṃ kathetvā kālaṃ katvā sagge nibbatti."
NULL,p56,285,100,gatha1,,"Yaṭṭhālako nāma mahāmahīpati,"
NULL,p56,286,100,gatha2,,"Mahājanassatthakaro guṇālayo;"
NULL,p56,287,100,gatha3,,"So dhātupūjaṃ vipulaṃ anekadhā,"
NULL,p56,288,100,gathalast,,"Katvā gato devapuraṃ anindito."
NULL,p56,289,100,bodytext,,"Tassa putto goṭhābhayakumāro pitu accayena pitarā vuttaniyāmeneva dhātuyā mahantaṃ pūjaṃ katvā goṭhābhaya mahārājā hutvā rajjaṃ karonto kācaragāme dasabhātike rājāno ghātetvā daṇḍakammatthāya goṭhābhayamahātherassa hatthoṭṭhajanapade vasantassa mattikalenavihāraṃ khīrasāla vihāraṃ nāgamahāvihāraṃ kumbhaselavihāraṃ cetiyapabbatavihāraṃ sānupabbatavihāraṃ kaṇikāra selavihāraṃ ambasela vihāraṃ tindukalena vihāraṃ karaṇḍakavihāraṃ godhasālavihāraṃ vālukatitthavihāranti evamādayo gaṅgāya paratīre pañcasatavihāre orimatīre pañcasatavihāre cā’ti vihārasahassaṃ kāretvā attano sadisanāmassa goṭhābhayattherassa dakkhiṇodakaṃ datvā adāsi. So yāvajīvaṃ dhātupūjaṃ katvā pacchime kāle maraṇamañce nipanno attano puttaṃ kākavaṇṇatissa kumāraṃ pakkosāpetvā āliṅgitvā;’tāta tissa, ayaṃ nalāṭadhātu amhākaṃ paramparāya āgatā. Tvaṃ kira dhātuṃ gahetvā mahāgaṅgāya passe seru nāma dahassa ante varāha nāma soṇḍiyā matthake patiṭṭhāpetvā saṅghārāmaṃ kārāpessasī’ti satthā jīvamāno vyākaraṇamakāsi. Tasmā tvaṃ imaṃ dhātuṃ gahetvā mamaccayena tasmiṃ ṭhāne patiṭṭhāpehī’ti puttaṃ anusāsitvā kālakiriyaṃ katvā sagge nibbatti."
NULL,p56,290,100,gatha1,,"Goṭhābhayo  nāma mahīpatissaro,"
NULL,p56,291,100,gatha2,,"Mahājane tosayi appamatto;"
NULL,p56,292,100,gatha3,,"So dhātupūjaṃ vipulaṃ karitvā,"
NULL,p56,293,100,gathalast,,"Agā asoko varadevalokaṃ."
NULL,p56,294,100,gatha1,,"Mahānando mahāpañño candagutto bahussuto;"
NULL,p56,295,100,gathalast,,"Bhaddaseno mahāthero bhaddadhamme visārado."
NULL,p56,296,100,gatha1,,"Jayaseno ca so vīro thero so saṅgharakkhito;"
NULL,p56,297,100,gathalast,,"Devatthero ca medhāvī rakkhakā dhātu bhaddakā."
NULL,p56,298,100,gatha1,,"Uparājā mahānāgo yaṭṭhālako mahābalo;"
NULL,p56,299,100,gathalast,,"Goṭhābhayo mahāpuñño kākavaṇṇo ca vīriyavā."
NULL,p56,300,100,gatha1,,"Ete therā ca rājāno puññavanto sumānasā;"
NULL,p56,301,100,gathalast,,"Dhātu paramparānītā dhātā dhātusukovidā."
NULL,p56,302,100,gatha1,,"Kassapādīnatherānaṃ paramparāyamāgatā;"
NULL,p56,303,100,gathalast,,"Mahānāgādi hatthato yāva tissamupāgatā."
NULL,p56,304,100,centered,,"Iti ariyajanappasādanatthāya kate dhātuvaṃse"
NULL,p56,305,100,centered,,"Dhātuparamparā kathā nāma"
NULL,p56,306,100,centered,,"Tatiyo paricchedo."
NULL,p56,307,2,chapter,"4.  Pakiṇṇakakathā","4.  Pakiṇṇakakathā"
NULL,p56,308,100,bodytext,,"Tatra ṭhatvā rañeño uppatti kathetabbā. (So pana) amhākaṃ satthuno bodhippattito puretarameva mahāmalaya raṭṭhe vanacarakaṃ paṭicca tassa bhariyāya kucchiyaṃ paṭisandhiṃ gaṇhi. Navaḍḍhamāsāvasāne mātukucchito nikkhamitvā kamena vaḍḍhanto viññubhāvaṃ pāpuṇi. Tassa pitā ekaṃ dārikaṃ ānetvā puttassa gehe akāsi. Aparabhāge tassa pitā kālamakāsi. Kumāro’carako’ti paññāyi. So tato paṭṭhāya paccekabuddhaṃ upaṭṭhahi. Carako attano nivāsavatthusmiṃ kadalipanasādīni ropetvā phalārāmaṃ akāsi. Tato aparabhāge tena ropitapanasarukkho mahantaṃ cāṭippamāṇaṃ panasaphalaṃ gaṇhi. Carako attano vatthuṃ gantvā sākhāya supakkaṃ panasaphalaṃ passitvā chinditvā gehaṃ āharitvā apassāyaṃ luñcitvā upadhāresi. Tato samantā catumadhuraṃ viya yūsaṃ otaritvā apassayaṃ apanīta āvāṭaṃ pūretvā aṭṭhāsi. Tato carako evaṃ cintesi. Imaṃ panasaphalaṃ amhākaṃ paccekabuddhena vinā aññesaṃ nānucchavikanti. Paṭisāmetvā ṭhapesi."
NULL,p56,309,100,bodytext,,"Punadivase paccekabuddho lenato nikkhamitvā sarīrapaṭijagganaṃ katvā surattapallavasadisaṃ antaravāsakaṃ parimaṇḍalaṃ katvā nivāsetvā bahalapavaramahāpaṃsukūlacīvaraṃ pārupitvā nīlabhamaravaṇṇaṃ pattaṃ hatthena gahetvā ākāsena āgantvā tassa kuṭidvāre pākaṭo ahosi. Carako kuṭito nikkhamitvā taṃ vanditvā hatthato pattaṃ gahetvā gehaṃ pavesetvā pīṭhe nisīdāpetvā attanā ṭhapitaṭṭhānato panasaphalaṃ gahetvā yūsaṃ patte pūretvā paṭiggahāpesi. Paccekabuddho  taṃ paribhuñjitvā ākāsato attano vasanaṭṭhānameva gato. Athekadivasaṃ carako paradesā gacchanto bhariyaṃ pakkosāpetvā;’ amma, ayyassa appamatto hutvā dānaṃ dehī’ti sabbūpakaraṇaṃ niyyādetvā paradesaṃ gato. Punadivase paccekabuddho lenato nikkhamitvā cīvaraṃ pārupitvā pattamādāya ākāsato āgantvā kuṭidvāre otaritvā aṭṭhāsi. Tasmiṃ khaṇe carakassa bhariyā kuṭito nikkhamitvā paccekabuddhassa hatthato pattaṃ gahetvā gehe nisīdāpetvā bhattaṃ adāsi."
NULL,p56,310,100,bodytext,,"Tena bhattakicce pariniṭṭhite sā taruṇapaccekabuddhaṃ passitvā kilesapaṭisaṃyuttaṃ cittaṃ uppādetvā paccekabuddhassa attano ajjhāsayaṃ kathesi. Paccekabuddho tassā kathaṃ sutvā jigucchamāno uppatitvā ākāsato attano vasanaṭṭhānameva gato. Sā paccekabuddhassa gatakāle attano sarīraṃ telena makkhetvā bhaṇḍanakā viya nitthunamānā mañce nipajji. Carako paradesato āgantvā bhariyaṃ nipajjamānaṃ evamāha?’Bhadde, kiṃ ayyassa bhikkhaṃ adāsī’ti. Sā nitthunamānā āha? Mā puccha tava ayyassa kammanti. Kathehi bhadde, kiṃ tena kammaṃ katanti. So attanā saddhiṃ kilesavasne okāsaṃ kārāpetuṃ vāyamitvā mayā ayuttanti vutte mama kese gahetvā hatthapādehi ākoṭetvā sarīraṃ nakhena ottharitvā sīse paharitvā gato’ti vutte carako taṃ sutvā asahanto (eso mayā) evarūpassa assamaṇakammassa posito’ti vatvā tassā sokaṃ vinodetvā dhanuṃ ādāya tikkhasaraṃ gahetvā etaṃ māretvā āgamissāmī’ti vatvā vasanaṭṭhānaṃ agamāsi."
NULL,p56,311,100,bodytext,,"Tasmiṃ samaye paccekabuddho nahānatthāya gato. Gantvā ca pana kāyabandhanaṃ ākāse cīvaravaṃsaṃ viya katvā nivāsanapāpuraṇaṃ tasmiṃ ṭhapetvā jalasāṭakaṃ nivāsetvā udakamatthakā ākāse nisīditvā nahāyituṃ ārabhi. Carako paccekabuddhassa garugāravakāraṇaṃ passanto gumbantare nilīno  aṭṭhāsi. Ṭhatvā ca pana evarūpaṃ acchariyaṃ disvā cintesi? Ayañca evarūpaṃ na karoti, addhā esā musāvādā’ti. Ahaṃ etissā vacanaṃ gahetvā evarūpassa samaṇassa akāraṇe aparādhaṃ kataṃ. Eso tādisaṃ na karotī’ti cintetvā paccekabuddhassa nahatvā ṭhītakāle gantvā pādesu nipatitvā?’Mayhaṃ khamatha ayyā’ti āha. Pacceka buddho? Kiṃ kathesi upāsakā’ti. So attano mātugāmassa kathitaṃ ācikkhi. Evañhi sati upāsaka tumhākaṃ āgatakammaṃ niṭṭhapetvā gantuṃ vaṭṭatī’ti āha. Mā evaṃ kathetha sāmi, ahaṃ aññāṇabhāvena tassā vacanaṃ gahetvā tumhākaṃ akāraṇe dubbhituṃ āgatomhi’ti sabbaṃ attanā cintitaṃ ācikkhi."
NULL,p56,312,100,bodytext,,"Paccekabuddho? Āma upāsaka, sā attanā saddhiṃ asaddhammapaṭisaṃyuttakathaṃ kathesī’ti āha. So tassā kujjhitvā ahaṃ etaṃ nissāya imassa aparajjhāmi. Gantvā taṃ māressāmī’ti paccekabuddhaṃ pañcapatiṭṭhitena vanditvā nikkhami. Paccekabuddho taṃ nivattetvā mātugāmaṃ mā mārehī’ti anekavidhāni kāraṇāni kathetvā pañcasīle patiṭṭhapetvā tassa dhammaṃ desento imaṃ gāthamāha?"
NULL,p56,313,100,gatha1,,"Yo appaduṭṭhassa narassa dussati,"
NULL,p56,314,100,gatha2,,"Suddhassa posassa anaṅgaṇassa;"
NULL,p56,315,100,gatha3,,"Tameva bālaṃ pacceti pāpaṃ,"
NULL,p56,316,100,gathalast,,"Sukhumo rajo paṭivātaṃva khitto’ti;"
NULL,p56,317,100,bodytext,,"Carako tassa dhammadesanaṃ sutvā pasantacitto hutvā pañcapatiṭṭhitena vanditvā gehaṃ gantvā tāya saddhiṃ samaggavāsaṃ vasitvā tato paṭṭhāya yāvajīvaṃ paccekabuddhassa cīvarapiṇḍapātasenāsanagilānapaccayabhesajjaparikkhārādayo parikkhāre ca datvā paṭijaggi. So tasmiṃyeva lene vasanto aparabhāge anupādisesāya nibbānadhātuyā parinibbāyi."
NULL,p56,318,100,gatha1,,"Sayambhuñāṇena  vigayha dhammaṃ,"
NULL,p56,319,100,gatha2,,"Dukkhaṃ anantaṃ sakalaṃ pahāya;"
NULL,p56,320,100,gatha3,,"Samādhijhānābhirato yasassi,"
NULL,p56,321,100,gathalast,,"Gato vināsaṃ pavaro yasassi."
NULL,p56,322,100,bodytext,,"Atha pacchā carako kālaṃ katvā sagge nibbatti. Tattha ciraṃ dibbasampattiṃ anubhavitvā devalokato cavitvā imasmiṃ dīpe malaya raṭṭhe amaruppala lenassa āsannaṭṭhāne upacarakassa putto hutvā nibbatti. So navamāsaḍḍhapariyosāne mātukucchito nikkhami. Tassa nāmagahaṇadivase ñātakā amaruppala kumāroti nāmaṃ akaṃsu. So pana aparabhāge vaḍḍhento dārakehi saddhiṃ kīḷanto pattapuṭena vālukabhattaṃ pacitvā, dārakā ime samaṇāti vatvā paṭipāṭiyā nisīdāpetvā dānaṃ dassāmī’ti vatvā kīḷādānaṃ deti. Ekadivasaṃ amaruppala kumāro vālukathupaṃ katvā attano nivāsanavatthadussaṃ gahetvā khuddakadaṇḍake bandhitvā paṭākaṃ katvā pūjanatthāya ṭhapesi. Amaruppala lenavāsī maliya devattheraṃ nissāya dānādīni puññāni katvā tato cuto imasmiṃyeva dīpe mahāgāme goṭhābhayamahārājassa aggamahesiyā kucchimhi paṭisandhiṃ gaṇhi. So navamāsaḍḍhapariyosāne mātukucchito nikkhami. Tassa nāmagahaṇa divase’kākavaṇṇatisso’ti nāmaṃ akaṃsu. So anupubbena vaḍḍhitvā pitu accayena chattaṃ ussāpetvā kākavaṇṇatissamahārājā ahosi. Tassa chatte ussāpiteyeva sakalaraṭṭhaṃ subhikkhaṃ ahosi. Pañca vā dvādasa vā divase anatikkamitvā devo sammā vassati. Vessantarabodhisattassa dānagge yācakānaṃ hatthe bhikkhābhājanaṃ viya tasmiṃ kāle vāpīpokkharaṇī-nadī-kandara-sobbha-jātasarādayo vassodakena pūritā ahesuṃ. Pañcavidhapadumasañchannā anekadijasamākiṇṇā nānārukkhehi virocitā ahesuṃ. Nānā sassāni sampajjiṃsu, uttarakuru ālakamandā rājadhānisadisaṃva hiraññasuvaṇṇādi ratanaṭṭhānaṃ."
NULL,p56,323,100,bodytext,,"So  rājā saddhāya sampanno mahābhikkhusaṅghassa cattāro paccaye anūnaṃ katvā dāpesi. Saṭṭhimattānaṃ tipiṭakadharānaṃ candanadoṇiyā satapākatelassa pūrāpetvā yāvapiṭṭhipādaṃ tāva osīdāpetvā nisinnānaṃ laṭṭhima dhudantakaṭṭhaṃ catumadhuraṃ pakkhipitvā dāpesi. Ucchukaṇḍa-sakkharā-nālikera-phalamūlakhandhakhādanañca nānāvidhamaccharasehi sugandhasālitaṇḍulena sādhitayāgubhattañca pātova adāsi. Antarābhatte aṭṭhārasavidha-antarakhajjakañca ucchukadalipanasaphalādayo ca nānāvidhottaribhaṅgena saddhiṃ sugandhasālitaṇḍulabhattaṃ nānaggarasaṃ dāpetvā pacchābhattaṃ aṭṭhavidhakappīyapānake ca dāpesi. Aññe samaṇaparikkhāre ca dāpesi. Iminā niyāmeneva bhikkhusaṅghassa tipiṭakadharabhikkhūnañca nirantaraṃ mahā dānaṃ datvā vasati."
NULL,p56,324,100,bodytext,,"Athāparena samayena kalyāṇiyaṃ sivo nāma mahārājā attano bhāgineyyassa abhayakumārassa kākavaṇṇatissa rañño bhaginiyā somadeviyā nāma rājaputtiyā āvāhamaṅgalaṃ katvā ānetvā pādaparicārikaṃ dāpesi. Datvā ca pana abhaya kumāraṃ girinagaramhi nisīdāpesī. So girinagare rajjaṃ kārāpetvā giriabhayo nāma rājā hutvā mahantaṃ sampattiṃ anubhavamāno vihāsi. Tato aparabhāge kākavaṇṇatissa mahārājā mahāgāme viharanto aññatarassa bhikkhussa gatte maṅkunā daṭṭhaṭṭhāne gaṇḍaṃ uṭṭhitaṃ disvā kimetaṃ ayyā’ti pucchi. Maṅkunā daṭṭhaṭṭhānaṃ mahārājāti. Taṃ sutvā saṃvegappatto, bhante maṅkunā kismiṃ na bhavanti’ti pucchi. Paṭṭasāṭake na bhavanti’ti. Ime pana bhaddantā paṭṭasāṭake kuto labhantī’ti cintetvā gato. Taṃ divasameva pānīyamāḷake nisinno tipiṭakatissatthero nāma rañño buddhasīhanādasuttaṃ nāma kathesi. So there pasanno; uttarāsaṅge dīyamāne’ekasāṭako bhavissāmi’ tasmā imameva dātuṃ na sakkā, kathaṃ karissāmī’ti cintento therena saddhiṃ kathayamāno tattha māḷakeyeva aṭṭhāsi. Tasmiṃ khaṇe eko kāko ambasākhantare nisīditvā"
NULL,p56,325,100,bodytext,,"Saddaṃ  karonto evamācikkhi. Ayya kākavaṇṇatissamahārāja, tumhākaṃ kaṅkhā nāma natthī, pasādakkhaṇe dhammakathikassa uttarāsaṅgaṃ dehī’ti āha."
NULL,p56,326,100,gatha1,,"(Kāko so kākavaṇṇassa vadeti vacanakkhamo,"
NULL,p56,327,100,gatha2,,"Pasādajāto therassa tuvaṃ saddhammadesane;"
NULL,p56,328,100,gathalast,,"Dadāhi uttarāsaṅgaṃ mahātherassa bhūmipā’ti.)"
NULL,p56,329,100,bodytext,,"Mahārāja, ahaṃ tumhākaṃ pañcasāsanaṃ gahetvā āgato. Vihāradevi puttaṃ vijāyi. Idamekaṃ sāsanaṃ. Ekā kareṇukā suvīrahatthipotakaṃ titthasare vijāyī. Idaṃ dutiyaṃ sāsanaṃ. Goṭhasamuddamajjhena sattamattā nāvā paṭṭane paccuṭṭhitā, idaṃ tatiyaṃ sāsanaṃ uttara vaḍḍhamānapabbatapāde dvikarīsappamāṇe khette taruṇatālakkhandhappamāṇā suvaṇṇakkhandhā uggacchiṃsu, idaṃ catutthaṃ sāsanaṃ. Giripabbatapāde koṭa raṭṭhaka vihāre koṭaraṭṭhako nāma thero maggopasamaṃ vatvā giripabbatamatthake sattatālappamāṇaṃ uggantvā ākāse nisinno parinibbāyi, idaṃ pañcamaṃ sāsanaṃ."
NULL,p56,330,100,gatha1,,"(Putto hatthī ca nāvā ca catutthaṃ hemakhandhakaṃ;"
NULL,p56,331,100,gathalast,,"Therassa parinibbānaṃ pañcamaṃ sāsanaṃ idaṃ."
NULL,p56,332,100,gatha1,,"Imaṃ gahetvāna ahaṃ āgato tava santikaṃ;"
NULL,p56,333,100,gathalast,,"Sāsanaṃ īdisaṃ sutvā puññakamme rato bhava."
NULL,p56,334,100,gatha1,,"Vatthaṃ sahasā dāpehi kato sabbasamāgamo;"
NULL,p56,335,100,gathalast,,"Idaṃ niccaṃ jānanto kiṃ laggo uttarāsaṅge’ti.)"
NULL,p56,336,100,bodytext,,"Rājā kākassa vacanaṃ sutvā hasi. Thero? Kasmā mahārāja hasī’ti pucchi. Bhante, etasmiṃ ambasākhantare nisīditvā saddaṃ karontassa kākassa kathaṃ sutvā hasinti sabbaṃ ārocesi. Thero’pi raññā purimattabhāve katakammaṃ  passitvā hasi. Rājā kasmā ayyo hasī’ti pucchi. Mahārāja, tumhākaṃ anantare attabhāve malayaraṭṭhe amaruppala nāma kāle katakammaṃ passitvā hasitti. Tena puṭṭho katakusalakammaṃ sabbaṃ vitthārena tassa ācikkhi. Rājā somanassappatto attano uttarāsaṅgaṃ datvā theraṃ vanditvā gehaṃ gato. Koṭaraṭṭhakavihāraṃ gantvā therassa sarīrajjhāpanaṃ kārāpetvā dhātuṃ ādāya cetiyaṃ kārāpetvā mahantaṃ pūjaṃ katvā mahāgāmaṃ gato. Suvaṇṇaṃ āharāpetvā rājaṅgaṇe ṭhapāpesi. Goṭhasamuddakucchiyaṃ patta nāvāto vatthāni āharāpetvā bhikkhusaṅghassa cīvaratthāya dāpetvā mahādānaṃ pavattetvā mahāgāmasamīpe vihāraṃ kārāpetvā viharanto attano puttaṃ duṭṭhagāmaṇiṃ pakkosāpetvā; tāta, tvaṃ gantvā girimhi nagare nisīdā’ti vatvā amaccañcassa pituṭṭhāne ṭhapetvā girinagaraṃ pāhesi. Taṃ disvā giriabhaya kumāro kumārena saddhiṃ āgatabaḷassa vatthāhārādīni dāpetvā mahantaṃ sammānaṃ akāsi. Rājakumāro giripabbatapāde vihāsi."
NULL,p56,337,100,bodytext,,"Tato aparabhāge jātiṃ nissāya khattiyānaṃ vivādo ahosi. So abhayarājā kiṃ mevivādenā’ti attano bhariyāya somadeviyā saddhiṃ balavāhanaṃ gahetvā anukkamena gacchanto serunagare rajjaṃ kārentaṃ attasahāyaṃ sivarājaṃ sandhāya tassa santikaṃ āgañji. So’pi sivarājā giriabhayaraññā saddhiṃ āgatabaḷassa mahantaṃ sakkāraṃ kāretvā ahatavatthatilataṇḍulādīni āharāpetvā dāpesi. Katipāhaccaye; samma, kasmā āgatosi’ti pucchi. So āgatakāraṇaṃ sabbamassa ācikkhi. Bhaddakaṃ samma, te kataṃ āgantabbameva āgato. Ahaṃ te kattabbaṃ jānissāmi. Tvaṃ mā cintayī’ti vatvā tassa vasanatthāya nagarabhūmiṃ gavesanto sarakoṭiyaṃ atiramaṇīyabhūmiṃ passitvā tasmiṃ bhūmibhāge so nagaraṃ māpetvā deviyā ekasadisanāmaṃ karissāmī’ti somanagaranti nāmaṃ akāsi. Taṃ nagaraṃ susamiddhaṃ sampannadhanadhaññādīhi upakaraṇehi dvāraṭṭālakagopuraparikhāpokkhara-ṇiyādīhi  sahitaṃ hatthiassarathapattiādīhi samākulaṃ saṅkhapaṇavabherisaddādīhi samākiṇṇaṃ nagaraṃ ahosi. So abhayo ciraṃ somanagare mahantaṃ issariyaṃ anubhavanto vihāsi."
NULL,p56,338,100,bodytext,,"Athāparasmiṃ kāle somadevī raññā saddhiṃ kathesi; ayya amhākaṃ paṭisaraṇaṃ cetiyañca vihārañca kāretuṃ vaṭṭatī’ti. Bhaddakaṃ te kathitanti somanassappatto hutvā vihārabhūmiṃ gavesanto nagarato nātidure nāccāsanne mahantaṃ sālavanaṃ atthi. Taṃ passituṃ gato. Tadā tasmiṃ sālavane mahāariṭṭhattherassa vaṃse mahāmahindatthero nāma eko thero atthi. So saṭṭhimatte bhikkhū gahetvā viharati. Taṃ disvā iriyāpathe pasanno theraṃ evamāha; ‘ayya tumhākaṃ imasmiṃ sālavane vihāraṃ karissāmi’ti. Thero tassa vacanaṃ sutvā tuṇhīhāvena adhivāsesi. Rājā somanassappatto theraṃ vanditvā nagarameva gantvā somadeviṃ āmantetvā; bhaddesomadevi, amhākaṃ manoratho matthakaṃ patto. Vihārakaraṇatthāya manāpo bhūmibhāgo laddho. Tattha ca mahindo nāma thero samaṇānaṃ saṭṭhimattaṃ gahetvā viharati. Taṃ vanditvā viharaṇatthāya paṭiññaṃ gahetvā āgato. Tattha vihāraṃ karissāmī’ti āha. Sā taṃ sutvā somanassappattā sādhū’ti sampaṭicchi. Punadivase deviyā saddhiṃ therassa santikaṃ gantvā vanditvā ekamantaṃ nisīdi. Thero tesaṃ mahāsamayasuttaṃ kathesi. Te ubho’pi dhammaṃ sutvā somanassajātā ahesuṃ. Atha rājā ayya dhātuṃ kuto labhissāmā’ti theraṃ pucchi. Mā cintayi mahārāja, dhātuṃ amhe jānissāmā’ti ācikkhi."
