id,book,par_num,level,class,title,text
NULL,p56,378,100,bodytext,,"Serunagare sivarājā’pi attānaṃ sabbālaṅkārehi alaṅkaritvā mahantena parivārena pūjāvidhānaṃ gāhāpetvā cetiyaṭṭhānaṃ āgantvā mahābhikkhusaṅghaṃ vanditvā ekamantaṃ aṭṭhāsi. Rājaparisā attano vibhavānurūpena vatthālaṅkārehi candana mālādīhi ca sobhamānā nalāṭe muttākalāpamolambaka vicittasuvaṇṇapaṭṭāni bandhitvā hatthābharaṇādi anekābharaṇehi dibbaparisā viya sumaṇḍitapasādhitā vesānurūpāni vividhāvudhāni gahetvā ekapasse ṭhītā. Sīhavyagghadīpicammehi pasādhitasuvaṇṇālaṅkārasuvaṇṇadhajahemajālasañchanne ratha vare ca sabbālaṅkāravibhusitā rathikā āruyha ekapasse ṭhītā. Brāhmaṇaputtādayo maṇḍitacamme pārupitvā upasobhayamānā ekapasse ṭhītā. Bahu amaccā attano attano vesānurūpena mahagghavatthābharaṇavibhūsitā saparivārā ekapasse ṭhītā. Gandhodaka pūrita dakkhiṇāvatta saṅkhaṃ gahetvā upavītasuttaṃ ekaṃsaṃ karitvā brāhmaṇaveṭhanaṃ veṭhetvā purohitabrāhmaṇā mahantena parivārena pūjāvidhānaṃ gāhāpetvā cetiyaṭṭhānaṃ āgantvā mahābhikkhusaṅghaṃ vanditvā jayaghosaṃ sāventā evamāhaṃsu?"
NULL,p56,379,100,gatha1,,"Khemaṃ subhikkhaṃ bhavatu niccaṃ janapadaṃ sivaṃ;"
NULL,p56,380,100,gathalast,,"Sassāni samuppajjantu rañño evaṃ jayā siyuṃ."
NULL,p56,381,100,bodytext,,"Avasesā mahājanā evamāhaṃsu? Samuddapariyantaṃ  hi mahiṃ sāgarakuṇḍalaṃ vasundharaṃ āvasatu amaccaparivārito. Evaṃ vatvā? Amhākaṃ ayyo kākavaṇṇatisso mahā rājā sadevake loke ekapuggalassa lokanāthassanalāṭadhātuṃ patiṭṭhāpetī’ti attano attano vibhavānurūpena sumaṇḍitapasādhitā. Khujjavāmanakādayo’pi sabbe janā pūjābhaṇḍāni gahetvā sādhukāraṃ dadamānā aṭṭhaṃsu. Imasmiṃ cetiyaṭṭhāne rāsībhūtā parisā evaṃ veditabbā? Khattiyā brāhmaṇā vessā negamā ca samāgatā pupphādigahitā sabbe alaṅkāravibhūsitā."
NULL,p56,382,100,gatha1,,"Gaṇanā vītivattā te aneke ca mahājanā;"
NULL,p56,383,100,gathalast,,"Samuddo pattharantova khattiyā samupāgatā."
NULL,p56,384,100,gatha1,,"Alaṅkato mahārājā sarājaparivārito;"
NULL,p56,385,100,gathalast,,"Devarājā yathā sakko aṭṭhāsi cetiyaṅgaṇe."
NULL,p56,386,100,gatha1,,"Sādhuvādena sattānaṃ pañcaṅgaturiyehi ca;"
NULL,p56,387,100,gathalast,,"Hatthassarathasaddena samākiṇṇaṃ mahītalaṃ."
NULL,p56,388,100,bodytext,,"Tato cūḷapiṇḍapātiyatissatthero attano saddhivihārīke pañcasata khīṇāsave parivāretvā cetiyaṭṭhānameva āgato. Mahāsāgalatthero’pi pañcasata khīṇāsave parivāretvā cetiyaṭṭhānameva āgato. Mahindatthero’pi attano sāvake saṭṭhimatte khiṇāsave gahetvā cetiyaṭṭhānameva āgato. Iti iminā niyāmeneva eko dve tayo cattāro pañca khīṇāsavā āgacchantā satta sahassamattā ahesuṃ. Tato cūḷapiṇḍapātiyatissatthero ettake bhikkhū parivāretvā cetiyaṅgaṇe nisīdī. Tato rājā āgantvā pañcapatiṭṭhitena vanditvā therena saddhiṃ kathesi?  Kesadhātu kuto labhissāma ayyā’ti. Tasmiṃ khaṇe tissatthero attano saddhivihārikaṃ sivattheraṃ olokesi. So olokitakkhaṇeyeva nisinnaṭṭhānato uṭṭhāya cīvaraṃ pārupitvā mahābhikkhusaṅghaṃ vanditvā chaḷabhiñño mahākhīṇāsavo catutthajjhānaṃ samāpajjitvā tato vuṭṭhāya pathaviyaṃ nimujjitvā bhumindharanāgavimāne pāturahosi."
NULL,p56,389,100,gatha1,,"(Sutvāssa sivathero ca vasippatto visārado;"
NULL,p56,390,100,gathalast,,"Pākaṭo abhavi nāganagaraṃ purato khaṇe.)"
NULL,p56,391,100,bodytext,,"Tasmiṃ kho pana samaye jayaseno nāgarājā attano bhāgineyyaṃ dvikoṭimatte nāge parivāretvā mahā yasaṃ anubhavamānaṃ nisinnaṃ iṅgitasaññaṃ datvā theraṃ duratova āgacchantaṃ disvā cintesi? Imasmiṃ nāgabhavane samaṇehi kattabbakiccaṃ natthī. Nissaṃsayaṃ kesadhātuṃ nissāya āgato bhavissatīti uṭṭhāya dhātugharaṃ pavisitvā dhātukaraṇḍakaṃ gilitvā kiñci ajānanto viya nisīdi. Tasmiṃ kāle thero tassa santikaṃ agamāsi. Nāgarājā paccuggantvā paṭisanthāraṃ karonto therena saddhiṃ kathesi. Kasmā ayyo āgato’ti vutte evamāha? Tilokanāthassa amhākaṃ sambuddhassa kesadhātūnaṃ atthāya āgato, tuyhaṃ santike ṭhapitakesadhātuyo papañcaṃ akatvā mayhaṃ dehi, teyeva sandhāya upajjhāyena pesitomhī’ti vutte amhākaṃ sammā sambuddhassa kesadhātuyo mama santike natthī’ti āha. Thero dhātukaraṇḍakaṃ gilitabhāvaṃ ñatvā gaṇhāmi mahārājā kesadhātuyo’ti vutte āma passanto gahetvā gacchāhīti āha. Evaṃ tayo vāre paṭiññaṃ gahetvā tatheva ṭhīto?"
NULL,p56,392,100,gatha1,,"Iddhiyā māpayitvāna tato so sukhumaṃ karaṃ,"
NULL,p56,393,100,gatha2,,"Pavesetvā mukhe tassa gaṇhī dhātukaraṇḍakaṃ;"
NULL,p56,394,100,gathalast,,"Nāgālayābhinikkhami tiṭṭha nāgā’ti bhāsiya."
NULL,p56,395,100,bodytext,,"Tasmiṃ  khaṇe jayaseno nāgarājā samaṇaṃ vañcetvā pesitomhī’ti vatvā tassa gatakāle dhātukaraṇḍakaṃ oloketvā dhātu apassitvā samaṇena nāsitomhī’ti dve hatthe ukkhipitvā ṭhapetvā attano sakalanāgabhavanaṃ eka kolāhalaṃ katvā mahantena saddena paridevanto? Amhākaṃ cakkhuni uppāṭetvā gato viya sadevakassa lokassa patiṭṭhānabhūtassa sammāsambuddhassa kesadhātuyo apāyadukkhato amuñcantānaṃ amhākaṃ abhibhavitvā dhātuyo gahetvā gatasamaṇaṃ anubandhitvā gaṇhissāmā’ti dvekoṭimatte nāge gahetvā attano bhāgineyyena saddhiṃ tassa piṭṭhito piṭṭhito anubandhitvā ākāsaṃ uggacchiṃ (su). Tasmiṃ khaṇe pana sivatthero akāsato otaritvā pathaviyaṃ pāvisi. Puna tepi pathaviyaṃ pavisiṃsu. Evaṃ thero tehi saddhiṃ ummujja nimujjaṃ karonto pāṭihāriyaṃ dassetvā serunagarassa nātidūre piṭṭhipāsāṇe uggañji. Tattheva te saṃvejetvā cetiyaṅgaṇe mahābhikkhusaṅghassa purato pākaṭo ahosi. Nāgā taṃ gahetuṃ asakkontā mahantena saddena ravaṃ patiravaṃ datvā. Ito paṭṭhāya naṭṭhamhā’ti tasmiṃ piṭṭhi pāsāṇe sabbe samāgamaṃ katvā mahāsaddena parideviṃsu? Naṭṭhambhā vata bho’ti. Tato paṭṭhāya so piṭṭhipāsāṇo nāgānaṃ ravaṃ patiravaṃ datvā paridevitahāvena nāgagallaṃ nāma ahosi."
NULL,p56,396,100,bodytext,,"Nāgo therassa piṭṭhitoyeva anubandhitvā cetiyaṅgaṇaṃ gantvā rājānaṃ evamāha? Deva, eso bhikkhu mayā adinnadhātu gahetvā āgato’ti. Taṃ sutvā rājā? Saccaṃ kira ayya nāgassa vacananti vutte naheva mahārāja, iminā dinnaṃ eva dhātuṃ aggahesinti vutte? Nāgo tava sakkhiṃ dehīti āha. Thero tassa bhāginyeṃ samaṇuppala nāgarājānaṃ sakkhiṃ akāsi. Rājā tassa bhāgineyyassa sabbavacanaṃ sutvā saddahi. Tasmiṃ kāle dukkhābhibhūto nāgarājā gantvā bahi ṭhīto. Tato paṭṭhāya so nāgarājā  bahi hutvā nisinnattā bahināgarājā nāma ahosi. Tassa pana bhāgineyyaṃ anto cetiyaṅgaṇe nisīdāpesi. Imassa pana cetiyassa ārakkhaṃ gahitanāgā kathetabbā. Sumananāgarañño parivārā chakoṭimattā nāgā, jayasenassa parivārā koṭisatamattā nāgā, samaṇuppalanāgarañño parivārā dvikoṭimattā nāgā ahesuṃ. Sabbe dhātuyā ārakkhaṃ gaṇhiṃsu. Rājā therassa hatthato kesadhātuṃ gahetvā ratanacaṅegāṭake ṭhapetvā mahindassa nāma amaccassa adāsi. Tasmiṃ samāgame tipiṭakamahāphussadevattherassa saddhivihārikā paṭisambhidappattā cattāro sāmaṇerā ahesuṃ. Tesu eko malaya rājaputto sumanasāmaṇero nāma, eko serunagare sivarājabhāgineyyassa putto uttara sāmaṇero nāma. Eko mahāgāme mālākāraputto cunda sāmaṇero nāma eko mahāgāme ekassa kuṭumbikassa putto mahākassapasāmaṇero nāma, ime cattāro sāmaṇerā ajja kākavaṇṇatissamahārājā mahācetiye dhātu nidhānaṃ karissati, mayaṃ himavantaṃ gantvā sukusumāni āharissāmāti theraṃ vanditvā ākāsato himavantaṃ gantvā campakanāgasalalādayo pūjanīyamālaṃ gahetvā tāvatiṃsadeva lokaṃ gatā."
NULL,p56,397,100,bodytext,,"Tasmiṃ kāle sakko devarājā sabbābharaṇapatimaṇḍito dvisu devalokesu devatāyo gahetvā erāvaṇahatthīkkhandhamāruyha aḍḍhateyyakoṭidevaccharāparivārito sudassanamahā vīthiyaṃ vicaranto savaṅgoṭake te cattāro sāmaṇere duratova āgacchante disvā hatthīkkhandhato oruyha pañca patiṭṭhitena vanditvā tesaṃ hatthe mālācaṅgoṭake disvā? Kiṃ ayyā tumhākaṃ hatthe’ti pucchi. Taṃ sutvā sāmaṇerā mahārāja, kiṃ tvaṃ na jānāsi. Laṅkāyaṃ kākavaṇṇatissa mahārājā dasabalassa nalāṭadhātuṃ gahetvā mahāvālukagaṅagāya dakkhiṇapasse seru nāma dahassa ante varāha nāma soṇḍimatthake cetiyaṃ kārāpetuṃ tumhākaṃ niyogena vissakammadevaputtena nimmitaiṭṭhakāni gahetvā cetiyaṃ kārāpetvā ajja dhātunidhānaṃ karoti. Tattha pūjanatthāya himavantato ānītapupphamidanti vatvā itopi kusumaṃ gahetuṃ āgatamhā’ti vadiṃsu. Sakko tesaṃ vacanaṃ sutvā?"
NULL,p56,398,100,bodytext,,"Ayya  tumhākaṃ hatthe pupphāni cūḷāmaṇicetiye pujetvā amhākaṃ uyyānato pupphāni gahetvā gacchathāti vatvā tehi saddhiṃ gantvā tesaṃ pupphehi cūḷāmaṇicetiyaṃ pūjesi. Tato papañcaṃ na bhavitabbanti sakkassa nivedesuṃ. Taṃ sutvā sakko sāmaṇerānaṃ pañcamahāuyyānato pāricchatta-koviḷārādīni pupphāni ca candanacuṇṇañca gahetvā dāpesi. Sāmaṇerā pupphāni gahetvā devalokato otaritvā himavantaṃ pavisitvā suvaṇṇamaṇipabbate santacchāyāya nasīditvā divāvihāraṃ katvā nakkhattavelāya sampattāya maṇī gavesamānā cattāro maṇayo addasaṃsu. Tesaṃ eko indanīlamaṇī, eko pahassarajotiraṅga maṇī, eko veluriyamaṇi, eko masāragallamaṇi, cattāro maṇayo ca dibbapupphāni ca gahetvā therānaṃ dassesuṃ. Thero? Mahārāja, ime sāmaṇerā pāricchattakakoviḷārādīni pupphāni ca candanacuṇṇañca cattāro maṇayo ca gahetvā āgatā’ti rañño ārocesuṃ."
NULL,p56,399,100,bodytext,,"Rājā taṃ sutvā somanassajāto sāmaṇere pañca patiṭṭhītena vanditvā tesamāhatamaṇayo gahetvā mahānanda nāma amaccassa datvā therehī saddhiṃ mahantena parivārena cetiyaṅgaṇaṃ gantvā maṇikaraṇḍakena dhātuṃ gahetvā attano sīse dhātuṃ ṭhapetvā upari setacchattaṃ kārāpetvā cetiyaṃ tikkhattuṃ padakkhiṇaṃ katvā pācīnadvāre ṭhīto? Ayaṃ dasabalassa nalāṭadhātu amhehi kārāpitāya buddhapaṭimāya nalāṭe uṇṇalomākāraṃ hutvā patiṭṭhahatūti adhiṭṭhāsi. Tassa cintitakkhaṇeyeva dhātu karaṇḍato nabhamuggantvā ākāse sattatālappamāṇe ṭhatvā chabbaṇṇa raṃsiyo vissajjesi. Tā raṃsiyo kuṭena āsiñcamānavilīna suvaṇṇaṃ viya antalikkhato nikkhantasuvaṇṇarasadhārā viya sakalalaṅkādīpaṃ  raṃsijālehi ekobhāsaṃ katvā gaṇhiṃsu. Tasmiṃ kāle yamakapāṭihāriyasadisaṃ pāṭihāriyaṃ ahosi. Mahākāruṇikassa bhagavato adiṭṭhapubbaṃ pāṭihāriyaṃ disvā mahājanā tathāgatassa rūpakāyaṃ paccakkhabhutā viya ahesuṃ."
NULL,p56,400,100,gatha1,,"Adiṭṭhapubbaṃ satthussa pāṭihīraṃ mahājanā;"
NULL,p56,401,100,gathalast,,"Disvā pītiparā jātā pasādamajjhaguṃ jine."
NULL,p56,402,100,gatha1,,"Pūjesuṃ gandhamālañca alaṅkāraṃ sakaṃ sakaṃ;"
NULL,p56,403,100,gathalast,,"Sabbe vandiṃsu sirasā-cetiyaṃ īdisaṃ varaṃ."
NULL,p56,404,100,bodytext,,"Tasmiṃ samāgame eko paṇḍitapuriso jinaṃ thomento evamāha?"
NULL,p56,405,100,gatha1,,"Nibbutassāpi buddhassa yaso bhavati īdiso;"
NULL,p56,406,100,gathalast,,"Ṭhītassa lokanāthassa kīdisā āsi sampadā."
NULL,p56,407,100,gatha1,,"Anubhāvamidaṃ sabbaṃ puññeneva mahesino;"
NULL,p56,408,100,gathalast,,"Kareyya ñatvā puññaṃ taṃ patthento bodhimuttamaṃ."
NULL,p56,409,100,bodytext,,"Tasmiṃ kāle nānāratanavicittaṃ anekālaṅkārapatimaṇḍitaṃ mahārahaṃ samussitadhajapatākaṃ nānāvidhakusumasamākiṇṇaṃ anekapūjāvidhānaṃ gahetvā manussā chaṇavesaṃ gaṇhiṃsu. Anekavidhaturiyasaṅghuṭṭaṃ ahosi. Tasmiṃ khaṇe devatāyo pupphavassaṃ vassāpenti. Mahānubhāvasampannā nāgā pūjaṃ karonti. Evaṃ sabbe devā nāgā manussā sādhukāraṃ denti, apphoṭenti, velukkhepaṃ karonti, hatthīno kuñcanādaṃ nadanti. Assā tuṭṭhiravaṃ ravanti, bahalaghana mahāpathavī yāva udakapariyantaṃ kampi. Disāsu vijjullatā nicchariṃsu. Sakalalaṅkādīpe sumanakūṭādayo mahānagā kusumagaṇasamākiṇṇā ahesuṃ. Sabbe jalāsayā pañcavidha padumasañchantā, devatānamantare manussā, manussānaṃ antare yakkhanāgasupaṇṇādayo ca ahesuṃ. Bhikkhubhikkhunīupāsaka upāsikā aparimāṇā ahesuṃ. Mahantena sādhukārena mahā nigghosena sakalalaṅkādīpe tibbavātābhihatasamuddo viya ekaninnādaṃ  ekanigghosaṃ ahosi. Iminā pūjāvidhānena pasādakabhūtamahājanakāyamajjhe dhātu pāṭihāriyaṃ dassetvā ākāsato otaritvā buddhapaṭimāya nalāṭe puṇṇacandasassirīkaṃ abhibhavantamiva virocamānā patiṭṭhāsi."
NULL,p56,410,100,bodytext,,"Rājā mahānandanāmakassa amaccassa hatthato kesadhātuṃ gahetvā vihāradeviyā datvā tvaṃ imā kesadhātuyo dasabalassa anavalokita matthake patiṭṭhāpehī’ti āha. Sā kesadhātuyo gahetvā tattheva patiṭṭhahantu’ti adhiṭṭhānaṃ akāsi. Tasmiṃ khaṇe kesadhātuyo karaṇḍato nabhaṃ uggantvā mayūragīvasaṃkāsanīlaraṃsiyo vissajjentī ākāsato otaritvā buddhapaṭimāya uttamaṅge sirasmiṃ patiṭṭhahiṃsu."
NULL,p56,411,100,bodytext,,"Tato rājā therena saddhiṃ dhātugabbhaṃ pavisitvā dibbacandanacuṇṇasamākiṇṇaṃ pāricchattakakoviḷārādi sugandhapupphasantharaṃ viyūhitvā pabhāsamudayasamākiṇṇe cattāro maṇi pāsāṇe ṭhapesi. Tesaṃ ālokābhibhūto dhātugabbho ativiya virocittha. Sabbanāṭakitthīyo attano attano ābharaṇāni omuñcitvā dhātugabbheyeva pūjesuṃ. Tato rājā dhātunidhānaṃ katvā buddharūpassa pādatale sīsaṃ ṭhapetvā nipanno evaṃ paridevi; mayhaṃ pitupitāmahaparamparāgatādhātu ajja ādiṃ katvā ito paṭṭhāya viyogā jātā ahaṃ dāni tumhākaṃ aticiraṃ (ṭhītā) ramaṇīyā rohaṇajanapadā āharitvā imasmiṃ ṭhāne patiṭṭhāpesinti vatvā sineru muddhani  samujjalamahāpadīpo viya tumhe idheva ṭhītā. Idāni na gamissāma mayaṃ khamatha bhagavā’ti paridevamāno dhātu gabbheyeva patitvā āha?"
NULL,p56,412,100,gatha1,,"Aho viyogaṃ dukkhaṃ me etā bādhenti dhātuyo;"
NULL,p56,413,100,gathalast,,"Vatvā so paridevanto dhātugabbhe sayī tadā."
NULL,p56,414,100,gatha1,,"Marissāmi no gamissaṃ ayyaṃ hitvā idheva’haṃ;"
NULL,p56,415,100,gathalast,,"Dullabhaṃ dassanaṃ tassa saṃsāre carato mamā’ti."
NULL,p56,416,100,bodytext,,"Vatvā paridevanto nipajji. Tassa pana bhikkhusaṅghassa antare sahadevo nāma thero rājānaṃ dhātugabbhe rodamānaṃ nipannaṃ disvā kimajjhāsayo etassā’ti cetopariyañāṇena samantāharitvā idha nipanno marissāmī’ti nipannabhāvaṃ jānitvā iddhiyā saṃsaraṃ piyarūpaṃ māpetvā dhātugabbhato taṃ bahi akāsi."
NULL,p56,417,100,gatha1,,"(Iddhiyā so vasipatto chaḷabhiñño visārado;"
NULL,p56,418,100,gathalast,,"Taṃ khaṇaññeva sappañño rājānaṃ taṃ bahiṃ akā.)"
NULL,p56,419,100,bodytext,,"Tato paṭhamānītajotiraṅga pāsāṇaṃ dhātugabbhassa upari vitānaṃ viya ṭhapetvā arahantā? Dhātugabbho samantato caturassamañcaṃ viya ekaghano hotu. Dhātu gabbhe gandhā mā sussantu, pupphāni mā milāyantu, ratanāni mā vivaṇṇā hontu, pūjanīyabhaṇḍāni mā nassantu, paccatthikapaccāmittānaṃ okāso vā vivaro vā mā hotu’ti adhiṭṭhahiṃsu. Tato rājā dhātuyo mahantaṃ pūjaṃ katvā maṅgalacetiye caturassakoṭṭhakaṃ atimanoramaṃ chattakammañca kelāsakūṭaṃ viya sudhākammañca vālukapādato paṭṭhāya sabbañca kattabbaṃ kammaṃ niṭṭhāpesi. So pana seta nimmalacandaraṃsi viya udakabubbuḷakelāsakūṭapaṭibhāgo chattadharo  acalappatiṭṭhito sujanappasādako aññatitthīya maddanakaro maṅgalathūpo virocittha."
NULL,p56,420,100,gatha1,,"Vilāsamāno aṭṭhāsi tosayanto mahājane;"
NULL,p56,421,100,gathalast,,"Maṅgalakelāsathūpo acalo suppatiṭṭhito."
NULL,p56,422,100,gatha1,,"Sujanappasādanakaro titthiyadiṭṭhimaddano;"
NULL,p56,423,100,gathalast,,"Bhavi saddhākaro seṭṭho sabbajanapasādako."
NULL,p56,424,100,gatha1,,"Cetiyo pavaro loke mahājananisevito;"
NULL,p56,425,100,gathalast,,"Dhajapupphasamākiṇṇo sadā pūjāraho bhavi."
NULL,p56,426,100,gatha1,,"Bahū janā samāgamma nānā desā samāgatā;"
NULL,p56,427,100,gathalast,,"Pūjesuṃ taṃ mahāthūpaṃ sabbadāpi atanditā."
NULL,p56,428,100,gatha1,,"Īdiso patirūpavāso so deso dullabho bhave;"
NULL,p56,429,100,gathalast,,"Appamattā sadā santā vinātha kusalaṃ bahunti."
NULL,p56,430,100,bodytext,,"Rājā kappāsikasukhumavatthena mahārahaṃ cetiyaṃ veṭhetvā, sirivaḍḍhanaṃ nāma mahābodhiṃ patiṭṭhapetvā tattha bodhigharañca kārāpetvā tibhūmakaṃ uposathāgāraṃ kārāpetvā rattiṭṭhāna divāṭṭhānādīni katvā sabbaṃ vihāre kattabbaṃ kāresi. Ettakaṃ kārāpetvā vihāraṃ dakkhiṇodakaṃ dassāmī’ti cintetvā asītisahassamattānaṃ bhikkhūnaṃ sattadivasāni nānāvidha sūpavyañjanehi mahādānaṃ datvā sattame divase mahābhikkhu saṅghassa ticīvaratthāya vatthāni dāpetvā pātova pātarāsabhattaṃ bhuñjitvā therassa santikaṃ gantvā vanditvā ekamantaṃ ṭhīto evamāha? Ayyā, cātuddasike mahābhikkhusaṅghassa dakkhiṇaṃ dātumicchāmī’ti. So panāyasmā evamāha; upakaṭṭha puṇṇamāyaṃ uposathadivase assayujanakkhattena dakkhiṇaṃ dhātuṃ bhaddakanti. So therassa vacanaṃ sutvā pañcapatiṭṭhitena theraṃ vanditvā somanagare attano bhaginiṃ deviṃ kathesi? Bhagini, dasabalassa nalāṭadhātuṃ nidahitvā maṅgalamahācetiyānurūpaṃ  pāsādaṃ alaṅkatadvāraṭṭālakatoraṇaṃ seta vattha anekadhajasamākiṇṇaṃ vihārañca kārāpetvā dakkhiṇaṃ dassāmī’ti ayyassa kathesiṃ. So panāyasmā; upakaṭṭha puṇṇamāya uposathadivase dātuṃ yuttanti āhā’ti. Deva, kiṃ kathesi, ayyassa kathītaniyāmeneva upakaṭṭha puṇṇamāya uposathadivase dakkhiṇaṃ dehī’ti āha. So tassā kathaṃ sutvā somanassapatto sādhu bhadde’ti sampaṭicchitvā somanagare viharanto, upakaṭṭha puṇṇamāya uposathe sampatteyeva ajjuposatho’ti ñatvā giriabhayaṃ pakkosāpetvā, tāta sve dakkhiṇaṃ dātabbaṃ tvaṃ senaṅgaṃ alaṅkaritvā sve amhehi saddhiṃ ehī’ti vatvā serunagare sivarañño loṇanagare mahānāgarañño paṇṇaṃ pahiṇī. Sve tumhākaṃ hatthiassarathapattādīni suvaṇṇālaṅkārehi alaṅkaritvā sve amhehi saddhiṃ chaṇa vesaṃ gāhāpetvā ayyassa tissattherassa dakkhiṇaṃ dīyamānaṃ samosarantuti. Te pana rājāno sāsanaṃ sutvā attano attano vibhavānurūpena hatthiassarathapattādīni alaṅkaritvā gandhapañcaṅgulikaṃ datvā suvaṇṇamālādīni pilandhāpetvā mahā goṇepi tatheva alaṅkaritvā siṅgesu suvaṇṇakañcukaṃ (paṭi) muñcāpetvā amaccagahapati-brāhmaṇaputta-ajagopaka-khujjavāmanaka-senāpatiādayo ca vicittavatthāni nivāsetvā nānāvidhavilepanāni vilimpetvā āgantvā rañño dassayiṃsu. Rājāpi caturaṅginiyā senāya parivuto alaṅkatahatthikkhandhaṃ āruhi. Sesarājāno ca attano attano senaṅgehi parivāretvā hatthikkhandhe nisīditvā rājānaṃ majjhe katvā vāmadakkhiṇapassato namassamānā nikkhamiṃsu. Tassa pana gamanaṃ ajātasattuno tathāgatassa dassanatthāya jīvakambavanagamanaṃ viya tiṃsayojanappamāṇaṃ erāvaṇahatthikkhandhaṃ āruhitvā dvīsu devalokesu devehi parivāretvā sakkassa devānamindassa nandanavanagamanakālo viya ca ahosi. So vaḍḍhamāsakacchāyāya  sampattāya somanagarato nikkhamitvā serudahassa ante nānāvidha alaṅkatapaṭiyattanāṭakitthīnaṃ pañcaṅgikaturiyaṃ paggaṇhāpayamāno aṭṭhāsi."
NULL,p56,431,100,bodytext,,"Mahāpathavī bhijjamānā viya pabbatā parivattamānā viya mahāsamuddo (thalaṃ) avattharitvā bhijjamānakālo viya ca ahosi. Brāhmaṇā jayamukhamaṅgalikā sotthi vacanaṃ vadiṃsu. Sabbālaṅkārapatimaṇḍitā nāṭakitthiyo pañcaṅgikaturiyaṃ pavattayiṃsu. Mahājano velukkhepasahassāni pavattesi. Tato rājā bahū gandhadīpadhūpādayo gāhāpetvā uṭṭhāya senāya parivuto therassa vasanaṭṭhānaṃ pavisitvā theraṃ vanditvā nisinno āha? Ayya rājāno ca sampiṇḍitvā dakkhiṇodakassa dīyamānassa kālo’ti. Thero tassa kathaṃ sutvā bhaddakaṃ mahārājā’ti sampaṭicchi. Tasmiṃ dakkhiṇodakassa dānadivase nānāvidhavicittamaṇidaṇḍakesu nānāvidha dhajapatākādīni bandhāpetvā samussitāni ahesuṃ. Purimādī disāsu manuññavātā vāyiṃsu. Tathā mahāraṃsijālasamujjalito sahassaraṃsibhākaro atthaṅgato ahosi. Vipphuritakiraṇarajadhūmarāhuabbhādīhi uparodhehi virahito tārāgaṇaparivuto puṇṇacando samujjalarajatamayaṃ ādāsamaṇḍalaṃ viya pācīnadisato samuggato. Tasmiṃ khaṇe daṇḍadīpikādayo samujjalāpesuṃ. Mahāmaṅgalacetiyaṃ pana jātisumanamālādāmena parikkhipitvā ekamālāguṇaṃ viya alaṅkari. Yathā tārāgaṇaparivuto puṇṇacando tathā padīpamālālaṅkato mahācetiyo ativiya virocati. Sakala laṅkādīpe pana sabbe rukkhāpi vicittadhajena alaṅkatā viya akālaphalapallavehi vicittā ahesuṃ. Mahāsamuddaloṇasāgarādayo’pi pañcavidhapadumasañchannā ahesuṃ."
NULL,p56,432,100,gatha1,,"Vicitravatthābharaṇehi sabbe,"
NULL,p56,433,100,gatha2,,"Alaṅkatā devasamānavaṇṇā;"
NULL,p56,434,100,gatha3,,"Anekasaṅkhyā sumanā patītā,"
NULL,p56,435,100,gathalast,,"Janā samantā parivārayiṃsu."
NULL,p56,436,100,gatha1,,"Sabbeva  ujjalāpesuṃ daṇḍadīpaṃ manoramaṃ;"
NULL,p56,437,100,gathalast,,"Sakalampi idaṃ dīpaṃ āsi obhāsitaṃ tadā."
NULL,p56,438,100,gatha1,,"Tārāgaṇasamākiṇṇo puṇṇacandova jotayī;"
NULL,p56,439,100,gathalast,,"Sārade nabhamajjhamhi ṭhito ruciraraṃsiyā."
NULL,p56,440,100,gatha1,,"Tathā ayaṃ thūpavaro suppabhāso alaṅkato;"
NULL,p56,441,100,gathalast,,"Mālāpadīpamajjhamhi bhāti bhutilakuttamo."
NULL,p56,442,100,gatha1,,"Sabbe’pi pādapā assa laṅkādīpassa sabbaso;"
NULL,p56,443,100,gathalast,,"Dhajehi’va samākiṇṇā āsuṃ pupphaphalandadā."
NULL,p56,444,100,gatha1,,"Sacetanā yathā sabbe akā pūjaṃ akā tadā;"
NULL,p56,445,100,gathalast,,"Tathā acetanā sabbe akā pūjaṃ anappakaṃ."
NULL,p56,446,100,bodytext,,"Yebhuyyena bhumaṭṭhe deve upādāya yāva akaṇiṭṭhakā devā brahmā dibbamālāpāricchattakakoviḷāracandanacuṇṇaṃ gahetvā āgatādevāti vā manussāti vā jānituṃ asakkonti. Ukkaṭṭhamahāsamāgamo ahosi. Tasmimpi divase mahāpathavi ākāsayugandharacakkavāḷapabbatuttamādayo kampiṃsu. Taṃ disvā rājā ativiya somanassappatto there ca avasesa mahāmattādayo sannipātetvā nāṭakādayo ca gahetvā, idānevāhaṃ vihāradakkhiṇaṃ dassāmi’ti cetiyaṅgaṇaṃ agamāsi. Theropi bhikkhusaṅghaṃ gahetvā cetiyaṅgaṇe alaṅkatamaṇḍape nisīdi. Rājā vāsitagandhodakasuvaṇṇabhiṅkāraṃ gahetvā udakaṃ therassa hatthe āsiñcitvā dakkhiṇaṃ adāsi. Datvā ca pana evamāha; ayyā esā dhātu mayhaṃ pitāmahavaṃsena āgatā. Idāni amhākaṃ atiruciraramaṇiyā rohaṇajanapadā āharitvā suvaṇṇena dhātugabbhaṃ, sattaratanena dhātumaṇḍapaṃ kārāpetvā tasmiṃ suvaṇṇamayaṃ buddhapaṭimaṃ nisīdāpetvā amhākaṃ dasabalassa nalāṭadhātuṃ  nidahitvā ayyassa cīvarādīnamatthāya idāni soḷasagāmavarāni dassāmi’ti gāmavarāni datvā samantato tigāvutappamāṇe serudahe bheriṃ carāpetvā ārāmikaṃ katvā āha? Bhante, tumhākaṃ mayā dinnasoḷasagāmaṃ ajjeva gantabbaṃ. Gantvā ca pana ajjeva pariggahaṃ karothāti vatvā tattheva vāsupagato puna divase samāgantvā sattāhaṃ mahādānaṃ datvā sattame divase mahābhikkhusaṅghassa tīcīvarappahonakasāṭakaṃ paṇītaṃ bhojanaṃ datvā therassa santikaṃ āgato, ayya vihāre kattabbaṃ aparihāpetvā mayā kataṃ, gehaṃ gamissāmīti (nivedesi). Thero tassa kathaṃ sutvā sādhu mahārājāti sampaṭicchi."
NULL,p56,447,100,bodytext,,"So pana cetiyassa pūjanatthāya pupphārāmaṃ kārāpetvā mālākārānaṃ paribbayaṃ dāpesi. Tathā bherivādakanāṭakānampi vihārasīmante suvaṇṇanaṅgalena paricchinditvā ārāmikānampi gāmaṃ kārāpesi. Bhikkhusaṅghassa veyyāvaccatthāya attano santike pañcasataamaccadhītaro tattake amaccaputte dāsadāsiyo ca datvā paribbayatthāya tesaṃ tesaṃ pañcasatasahassakahāpaṇe ca dāpesi. Bhikkhusaṅghassa ca dhātupujanatthāya soḷasasahassaṃ kahāpaṇaṃ dāpesi."
