id,book,par_num,level,class,title,text
NULL,p56,1,1,book,"Dhātuvaṃso ","Dhātuvaṃso "
NULL,p56,2,100,centered,,"Namo tassa bhagavato arahato sammāsambuddhassa"
NULL,p56,3,2,chapter,"1. Tathāgatassāgamanakathā","1. Tathāgatassāgamanakathā"
NULL,p56,4,100,gatha1,,"Sambuddhamatulaṃ suddhaṃ dhammaṃ saṅghaṃ anuttaraṃ,"
NULL,p56,5,100,gatha2,,"Namassitvā pavakkhāmi dhātuvaṃsappakāsanaṃ;"
NULL,p56,6,100,gatha3,,"Tikkhattumagamā nātho laṅkādīpaṃ manoramaṃ,"
NULL,p56,7,100,gathalast,,"Sattānaṃ hitamicchanto sāsanassa ciraṭṭhitiṃ."
NULL,p56,8,100,bodytext,,"Tattha tikkhattumagamā nātho’ti anamatagge saṃsāravaṭṭe parināmetvā appatisaraṇabhāvappattānaṃ lokiyalokuttarasukhanipphādanabhāvena nātho patisaraṇa bhūto bhagavā buddhadhammasaṅgharatanattayamaggaṃ ācikkhanto laṅkādīpaṃ tikkhattuṃ gato. Tattha paṭhamagamane tāva bodhimaṇḍaṃ āruyha puratthīmābhimukho nisīditvā sūriye anatthamiteyeva mārabalaṃ vidhametvā, paṭhamayāme pubbenivāsañāṇaṃ anussaritvā majjhimayāme cutupapātañāṇaṃ patvā pacchimayāmāvasāne paccayākāre ñāṇaṃ otāretvā dasabalacatuvesārajjādi guṇapatimaṇḍitaṃ sabbaññutañāṇaṃ paṭivijjhitvā bodhimaṇḍappadese anukkamena sattasattāhaṃ vītināmetvā aṭṭhame sattāhe ajapālanigrodhamūle nisinno dhammagambhirataṃ paccavekkhanena appossukkataṃ āpajjamāno dasasahassa brahmaparivārena sahampatimahābrahmunā āyācitadhammadesano hutvā  buddhacakkhunā lokaṃ olokento pañcavaggiyānaṃ bhikkhunaṃ bahūpakārakaṃ anussaritvā uṭṭhāyāsanā kāsīnaṃ puraṃ gantvā aññākoṇaḍaññappamukhe aṭṭhārasa brahmakoṭiyo amataṃ pāyento dhammacakkaṃ pavattetvā pakkhassa pañcamiyaṃ pañcavaggiye sabbepi te arahante patiṭṭhāpetvā taṃ divasameva yasakulaputtassa rattibhāge sotāpattiphalaṃ datvā punadivase arahantaṃ datvā tassa sahāyake catupaññāsajane arahantaṃ pāpetvā evaṃ loke ekasaṭṭhiyā arahantesu jātesu vutthavasso pavāretvā, ‘caratha bhikkhave cārika’ nti bhikkhu disāsu pesetvā sayaṃ uruvelaṃ gacchanto antarāmagge kappāsikavanasaṇḍe bhaddavaggiye kumāre tiṃsajane vinetvā ehibhikkhubhāvena pabbājetvā uruvelaṃ gantvā aḍḍhuḍḍhāni pāṭihāriyasahassāni dassento uruvelakassapādayo sahassajaṭilaparivāre tebhātikajaṭile vinento tattheva vihāsi. Aparabhāge aṅgamagadharaṭṭhavāsino uruvelakassapassa mahāyaññaṃ upaṭṭhāpesuṃ. So pana icchācārābhibhūto cintesi? ‘‘Sacāyaṃ mahāsamaṇo imassa samāgamassa majjhe pāṭihāriyaṃ kareyya lābhasakkāro me parihāyissati’’ti. Tassevaṃ pavattaajjhāsayaṃ ñatvā pātova uttarakuruto bhikkhaṃ āharitvā anotatte āhāraṃ paribhuñjitvā sāyanha samaye phussapuṇṇamīuposathadivase laṅkādīpassatthāya laṅkādīpamupāgami."
NULL,p56,9,100,bodytext,,"Tassa pana dīpassa mahāgaṅgāya dakkhiṇapasse āyāmato tiyojane puthulato ekayojanappamāṇe mahānāgavanuyyāne yakkhasamāgamassa majjhe tassa upari mahiyaṅgaṇathūpassa patiṭṭhānaṭṭhāne ākāseyeva ṭhīto vuṭṭhivātandhakāraṃ dassetvā tesaṃ bhayaṃ uppādesi. Te bhayena upaddutā ‘‘kassa nu kho imaṃ kamma’’nti ito cito olokento addasaṃsu bhagavantaṃ ākāse nisinnaṃ. Disvāna bhagavantaṃ abhayaṃ yāviṃsu. Tesaṃ bhagavā āha?"
NULL,p56,10,100,bodytext,,"‘‘Sace  tumhe abhayaṃ icchatha mayhaṃ nisajjaṭṭhānassa okāsaṃ dethā’’ti. Sabbepi te tassa nisajjaṭṭhānaṃ adaṃsu. Bhagavā nisajjāya okāsaṃ gahetvā tesaṃ bhayaṃ vinodetvā tehi dinne bhumibhāge cammakhaṇḍaṃ pattharitvā nisīdi. Nisinnova pana bhagavā cammakhaṇḍaṃ pasāresi. Te yakkhā bhītatasitā aññattha gantuṃ asahamānā samantato sāgaratīre rāsibhūtā ahesuṃ. Satthā giridīpaṃ iddhānubhāvena āharitvā dassesi. Tesu tattha patiṭṭhitesu puna yathāṭṭhāneva ṭhapetvā pattharitacammakhaṇḍampi saṃkhipi. Tasmiṃ khaṇe tato tato devā sannipatiṃsu. Tesaṃ samāgame dhammaṃ desesi. Anekesaṃ pāṇakoṭīnaṃ dhammābhisamayo ahosi. Saraṇesu ca sīlesu ca patiṭṭhitā asaṅkheyyā ahesuṃ. Sumanakūṭe pana mahāsumanadevo sotāpattiphalaṃ patvā attano pūjanīyaṃ bhagavantaṃ yāci. Bhagavā tena yācito sīsaṃ pāṇinā parāmasitvā kesadhātuṃgahetvā tassa adāsi. Datvā ca pana laṅkādīpaṃ tikkhattuṃ padakkhiṇaṃ katvā parittaṃ katvā ārakkhaṃ saṃvidhāya puna uruvelameva āgato. So pana kesadhātuyo suvaṇṇacaṅgoṭakenādāya satthu nisinnaṭṭhāne nānāratanehi vicittaṃ thūpaṃ patiṭṭhāpetvā upari indanīlamaṇithūpikāhi pidahitvā gandhamālādīhi pūjento vihāsi. Parinibbute pana bhagavati sāriputtassa antevāsiko sarabhū nāma thero khīṇāsavo citakato iddhiyā tathāgatassa gīvaṭṭhiṃ ādāya tasmiṃ indanīlamaṇithūpe patiṭṭhāpetvā meghavaṇṇapāsāṇehi dvādasahatthaṃ thūpaṃ kārāpetvā gato. Tato devānampiyatissarañño bhātā cūḷābhayo nāma kumāro tamabbhutaṃ cetiyaṃ disvā abhippasanno taṃ paṭicchādento tiṃsahatthaṃ cetiyaṃ patiṭṭhāpesi. Puna duṭṭhagāmaṇī abhayamahārājā taṃ paṭicchādetvā asītihatthaṃ kañcukacetiyaṃ kārāpesi. Mahiyaṅgaṇa  thūpassa patiṭṭhānādhikāro evaṃ vitthārato veditabbo?"
NULL,p56,11,100,unindented,,"Bodhiṃ patvāna sambuddho bodhimūle narāsabho"
NULL,p56,12,100,unindented,,"Nisīditvāna sattāhaṃ pāṭihīraṃ tato akā."
NULL,p56,13,100,unindented,,"Tato pubbuttare ṭhatvā pallaṅkā īsake jino"
NULL,p56,14,100,unindented,,"Animisena nettena sattāhaṃ taṃ udikkhayi."
NULL,p56,15,100,unindented,,"Caṅkamitvāna sattāhaṃ cakkhame ratanāmaye"
NULL,p56,16,100,unindented,,"Vicinitvā jino dhammaṃ varaṃ so ratanāghare."
NULL,p56,17,100,unindented,,"Ajapālamhi sattāhaṃ anubhosi samādhijaṃ"
NULL,p56,18,100,unindented,,"Ramme ca mucalindasmiṃ vimuttisukhamuttamaṃ."
NULL,p56,19,100,unindented,,"Rājāyatanamūlamhi sattarattindivaṃ vasī"
NULL,p56,20,100,unindented,,"Dantaponodakaṃ sakko adāsi satthuno tadā."
NULL,p56,21,100,unindented,,"Catuhi lokapālehi silāpattaṃ samāhaṭaṃ catukkamekakaṃ katvā adhiṭṭhānena nāyako."
NULL,p56,22,100,unindented,,"Vāṇijehi tadā dinnaṃ manthañca madhupiṇḍikaṃ"
NULL,p56,23,100,unindented,,"Tahiṃ pana gahetvāna bhattakiccaṃ akā jino."
NULL,p56,24,100,unindented,,"Gaṇhiṃsu saraṇaṃ tassa tapussabhallikā ubho"
NULL,p56,25,100,unindented,,"Saraṇaṃ agamuṃ te taṃ satthu dinnasiroruhā."
NULL,p56,26,100,unindented,,"Gantvāna te sakaṃ raṭṭhaṃ thūpaṃ katvā manoramaṃ"
NULL,p56,27,100,unindented,,"Namassiṃsu ca pūjesuṃ dvebhātikopāsakā."
NULL,p56,28,100,unindented,,"Iti so sattasattāhaṃ vītināmesi nāyako?"
NULL,p56,29,100,unindented,,"Brahmunā yācito satthā dhammacakkaṃ pavattituṃ."
NULL,p56,30,100,unindented,,"Tato bārāṇasiṃ gantvā dhammacakkaṃ pavattayi"
NULL,p56,31,100,unindented,,"Koṇḍañño desite dhamme sotāpattiphalaṃ labhi."
NULL,p56,32,100,unindented,,"Brahmāno’ṭṭhārasakoṭī devatā ca asaṅkhiyā"
NULL,p56,33,100,unindented,,"Sotāpattiphalaṃ pattā dhammacakke pavattite."
NULL,p56,34,100,gatha1,,"Patto  pāṭipade vappo bhaddiyo dutiye phalaṃ,"
NULL,p56,35,100,gathalast,,"Tatiye ca mahānāmo assajī ca catutthīyaṃ."
NULL,p56,36,100,gatha1,,"Te sabbe sannipātetvā pañca’me pañcavaggiye,"
NULL,p56,37,100,gathalast,,"Anattasuttaṃ desetvā bodhiyagga phalena te."
NULL,p56,38,100,gatha1,,"Bodhiṃ pāpetvā pañcāhe yasattherādike jane,"
NULL,p56,39,100,gathalast,,"Tato maggantare tiṃsakumāre bhaddavaggiye."
NULL,p56,40,100,gatha1,,"Uruvelaṃ tato gantvā uruvelāya saññitaṃ,"
NULL,p56,41,100,gathalast,,"Uruvelenanuññāto uruvelanāgaṃ dami."
NULL,p56,42,100,gatha1,,"Taṃ taṃ damī jino nāgaṃ damanena urādigaṃ,"
NULL,p56,43,100,gathalast,,"Tathāgataṃ nimantiṃsu disvā te pāṭihāriyaṃ."
NULL,p56,44,100,gatha1,,"Idheva vanasaṇḍasmiṃ vihāretvā mahāmunī,"
NULL,p56,45,100,gathalast,,"Upaṭṭhāhāmase sabbe niccabhattena taṃ mayaṃ."
NULL,p56,46,100,gatha1,,"Uruvelakassapassa mahāyaññe upaṭṭhite,"
NULL,p56,47,100,gathalast,,"Tassa’ttano nāgamane icchācāraṃ vijāniya."
NULL,p56,48,100,gatha1,,"Uttarakuruto bhikkhaṃ haritvā dipaduttamo,"
NULL,p56,49,100,gathalast,,"Anotattadahe bhutvā sāyanha samaye sayaṃ."
NULL,p56,50,100,gatha1,,"Bodhito navame māse phussapuṇṇamiyaṃ jino,"
NULL,p56,51,100,gathalast,,"Laṅkādīpaṃ visodhetuṃ laṅkādīpamupāgami."
NULL,p56,52,100,gatha1,,"Yakkhe damitvā sambuddho dhātuṃ datvāna nāyako,"
NULL,p56,53,100,gathalast,,"Gantvāna uruvelaṃ so vasī tattha vane jino."
NULL,p56,54,100,centered,,"Paṭhamagamanakathā samattā."
NULL,p56,55,100,bodytext,,"Dutiyagamane pana bodhito pañcame vasse jetavanamahāvihāre vasanto cūḷodara’mahodarānaṃ mātulabhāgineyyānaṃ nāgānaṃ maṇipallaṅkaṃ nissāya saṅgāmaṃ paccupaṭṭhitaṃ disvā sayaṃ pattacīvaramādāya cittamāsassa kāḷapakkhe uposathadivase  nāgadīpaṃ gantvā tesaṃ saṅgāmamajjhe ākāse nisinno andhakāraṃ akāsi. Te andhakārābhibhūte samassāsetvā ālokaṃ dassetvā attano saraṇabhūtānaṃ tesaṃ sāmaggikaraṇatthaṃ phalabharitarukkhaṃ cālento viya dhammaṃ desesi. Te ubhopi dhamme pasīditvā tampi pallaṅkaṃ tathāgatassa adaṃsu. Bhagavā pallaṅke nisinno dibbannapānehi santappito bhattānumodanaṃ katvā asītikoṭiyo nāge saraṇesu ca sīlesu ca patiṭṭhāpesi. Tasmiṃ samāgame mahodarassa mātulo maṇiakkhiko nāma nāgarājā bhagavantaṃ puna kalyāṇidesamāgamanatthaṃ. Ayāci. Bhagavā pana tuṇhībhāvena adhivāsetvā ‘‘jetavanameva gato."
NULL,p56,56,100,gatha1,,"Evañhi so nāgadīpaṃ upeto,"
NULL,p56,57,100,gatha2,,"Mārābhibhu sabbavidu sumedho;"
NULL,p56,58,100,gatha3,,"Dametva nāge karuṇāyupeto,"
NULL,p56,59,100,gathalast,,"Gantvā vasī jetavane munindo."
NULL,p56,60,100,centered,,"Dutiyagamanakathā samattā."
NULL,p56,61,100,bodytext,,"Tatiyagamane pana bodhito aṭṭhame vasse jetavanamahāvihāre viharanto bhagavā? ‘‘Mama parinibbānato pacchā tambapaṇṇidīpe sāsanaṃ patiṭṭhahissati, so dīpo bahu bhikkhubhikkhunīupāsakopāsikādi ariyagaṇasevito kāsāvapajjoto bhavissati, mayhaṃ catunnaṃ dāṭhādhātunaṃ antare ekā dāṭhā ca dakkhiṇaakkhadhātu ca nalāṭadhātu ca rāmagāmavāsīhi laddho ekakoṭṭhāso ca aññe bahusarīradhātu ca kesadhātuyo ca tattheva patiṭṭhahissanti anekāni saṅghārāmasahassāni ca. Buddhadhammasaṅgharatane patiṭṭhitasaddho mahājano bhavissati. Tasmā laṅkādīpaṃ gantvā tattha samāpattiṃ samāpajjitvā āgantuṃ vaṭṭatī ‘‘ti cintetvā ānandattheraṃ āmantesi? ‘‘Ānanda catupaṭisambhidappattānaṃ pañcasatamahākhīṇāsavānaṃ bhikkhūnaṃ paṭivedesi. Amhehi saddhiṃ gantabba ‘‘nti. Ānandatthero kapilavatthukoḷiya nagaravāsīnaṃ pañcasatamahākhīṇāsavānaṃ bhikkhūnaṃ paṭivedesi. Te paṭiveditā pañcasatakhīṇāsavā pattacīvaradhārā hutvā satthāraṃ vanditvā  añjaliṃ paggayha namassamānā aṭṭhaṃsu. Satthuno pana salalāya nāma gandhakuṭiyā avidūre rattasetanīluppalakumudapadumapuṇḍarīkasatapattasahassapattajalajehi sogandhika nānāpupphehi sañcannā,subhasopānā, pasāditasamatittikakākapeyyasuramaṇīyasītalamadhurodakā suphullapupphaphaladhārita nānāvidhavicittasālasalalacampakāsokarukkhānāgarukkhādīhi susajjitabhūmipadesā accantaramaṇiyā pokkharaṇī atthi. Tattha adhivattho mahānubhāvo sumanonāma nāgarājā soḷasasahassamattāhi nāgamāṇavikāhi parivuto mahantaṃ sirisampattiṃ anubhavamāno tathāgatassa rūpasobhaggappattaṃ attabhāvaṃ oloketvā mahantaṃ sukhasomanassaṃ anubhavamāno attano mātaraṃ nandanāgamānavikaṃ garuṭṭhāne ṭhapetvā tassā veyyāvaccaṃ kurumāno tasmiṃyeva pokkharaṇiṃ ajjhāvasati. Satthā pana attano gamanaṃ saṃvidhānānantare sumanaṃ nāgarājānaṃ avidure ṭhitaṃ āmantetvā saparivāro āgacchā hīti āha. So sādhuti sampaṭicchitvā attano parivāre chakoṭimatte nāge gahetvā supuppītacampakarukkhaṃ tathāgatassa sūriyaraṃsinivāraṇatthaṃ chattaṃ katvā gaṇhi. Atha bhagavā ravirasmipatthaṭasuvaṇṇapabbato viya virocamāno attano pattacīvaramādāya ākāsaṃ abbhūggañchi. Satthāraṃ parivāretvā ṭhītā te pañcasatakhīṇāsavāpi sakaṃ sakaṃ pattacīvaramādāya ākāsaṃ uggantvā satthāraṃ parivārayiṃsu. Satthā pañcasatakhīṇāsavaparivuto visākhapuṇṇamuposathadivase kalyāṇiyaṃ gantvā mahārahe maṇḍapamajjhe paññattavara buddhāsane pañcasatakhīṇāsavaparivuto hutvā nisīdi."
NULL,p56,62,100,bodytext,,"Atha maṇiakkhiko nāma nāgarājā buddhapamukhaṃ bhikkhu saṅghaṃ anekehi dibbehi khajjabhojjehi santappetvā ekamantaṃ nisīdi. Satthā tassa bhattānumodanaṃ katvā sumanakuṭe padalañchanaṃ dassetvā tasmiṃ pabbatapāde anekapādapākiṇṇabhūmippadese nisinno divāvihāraṃ katvā tato vuṭṭhāya dīghavāpicetiyaṭṭhāne samāpattiṃ samāpajji. Mahāpathavī udakapariyantaṃ katvā satavāraṃ sahassavāraṃ saṅkampi. Tattha mahāsenaṃ nāma devaputtaṃ ārakkhatthāya nivattetvā tato  vuṭṭhāya mahāthūpaṭṭhāne tatheva samāpattiṃ samāpajji. Mahāpathavi tatheva kampi. Tatrāpi visālarūpa devaputtaṃ ārakkhaṃ gaṇhanatthāya ṭhapetvā tato vuṭṭhāya thūpārāma cetiyaṭṭhāne tatheva nirodhasamāpattiṃ samāpajji. Mahāpathavī tatheva kampi. Tattha ca pathavipāla devaputtaṃ ārakkhatthāya. Nivattetvā tato vuṭṭhāya maricavaṭṭicetiyaṭṭhānaṃ gantvā pañcahi bhikkhusatehi saddhiṃ samāpattiṃ appayi. Pathavi tatheva kampi. Tasmiṃ ṭhāne indakadevaputtaṃ ārakkhaṃ gaṇhanatthāya ṭhapesi. Tato vuṭṭhāya kācaragāmacetiyaṭṭhāne tatheva samāpattiṃ samāpajji. Pathavi tatheva kampi. (Tasmiṃ ṭhāne mahāghosa devaputtaṃ ārakkhaṃ gaṇhanatthāya niyyādesi) etasmiṃ mahācetiyaṭṭhāne mahāghosaṃ nāma devaputtaṃ ārakkhaṃ gahaṇatthāya nivattetvā tato vuṭṭhāya tissamahāvihāracetiyaṭṭhāne tatheva samāpattiṃ samāpajji. Pathavi tatheva kampi. Tattha maṇimekhalaṃ nāma devadhītaraṃ ārakkhaṃ gāhāpetvā tato nāgamahāvihāracetiyaṭṭhāne tatheva samāpattiṃ samāpajji. Pathavi tatheva kampi. Tasmimpi mahindaṃ nāma devaputtaṃ ārakkhaṃ gahaṇatthāya ṭhapesi. Tato vuṭṭhāya mahāgaṅgāya dakkhiṇadisābhāge seru nāma dahassa ante varāha nāma soṇḍimatthake atimanoramaṃ udakabubbuḷakelāsakūṭapaṭibhāgaṃ cetiyaṃ patiṭṭhahissatī’ti pañcasatakhīṇāsavehi saddhiṃ nirodhasamāpattiṃ samāpajji. Bahalaghanamahāpathavi paribbhamitakumbhakāracakkaṃ viya pabhintamadamahā hatthināgassa kuñcanādakaraṇaṃ viya ucchukoṭṭana yanta-mukhasaddo  viya (ca) satavāraṃ sahassavāraṃ nadamānā somanassappattā viya sakalalaṅkādīpaṃ unnādaṃ kurumānā saṃkampi. Tato vuṭṭhāya sumananāgarañño hatthesu ṭhita campakarukkhato pupphāni ādāya tattha pūjetvā punappunaṃ taṃ olokesi. So satthāraṃ vanditvā mayā bhante kiṃ kattabbanti pucchi. Imassa ṭhānassa ārakkhaṃ karohīti āha. So taṃ sutvā bhante tumhākaṃ gandhakuṭiṃ mama ārakkhaṃ karontassa rūpasobhaggappattaṃ asītyānubyañjanabyāmappabhādvattiṃsamahāpurisalakkhaṇavicittaṃ dassanānuttariyabhūtaṃ passantassa manosilātale sīhanādaṃ nadanto taruṇasīho viya gajjanto pāvussakamahāmegho viya ākāsagaṅgaṃ otaranto viya ratanadāmaṃ ganthento viya ca aṭṭhaṅgasamannāgataṃ savanīyasaraṃ vissajjetvā bramhaghosaṃ nicchārento nānānayehi vicittakathaṃ kathayamānānaṃ savanānurittayabhūtaṃ saṃsāraṇṇavanimuggānaṃ tāraṇasamatthaṃ madhura dhammadesanaṃ suṇantassa, ñāṇiddhiyā koṭippatte sāriputtamoggallānādayo asītimahāsāvake passantassa, tattheva mayhaṃ vasanaṃ ruccati. Na sakkomi aññattha tumhehi vinā vasitunti āha. Bhagavā tassa kathaṃ sutvā nagarāja, imaṃ padesaṃ tayā ciraṃ vasitaṭṭhānaṃ. Kakusandhassa bhagavato dhātu imasmiṃyeva ṭhāne patiṭṭhitā, tvameva tasmiṃ kāle varaniddo nāma nāgarājā hutvā tassā dhātuyā ārakkhaṃ gahetvā gandhamālādīhi pūjaṃ karonto ciraṃ vihāsi. Puna koṇāgamanassa bhagavato dhātu imasmiṃyeva ṭhāne patiṭṭhitā tvameva tasmiṃ kāle jayaseno nāma devaputto hutvā tassā dhātuyā ārakkhaṃ gahetvā gandhamālādīhi pūjaṃ katvā tattheva ciraṃ vihāsi. Puna kassapassa bhagavato dhātu imasmiṃyeva ṭhāne patiṭṭhitā. Tvameva tasmiṃ kāle dīghasālo nāma nāgarājā hutvā tāya dhātuyā ārakkhaṃ gahetvā gandhamālādīhi pūjaṃ karonto vihāsi. Mayi pana parinibbute kākavaṇṇatissamahārājā mayhaṃ nalāṭadhātuṃ imasmiṃyeva  ṭhāne patiṭṭhāpessati, tasmā tvaṃ imassa ṭhānassa ārakkhaṃ karohīti vatvā pañcasīlesu patiṭṭhāpetvā pañcasatakhīṇāsavehi saddhiṃ cetiyaṭṭhānaṃ padakkhiṇaṃ katvā tvaṃ appamatto hohīti vatvā ākāsaṃ uppatitvā jetavanameva gato."
NULL,p56,63,100,bodytext,,"Tassa pana nāgarañño mātā indamānavikā nāma āgantvā tathāgataṃ vanditvā ekamantaṃ ṭhitā, bhante mama putto sumano nāma nāgarājā kuhinti āha. Tava putto tambapaṇṇidīpe mahāvālukagaṅgāya dakkhiṇabhāge seru nāma dahassa samīpe varāha nāma soṇḍiyaṃ samādhi appitattā attano parivāre chakoṭimatte nāge gahetvā satthāraṃ vanditvā bhante ito paṭṭhāya tumhākaṃ dassanaṃ dullabhaṃ, khamatha meti accayaṃ desetvā mahatiṃ nāgasampattiṃ gahetvā puttassa sumananāgarājassa santikaṃ gantvā mahatiṃ issariyasampattiṃ anubhavanti tattheva ārakkhaṃ gahetvā ciraṃ vihāsi."
NULL,p56,64,100,gatha1,,"Mahāpañño mahāsaddho mahāvīro mahāisi,"
NULL,p56,65,100,gatha2,,"Mahābalena sampanno mahantaguṇabhusito;"
NULL,p56,66,100,gatha3,,"Gantvāna tambapaṇṇiṃ so sattānuddayamānaso,"
NULL,p56,67,100,gathalast,,"Gantvā nāgavaraṃ dīpaṃ agā jetavanaṃ vidu."
NULL,p56,68,100,gatha1,,"Atisayamatisāro sāradānaṃ karonto,"
NULL,p56,69,100,gatha2,,"Atiadhiramaṇiyo sabbalokekanetto;"
NULL,p56,70,100,gatha3,,"Atiguṇadharaṇīyo sabbasatte tamaggaṃ,"
NULL,p56,71,100,gathalast,,"Ativipuladayo tānetumāgā sudīpaṃ."
NULL,p56,72,100,centered,,"Tatiyagamanakathā samattā."
NULL,p56,73,100,bodytext,,"Iti ariyajanapasādanatthāya kate dhātuvaṃse tathāgatassa gamanaṃ nāma paṭhamo paricchedo."
NULL,p56,74,100,unindented,,"Āgantvā tambapaṇṇiṃ so sattānuddayamānaso"
NULL,p56,75,100,unindented,,"Puna gantvā nāgadīpaṃ agā jetavanaṃ varaṃ"
NULL,p56,76,100,unindented,,"Atisayamatisāro sāradāneka ratto"
NULL,p56,77,100,unindented,,"Atidhitiramaṇiyo sabbalokekanetto"
NULL,p56,78,100,unindented,,"Atiguṇaramaṇīyaṃ sabbasantekamaggaṃ"
NULL,p56,79,100,unindented,,"Ativipuladayattā laṅkamāgā sudīpaṃ"
NULL,p56,80,100,centered,,"Iti sīhaḷabhāsāya kate dhātuvaṃse dissate."
NULL,p56,81,2,chapter,"2.  Parinibbānakathā","2.  Parinibbānakathā"
NULL,p56,82,100,bodytext,,"Satthā pana tato pañcacattālīsavassāni tipiṭakapariyattidhammaṃ desetvā veneyyajane saṃsārato catuariyamaggaphalapaṭilābhavasena uddhāretvā nibbāne patiṭṭhāpetvā pacchime kāle vesālinagaraṃ upanissāya cāpālacetiyaṃ nissāya viharanto mārena parinibbānatthāya ārādhito sato sampajāno āyusaṅkhāre vissajjesi. Tassa vissaṭṭhabhāvaṃ ānandoyeva aññāsi. Añño kocipi jānanto nāma natthi. Tasmā bhikkhusaṅghampi jānāpessāmīti jetavanamahāvihāraṃ gantvā sabbaṃ bhikkhusaṅghaṃ sannipātāpetvā bhikkhave tathāgatassa na cirasseva tiṇṇaṃ māsānaṃ accayena parinibbānaṃ bhavissati, tumhe sattatiṃsabodhi pakkhiyadhammesu samaggā hutvā ekībhāvā hotha, tumhe vivādaṃ mā karotha. Appamādena tisso sikkhā sampādethāti vatvā puna divase vesāliyaṃ piṇḍāya caritvā piṇḍapātā paṭikkamitvā bhaṇḍagāmaṃ gato. Bhaṇḍagāmato hatthigāmaṃ hatthigāmato ambagāmaṃ ambagāmato jambugāmaṃ jambugāmato nigrodhagāmaṃ nigrodhagāmato bhoganagaraṃ bhoganagarato pāvānagaraṃ pāvānagarato kusinārānagaraṃ patto. Tattha yamakasālānamantare ṭhīto ānandattheraṃ āmantetvā untarasīsakaṃ katvā mañcakaṃ paññāpehi kilantosmi ānanda nipajjissāmi’ti āha. Taṃ sutvā ānandatthero uttarasīsakaṃ katvā mañcakaṃ paññāpetvā catugguṇaṃ saṅghāṭiṃ attharitvā pañcacattālīsavassāni asayitabuddhaseyyaṃ sayanto dakkhiṇapassena sato sampajāno anuṭṭhānasaññaṃ manasikaritvā sīhaseyyaṃ kappesi."
NULL,p56,83,100,gatha1,,"Atītamaddhāna bhave caranto,"
NULL,p56,84,100,gatha2,,"Anantasatte karuṇāyupeto;"
NULL,p56,85,100,gatha3,,"Katvāna puññāni anappakāni,"
NULL,p56,86,100,gathalast,,"Patto sivaṃ lokahitāya nātho."
NULL,p56,87,100,gatha1,,"Evaṃ  hi so dasabalopi vihīnathāmo,"
NULL,p56,88,100,gatha2,,"Yamassa sālāna nipajji majjhe;"
NULL,p56,89,100,gatha3,,"Katvāna saññañhi anuṭṭhahānaṃ,"
NULL,p56,90,100,gathalast,,"Sa iddhimā māramukhaṃ paviṭṭho."
NULL,p56,91,100,bodytext,,"Tasmiṃ khaṇe samakasālā supupphitā ahesuṃ. Na kevalaṃ yamakasālāyeva supupphītā, atha kho dasasahassī lokadhātu cakkavāḷesu sālarukkhāpi pupphitā. Na sālarukkhāyeva supupphitā, atha kho yaṃ kiñci pupphupagaphalūpaga rukkhajātaṃ sabbampi pupphañca phalañca gaṇhi. Jalesu jalapadumāni thalesu thalapadumāni khandhesu khandhapadumāni sākhāsu sākhāpadumāni latāsu latāpadumāni ākāse olambapadumāni piṭṭhipāsāṇe hinditvā satapattapadumāni supupphitāni ahesuṃ. Pathavito yāva brahmaloko tāva dasasahassi cakkavāḷā ekamālāguṇā viya ahesuṃ. Devā ākāsato dibbamandāravapāricchattakakoviḷārapupphāni ca candanacuṇṇāni ca samākiranti. Dibbaturiyasaṅgitiyo ca antalikkhe pavattanti. Anekāni acchariyasahassāni ahesuṃ. Evaṃ pūjāvisese pavattamāne paṭhamayāme subhaddaparibbājakaṃ vinetvā majjhimayāme dasasahassi lokadhātu devatānaṃ anusāsitvā pacchimayāmāvasāne paṭhamajjhānaṃ samāpajjitvā tato vuṭṭhāya dutiyajjhānaṃ catutthajjhānaṃ samāpajji. Tato vuṭṭhāya ākāsānañcāyatanaṃ viññāṇañcāyatanaṃ ākiñcaññāyatanaṃ nevasaññānāsaññāyatanaṃ samāpajjitvā tato vuṭṭhāya nirodhasamāpattiṃ samāpajji. Tato vuṭṭhāya paṭhamajjhānaṃ dutiyajjhānaṃ tatiyajjhānaṃ catutthajjhānañca samāpajji. Tato vuṭṭhāya etthantarato anupādisesanibbānadhātuyā parinibbāyi."
NULL,p56,92,100,gatha1,,"Mahāmohatamaṃ hantvā sattānaṃ hadayassitaṃ,"
NULL,p56,93,100,gatha2,,"Ravīva jotamāno so lokassa anukampako;"
NULL,p56,94,100,gatha3,,"Vassāni  pañcatālīsaṃ katvā sattahitaṃ bahuṃ,"
NULL,p56,95,100,gathalast,,"Adhunā aggikkhandhova parinibbāyi so jino."
NULL,p56,96,100,bodytext,,"Evaṃ pana bhagavati parinibbute vissakammadevaputto tathāgatassa sarīrappamāṇaṃ varadoṇiṃ ratanehi māpetvā visuddhakappāsehi tathāgatassa sarīraṃ veṭhetvā ratanadoṇiyaṃ pakkhipitvā gandhatelehi pūretvā aparāya doṇiyā pidahitvā sabbagandhadārucitakaṃ katvā yebhuyyena devatāyo lohitacandanaghaṭikāyo ādāya citakāyaṃ pakkhipitvā aggiṃ gāhāpetuṃ nāsakkhiṃsu. Kasmā? Mahākassapattherassa anāgatattā. So āyasmā mahākassapatthero yebhuyyena bahunnaṃ devānaṃ piyo manāpo. Therassa hi dānaṃ datvā sagge nibbattānaṃ pamāṇo nāma natthi. Tasmā devatā tasmiṃ samāgame attano kulūpagattheraṃ adisvā amhākaṃ mahākassapatthero kuhinti olokento attano parivārehi pañcamattehi bhikkhusatehi saddhiṃ maggaṃ paṭipannoti ñatvā yāva thero imasmiṃ na sampatto citakaṃ tāva na pajjalatuti adhiṭṭhahiṃsu. Tasmiṃ kāle thero yebhuyyena terasadhutaṅgadharehi pañcamattehi bhikkhusatehi saddhiṃ āgantvā citakaṃ tikkhattuṃ padakkhiṇaṃ katvā pādapasse ṭhīto, bhante tumhākaṃ dassanatthāya ito kappasatasahassamatthake padumuttarasatthuno pādamule abhinīhārato paṭṭhāya avijahitvā āgato. Idāni me avasānadassananti pāde gahetvā vandituṃ adhiṭṭhāsi."
NULL,p56,97,100,gatha1,,"Mahākassapathero so bhikkhusaṅghapurakkhato;"
NULL,p56,98,100,gathalast,,"Ekaṃsaṃ cīvaraṃ katvā paggahetvāna añjaliṃ."
NULL,p56,99,100,gatha1,,"Padakkhiṇañca tikkhattuṃ katvā ṭhatvā padantike;"
NULL,p56,100,100,gathalast,,"Patiṭṭhahantu sīse me jinapādeti’dhiṭṭhahi."
NULL,p56,101,100,gatha1,,"Sahādhiṭṭhānaṃ citakā dussāni ca vibhindiya;"
NULL,p56,102,100,gathalast,,"Nikkhamiṃsu tadā pādā ghanamuttova candimā."
NULL,p56,103,100,gatha1,,"Uho hatthehi paggayha ṭhapetvā attano sire;"
NULL,p56,104,100,gathalast,,"Vanditvā satthuno pāde khamāpetvā visajjayī."
NULL,p56,105,100,gatha1,,"Puṇṇacando yathā abbhaṃ citakaṃ pāvisi tadā;"
NULL,p56,106,100,gathalast,,"Idaṃ accherakaṃ disvā ravaṃ ravi mahājano."
NULL,p56,107,100,gatha1,,"Uṭṭhahitvāna pācīnā vando atthaṅgato yathā;"
NULL,p56,108,100,gathalast,,"Pāde antaradhāyante arodiṃsu mahājanā."
